user_input,retrieved_contexts,response,reference,context_recall,context_precision,faithfulness,answer_relevancy,answer_correctness
What is Acid phosphatase test ?,"['Achromatopsia see Color blindness\nAcid indigestion see Heartburn\nAcid phosphatase test\nDefinition\nAcid phosphatase is an enzyme found throughout\nthe body, but primarily in the prostate gland. Like all\nenzymes, it is needed to trigger specific chemical reac-\ntions. Acid phosphatase testing is done to diagnose\nwhether prostate cancer has spread to other parts of the\nbody (metastasized), and to check the effectiveness of\ntreatment. The test has been largely supplanted by the\nprostate specific antigen test (PSA).\nPurpose\nThe male prostate gland has 100 times more acid\nphosphatase than any other body tissue. When prostate\ncancer spreads to other parts of the body, acid phos-\nphatase levels rise, particularly if the cancer spreads to\nthe bone. One-half to three-fourths of persons who have', 'method used.\nAbnormal results\nThe highest levels of acid phosphatase are found in\nmetastasized prostate cancer. Diseases of the bone, such\nas Paget’s disease or hyperparathyroidism; diseases of\nblood cells, such as sickle cell disease or multiple\nmyeloma; or lysosomal disorders, such as Gaucher’s dis-\nease, will show moderately increased levels.\nCertain medications can cause temporary increases\nor decreases in acid phosphatase levels. Manipulation of\nthe prostate gland through massage, biopsy, or rectal\nexam before a test can increase the level.\nGALE ENCYCLOPEDIA OF MEDICINE 2 23\nAcid phosphatase test\nGEM - 0001 to 0432 - A  10/22/03 1:41 PM  Page 23', 'static acid phosphatase but not red blood cell acid phos-\nphatase. Laboratory test methods based on these differ-\nences reveal how much of a person’s total acid phos-\nphatase is derived from the prostate. Results are usually\navailable the next day.\nPreparation\nThis test requires drawing about 5-10 mL of blood.\nThe patient should not have a rectal exam or prostate\nmassage for two to three days prior to the test.\nAftercare\nDiscomfort or bruising may occur at the puncture\nsite, and the person may feel dizzy or faint. Applying\npressure to the puncture site until the bleeding stops will\nreduce bruising. Warm packs to the puncture site will\nrelieve discomfort.\nNormal results\nNormal results vary based on the laboratory and the\nmethod used.\nAbnormal results', 'metastasized prostate cancer have high acid phosphatase\nlevels. Levels fall after the tumor is removed or reduced\nthrough treatment.\nTissues other than prostate have small amounts of\nacid phosphatase, including bone, liver, spleen, kidney,\nand red blood cells and platelets. Damage to these tissues\ncauses a moderate increase in acid phosphatase levels.\nAcid phosphatase is very concentrated in semen.\nRape investigations will often include testing for the\npresence of acid phosphatase in vaginal fluid.\nPrecautions\nThis is not a screening test for prostate cancer. Acid\nphosphatase levels rise only after prostate cancer has\nmetastasized.\nDescription\nLaboratory testing measures the amount of acid\nphosphatase in a person’s blood, and can determine from', 'the sample takes only a few minutes.\nA person being tested for alkaline phosphatase\nshouldn’t have anything to eat or drink, except water, for\neight to ten hours before the test. Some people release\nalkaline phosphatase from the intestine into the blood-\nstream after eating. This will temporarily increase the\nresult of the test.\nAftercare\nDiscomfort or bruising may occur at the puncture site\nor the person may feel dizzy or faint. Pressure to the\nGALE ENCYCLOPEDIA OF MEDICINE 2106\nAlkaline phosphatase test\nGEM - 0001 to 0432 - A  10/22/03 1:41 PM  Page 106', 'amounts, to trigger specific chemical reactions. When it\nis present in large amounts, it may signify bone or liver\ndisease or a tumor.\nPurpose\nMedical testing of alkaline phosphatase is concerned\nwith the enzyme that is found in liver, bone, placenta,\nand intestine. In a healthy liver, fluid containing alkaline\nphosphate and other substances is continually drained\naway through the bile duct. In a diseased liver, this bile\nduct is often blocked, keeping fluid within the liver.\nAlkaline phosphatase accumulates and eventually\nescapes into the bloodstream.\nThe alkaline phosphatase of the liver is produced by\nthe cells lining the small bile ducts (ductoles) in the liver.\nIts origin differs from that of other enzymes called\naminotransferases. If the liver disease is primarily of an', 'what tissue the enzyme is coming. For example, it is\nimportant to know if the increased acid phosphatase is\nfrom the prostate or red blood cells. Acid phosphatase\nfrom the prostate, called prostatic acid phosphatase\n(PAP), is the most medically significant type of acid\nphosphatase.\nKEY TERMS\nEnzyme—A substance needed to trigger specific\nchemical reactions.\nMetastasize —Spread to other parts of the body;\nusually refers to cancer.\nProstate gland—A gland of the male reproductive\nsystem.\nSubtle differences between prostatic acid phos-\nphatase and acid phosphatases from other tissues cause\nthem to react differently in the laboratory when mixed\nwith certain chemicals. For example, adding the chemi-\ncal tartrate to the test mixture inhibits the activity of pro-']","The acid phosphatase test measures the level of acid phosphatase, an enzyme primarily found in the prostate gland, in a person's blood. This test is used to diagnose whether prostate cancer has spread to other parts of the body (metastasized) and to check the effectiveness of treatment. It is important to note that the acid phosphatase test has largely been replaced by the prostate-specific antigen (PSA) test.

The test is significant because the male prostate gland contains 100 times more acid phosphatase than any other body tissue. Elevated levels of acid phosphatase can indicate metastasized prostate cancer, particularly if the cancer has spread to the bone. Other conditions, such as diseases of the bone or blood cells, can also cause increased levels.

Preparation for the test requires that the patient avoid rectal exams or prostate massage for two to three days prior. Aftercare may involve managing discomfort or bruising at the puncture site where blood is drawn. Normal results can vary based on the laboratory and method used, and abnormal results may indicate the presence of prostate cancer or other conditions affecting the bones or blood cells (Source: Unknown). 

Always consult a healthcare provider for professional medical advice regarding diagnosis or treatment.","Acid phosphatase is an enzyme found throughout the body, but primarily in the prostate gland. Like all enzymes, it is needed to trigger specific chemical reactions. Acid phosphatase testing is done to diagnose whether prostate cancer has spread to other parts of the body (metastasized), and to check the effectiveness of treatment. The test has been largely supplanted by the prostate specific antigen test (PSA).",1.0,0.9428571428382857,0.9285714285714286,0.9187139542307154,0.5815794091083506
What is Acne?,"['creams containing benzoyl peroxide or tretinoin may be\nused to clear up mild to moderately severe acne.\nIsotretinoin (Accutane) is prescribed only for very\nsevere, disfiguring acne.\nAcne is a skin condition that occurs when pores or\nhair follicles become blocked. This allows a waxy\nmaterial, sebum, to collect inside the pores or follicles.\nNormally, sebum flows out onto the skin and hair to\nform a protective coating, but when it cannot get out,\nsmall swellings develop on the skin surface. Bacteria\nand dead skin cells can also collect that can cause\ninflammation. Swellings that are small and not\ninflamed are whiteheads or blackheads. When they\nbecome inflamed, they turn into pimples. Pimples that\nfill with pus are called pustules.\nAcne cannot be cured, but acne drugs can help clear', 'cells, and bacteria.\nDescription\nAcne vulgaris, the medical term for common acne, is\nthe most common skin disease. It affects nearly 17 million\npeople in the United States. While acne can arise at any\nage, it usually begins at puberty and worsens during ado-\nlescence. Nearly 85% of people develop acne at some time\nbetween the ages of 12-25 years. Up to 20% of women\ndevelop mild acne. It is also found in some newborns.\nThe sebaceous glands lie just beneath the skin’s sur-\nface. They produce an oil called sebum, the skin’s natural\nmoisturizer. These glands and the hair follicles within\nwhich they are found are called sebaceous follicles.\nThese follicles open onto the skin through pores. At\npuberty, increased levels of androgens (male hormones)', 'disease specialist, or an endocrinologist, a specialist who\ntreats diseases of the body’s endocrine (hormones and\nglands) system.\nAcne has a characteristic appearance and is not diffi-\ncult to diagnose. The doctor takes a complete medical\nhistory, including questions about skin care, diet, factors\ncausing flare-ups, medication use, and prior treatment.\nPhysical examination includes the face, upper neck,\nchest, shoulders, back, and other affected areas. Under\ngood lighting, the doctor determines what types and how\nmany blemishes are present, whether they are inflamed,\nwhether they are deep or superficial, and whether there is\nscarring or skin discoloration.\nIn teenagers, acne is often found on the forehead,\nnose, and chin. As people get older, acne tends to appear', 'people, especially teenagers, become emotionally upset\nabout their condition, and have problems forming rela-\ntionships or keeping jobs.\nDiagnosis\nAcne patients are often treated by family doctors.\nComplicated cases are referred to a dermatologist, a skin\nGALE ENCYCLOPEDIA OF MEDICINE 224\nAcne\nGEM - 0001 to 0432 - A  10/22/03 1:41 PM  Page 24', 'cause the glands to produce too much sebum. When\nexcess sebum combines with dead, sticky skin cells, a\nhard plug, or comedo, forms that blocks the pore. Mild\nnoninflammatory acne consists of the two types of come-\ndones, whiteheads and blackheads.\nModerate and severe inflammatory types of acne\nresult after the plugged follicle is invaded by Propioni-\nbacterium acnes , a bacteria that normally lives on the\nskin. A pimple forms when the damaged follicle weakens\nand bursts open, releasing sebum, bacteria, and skin and\nwhite blood cells into the surrounding tissues. Inflamed\npimples near the skin’s surface are called papules; when\ndeeper, they are called pustules. The most severe type of\nacne consists of cysts (closed sacs) and nodules (hard', 'swellings). Scarring occurs when new skin cells are laid\ndown to replace damaged cells.\nThe most common sites of acne are the face, chest,\nshoulders, and back since these are the parts of the body\nwhere the most sebaceous follicles are found.\nCauses and symptoms\nThe exact cause of acne is unknown. Several risk\nfactors have been identified:\n• Age. Due to the hormonal changes they experience,\nteenagers are more likely to develop acne.\n• Gender. Boys have more severe acne and develop it\nmore often than girls.\n• Disease. Hormonal disorders can complicate acne in\ngirls.\n• Heredity. Individuals with a family history of acne have\ngreater susceptibility to the disease.\n• Hormonal changes. Acne can flare up before menstrua-\ntion, during pregnancy, and menopause.', 'tion, during pregnancy, and menopause.\n• Diet. No foods cause acne, but certain foods may cause\nflare-ups.\n• Drugs. Acne can be a side effect of drugs including\ntranquilizers, antidepressants, antibiotics, oral contra-\nceptives, and anabolic steroids.\n• Personal hygiene. Abrasive soaps, hard scrubbing, or\npicking at pimples will make them worse.\n• Cosmetics. Oil-based makeup and hair sprays worsen\nacne.\n• Environment. Exposure to oils and greases, polluted air,\nand sweating in hot weather aggravate acne.\n• Stress. Emotional stress may contribute to acne.\nAcne is usually not conspicuous, although inflamed\nlesions may cause pain, tenderness, itching, or swelling.\nThe most troubling aspects of these lesions are the nega-\ntive cosmetic effects and potential for scarring. Some']","Acne, or acne vulgaris, is the most common skin disease, affecting nearly 17 million people in the United States. It occurs when pores or hair follicles become blocked, leading to the accumulation of sebum, a waxy material produced by sebaceous glands. This blockage can result in small swellings on the skin surface, which can become inflamed and develop into various types of blemishes, such as whiteheads, blackheads, and pimples. Acne typically begins at puberty and can worsen during adolescence, with about 85% of individuals experiencing it between the ages of 12 and 25. While acne cannot be cured, treatments are available to help manage and clear the condition (Source: Unknown). 

If you have concerns about acne or its treatment, it's best to consult a healthcare provider for personalized advice.","Acne is a common skin disease characterized by pimples on the face, chest, and back. It occurs when the pores of the skin become clogged with oil, dead skin cells, and bacteria.",1.0,0.8666666666377778,0.9333333333333333,0.9233139614568562,0.37426380404823434
What is Acrocyanosis?,"['es the blue color. The acrocyanosis patient’s pulse is nor-\nmal, which rules out obstructive diseases. Raynaud’s dis-\nease differs from acrocyanosis in that it causes white and\nred skin coloration phases, not just bluish discoloration.\nTreatment\nAcrocyanosis usually isn’t treated. Drugs that block\nthe uptake of calcium ( calcium channel blockers ) and\nalpha-one antagonists reduce the symptoms in most\ncases. Drugs that dilate blood vessels are only effective\nsome of the time. Sweating from the affected areas can\nbe profuse and require treatment. Surgery to cut the sym-\npathetic nerves is performed rarely.\nPrognosis\nAcrocyanosis is a benign and persistent disease. The\nmain concern of patients is cosmetic. Left untreated, the\ndisease does not worsen.\nResources\nBOOKS', 'Lisa Andres, M.S., CGC\nAcquired hypogammaglobulinemia see\nCommon variable immunodeficiency\nAcquired immunodeficiency syndrome see\nAIDS\nAcrocyanosis\nDefinition\nAcrocyanosis is a decrease in the amount of oxygen\ndelivered to the extremities. The hands and feet turn blue\nbecause of the lack of oxygen. Decreased blood supply\nto the affected areas is caused by constriction or spasm of\nsmall blood vessels.\nDescription\nAcrocyanosis is a painless disorder caused by constric-\ntion or narrowing of small blood vessels in the skin of affect-\ned patients. The spasm of the blood vessels decreases the\namount of blood that passes through them, resulting in less\nblood being delivered to the hands and feet. The hands may\nbe the main area affected. The affected areas turn blue and', 'hands and feet. Sufficient blood still passes through the\nblood vessels so that the tissue in the affected areas does\nnot starve for oxygen or die. Mainly, blood vessels near\nthe surface of the skin are affected.\nDiagnosis\nDiagnosis is made by observation of the main clini-\ncal symptoms, including persistently blue and sweaty\nhands and/or feet and a lack of pain. Cooling the hands\nincreases the blueness, while warming the hands decreas-\nGALE ENCYCLOPEDIA OF MEDICINE 2 31\nAcrocyanosis\nGEM - 0001 to 0432 - A  10/22/03 1:41 PM  Page 31', 'skin and mucous membranes called cyanosis. Cyanosis is most easily seen \naround the lips and in the oral mucosa. A sign of chronic hypoxia is \nclubbing, a gradual enlargement of the fingertips (see Figure 11.17\n). See \nTable 11.2b for symptoms and signs of hypoxia.8 \n \n7. “Acopaquia.jpg” by Desherinka is licensed under CC BY-SA 4.0 \n8. This work is a derivative of Clinical Procedures for Safer Patient Care by British Columbia Institute of \nTechnology and is licensed under CC BY 4.0 \n11.2 Basic Concepts of Oxygenation  |  639', 'zero. It is rare to receive a true 10, as some acrocyanosis in\nGALE ENCYCLOPEDIA OF MEDICINE 2 331\nApgar testing\nGEM - 0001 to 0432 - A  10/22/03 1:42 PM  Page 331', 'neonate’s ability to oxygenate its body and extremities,\nand is dependent on heart rate and respirations. A per-\nfectly healthy newborn will often receive a score of 9\nbecause of some blueness in the hands and feet.\n• Pulse (heart rate): 2 for a pulse of 100+ beats per minute\n(bpm); 1 for a pulse below 100 bpm; 0 for no pulse.\nHeart rate is assessed by listening with a stethoscope to\nthe newborn’s heart and counting the number of beats.\n• Grimace, or reflex irritability: 2 if the neonate coughs,\nsneezes, or vigorously cries in response to a stimulus\nKEY TERMS\nAcrocyanosis —A slight cyanosis, or blueness of\nthe hands and feet of the neonate is considered\nnormal. This impaired ability to fully oxygenate\nthe extremities is due to an immature circulatory\nsystem which is still in flux.', 'by unilateral redness and edema. \nFigure 9.6 Peripheral Edema \n9.3 Cardiovascular Assessment  |  559']","Acrocyanosis is a condition characterized by a decrease in the amount of oxygen delivered to the extremities, leading to a bluish discoloration of the hands and feet. This occurs due to constriction or spasm of small blood vessels, which reduces blood supply to the affected areas. Acrocyanosis is a painless disorder, and while it primarily affects the hands, it can also involve the feet. Despite the bluish appearance, sufficient blood still passes through the blood vessels, preventing tissue from starving for oxygen or dying. The condition is typically benign and persistent, with the main concern for patients being cosmetic. Left untreated, acrocyanosis does not worsen (Source: Unknown). 

If you have further questions or concerns, it's always best to consult a healthcare provider for personalized advice.",Acrocyanosis is a decrease in the amount of oxygen delivered to the extremities. The hands and feet turn blue because of the lack of oxygen. Decreased blood supply to the affected areas is caused by constriction or spasm of small blood vessels.,1.0,0.555555555537037,1.0,0.9462448663000784,0.9628163504456417
What is general Anesthesia ?,"['• producing unconsciousness\n• inhibiting normal body reflexes to make surgery safe\nand easier to perform\n• relaxing the muscles of the body\nDescription\nAnesthesia performed with general anesthetics\noccurs in four stages which may or may not be observ-\nable because they can occur very rapidly:\nGALE ENCYCLOPEDIA OF MEDICINE 2 185\nAnesthesia, general\nGEM - 0001 to 0432 - A  10/22/03 1:42 PM  Page 185', 'get into the neurons, nerve impulses are not generated\nand the brain becomes unconscious, does not store mem-\nories, does not register pain impulses from other areas of\nthe body, and does not control involuntary reflexes.\nAlthough anesthesia may feel like deep sleep, it is not the\nsame. In sleep, some parts of the brain speed up while\nothers slow down. Under anesthesia, the loss of con-\nsciousness is more widespread.\nWhen general anesthesia was first introduced in\nmedical practice, ether and chloroform were inhaled with\nthe physician manually covering the patient’s mouth.\nSince then, general anesthesia has become much more\nsophisticated. During most surgical procedures, anesthet-\nic agents are now delivered and controlled by computer-\nized equipment that includes anesthetic gas monitoring', 'replacing thiopental as an intravenous induction agent.\nIt is used for general surgery , cardiac surgery, neuro-\nsurgery, and pediatric surgery.\nGeneral anesthetics are given only by anesthesiolo-\ngists, the medical professionals trained to use them. These\nspecialists consider many factors, including a patient’s\nage, weight, medication allergies, medical history, and\ngeneral health, when deciding which anesthetic or combi-\nnation of anesthetics to use. General anesthetics are usual-\nly inhaled through a mask or a breathing tube or injected\ninto a vein, but are also sometimes given rectally.\nGeneral anesthesia is much safer today than it was in\nthe past. This progress is due to faster-acting anesthetics,\nimproved safety standards in the equipment used to', 'online.oxygen.com>.\n“Prevalence of Iron Deficiency in the United States.” ThriveOn-\nline. 2 June 1998 <http://thriveonline.oxygen.com>.\n“Sickle Cell Anemia & Sickle Cell Trait.” ThriveOnline. 2 June\n1995 <http://thriveonline.oxygen.com>.\n“Thalassemia.” ThriveOnline. 2 June 1998 <http://thriveonline.\noxygen.com>.\nMaureen Haggerty\nAnencephaly see Congenital brain defects\nAnesthesia, general\nDefinition\nGeneral anesthesia is the induction of a state of uncon-\nsciousness with the absence of pain sensation over the\nentire body, through the administration of anesthetic drugs.\nIt is used during certain medical and surgical procedures.\nPurpose\nGeneral anesthesia has many purposes including:\n• pain relief (analgesia)\n• blocking memory of the procedure (amnesia)\n• producing unconsciousness', 'GALE ENCYCLOPEDIA OF MEDICINE 2186\nAnesthesia, general\nGEM - 0001 to 0432 - A  10/22/03 1:42 PM  Page 186', 'cease to function. Death can result if the patient cannot\nbe revived quickly. This stage should never be reached.\nCareful control of the amounts of anesthetics adminis-\ntered prevent this occurrence.\nAgents used for general anesthesia may be either\ngases or volatile liquids that are vaporized and inhaled\nwith oxygen, or drugs delivered intravenously. A combi-\nnation of inhaled anesthetic gases and intravenous drugs\nare usually delivered during general anesthesia; this\npractice is called balanced anesthesia and is used because\nit takes advantage of the beneficial effects of each anes-\nthetic agent to reach surgical anesthesia. If necessary, the\nextent of the anesthesia produced by inhaling a general\nanesthetic can be rapidly modified by adjusting the con-', 'Special conditions\nPeople with certain medical conditions are at greater\nrisk of developing problems with anesthetics. Before\nundergoing general anesthesia, anyone with the follow-\ning conditions should absolutely inform their doctor.\nALLERGIES. Anyone who has had allergic or other\nunusual reactions to barbiturates or general anesthetics\nin the past should notify the doctor before having general\nanesthesia. In particular, people who have had malignant\nhyperthermia or whose family members have had malig-\nnant hyperthermia during or after being given an anes-\nGALE ENCYCLOPEDIA OF MEDICINE 2 187\nAnesthesia, general\nGEM - 0001 to 0432 - A  10/22/03 1:42 PM  Page 187']","General anesthesia is the induction of a state of unconsciousness with the absence of pain sensation over the entire body, achieved through the administration of anesthetic drugs. It is used during certain medical and surgical procedures for various purposes, including pain relief (analgesia), blocking memory of the procedure (amnesia), and producing unconsciousness (Source: GALE ENCYCLOPEDIA OF MEDICINE). 

General anesthetics can be administered through inhalation (gases or volatile liquids) or intravenously, and a combination of both methods is often used in a practice known as balanced anesthesia. This approach takes advantage of the beneficial effects of each anesthetic agent to achieve the desired level of surgical anesthesia (Source: GALE ENCYCLOPEDIA OF MEDICINE). 

It's important to note that general anesthesia is much safer today than in the past due to advancements in anesthetic agents and improved safety standards in equipment (Source: GALE ENCYCLOPEDIA OF MEDICINE).","General anesthesia is the induction of a state of unconsciousness with the absence of pain sensation over the entire body, through the administration of anesthetic drugs. It is used during certain medical and surgical procedures.",1.0,0.999999999975,1.0,0.9307374251312973,0.6149116610740426
What is Angina ?,"['nary artery muscle spasm of insufficient duration or\nintensity to cause an actual heart attack.\nCauses and symptoms\nAngina causes a pressing pain or sensation of heavi-\nness, usually in the chest area under the breast bone (ster-\nnum). It occasionally is experienced in the shoulder, arm,\nneck, or jaw regions. Because episodes of angina occur\nwhen the heart’s need for oxygen increases beyond the\noxygen available from the blood nourishing the heart, the\ncondition is often precipitated by physical exertion. In\nmost cases, the symptoms are relieved within a few min-\nutes by resting or by taking prescribed angina medica-\ntions. Emotional stress, extreme temperatures, heavy\nmeals, cigarette smoking, and alcohol can also cause or\ncontribute to an episode of angina.\nDiagnosis', 'na pectoris.\nDescription\nOften described as a muscle spasm and choking sen-\nsation, the term “angina” is used primarily to describe\nchest (thoracic) pain originating from insufficient oxygen\nto the heart muscle. An episode of angina is not an actual\nheart attack , but rather pain that results from the heart\nmuscle temporarily receiving too little blood. This tem-\nporary condition may be the result of demanding activi-\nties such as exercise and does not necessarily indicate\nthat the heart muscle is experiencing permanent damage.\nIn fact, episodes of angina seldom cause permanent dam-\nage to heart muscle.\nAngina can be subdivided further into two cate-\ngories: angina of effort and variant angina.\nAngina of effort\nAngina of effort is a common disorder caused by the', 'narrowing of the arteries ( atherosclerosis ) that supply\noxygen-rich blood to the heart muscle. In the case of\nangina of effort, the heart (coronary) arteries can provide\nthe heart muscle (myocardium) adequate blood during\nrest but not during periods of exercise, stress, or excite-\nment—any of which may precipitate pain. The pain is\nrelieved by resting or by administering nitroglycerin, a\nmedication that reduces ischemia of the heart. Patients\nwith angina of effort have an increased risk of heart\nattack (myocardial infarction).\nV ariant angina\nVariant angina is uncommon and occurs indepen-\ndently of atherosclerosis which may, however, be present\nas an incidental finding. Variant angina occurs at rest and\nis not related to excessive work by the heart muscle.', 'all of the organs in the body.\nArteriosclerosis —Hardening of the arteries that\noccurs as part of the aging process.\nArtery—A blood vessel that carries blood from the\nheart to the body’s tissues.\nAtherosclerosis—A form of arteriosclerosis in\nwhich cholesterol-containing fatty deposits accu-\nmulate in the inner most walls of the heart’s arteries.\nThoracic—Relating to the chest.\nAneurysms see Aneurysmectomy; Cerebral\naneurysm; Ventricular aneurysm\nAngina\nDefinition\nAngina is pain, “discomfort,” or pressure localized\nin the chest that is caused by an insufficient supply of\nblood ( ischemia ) to the heart muscle. It is also some-\ntimes characterized by a feeling of choking, suffocation,\nor crushing heaviness. This condition is also called angi-\nna pectoris.\nDescription', 'Eczema—Inflammation of the skin with itching\nand a rash. The rash may have blisters that ooze\nand form crusts.\nPimple—A small, red swelling of the skin.\nPsoriasis —A skin disease in which people have\nitchy, scaly, red patches on the skin.\nPus—Thick, whitish or yellowish fluid that forms\nin infected tissue.\nTriglyceride —A substance formed in the body\nfrom fat in the diet.\nAntiangina drugs\nDefinition\nAntiangina drugs are medicines that relieve the\nsymptoms of angina pectoris (severe chest pain).\nPurpose\nThe dull, tight chest pain of angina occurs when the\nheart’s muscular wall is not getting enough oxygen. By\nrelaxing the blood vessels, antiangina drugs reduce the\nheart’s work load and increase the amount of oxygen-\nrich blood that reaches the heart. These drugs come in', 'Research indicates that variant angina is caused by coro-\nGALE ENCYCLOPEDIA OF MEDICINE 2194\nAngina\nGEM - 0001 to 0432 - A  10/22/03 1:42 PM  Page 194', 'often controlled by medication, most commonly with\nnitroglycerin. This drug relieves symptoms of angina by\nincreasing the diameter of the blood vessels carrying\nblood to the heart muscle. Nitroglycerin is taken whenever\ndiscomfort occurs or is expected. It may be taken by\nmouth by placing the tablet under the tongue or transder-\nmally by placing a medicated patch directly on the skin. In\naddition, beta blockers or calcium channel blockers\nmay be prescribed to also decrease the demand on the\nheart by decreasing the rate and workload of the heart.\nSurgical treatment\nWhen conservative treatments are not effective in\nthe reduction of angina pain and the risk of heart attack\nremains high, physicians may recommend angioplasty\nor surgery. Coronary artery bypass surgery is an opera-']","Angina, also known as angina pectoris, is a condition characterized by pain, discomfort, or pressure localized in the chest due to an insufficient supply of blood (ischemia) to the heart muscle. This pain can sometimes feel like choking, suffocation, or a crushing heaviness. Angina occurs when the heart's need for oxygen exceeds the oxygen available from the blood nourishing the heart, often triggered by physical exertion, emotional stress, extreme temperatures, heavy meals, cigarette smoking, or alcohol consumption. 

There are two main types of angina: 
1. **Angina of effort**: This is caused by the narrowing of the coronary arteries (atherosclerosis) and typically occurs during physical activity or stress, relieved by rest or medications like nitroglycerin.
2. **Variant angina**: This is less common and can occur at rest, not necessarily related to exertion, and may occur independently of atherosclerosis.

Episodes of angina are not heart attacks and usually do not cause permanent damage to the heart muscle (Source: Unknown). 

If you have concerns about angina or related symptoms, it's important to consult a healthcare provider for proper diagnosis and treatment.","Angina is pain, “discomfort,” or pressure localized in the chest that is caused by an insufficient supply of blood (ischemia) to the heart muscle. It is also sometimes characterized by a feeling of choking, suffocation, or crushing heaviness. This condition is also called angina pectoris.",1.0,0.99999999998,0.9333333333333333,0.9143928624173613,0.49285389364029186
What is the step-by-step process for inserting the catheter to begin an angiography?,"['dle before the guide wire is inserted.\nThe guide wire is fed through the outer needle into\nthe artery and to the area that requires angiographic\nstudy. A fluoroscopic screen that displays a view of the\npatient’s vascular system is used to pilot the wire to the\ncorrect location. Once it is in position, the needle is\nremoved and a catheter is slid over the length of the\nguide wire until it to reaches the area of study. The guide\nwire is removed and the catheter is left in place in prepa-\nration for the injection of the contrast medium, or dye.\nDepending on the type of angiography procedure\nbeing performed, the contrast medium is either injected\nby hand with a syringe or is mechanically injected with\nan automatic injector connected to the catheter. An', 'An automatic film changer is used because the manual\nchanging of x-ray plates can eat up valuable time.\nOnce the x rays are complete, the catheter is slowly\nand carefully removed from the patient. Pressure is\napplied to the site with a sandbag or other weight for 10-\n20 minutes in order for clotting to take place and the\narterial puncture to reseal itself. A pressure bandage is\nthen applied.\nMost angiograms follow the general procedures out-\nlined above, but vary slightly depending on the area of\nthe vascular system being studied. A variety of common\nangiography procedures are outlined below:\nCerebral angiography\nCerebral angiography is used to detect aneurysms,\nblood clots, and other vascular irregularities in the brain.\nThe catheter is inserted into the femoral or carotid artery', 'usually awake, but is given local anesthesia to make the area\nwhere the catheter is inserted numb. After the site where the\ncatheter will be inserted is prepared and anesthetized, the\ncardiologist inserts a catheter into the appropriate blood ves-\nsel, then passes a balloon-tipped catheter through the first\ncatheter. Guided by a video monitor and an x ray, the physi-\ncian slowly threads the catheter into the heart. The deflated\nballoon is positioned in the valve opening, then is inflated\nrepeatedly. The inflated balloon widens the valve’s opening\nby splitting the valve leaflets apart. Once the valve is\nwidened, the balloon-tipped catheter is removed. The other\ncatheter remains in place for 6 to 12 hours because in some\ncases the procedure must be repeated.\nPreparation', 'monitored throughout the procedure.\nAngiography requires the injection of a contrast dye\nthat makes the blood vessels visible to x ray. The dye is\ninjected through a procedure known as arterial puncture.\nThe puncture is usually made in the groin area, armpit,\ninside elbow, or neck. The site is cleaned with an antisep-\ntic agent and injected with a local anesthetic. First, a\nsmall incision is made in the skin to help the needle pass.\nA needle containing an inner wire called a stylet is insert-\ned through the skin into the artery. When the radiologist\nhas punctured the artery with the needle, the stylet is\nremoved and replaced with another long wire called a\nguide wire. It is normal for blood to spout out of the nee-\ndle before the guide wire is inserted.', 'During a kidney angiogram, the guide wire and catheter\nare inserted into the femoral artery in the groin area and\nadvanced through the abdominal aorta, the main artery in\nthe abdomen, and into the renal arteries. The procedure\nwill take approximately one hour.\nFluorescein angiography\nFluorescein angiography is used to diagnose retinal\nproblems and circulatory disorders. It is typically con-\nducted as an outpatient procedure. The patient’s pupils\nare dilated with eye drops and he rests his chin and fore-\nhead against a bracing apparatus to keep it still. Sodium\nfluorescein dye is then injected with a syringe into a vein\nin the patient’s arm. The dye will travel through the\npatient’s body and into the blood vessels of the eye. The\nprocedure does not require x rays. Instead, a rapid series', 'and the injected contrast medium travels through the\nblood vessels on the brain. Patients frequently experience\nheadache, warmth, or a burning sensation in the head or\nneck during the injection portion of the procedure. A\ncerebral angiogram takes two to four hours to complete.\nCoronary angiography\nCoronary angiography is administered by a cardiol-\nogist with training in radiology or, occasionally, by a\nradiologist. The arterial puncture is typically given in the\nfemoral artery, and the cardiologist uses a guide wire and\ncatheter to perform a contrast injection and x-ray series\non the coronary arteries. The catheter may also be placed\nin the left ventricle to examine the mitral and aortic\nvalves of the heart. If the cardiologist requires a view of', 'surgically exposing the site of entry. Direct view of the\nvessel’s puncture site aids in monitoring damage to the\nvessel or excessive bleeding at the site. Once the vessel is\npunctured and the guidewire is introduced, fluoroscopy\nis used to monitor small injections of contrast media used\nto visualize the path through the vessel. If the fluo-\nroscopy system has a feature called ‘roadmap’, the\namount of contrast media injected will be greater in order\nto define the full route the guidewire will take. The fluo-\nroscopy system will then superimpose subsequent\nimages over the roadmap while the vessel is traversed,\nthat is, the physician moves the guidewire along the map\nto the destination.\nHaving reached the area of stenosis, the physician\nwill inflate the balloon on the catheter that has been']","The step-by-step process for inserting the catheter to begin an angiography is as follows:

1. **Preparation of the Site**: The area where the catheter will be inserted (usually the groin, armpit, inside elbow, or neck) is cleaned with an antiseptic agent and injected with a local anesthetic to numb the area.

2. **Arterial Puncture**: A small incision is made in the skin to facilitate the insertion of a needle. A needle containing an inner wire called a stylet is inserted through the skin into the artery. 

3. **Guide Wire Insertion**: Once the artery is punctured, the stylet is removed and replaced with a long wire called a guide wire. It is normal for blood to spout out of the needle before the guide wire is inserted.

4. **Catheter Insertion**: The guide wire is fed through the outer needle into the artery and guided to the area that requires the angiographic study using a fluoroscopic screen. Once the guide wire is in position, the needle is removed.

5. **Advancing the Catheter**: A catheter is slid over the length of the guide wire until it reaches the area of study. 

6. **Removing the Guide Wire**: The guide wire is then removed, leaving the catheter in place in preparation for the injection of the contrast medium (dye).

7. **Injection of Contrast Medium**: Depending on the procedure, the contrast medium is either injected by hand with a syringe or mechanically injected with an automatic injector connected to the catheter.

8. **Completion of the Procedure**: After the angiography is completed, the catheter is slowly and carefully removed from the patient, and pressure is applied to the site to promote clotting and resealing of the arterial puncture.

This process may vary slightly depending on the specific type of angiography being performed (e.g., cerebral, coronary, or kidney angiography) (Sources: Unknown). 

Always consult a healthcare provider for more detailed information and guidance regarding angiography procedures.","Preparation: The puncture site (commonly the groin, armpit, inside elbow, or neck) is cleaned with an antiseptic agent and injected with a local anesthetic. Incision and Needle Insertion: A small incision is made in the skin. A needle containing an inner wire, known as a stylet, is inserted through the skin and into the artery. Guide Wire Placement: Once the artery is punctured, the stylet is removed and replaced with a long guide wire (it is normal for blood to spout briefly before this wire is inserted). Catheter Advancement: The needle is removed, and a catheter is slid over the length of the guide wire. Using a fluoroscopic screen to visualize the vascular system, the catheter is piloted to the specific area of study, and the guide wire is removed to prepare for dye injection.",1.0,0.6678571428404464,0.9473684210526315,0.9943701351289255,0.9838979534701272
What procedural steps are taken to treat the puncture site once the angiography imaging is complete?,"['will be monitored and the puncture site observed closely.\nPain medication may be prescribed if the patient is expe-\nriencing discomfort from the puncture, and a cold pack is\napplied to the site to reduce swelling. It is normal for the\npuncture site to be sore and bruised for several weeks.\nGALE ENCYCLOPEDIA OF MEDICINE 2 199\nAngiography\nGEM - 0001 to 0432 - A  10/22/03 1:42 PM  Page 199', 'The patient may also develop a hematoma, a hard mass\ncreated by the blood vessels broken during the procedure.\nHematomas should be watched carefully, as they may\nindicate continued bleeding of the arterial puncture site.\nAngiography patients are also advised to enjoy two\nto three days of rest and relaxation after the procedure in\norder to avoid placing any undue stress on the arterial\npuncture. Patients who experience continued bleeding or\nabnormal swelling of the puncture site, sudden dizziness,\nor chest pains in the days following an angiography pro-\ncedure should seek medical attention immediately.\nPatients undergoing a fluorescein angiography\nshould not drive or expose their eyes to direct sunlight\nfor 12 hours following the procedure.\nRisks', 'monitored throughout the procedure.\nAngiography requires the injection of a contrast dye\nthat makes the blood vessels visible to x ray. The dye is\ninjected through a procedure known as arterial puncture.\nThe puncture is usually made in the groin area, armpit,\ninside elbow, or neck. The site is cleaned with an antisep-\ntic agent and injected with a local anesthetic. First, a\nsmall incision is made in the skin to help the needle pass.\nA needle containing an inner wire called a stylet is insert-\ned through the skin into the artery. When the radiologist\nhas punctured the artery with the needle, the stylet is\nremoved and replaced with another long wire called a\nguide wire. It is normal for blood to spout out of the nee-\ndle before the guide wire is inserted.', 'An automatic film changer is used because the manual\nchanging of x-ray plates can eat up valuable time.\nOnce the x rays are complete, the catheter is slowly\nand carefully removed from the patient. Pressure is\napplied to the site with a sandbag or other weight for 10-\n20 minutes in order for clotting to take place and the\narterial puncture to reseal itself. A pressure bandage is\nthen applied.\nMost angiograms follow the general procedures out-\nlined above, but vary slightly depending on the area of\nthe vascular system being studied. A variety of common\nangiography procedures are outlined below:\nCerebral angiography\nCerebral angiography is used to detect aneurysms,\nblood clots, and other vascular irregularities in the brain.\nThe catheter is inserted into the femoral or carotid artery', 'tal hypertension.\nand the possible complications involved, and asked to\nsign an informed consent form.\nAftercare\nBecause life-threatening internal bleeding is a possi-\nble complication of an arterial puncture, an overnight stay\nin the hospital is sometimes recommended following an\nangiography procedure, particularly with cerebral and\ncoronary angiograms. If the procedure is performed on an\noutpatient basis, the patient is typically kept under close\nobservation for a period of at six to 12 hours before being\nreleased. If the arterial puncture was performed in the\nfemoral artery, the patient will be instructed to keep his\nleg straight and relatively immobile during the observa-\ntion period. The patient’s blood pressure and vital signs', 'drawn from the vessel and the puncture site repaired.\nRisks\nDuring the procedure there is a danger of puncturing\nthe vessel with the guidewire. This is a very small risk.\nPatients must be monitored for hematoma or hemorrhage\nat the puncture site. There is also a small risk of heart\nattack, emboli, and although unlikely death. Hospital-\nization will vary in length by the patient’s overall condi-\ntion, any complications, and availability of home care.\nResources\nBOOKS\nThomas MD MPH, Clayton L. editor. Taber’s Cyclopedic Med-\nical Dictionary. Philadelphia, PA: F.A. Davis Company,\n1985.\nSchneider MD, Peter A. Endovascular Skills: Guidewires,\nCatheters, Arteriography, Balloon Angioplasty, Stents.St.\nLouis, MO: Quality Medical Publishing, Inc., 1998.', 'plasty (PTCA) is to be performed, the patient will be\nkept awake to report on discomfort and cough if\nrequired. PTCA procedures are performed in cardiac\ncatheterization labs with sophisticated monitoring\ndevices. If angioplasty is performed in the radiology\ndepartment’s angiographic suite, the patient may be\nsedated for the procedure and a nurse will monitor the\npatient’s vital signs during the procedure. If performed\nby a vascular surgeon, the angioplasty procedure will be\nperformed in an operating room or specially designed\nvascular procedure suite.\nThe site of the introduction of the angioplasty equip-\nment is prepared as a sterile surgical site. Although many\nprocedures are performed by puncturing the vessel\nthrough skin, many procedures are also performed by']","Once the angiography imaging is complete, the following procedural steps are taken to treat the puncture site:

1. **Removal of the Catheter**: The catheter is slowly and carefully removed from the patient.
2. **Applying Pressure**: Pressure is applied to the puncture site with a sandbag or other weight for 10-20 minutes to facilitate clotting and allow the arterial puncture to reseal itself.
3. **Applying a Pressure Bandage**: After the pressure is applied, a pressure bandage is then placed on the puncture site.

These steps are crucial to ensure proper healing and to minimize the risk of complications such as bleeding. It is also important for patients to be monitored for any signs of complications following the procedure (Source: Unknown).","Removal: The catheter is slowly and carefully withdrawn from the patient. Compression: To ensure the arterial puncture reseals itself and clotting occurs, pressure is applied to the site using a sandbag or other weight for 10 to 20 minutes. Bandaging: Once clotting has taken place, a pressure bandage is applied to the site.",1.0,0.6999999999766667,0.625,0.9869279339286696,0.7824540500042896
What specific bowel-related side effects should prompt a patient to stop taking isotretinoin immediately and consult a physician?,"['ing, redness or pain\nBowel inflammation is not a common side effect,\nbut it may occur. If any of the following signs of bowel\ninflammation occur, stop taking isotretinoin immediately\nand check with a physician:\n• pain in the abdomen\n• bleeding from the rectum\n• severe diarrhea\nBenzoyl peroxide and tretinoin\nThe most common side effects of antiacne drugs\napplied to the skin are slight redness, dryness, peeling,\nKEY TERMS\nAcne—A skin condition in which raised bumps,\npimples, and cysts form on the face, neck, shoul-\nders and upper back.\nBacteria—Tiny, one-celled forms of life that cause\nmany diseases and infections.\nBowel—The intestine; a tube-like structure that\nextends from the stomach to the anus. Some diges-\ntive processes are carried out in the bowel before', 'ends. This will help reduce the chance of a pregnant\nwoman receiving blood containing isotretinoin, which\ncould cause birth defects.\nIsotretinoin may cause a sudden decrease in night\nvision. If this happens, do not drive or do anything else\nthat could be dangerous until vision returns to normal.\nLet the physician know about the problem.\nThis medicine may also make the eyes, nose, and\nmouth dry. Ask the physician about using special eye\ndrops to relieve eye dryness. To temporarily relieve the\ndry mouth , chew sugarless gum, suck on sugarless\ncandy or ice chips, or use saliva substitutes, which come\nin liquid and tablet forms and are available without a pre-\nscription. If the problem continues for more than two\nweeks, check with a physician or dentist. Mouth dryness', '• diabetes (or family history of diabetes). Isotretinoin\nmay also change blood sugar levels.\n• family history of high triglyceride levels in the blood\n• severe weight problems\nUSE OF CERTAIN MEDICINES. Using antiacne drugs\nwith certain other drugs may affect the way the drugs\nwork or may increase the chance of side effects.\nSide effects\nIsotretinoin\nMinor discomforts such as dry mouth or nose, dry\neyes, dry skin, or itching usually go away as the body\nadjusts to the drug and do not require medical attention\nunless they continue or are bothersome.\nOther side effects should be brought to a physicians\nattention. These include:\n• burning, redness, or itching of the eyes\n• nosebleeds\n• signs of inflammation of the lips, such as peeling, burn-\ning, redness or pain', 'ing vitamin A while taking isotretinoin.\n• tetracyclines (used to treat infections). Using these medi-\ncines with isotretinoin increases the chance of swelling\nof the brain. Make sure the physician knows if tetracy-\ncline is being used to treat acne or another infection.\nNancy Ross-Flanigan\nKEY TERMS\nAcne—A skin condition in which raised bumps,\npimples, and cysts form on the face, neck, shoul-\nders and upper back.\nBacteria—Tiny, one-celled forms of life that cause\nmany diseases and infections.\nBowel—The intestine; a tube-like structure that\nextends from the stomach to the anus. Some diges-\ntive processes are carried out in the bowel before\nfood passes out of the body as waste.\nCyst—An abnormal sac or enclosed cavity in the\nbody, filled with liquid or partially solid material.', 'that continues over a long time may contribute to tooth\ndecay and other dental problems.\nIsotretinoin may increase sensitivity to sunlight.\nPatients being treated with this medicine should avoid\nexposure to the sun and should not use tanning beds, tan-\nning booths, or sunlamps until they know how the drug\naffects them.\nIn the early stages of treatment with isotretinoin,\nsome people’s acne seems to get worse before it starts\ngetting better. If the condition becomes much worse or if\nthe skin is very irritated, check with the physician who\nprescribed the medicine.\nBenzoyl peroxide and tretinoin\nWhen applying antiacne drugs to the skin, be careful\nnot to get the medicine in the eyes, mouth, or inside of\nthe nose. Do not put the medicine on skin that is wind', 'Isotretinoin may interact with other medicines.\nWhen this happens, the effects of one or both drugs may\nchange or the risk of side effects may be greater. Anyone\nwho takes isotretinoin should let the physician know\nabout all other medicines he or she is taking and should\nask whether the possible interactions can interfere with\ndrug therapy. Among the drugs that may interact with\nisotretinoin are:\n• etretinate (Tegison), used to treat severe psoriasis. Using\nthis medicine with isotretinoin increases side effects.\n• tretinoin (Retin-A, Renova). Using this medicine with\nisotretinoin increases side effects.\n• vitamin A or any medicine containing vitamin A. Using\nany vitamin A preparations with isotretinoin increases\nside effects. Do not take vitamin supplements contain-', 'OTHER MEDICAL CONDITIONS. Before using anti-\nacne drugs applied to the skin, people with any of these\nmedical problems should make sure their physicians are\naware of their conditions:\n• eczema. Anti-acne drugs that are applied to the skin\nmay make this condition worse.\n• sunburn or raw skin. Anti-acne drugs that are applied to\nthe skin may increase the pain and irritation of these\nconditions.\nIn people with certain medical conditions, isotre-\ntinoin may increase the amount of triglyceride (a fatty-\nsubstance) in the blood. This may lead to heart or blood\nvessel problems. Before using isotretinoin, people with\nany of these medical problems should make sure their\nphysicians are aware of their conditions:\n• alcoholism or heavy drinking, now or in the past']","A patient should stop taking isotretinoin immediately and consult a physician if they experience any of the following signs of bowel inflammation:

- Pain in the abdomen
- Bleeding from the rectum
- Severe diarrhea

These symptoms indicate a potential serious side effect that requires medical attention (Source: Unknown).","Although bowel inflammation is not common, patients should stop taking isotretinoin and seek medical attention if they experience pain in the abdomen, bleeding from the rectum, or severe diarrhea.",1.0,0.9999999999,1.0,0.9185709391529465,0.90928386203951
Which drugs or supplements can cause adverse interactions when taken concurrently with isotretinoin?,"['Isotretinoin may interact with other medicines.\nWhen this happens, the effects of one or both drugs may\nchange or the risk of side effects may be greater. Anyone\nwho takes isotretinoin should let the physician know\nabout all other medicines he or she is taking and should\nask whether the possible interactions can interfere with\ndrug therapy. Among the drugs that may interact with\nisotretinoin are:\n• etretinate (Tegison), used to treat severe psoriasis. Using\nthis medicine with isotretinoin increases side effects.\n• tretinoin (Retin-A, Renova). Using this medicine with\nisotretinoin increases side effects.\n• vitamin A or any medicine containing vitamin A. Using\nany vitamin A preparations with isotretinoin increases\nside effects. Do not take vitamin supplements contain-', 'that continues over a long time may contribute to tooth\ndecay and other dental problems.\nIsotretinoin may increase sensitivity to sunlight.\nPatients being treated with this medicine should avoid\nexposure to the sun and should not use tanning beds, tan-\nning booths, or sunlamps until they know how the drug\naffects them.\nIn the early stages of treatment with isotretinoin,\nsome people’s acne seems to get worse before it starts\ngetting better. If the condition becomes much worse or if\nthe skin is very irritated, check with the physician who\nprescribed the medicine.\nBenzoyl peroxide and tretinoin\nWhen applying antiacne drugs to the skin, be careful\nnot to get the medicine in the eyes, mouth, or inside of\nthe nose. Do not put the medicine on skin that is wind', 'OTHER MEDICAL CONDITIONS. Before using anti-\nacne drugs applied to the skin, people with any of these\nmedical problems should make sure their physicians are\naware of their conditions:\n• eczema. Anti-acne drugs that are applied to the skin\nmay make this condition worse.\n• sunburn or raw skin. Anti-acne drugs that are applied to\nthe skin may increase the pain and irritation of these\nconditions.\nIn people with certain medical conditions, isotre-\ntinoin may increase the amount of triglyceride (a fatty-\nsubstance) in the blood. This may lead to heart or blood\nvessel problems. Before using isotretinoin, people with\nany of these medical problems should make sure their\nphysicians are aware of their conditions:\n• alcoholism or heavy drinking, now or in the past', '• diabetes (or family history of diabetes). Isotretinoin\nmay also change blood sugar levels.\n• family history of high triglyceride levels in the blood\n• severe weight problems\nUSE OF CERTAIN MEDICINES. Using antiacne drugs\nwith certain other drugs may affect the way the drugs\nwork or may increase the chance of side effects.\nSide effects\nIsotretinoin\nMinor discomforts such as dry mouth or nose, dry\neyes, dry skin, or itching usually go away as the body\nadjusts to the drug and do not require medical attention\nunless they continue or are bothersome.\nOther side effects should be brought to a physicians\nattention. These include:\n• burning, redness, or itching of the eyes\n• nosebleeds\n• signs of inflammation of the lips, such as peeling, burn-\ning, redness or pain', 'use antiacne drugs. Before using these products, be sure to\nlet the physician know about any of these conditions:\nALLERGIES. Anyone who has had unusual reactions\nto etretinate, isotretinoin, tretinoin, vitamin A prepara-\ntions, or benzoyl peroxide in the past should let his or her\nphysician know before using an antiacne drug. The\nphysician should also be told about any allergies to\nfoods, dyes, preservatives, or other substances.\nPREGNANCY. Women who are pregnant or who may\nbecome pregnant should check with a physician before\nusing tretinoin or benzoyl peroxide. Isotretinoin causes\nbirth defects in humans and must not be used during\npregnancy.\nBREASTFEEDING. No problems have been reported\nin nursing babies whose mothers used tretinoin or ben-', 'ends. This will help reduce the chance of a pregnant\nwoman receiving blood containing isotretinoin, which\ncould cause birth defects.\nIsotretinoin may cause a sudden decrease in night\nvision. If this happens, do not drive or do anything else\nthat could be dangerous until vision returns to normal.\nLet the physician know about the problem.\nThis medicine may also make the eyes, nose, and\nmouth dry. Ask the physician about using special eye\ndrops to relieve eye dryness. To temporarily relieve the\ndry mouth , chew sugarless gum, suck on sugarless\ncandy or ice chips, or use saliva substitutes, which come\nin liquid and tablet forms and are available without a pre-\nscription. If the problem continues for more than two\nweeks, check with a physician or dentist. Mouth dryness', 'ing vitamin A while taking isotretinoin.\n• tetracyclines (used to treat infections). Using these medi-\ncines with isotretinoin increases the chance of swelling\nof the brain. Make sure the physician knows if tetracy-\ncline is being used to treat acne or another infection.\nNancy Ross-Flanigan\nKEY TERMS\nAcne—A skin condition in which raised bumps,\npimples, and cysts form on the face, neck, shoul-\nders and upper back.\nBacteria—Tiny, one-celled forms of life that cause\nmany diseases and infections.\nBowel—The intestine; a tube-like structure that\nextends from the stomach to the anus. Some diges-\ntive processes are carried out in the bowel before\nfood passes out of the body as waste.\nCyst—An abnormal sac or enclosed cavity in the\nbody, filled with liquid or partially solid material.']","Isotretinoin may interact with several drugs and supplements, which can increase the risk of side effects or alter the effects of one or both medications. The following are known to cause adverse interactions when taken concurrently with isotretinoin:

1. **Etretinate (Tegison)** - used to treat severe psoriasis; using this with isotretinoin increases side effects.
2. **Tretinoin (Retin-A, Renova)** - using this with isotretinoin also increases side effects.
3. **Vitamin A or any medicine containing Vitamin A** - using any vitamin A preparations with isotretinoin increases side effects.
4. **Tetracyclines** - used to treat infections; using these with isotretinoin increases the chance of swelling of the brain.

It is important for anyone taking isotretinoin to inform their physician about all other medications and supplements they are using to assess potential interactions (Source: Unknown).","Isotretinoin interacts with several substances, including: • Etretinate and Tretinoin: Increases side effects.• Vitamin A: Increases side effects (patients should avoid vitamin supplements containing Vitamin A).• Tetracyclines: Increases the chance of brain swelling.",1.0,0.642857142825,1.0,0.9459648470873395,0.9890864602547572
What medical conditions require special consideration or physician awareness before a patient begins using isotretinoin?,"['OTHER MEDICAL CONDITIONS. Before using anti-\nacne drugs applied to the skin, people with any of these\nmedical problems should make sure their physicians are\naware of their conditions:\n• eczema. Anti-acne drugs that are applied to the skin\nmay make this condition worse.\n• sunburn or raw skin. Anti-acne drugs that are applied to\nthe skin may increase the pain and irritation of these\nconditions.\nIn people with certain medical conditions, isotre-\ntinoin may increase the amount of triglyceride (a fatty-\nsubstance) in the blood. This may lead to heart or blood\nvessel problems. Before using isotretinoin, people with\nany of these medical problems should make sure their\nphysicians are aware of their conditions:\n• alcoholism or heavy drinking, now or in the past', 'use antiacne drugs. Before using these products, be sure to\nlet the physician know about any of these conditions:\nALLERGIES. Anyone who has had unusual reactions\nto etretinate, isotretinoin, tretinoin, vitamin A prepara-\ntions, or benzoyl peroxide in the past should let his or her\nphysician know before using an antiacne drug. The\nphysician should also be told about any allergies to\nfoods, dyes, preservatives, or other substances.\nPREGNANCY. Women who are pregnant or who may\nbecome pregnant should check with a physician before\nusing tretinoin or benzoyl peroxide. Isotretinoin causes\nbirth defects in humans and must not be used during\npregnancy.\nBREASTFEEDING. No problems have been reported\nin nursing babies whose mothers used tretinoin or ben-', 'that continues over a long time may contribute to tooth\ndecay and other dental problems.\nIsotretinoin may increase sensitivity to sunlight.\nPatients being treated with this medicine should avoid\nexposure to the sun and should not use tanning beds, tan-\nning booths, or sunlamps until they know how the drug\naffects them.\nIn the early stages of treatment with isotretinoin,\nsome people’s acne seems to get worse before it starts\ngetting better. If the condition becomes much worse or if\nthe skin is very irritated, check with the physician who\nprescribed the medicine.\nBenzoyl peroxide and tretinoin\nWhen applying antiacne drugs to the skin, be careful\nnot to get the medicine in the eyes, mouth, or inside of\nthe nose. Do not put the medicine on skin that is wind', 'taking the medicine. If the condition is still severe after\nseveral months of treatment and a two-month break, the\nphysician may prescribe a second course of treatment.\nPrecautions\nIsotretinoin\nIsotretinoin can cause serious birth defects, includ-\ning mental retardation and physical deformities. This\nmedicine should not be used during pregnancy. Women\nwho are able to bear children should not use isotretinoin\nunless they have very severe acne that has not cleared up\nwith the use of other anti-acne drugs. In that case, a\nwoman who uses this drug must have a pregnancy test\ntwo weeks before beginning treatment and each month\nthey are taking the drug. Another pregnancy test must be\ndone one month after treatment ends. The woman must\nuse an effective birth control method for one month', 'before treatment begins and must continue using it\nthroughout treatment and for one month after treatment\nends. Women who are able to bear children and who want\nto use this medicine should discuss this information with\ntheir health care providers. Before using the medicine,\nthey will be asked to sign a consent form stating that they\nunderstand the danger of taking isotretinoin during preg-\nnancy and that they agree to use effective birth control.\nDo not donate blood to a blood bank while taking\nisotretinoin or for 30 days after treatment with the drug\nGALE ENCYCLOPEDIA OF MEDICINE 2226\nAntiacne drugs\nGEM - 0001 to 0432 - A  10/22/03 1:42 PM  Page 226', '• diabetes (or family history of diabetes). Isotretinoin\nmay also change blood sugar levels.\n• family history of high triglyceride levels in the blood\n• severe weight problems\nUSE OF CERTAIN MEDICINES. Using antiacne drugs\nwith certain other drugs may affect the way the drugs\nwork or may increase the chance of side effects.\nSide effects\nIsotretinoin\nMinor discomforts such as dry mouth or nose, dry\neyes, dry skin, or itching usually go away as the body\nadjusts to the drug and do not require medical attention\nunless they continue or are bothersome.\nOther side effects should be brought to a physicians\nattention. These include:\n• burning, redness, or itching of the eyes\n• nosebleeds\n• signs of inflammation of the lips, such as peeling, burn-\ning, redness or pain', 'Isotretinoin may interact with other medicines.\nWhen this happens, the effects of one or both drugs may\nchange or the risk of side effects may be greater. Anyone\nwho takes isotretinoin should let the physician know\nabout all other medicines he or she is taking and should\nask whether the possible interactions can interfere with\ndrug therapy. Among the drugs that may interact with\nisotretinoin are:\n• etretinate (Tegison), used to treat severe psoriasis. Using\nthis medicine with isotretinoin increases side effects.\n• tretinoin (Retin-A, Renova). Using this medicine with\nisotretinoin increases side effects.\n• vitamin A or any medicine containing vitamin A. Using\nany vitamin A preparations with isotretinoin increases\nside effects. Do not take vitamin supplements contain-']","Before using isotretinoin, patients should ensure their physicians are aware of the following medical conditions:

1. **Alcoholism or heavy drinking** (now or in the past) - Isotretinoin may increase triglyceride levels in the blood, potentially leading to heart or blood vessel problems.
2. **Diabetes** (or family history of diabetes) - Isotretinoin may change blood sugar levels.
3. **Family history of high triglyceride levels in the blood** - This condition may also be affected by isotretinoin.
4. **Severe weight problems** - This may require special consideration when using isotretinoin.

Additionally, it is crucial for women who are pregnant or may become pregnant to avoid isotretinoin due to the risk of serious birth defects. They must discuss effective birth control methods with their healthcare provider before starting treatment (Source: Unknown). 

Always consult a healthcare provider for personalized medical advice.","Physicians must be informed if the patient has a history of alcoholism or heavy drinking, diabetes (or a family history of it), a family history of high triglyceride levels, or severe weight problems, as isotretinoin can affect triglyceride and blood sugar levels.",1.0,0.16666666665,0.8333333333333334,0.9606615623448582,0.8810697270640071
What is the primary mechanism by which antiangina drugs relieve chest pain?,"['often controlled by medication, most commonly with\nnitroglycerin. This drug relieves symptoms of angina by\nincreasing the diameter of the blood vessels carrying\nblood to the heart muscle. Nitroglycerin is taken whenever\ndiscomfort occurs or is expected. It may be taken by\nmouth by placing the tablet under the tongue or transder-\nmally by placing a medicated patch directly on the skin. In\naddition, beta blockers or calcium channel blockers\nmay be prescribed to also decrease the demand on the\nheart by decreasing the rate and workload of the heart.\nSurgical treatment\nWhen conservative treatments are not effective in\nthe reduction of angina pain and the risk of heart attack\nremains high, physicians may recommend angioplasty\nor surgery. Coronary artery bypass surgery is an opera-', 'different forms, and are used in three main ways:\n• taken regularly over a long period, they reduce the\nnumber of angina attacks.\n• taken just before some activity that usually brings on an\nattack, such as climbing stairs, they prevent attacks.\n• taken when an attack begins, they relieve the pain and\npressure.\nNot every form of antiangina drug can be used in\nevery way. Some work too slowly to prevent attacks that\nare about to begin or to relieve attacks that have already\nstarted. These forms can be used only to reduce the num-\nber of attacks. Be sure to understand how and when to\nuse the type of antiangina drug that has been prescribed.\nDescription\nAntiangina drugs, also known as nitrates, come in\nmany different forms: tablets and capsules that are swal-', 'lowed; tablets that are held under the tongue, inside the\nlip, or in the cheek until they dissolve; stick-on patches;\nointment; and in-the-mouth sprays. Commonly used\nantiangina drugs include isosorbide dinitrate (Isordil,\nSorbitrate, and other brands) and nitroglycerin (Nitro-\nBid, Nitro-Dur, Nitrolingual Spray, Nitrostat Tablets,\nTransderm-Nitro, and other brands). These medicines are\navailable only with a physician’s prescription.\nRecommended dosage\nThe recommended dosage depends on the type and\nform of antiangina drug and may be different for differ-\nent patients. Check with the physician who prescribed\nthe drug or the pharmacist who filled the prescription for\nthe correct dosage.\nAlways take antiangina drugs exactly as directed.', 'son should go to the hospital emergency room as soon as\npossible. A heart attack may be in progress.\nSome people develop tolerance to antiangina drugs\nover time. That is, the drug no longer produces the\ndesired effects. Anyone who seems to be developing a\ntolerance to this medicine should check with his or her\nphysician.\nAnyone who has had unusual reactions to antiangina\ndrugs in the past should let his or her physician know\nbefore taking the drugs again. The physician should also\nbe told about any allergies to foods, dyes, preservatives,\nor other substances.\nWomen who are pregnant or breastfeeding or who\nmay become pregnant should check with their physicians\nbefore using antiangina drugs.\nOlder people may be especially sensitive to the', 'slow channel blockers or calcium antagonists, inhibit the\nmovement of ionic calcium across the cell membrane.\nThis reduces the force of contraction of muscles of the\nheart and arteries. Although the calcium channel block-\ners are treated as a group, there are four different chemi-\ncal classes, leading to significant variations in the activi-\nty of individual drugs. Nifedipine (Adalat, Procardia) has\nthe greatest effect on the blood vessels, while verapamil\n(Calan, Isoptin) and diltiazem (Cardizem) have a greater\neffect on the heart muscle itself.\nPeripheral vasodilators such as hydralazine\n(Apresoline), isoxuprine (Vasodilan), and minoxidil\n(Loniten) act by relaxing blood vessels.\nThere are several groups of drugs which act by reduc-\ning adrenergic nerve stimulation, the excitatory nerve', 'response to certain nerve impulses. This, in turn, decreases\nthe force and rate of the heart’s contractions, which lowers\nblood pressure and reduces the heart’s demand for oxygen.\nPurpose\nThe main use of beta blockers is to treat high blood\npressure. Some also are used to relieve the type of chest\npain called angina or to prevent heart attacks in people\nwho already have had one heart attack . These drugs\nmay also be prescribed for other conditions, such as\nmigraine, tremors, and irregular heartbeat. In eye drop\nform, they are used to treat certain kinds of glaucoma.\nDescription\nBeta blockers, also known as beta-adrenergic block-\ners, are available only with a physician’s prescription.\nGALE ENCYCLOPEDIA OF MEDICINE 2474\nBeta blockers\nGEM -0433 to 0624 - B  10/22/03 6:08 PM  Page 474', 'Eczema—Inflammation of the skin with itching\nand a rash. The rash may have blisters that ooze\nand form crusts.\nPimple—A small, red swelling of the skin.\nPsoriasis —A skin disease in which people have\nitchy, scaly, red patches on the skin.\nPus—Thick, whitish or yellowish fluid that forms\nin infected tissue.\nTriglyceride —A substance formed in the body\nfrom fat in the diet.\nAntiangina drugs\nDefinition\nAntiangina drugs are medicines that relieve the\nsymptoms of angina pectoris (severe chest pain).\nPurpose\nThe dull, tight chest pain of angina occurs when the\nheart’s muscular wall is not getting enough oxygen. By\nrelaxing the blood vessels, antiangina drugs reduce the\nheart’s work load and increase the amount of oxygen-\nrich blood that reaches the heart. These drugs come in']","Antiangina drugs relieve chest pain primarily by relaxing the blood vessels, which reduces the heart's workload and increases the amount of oxygen-rich blood that reaches the heart. This is particularly important because the dull, tight chest pain of angina occurs when the heart's muscular wall is not getting enough oxygen (Source: Unknown).","Antiangina drugs work by relaxing the blood vessels. This reduction in tension lowers the heart's workload and increases the supply of oxygen-rich blood reaching the heart muscle, thereby relieving the symptoms of angina pectoris.",1.0,0.609523809503492,1.0,0.9613923014510285,0.8362762303164972
In what three ways are antiangina drugs typically used to manage conditions?,"['different forms, and are used in three main ways:\n• taken regularly over a long period, they reduce the\nnumber of angina attacks.\n• taken just before some activity that usually brings on an\nattack, such as climbing stairs, they prevent attacks.\n• taken when an attack begins, they relieve the pain and\npressure.\nNot every form of antiangina drug can be used in\nevery way. Some work too slowly to prevent attacks that\nare about to begin or to relieve attacks that have already\nstarted. These forms can be used only to reduce the num-\nber of attacks. Be sure to understand how and when to\nuse the type of antiangina drug that has been prescribed.\nDescription\nAntiangina drugs, also known as nitrates, come in\nmany different forms: tablets and capsules that are swal-', 'often controlled by medication, most commonly with\nnitroglycerin. This drug relieves symptoms of angina by\nincreasing the diameter of the blood vessels carrying\nblood to the heart muscle. Nitroglycerin is taken whenever\ndiscomfort occurs or is expected. It may be taken by\nmouth by placing the tablet under the tongue or transder-\nmally by placing a medicated patch directly on the skin. In\naddition, beta blockers or calcium channel blockers\nmay be prescribed to also decrease the demand on the\nheart by decreasing the rate and workload of the heart.\nSurgical treatment\nWhen conservative treatments are not effective in\nthe reduction of angina pain and the risk of heart attack\nremains high, physicians may recommend angioplasty\nor surgery. Coronary artery bypass surgery is an opera-', 'lowed; tablets that are held under the tongue, inside the\nlip, or in the cheek until they dissolve; stick-on patches;\nointment; and in-the-mouth sprays. Commonly used\nantiangina drugs include isosorbide dinitrate (Isordil,\nSorbitrate, and other brands) and nitroglycerin (Nitro-\nBid, Nitro-Dur, Nitrolingual Spray, Nitrostat Tablets,\nTransderm-Nitro, and other brands). These medicines are\navailable only with a physician’s prescription.\nRecommended dosage\nThe recommended dosage depends on the type and\nform of antiangina drug and may be different for differ-\nent patients. Check with the physician who prescribed\nthe drug or the pharmacist who filled the prescription for\nthe correct dosage.\nAlways take antiangina drugs exactly as directed.', 'na attacks to return. If it is necessary to stop taking the\ndrug, check with the physician who prescribed it for\ninstructions on how to taper down gradually.\nPrecautions\nRemember that some forms of antiangina drugs\nwork too slowly to relieve attacks that have already start-\ned. Check with the physician who prescribed the medi-\ncine for instructions on how to use the type that has been\nprescribed. Patients who are using slower-acting forms to\nmake attacks less frequent may want to ask their physi-\ncians to prescribe a fast-acting type to relieve attacks.\nAnother method of treating the frequency of attacks is to\nincrease the dosage of the long-acting antiangina drug.\nDo this only with the approval of a physician.\nThese medicines make some people feel lighthead-', 'son should go to the hospital emergency room as soon as\npossible. A heart attack may be in progress.\nSome people develop tolerance to antiangina drugs\nover time. That is, the drug no longer produces the\ndesired effects. Anyone who seems to be developing a\ntolerance to this medicine should check with his or her\nphysician.\nAnyone who has had unusual reactions to antiangina\ndrugs in the past should let his or her physician know\nbefore taking the drugs again. The physician should also\nbe told about any allergies to foods, dyes, preservatives,\nor other substances.\nWomen who are pregnant or breastfeeding or who\nmay become pregnant should check with their physicians\nbefore using antiangina drugs.\nOlder people may be especially sensitive to the', 'effects of antiangina drugs and thus more likely to have\nside effects such as dizziness and lightheadedness.\nBefore using antiangina drugs, people with any of\nthese medical problems should make sure their physi-\ncians are aware of their conditions:\n• recent heart attack or stroke\n• kidney disease\n• liver disease\n• severe anemia\n• overactive thyroid\n• glaucoma\n• recent head injury\nSide effects\nA common side effect is a headache just after taking\na dose of the medicine. These headaches usually become\nless noticeable as the body adjusts to the drug. Check\nwith a physician if they are severe or they continue even\nafter taking the medicine for a few weeks. Unless a\nphysician says to do so, do not change the dose to avoid\nGALE ENCYCLOPEDIA OF MEDICINE 2230\nAntiangina drugs\nAntiangina Drugs', 'Antiangina drugs\nAntiangina Drugs\nBrand Name (Generic Name) Possible Common Side Effects Include:\nCalan (calan SR, isoptin, isoptin SR, verelan) Constipation, dizziness, fatigue, headache, fluid retention, low\nblood pressure, nausea\nCardene (nicardipine hydrochloride) Dizziness, headache, indigestion, nausea, rapid heartbeat,\nsleepiness, swelling of feet, flushing\nCardizem (diltiazem hydrochloride) Dizziness, fluid retention, headache, nausea, rash\nCorgard (nadolol) Behaviorial changes, dizziness, drowsiness, tiredness\nImdur, Ismo, Monoket (isosorbide mononitrate) Headache\nIsordil (isosorbide dinitrate) Headache, dizziness, low blood pressure\nLopressor (metroprolol tartrate) Depression, diarrhea, itching, rash, tiredness']","Antiangina drugs are typically used in three main ways to manage conditions:

1. Taken regularly over a long period to reduce the number of angina attacks.
2. Taken just before an activity that usually triggers an attack, such as climbing stairs, to prevent attacks.
3. Taken when an attack begins to relieve the pain and pressure associated with angina.

It's important to note that not every form of antiangina drug can be used in every way, as some may work too slowly to prevent or relieve attacks. Always consult with a healthcare provider to understand how and when to use the prescribed type of antiangina drug (Source: Unknown).","1. Long-term prevention: Taken regularly to reduce the frequency of angina attacks.2. Prophylaxis: Taken just before an activity known to trigger an attack (e.g., climbing stairs) to prevent it.3. Acute relief: Taken at the onset of an attack to relieve pain and pressure.",1.0,0.99999999995,1.0,0.9688820696805182,0.7797806007850239
What forms of administration are available for antiangina drugs (nitrates)?,"['lowed; tablets that are held under the tongue, inside the\nlip, or in the cheek until they dissolve; stick-on patches;\nointment; and in-the-mouth sprays. Commonly used\nantiangina drugs include isosorbide dinitrate (Isordil,\nSorbitrate, and other brands) and nitroglycerin (Nitro-\nBid, Nitro-Dur, Nitrolingual Spray, Nitrostat Tablets,\nTransderm-Nitro, and other brands). These medicines are\navailable only with a physician’s prescription.\nRecommended dosage\nThe recommended dosage depends on the type and\nform of antiangina drug and may be different for differ-\nent patients. Check with the physician who prescribed\nthe drug or the pharmacist who filled the prescription for\nthe correct dosage.\nAlways take antiangina drugs exactly as directed.', 'different forms, and are used in three main ways:\n• taken regularly over a long period, they reduce the\nnumber of angina attacks.\n• taken just before some activity that usually brings on an\nattack, such as climbing stairs, they prevent attacks.\n• taken when an attack begins, they relieve the pain and\npressure.\nNot every form of antiangina drug can be used in\nevery way. Some work too slowly to prevent attacks that\nare about to begin or to relieve attacks that have already\nstarted. These forms can be used only to reduce the num-\nber of attacks. Be sure to understand how and when to\nuse the type of antiangina drug that has been prescribed.\nDescription\nAntiangina drugs, also known as nitrates, come in\nmany different forms: tablets and capsules that are swal-', 'often controlled by medication, most commonly with\nnitroglycerin. This drug relieves symptoms of angina by\nincreasing the diameter of the blood vessels carrying\nblood to the heart muscle. Nitroglycerin is taken whenever\ndiscomfort occurs or is expected. It may be taken by\nmouth by placing the tablet under the tongue or transder-\nmally by placing a medicated patch directly on the skin. In\naddition, beta blockers or calcium channel blockers\nmay be prescribed to also decrease the demand on the\nheart by decreasing the rate and workload of the heart.\nSurgical treatment\nWhen conservative treatments are not effective in\nthe reduction of angina pain and the risk of heart attack\nremains high, physicians may recommend angioplasty\nor surgery. Coronary artery bypass surgery is an opera-', 'na attacks to return. If it is necessary to stop taking the\ndrug, check with the physician who prescribed it for\ninstructions on how to taper down gradually.\nPrecautions\nRemember that some forms of antiangina drugs\nwork too slowly to relieve attacks that have already start-\ned. Check with the physician who prescribed the medi-\ncine for instructions on how to use the type that has been\nprescribed. Patients who are using slower-acting forms to\nmake attacks less frequent may want to ask their physi-\ncians to prescribe a fast-acting type to relieve attacks.\nAnother method of treating the frequency of attacks is to\nincrease the dosage of the long-acting antiangina drug.\nDo this only with the approval of a physician.\nThese medicines make some people feel lighthead-', 'son should go to the hospital emergency room as soon as\npossible. A heart attack may be in progress.\nSome people develop tolerance to antiangina drugs\nover time. That is, the drug no longer produces the\ndesired effects. Anyone who seems to be developing a\ntolerance to this medicine should check with his or her\nphysician.\nAnyone who has had unusual reactions to antiangina\ndrugs in the past should let his or her physician know\nbefore taking the drugs again. The physician should also\nbe told about any allergies to foods, dyes, preservatives,\nor other substances.\nWomen who are pregnant or breastfeeding or who\nmay become pregnant should check with their physicians\nbefore using antiangina drugs.\nOlder people may be especially sensitive to the', 'Nitro-Bid, Nitro-Dur, Nitrolingual Spray, Nitrostat Tables, Transderm-Nitro (nitroglycerin) Dizziness, flushing, headache\nNorvasc (amlodipine besylate) Dizziness, fatigue, fluid retention, headache, palpitations\nProcardia, Procardia XL, Adalat (nifedipine) Constipation, dizziness, hearburn, low blood pressure, moodi-\nness, nausea, swelling\nTenormin (atenolol) Dizziness, fatigue, nausea, slowed heartbeat\nGEM - 0001 to 0432 - A  10/22/03 1:42 PM  Page 230', 'levels of the drug in the patient’s bloodstream. For example, pain \nmedications administered at end of life are often prescribed ATC instead \nof PRN (as needed) to maintain optimal pain relief. \nRoute of Administration \nCommon routes of administration and standard abbreviations include the \nfollowing: \n• Oral (PO) – the patient swallows a tablet or capsule \n• Sublingual (SL) – applied under the tongue \n• Enteral (NG or PEG) – administered via a tube directly into the GI tract \n• Rectal (PR) – administered via rectal suppository \n• Inhalation (INH) – the patient breathes in medication from an inhaler \n• Intramuscular (IM) – administered via an injection into a muscle \n• Subcutaneous – administered via injection into the fat tissue beneath']","Antiangina drugs, also known as nitrates, are available in several forms of administration, including:

1. **Sublingual tablets** - These are placed under the tongue until they dissolve.
2. **Transdermal patches** - These are stick-on patches applied directly to the skin.
3. **Ointments** - These are applied to the skin.
4. **In-the-mouth sprays** - These are sprays used inside the mouth.

These various forms allow for different methods of delivery depending on the patient's needs and the specific medication prescribed (Source: Unknown). 

Always consult with a healthcare provider for proper usage and administration of these medications.","These drugs are available as swallowed tablets and capsules; sublingual tablets (held under the tongue, inside the lip, or in the cheek); stick-on patches; ointments; and in-the-mouth sprays.",1.0,0.999999999975,0.8571428571428571,0.9617904755850473,0.7965366238103795
What precaution should be taken regarding the discontinuation of antiangina medication?,"['son should go to the hospital emergency room as soon as\npossible. A heart attack may be in progress.\nSome people develop tolerance to antiangina drugs\nover time. That is, the drug no longer produces the\ndesired effects. Anyone who seems to be developing a\ntolerance to this medicine should check with his or her\nphysician.\nAnyone who has had unusual reactions to antiangina\ndrugs in the past should let his or her physician know\nbefore taking the drugs again. The physician should also\nbe told about any allergies to foods, dyes, preservatives,\nor other substances.\nWomen who are pregnant or breastfeeding or who\nmay become pregnant should check with their physicians\nbefore using antiangina drugs.\nOlder people may be especially sensitive to the', 'na attacks to return. If it is necessary to stop taking the\ndrug, check with the physician who prescribed it for\ninstructions on how to taper down gradually.\nPrecautions\nRemember that some forms of antiangina drugs\nwork too slowly to relieve attacks that have already start-\ned. Check with the physician who prescribed the medi-\ncine for instructions on how to use the type that has been\nprescribed. Patients who are using slower-acting forms to\nmake attacks less frequent may want to ask their physi-\ncians to prescribe a fast-acting type to relieve attacks.\nAnother method of treating the frequency of attacks is to\nincrease the dosage of the long-acting antiangina drug.\nDo this only with the approval of a physician.\nThese medicines make some people feel lighthead-', 'effects of antiangina drugs and thus more likely to have\nside effects such as dizziness and lightheadedness.\nBefore using antiangina drugs, people with any of\nthese medical problems should make sure their physi-\ncians are aware of their conditions:\n• recent heart attack or stroke\n• kidney disease\n• liver disease\n• severe anemia\n• overactive thyroid\n• glaucoma\n• recent head injury\nSide effects\nA common side effect is a headache just after taking\na dose of the medicine. These headaches usually become\nless noticeable as the body adjusts to the drug. Check\nwith a physician if they are severe or they continue even\nafter taking the medicine for a few weeks. Unless a\nphysician says to do so, do not change the dose to avoid\nGALE ENCYCLOPEDIA OF MEDICINE 2230\nAntiangina drugs\nAntiangina Drugs', 'headaches. Other common side effects include dizziness,\nlightheadedness, fast pulse, flushed face and neck, nau-\nsea or vomiting, and restlessness. These problems do not\nneed medical attention unless they do not go away or\nthey interfere with normal activities.\nOther side effects may occur. Anyone who has\nunusual symptoms after taking an antiangina drug should\nget in touch with his or her physician.\nInteractions\nAntiangina drugs may interact with other medicines.\nThis may increase the risk of side effects or change the\neffects of one or both drugs. Anyone who takes antiangi-\nna drugs should let the physician know all other medi-\ncines he or she is taking. Among the drugs that may\ninteract with antiangina drugs are:\n• other heart medicines\n• blood pressure medicines\n• aspirin\n• alcohol', 'The medicine will not work if it is not taken correctly.\nDo not stop taking this medicine suddenly after tak-\ning it for several weeks or more, as this could cause angi-\nGALE ENCYCLOPEDIA OF MEDICINE 2 229\nAntiangina drugs\nGEM - 0001 to 0432 - A  10/22/03 1:42 PM  Page 229', 'important.\nDo not stop taking this medicine without checking\nwith the physician who prescribed it. Some conditions\nmay get worse when patients stop taking beta blockers\nabruptly. This may also increase the risk of heart attack\nin some people. Because of these possible effects, it is\nimportant to keep enough medicine on hand to get\nthrough weekends, holidays, and vacations.\nPhysicians may recommend that patients check their\npulse before and after taking this medicine. If the pulse\nbecomes too slow, circulation problems may result.\nPrecautions\nSeeing a physician regularly while taking beta\nblockers is important. The physician will check to make\nsure the medicine is working as it should and will watch\nfor unwanted side effects. People who have high blood', 'ed, dizzy, or faint when they get up after sitting or lying\ndown. To lessen the problem, get up gradually and hold\nonto something for support if possible. Antiangina drugs\nmay also cause dizziness, lightheadedness, or fainting in\nhot weather or when people stand for a long time or\nexercise . Use caution in all these situations. Drinking\nalcohol while taking antiangina drugs may cause the\nsame problems. Anyone who takes this medicine should\nlimit the amount of alcohol consumed.\nBecause these drugs may cause dizziness, be careful\nwhen driving, using machines, or doing anything else\nthat could be dangerous.\nIf the person is taking the form of nitroglycerin that\nis placed under the tongue and symptoms are not relieved\nwithin three doses taken about 5 minutes apart, the per-']","It is important not to stop taking antiangina medication suddenly after using it for several weeks or more, as this could lead to worsening conditions or increase the risk of a heart attack in some individuals. Patients should always check with the physician who prescribed the medication before discontinuing it. If it is necessary to stop taking the drug, the physician should provide instructions on how to taper down gradually (Source: Unknown).","Patients should not stop taking the medicine suddenly after using it for several weeks, as this could cause angina attacks to return. Dosage should be tapered down gradually under a physician's instructions.",1.0,0.9150793650641138,1.0,0.9454895652113048,0.836019578510604
What is the protocol if sublingual nitroglycerin does not relieve symptoms after three doses?,"['lowed; tablets that are held under the tongue, inside the\nlip, or in the cheek until they dissolve; stick-on patches;\nointment; and in-the-mouth sprays. Commonly used\nantiangina drugs include isosorbide dinitrate (Isordil,\nSorbitrate, and other brands) and nitroglycerin (Nitro-\nBid, Nitro-Dur, Nitrolingual Spray, Nitrostat Tablets,\nTransderm-Nitro, and other brands). These medicines are\navailable only with a physician’s prescription.\nRecommended dosage\nThe recommended dosage depends on the type and\nform of antiangina drug and may be different for differ-\nent patients. Check with the physician who prescribed\nthe drug or the pharmacist who filled the prescription for\nthe correct dosage.\nAlways take antiangina drugs exactly as directed.', 'If any post-assessments are required, follow up in the appropriate time \nframe. For example, when administering oral pain medication, follow up \napproximately 30 minutes to an hour after medication is given to ensure \neffective pain relief. \nIf medication is given sublingual (under the tongue) or buccal (between \nthe cheek and gum), the mouth should be moist. Offering the patient a \ndrink of water prior to giving the medication can help with absorption. \nInstruct the patient to allow the medication to completely dissolve and \nreinforce the importance of not swallowing or chewing the medication. \n25. “DSC_17631-150x150.jpg” by British Columbia Institute of Technology is licensed under CC BY 4.0. Access', '19. Evaluate the patient’s response to the medication within the \nappropriate time frame. Note: Most sublingual medications act in 15 \nminutes, and most oral medications act in 30 minutes. If patient \npresents with any adverse effects: \n◦ Withhold further doses. \n◦ Assess vital signs. \n◦ Notify prescriber. \n◦ Notify pharmacy. \n◦ Document as per agency policy. \n886  |  15.4 Checklist for Oral Medication Administration', 'son should go to the hospital emergency room as soon as\npossible. A heart attack may be in progress.\nSome people develop tolerance to antiangina drugs\nover time. That is, the drug no longer produces the\ndesired effects. Anyone who seems to be developing a\ntolerance to this medicine should check with his or her\nphysician.\nAnyone who has had unusual reactions to antiangina\ndrugs in the past should let his or her physician know\nbefore taking the drugs again. The physician should also\nbe told about any allergies to foods, dyes, preservatives,\nor other substances.\nWomen who are pregnant or breastfeeding or who\nmay become pregnant should check with their physicians\nbefore using antiangina drugs.\nOlder people may be especially sensitive to the', 'often controlled by medication, most commonly with\nnitroglycerin. This drug relieves symptoms of angina by\nincreasing the diameter of the blood vessels carrying\nblood to the heart muscle. Nitroglycerin is taken whenever\ndiscomfort occurs or is expected. It may be taken by\nmouth by placing the tablet under the tongue or transder-\nmally by placing a medicated patch directly on the skin. In\naddition, beta blockers or calcium channel blockers\nmay be prescribed to also decrease the demand on the\nheart by decreasing the rate and workload of the heart.\nSurgical treatment\nWhen conservative treatments are not effective in\nthe reduction of angina pain and the risk of heart attack\nremains high, physicians may recommend angioplasty\nor surgery. Coronary artery bypass surgery is an opera-', '▪ Perform hand hygiene. \nD. Nose Spray: \n▪ Perform hand hygiene. (Put on gloves, as needed, to comply \nwith standard precautions). \n▪ Have the patient blow their nose. \n▪ Have the patient tilt their head back. \n▪ Instruct the patient to inhale with administration if necessary. \n▪ Close the opposite nare. \n▪ Place a bottle or dropper in the affected nare. \n▪ Squeeze the bottle or dropper and have the patient inhale. \n▪ Keep the bottle or dropper compressed and remove from the \nnare. \n▪ Instruct the patient to hold their breath for a few seconds and \nthen breathe out through the mouth. \n▪ Repeat in other nare if ordered. \n▪ Clean tip of bottle with tissue or cloth. \n▪ Perform hand hygiene. \nE. Vaginal Cream or Suppository: \n▪ Perform hand hygiene and don gloves.', 'types of medications. The patient should be given tissues and asked to \nblow their nose. Position the patient with their head tilted backwards \nwhile sitting or lying supine looking upwards. The nurse should insert the \ntip of the spray bottle or the nasal dropper into one nare while occluding \nthe other nare and then activate the spray as the patient inhales. The \nbottle should remain compressed as it is removed from the nose to \nprevent contamination. The patient should be instructed to hold their \nbreath for a few seconds and then breathe through their mouth. Repeat \nthis procedure in the other nare if ordered. Wipe the outside of the bottle \nwith clean tissue before storing it and advise the patient to avoid blowing']","The context does not provide specific information regarding the protocol if sublingual nitroglycerin does not relieve symptoms after three doses. However, it is generally advised that if a patient experiences persistent symptoms of angina despite taking nitroglycerin, they should seek immediate medical attention, as this may indicate a heart attack in progress. It is crucial to consult a healthcare provider for proper guidance in such situations.","If symptoms are not relieved within three doses taken about 5 minutes apart, the person should go to a hospital emergency room immediately, as a heart attack may be in progress.",1.0,0.249999999975,1.0,0.0,0.7796876059838902
"What is a common, often temporary, side effect experienced immediately after taking a dose of antiangina medication?","['headaches. Other common side effects include dizziness,\nlightheadedness, fast pulse, flushed face and neck, nau-\nsea or vomiting, and restlessness. These problems do not\nneed medical attention unless they do not go away or\nthey interfere with normal activities.\nOther side effects may occur. Anyone who has\nunusual symptoms after taking an antiangina drug should\nget in touch with his or her physician.\nInteractions\nAntiangina drugs may interact with other medicines.\nThis may increase the risk of side effects or change the\neffects of one or both drugs. Anyone who takes antiangi-\nna drugs should let the physician know all other medi-\ncines he or she is taking. Among the drugs that may\ninteract with antiangina drugs are:\n• other heart medicines\n• blood pressure medicines\n• aspirin\n• alcohol', 'effects of antiangina drugs and thus more likely to have\nside effects such as dizziness and lightheadedness.\nBefore using antiangina drugs, people with any of\nthese medical problems should make sure their physi-\ncians are aware of their conditions:\n• recent heart attack or stroke\n• kidney disease\n• liver disease\n• severe anemia\n• overactive thyroid\n• glaucoma\n• recent head injury\nSide effects\nA common side effect is a headache just after taking\na dose of the medicine. These headaches usually become\nless noticeable as the body adjusts to the drug. Check\nwith a physician if they are severe or they continue even\nafter taking the medicine for a few weeks. Unless a\nphysician says to do so, do not change the dose to avoid\nGALE ENCYCLOPEDIA OF MEDICINE 2230\nAntiangina drugs\nAntiangina Drugs', 'Antiangina drugs\nAntiangina Drugs\nBrand Name (Generic Name) Possible Common Side Effects Include:\nCalan (calan SR, isoptin, isoptin SR, verelan) Constipation, dizziness, fatigue, headache, fluid retention, low\nblood pressure, nausea\nCardene (nicardipine hydrochloride) Dizziness, headache, indigestion, nausea, rapid heartbeat,\nsleepiness, swelling of feet, flushing\nCardizem (diltiazem hydrochloride) Dizziness, fluid retention, headache, nausea, rash\nCorgard (nadolol) Behaviorial changes, dizziness, drowsiness, tiredness\nImdur, Ismo, Monoket (isosorbide mononitrate) Headache\nIsordil (isosorbide dinitrate) Headache, dizziness, low blood pressure\nLopressor (metroprolol tartrate) Depression, diarrhea, itching, rash, tiredness', 'ed, dizzy, or faint when they get up after sitting or lying\ndown. To lessen the problem, get up gradually and hold\nonto something for support if possible. Antiangina drugs\nmay also cause dizziness, lightheadedness, or fainting in\nhot weather or when people stand for a long time or\nexercise . Use caution in all these situations. Drinking\nalcohol while taking antiangina drugs may cause the\nsame problems. Anyone who takes this medicine should\nlimit the amount of alcohol consumed.\nBecause these drugs may cause dizziness, be careful\nwhen driving, using machines, or doing anything else\nthat could be dangerous.\nIf the person is taking the form of nitroglycerin that\nis placed under the tongue and symptoms are not relieved\nwithin three doses taken about 5 minutes apart, the per-', 'son should go to the hospital emergency room as soon as\npossible. A heart attack may be in progress.\nSome people develop tolerance to antiangina drugs\nover time. That is, the drug no longer produces the\ndesired effects. Anyone who seems to be developing a\ntolerance to this medicine should check with his or her\nphysician.\nAnyone who has had unusual reactions to antiangina\ndrugs in the past should let his or her physician know\nbefore taking the drugs again. The physician should also\nbe told about any allergies to foods, dyes, preservatives,\nor other substances.\nWomen who are pregnant or breastfeeding or who\nmay become pregnant should check with their physicians\nbefore using antiangina drugs.\nOlder people may be especially sensitive to the', 'they are severe or they interfere with normal activities.\nMore serious side effects are rare, but may occur. If\nany of the following side effects occur, check with a\nphysician immediately:\n• swelling of the face, lips, tongue, throat, arms, legs,\nhands, or feet\n• itchy skin\n• sudden breathing or swallowing problems\n• chest pain\n• hoarseness\n• sore throat\n• fever and chills\n• stomach pain\n• yellow eyes or skin\nIn addition, anyone who has any of the following\nsymptoms while taking an ACE inhibitor should check\nwith his or her physician as soon as possible:\n• dizziness, lightheadedness, fainting\n• confusion\n• nervousness\n•f e v e r\n• joint pain\n• numbness or tingling in hands, feet, or lips\n• weak or heavy feeling in the legs\n• skin rash\n• irregular heartbeat', 'nary artery muscle spasm of insufficient duration or\nintensity to cause an actual heart attack.\nCauses and symptoms\nAngina causes a pressing pain or sensation of heavi-\nness, usually in the chest area under the breast bone (ster-\nnum). It occasionally is experienced in the shoulder, arm,\nneck, or jaw regions. Because episodes of angina occur\nwhen the heart’s need for oxygen increases beyond the\noxygen available from the blood nourishing the heart, the\ncondition is often precipitated by physical exertion. In\nmost cases, the symptoms are relieved within a few min-\nutes by resting or by taking prescribed angina medica-\ntions. Emotional stress, extreme temperatures, heavy\nmeals, cigarette smoking, and alcohol can also cause or\ncontribute to an episode of angina.\nDiagnosis']","A common, often temporary side effect experienced immediately after taking a dose of antiangina medication is a headache. These headaches usually become less noticeable as the body adjusts to the drug. If the headaches are severe or continue even after taking the medication for a few weeks, it is advisable to check with a physician (Source: Unknown).",A headache is a common side effect right after dosing. These usually become less noticeable as the body adjusts to the drug over time.,1.0,0.9999999999666667,1.0,0.9373715712652908,0.8239690144461136
How do benzodiazepines differ from SSRIs and buspirone in terms of onset of action for treating anxiety?,"['ine and others) which have a milder side effect profile\nand less risk of dependency. However, traditional anxi-\nolytics remain useful for patients who need a rapid onset\nof action, or whose frequency of exposure to anxiety pro-\nvoking stimuli is low enough to eliminate the need for\ncontinued treatment. While SSRIs may require three to\nfive weeks to show any effects, and must be taken contin-\nuously, benzodiazepines may produce a response within\n30 minutes, and may be dosed on an as-needed basis.\nThe intermediate action benzodiazepines, alprazo-\nlam (Xanax), and lorazepam (Ativan) are the appropriate\nchoice for treatment of mild anxiety and social phobia.\nDiazepam (Valium) is still widely used for anxiety, but\nits active metabolite, desmethyldiazepam, which has a', 'long half-life, may make this a poorer choice than other\ndrugs in its class. Note that there is considerable varia-\ntion between individuals in metabolism of benzodi-\nazepines, so patient response may not be predictable. As\na class, benzodiazepines are used not only as anxiolytics,\nbut also as sedatives, muscle relaxants, and in treatment\nof epilepsy and alcoholism . The distinctions between\nthese uses are largely determined by onset and duration\nof action, and route of administration.\nBuspirone (BuSpar), which is not chemically related\nto other classes of central nervous system drugs, is also a\ntraditional anxiolytic, although it is now considered\neither a third line or adjunctive agent for use after trials\nof SSRIs and benzodiazepines. It is appropriate for use in', 'patients who have either failed trials of other treatments,\nor who should not receive benzodiazepines because of a\nhistory of substance abuse problems. Buspirone, in com-\nmon with antidepressants, requires a two to three week\nperiod before there is clinical evidence of improvement,\nand must be continuously dosed to maintain its effects.\nGALE ENCYCLOPEDIA OF MEDICINE 2 231\nAntianxiety drugs\nGEM - 0001 to 0432 - A  10/22/03 1:42 PM  Page 231', 'dependence problems, does not interact with alcohol, and\ndoes not affect the patient’s ability to drive or operate\nmachinery. However, buspirone is not effective against\ncertain types of anxiety, such as panic disorder.\nANTIDEPRESSANTS AND BETA-BLOCKERS. For some\nanxiety disorders, such as obsessive-compulsive disor-\nder and panic type anxiety, a type of drugs used to treat\ndepression, selective serotonin reuptake inhibitors\n(SSRIs; such as Prozac and Paxil), are the treatment of\nchoice. Because anxiety often coexists with symptoms of\ndepression, many doctors prescribe antidepressant med-\nications for anxious/depressed patients. While SSRIs are\nGALE ENCYCLOPEDIA OF MEDICINE 2320\nAnxiety\nGEM - 0001 to 0432 - A  10/22/03 1:42 PM  Page 320', 'Benzodiazepines are controlled drugs under federal\nlaw. Buspirone is not a controlled substance and has no\nestablished abuse potential.\nRecommended dosage\nBenzodiazepines should be administered 30 to 60\nminutes before exposure to the anticipated stress.\nDosage should be individualized to minimize sedation.\nThe normal dose of alprazolam is 0.25–0.5 mg. The\nusual dose of lorazepam is 2–3 mg. Doses may be repeat-\ned if necessary.\nBuspirone is initially dosed at 5 mg t.i.d. (3 times a\nday.) Increase the dosage 5 mg/day, at intervals of two to\nthree days, as needed. Do not exceed 60 mg/day. Two to\nthree weeks may be required before a satisfactory response\nis seen.\nPrecautions\nBenzodiazepines should not be used in patients with\npsychosis , acute narrow angle glaucoma , or liver dis-', 'which he or she is exposed to unfamiliar people or pos-\nsible scrutiny by others, and may react in a humiliating\nor embarrassing way. The exposure to the feared situa-\ntion produces an anxiety attack. Fear of these episodes\nof anxiety leads to avoidance behavior, which impairs\nnormal social functioning, including working or attend-\ning classes. The patient is aware that these fears are\nunjustified.\nDescription\nIn psychiatric practice, treatment of anxiety has\nlargely turned from traditional antianxiety agents, anxi-\nolytics, to antidepressant therapies. In current use, the\nbenzodiazepines , the best known class of anxiolytics,\nhave been largely supplanted by serotonin-specific reup-\ntake inhibitors (SSRIs, citalopram, fluoxetine, fluvoxam-', 'ease. The drugs can act as respiratory depressants and\nshould be avoided in patients with respiratory conditions.\nBenzodiazepines are potentially addictive and should not\nbe administered to patients with substance abuse disor-\nders. Because benzodiazepines are sedative, they should\nbe avoided in patients who must remain alert. Their use\nfor periods over four months has not been documented.\nThese drugs should not be used during the second and\nthird trimester of pregnancy , although use during the\nfirst trimester appears to be safe. They should not be\ntaken while breastfeeding. Consult specialized references\nfor use in children.\nBuspirone is metabolized by the liver and excreted\nby the kidney, and should be used with care in patients\nwith hepatic or renal disease. The drug is classified as']","Benzodiazepines differ from SSRIs and buspirone in terms of onset of action for treating anxiety. Benzodiazepines can produce a response within 30 minutes and may be dosed on an as-needed basis, making them suitable for patients who require rapid relief from anxiety. In contrast, SSRIs typically require three to five weeks to show any effects and must be taken continuously. Buspirone also requires a two to three week period before there is clinical evidence of improvement and must be continuously dosed to maintain its effects (Source: Unknown). 

It's important to consult a healthcare provider for personalized advice regarding anxiety treatment.","Benzodiazepines can produce a response within 30 minutes and can be used on an as-needed basis. In contrast, SSRIs and buspirone generally require two to three weeks (or up to five weeks for SSRIs) of continuous dosing to show clinical evidence of improvement.",1.0,0.94999999997625,0.8888888888888888,0.9738866760811794,0.7042161161067341
What is the recommended timing for administering benzodiazepines relative to an anticipated stressor?,"['Benzodiazepines are controlled drugs under federal\nlaw. Buspirone is not a controlled substance and has no\nestablished abuse potential.\nRecommended dosage\nBenzodiazepines should be administered 30 to 60\nminutes before exposure to the anticipated stress.\nDosage should be individualized to minimize sedation.\nThe normal dose of alprazolam is 0.25–0.5 mg. The\nusual dose of lorazepam is 2–3 mg. Doses may be repeat-\ned if necessary.\nBuspirone is initially dosed at 5 mg t.i.d. (3 times a\nday.) Increase the dosage 5 mg/day, at intervals of two to\nthree days, as needed. Do not exceed 60 mg/day. Two to\nthree weeks may be required before a satisfactory response\nis seen.\nPrecautions\nBenzodiazepines should not be used in patients with\npsychosis , acute narrow angle glaucoma , or liver dis-', 'ine and others) which have a milder side effect profile\nand less risk of dependency. However, traditional anxi-\nolytics remain useful for patients who need a rapid onset\nof action, or whose frequency of exposure to anxiety pro-\nvoking stimuli is low enough to eliminate the need for\ncontinued treatment. While SSRIs may require three to\nfive weeks to show any effects, and must be taken contin-\nuously, benzodiazepines may produce a response within\n30 minutes, and may be dosed on an as-needed basis.\nThe intermediate action benzodiazepines, alprazo-\nlam (Xanax), and lorazepam (Ativan) are the appropriate\nchoice for treatment of mild anxiety and social phobia.\nDiazepam (Valium) is still widely used for anxiety, but\nits active metabolite, desmethyldiazepam, which has a', '(Librium), diazepam (Valium), and lorazepam (Ativan).\nThese medicines take effect fairly quickly, starting to work\nwithin an hour after they are taken. Benzodiazepines are\navailable only with a physician’s prescription and are\navailable in tablet, capsule, liquid, or injectable forms.\nRecommended dosage\nThe recommended dosage depends on the type of\nbenzodiazepine, its strength, and the condition for which\nit is being taken. Doses may be different for different\npeople. Check with the physician who prescribed the\ndrug or the pharmacist who filled the prescription for the\ncorrect dosage.\nAlways take benzodiazepines exactly as directed.\nNever take larger or more frequent doses, and do not take\nthe drug for longer than directed. If the medicine does not', 'patients who have either failed trials of other treatments,\nor who should not receive benzodiazepines because of a\nhistory of substance abuse problems. Buspirone, in com-\nmon with antidepressants, requires a two to three week\nperiod before there is clinical evidence of improvement,\nand must be continuously dosed to maintain its effects.\nGALE ENCYCLOPEDIA OF MEDICINE 2 231\nAntianxiety drugs\nGEM - 0001 to 0432 - A  10/22/03 1:42 PM  Page 231', 'take benzodiazepines. Before taking these drugs, be sure\nto let the physician know about any of these conditions:\nALLERGIES. Anyone who has had unusual reactions to\nbenzodiazepines or other mood-altering drugs in the past\nshould let his or her physician know before taking the\ndrugs again. The physician should also be told about any\nallergies to foods, dyes, preservatives, or other substances.\nPREGNANCY. Some benzodiazepines increase the\nlikelihood of birth defects. Using these medicines during\npregnancy may also cause the baby to become dependent\non them and to have withdrawal symptoms after birth.\nWhen taken late in pregnancy or around the time of labor\nand delivery, these drugs can cause other problems in the\nnewborn baby, such as weakness, breathing problems,', 'If any post-assessments are required, follow up in the appropriate time \nframe. For example, when administering oral pain medication, follow up \napproximately 30 minutes to an hour after medication is given to ensure \neffective pain relief. \nIf medication is given sublingual (under the tongue) or buccal (between \nthe cheek and gum), the mouth should be moist. Offering the patient a \ndrink of water prior to giving the medication can help with absorption. \nInstruct the patient to allow the medication to completely dissolve and \nreinforce the importance of not swallowing or chewing the medication. \n25. “DSC_17631-150x150.jpg” by British Columbia Institute of Technology is licensed under CC BY 4.0. Access', 'ease. The drugs can act as respiratory depressants and\nshould be avoided in patients with respiratory conditions.\nBenzodiazepines are potentially addictive and should not\nbe administered to patients with substance abuse disor-\nders. Because benzodiazepines are sedative, they should\nbe avoided in patients who must remain alert. Their use\nfor periods over four months has not been documented.\nThese drugs should not be used during the second and\nthird trimester of pregnancy , although use during the\nfirst trimester appears to be safe. They should not be\ntaken while breastfeeding. Consult specialized references\nfor use in children.\nBuspirone is metabolized by the liver and excreted\nby the kidney, and should be used with care in patients\nwith hepatic or renal disease. The drug is classified as']","Benzodiazepines should be administered 30 to 60 minutes before exposure to the anticipated stress. This timing helps ensure that the medication takes effect when it is most needed. It's important to individualize the dosage to minimize sedation (Source: Unknown). 

Always consult a healthcare provider for personalized advice regarding medication use.",Benzodiazepines should be administered 30 to 60 minutes before exposure to the anticipated stress or anxiety-provoking situation.,1.0,0.99999999995,0.5,0.9501520798481665,0.4913225649276376
What are the key contraindications for the use of benzodiazepines?,"['ease. The drugs can act as respiratory depressants and\nshould be avoided in patients with respiratory conditions.\nBenzodiazepines are potentially addictive and should not\nbe administered to patients with substance abuse disor-\nders. Because benzodiazepines are sedative, they should\nbe avoided in patients who must remain alert. Their use\nfor periods over four months has not been documented.\nThese drugs should not be used during the second and\nthird trimester of pregnancy , although use during the\nfirst trimester appears to be safe. They should not be\ntaken while breastfeeding. Consult specialized references\nfor use in children.\nBuspirone is metabolized by the liver and excreted\nby the kidney, and should be used with care in patients\nwith hepatic or renal disease. The drug is classified as', 'slow heartbeat, and body temperature problems.\nWomen who are pregnant or who may become preg-\nnant should not use benzodiazepines unless their anxiety\nis so severe that it threatens their pregnancy.Any woman\nwho must take this medicine while pregnant should be\nsure to thoroughly discuss its risks and benefits with her\nphysician.\nBREASTFEEDING. Benzodiazepines may pass into\nbreast milk and cause problems in babies whose mothers\ntaken the medicine. These problems include drowsiness,\nbreathing problems, and slow heartbeat. Women who are\nbreastfeeding their babies should not use this medicine\nwithout checking with their physicians.\nOTHER MEDICAL CONDITIONS. Before using ben-\nzodiazepines, people with any of these medical problems\nshould make sure their physicians are aware of their con-', 'ditions:\n• current or past drug or alcohol abuse\n• depression\n• severe mental illness\n• epilepsy or other seizure disorders\n• swallowing problems\n• chronic lung disease such as emphysema, asthma,o r\nchronic bronchitis\n• kidney disease\n• liver disease\n• brain disease\n• glaucoma\n• hyperactivity\n• myasthenia gravis\n• porphyria\n• sleep apnea\nUSE OF CERTAIN MEDICINES. Taking benzodiaze-\npines with certain other drugs may affect the way the\ndrugs work or may increase the chance of side effects.\nSide effects\nThe most common side effects are dizziness, light-\nheadedness, drowsiness, clumsiness, unsteadiness, and\nGALE ENCYCLOPEDIA OF MEDICINE 2 467\nBenzodiazepines\nGEM -0433 to 0624 - B  10/22/03 6:08 PM  Page 467', 'take benzodiazepines. Before taking these drugs, be sure\nto let the physician know about any of these conditions:\nALLERGIES. Anyone who has had unusual reactions to\nbenzodiazepines or other mood-altering drugs in the past\nshould let his or her physician know before taking the\ndrugs again. The physician should also be told about any\nallergies to foods, dyes, preservatives, or other substances.\nPREGNANCY. Some benzodiazepines increase the\nlikelihood of birth defects. Using these medicines during\npregnancy may also cause the baby to become dependent\non them and to have withdrawal symptoms after birth.\nWhen taken late in pregnancy or around the time of labor\nand delivery, these drugs can cause other problems in the\nnewborn baby, such as weakness, breathing problems,', 'Some benzodiazepines may change the results of\ncertain medical tests. Before having medical tests, any-\none taking this medicine should alert the health care pro-\nfessional in charge.\nChildren are generally more sensitive than adults to\nthe effects of benzodiazepines. This sensitivity may\nincrease the chance of side effects.\nOlder people are more sensitive than younger adults\nto the effects of this medicine and may be at greater risk\nfor side effects. Older people who take these drugs to\nhelp them sleep may be drowsy during the day. Older\npeople also increase their risk of falling and injuring\nthemselves when they take these drugs.\nSpecial conditions\nPeople with certain medical conditions or who are\ntaking certain other medicines can have problems if they', 'schedule B during pregnancy, but should not be taken\nduring breastfeeding. Its use in children under the age of\n18 years has not been studied.\nSide effects\nThe most common side effects of benzodiazepines are\nsecondary to their CNS effects and include sedation and\nsleepiness; depression; lethargy; apathy; fatigue; hypoac-\ntivity; lightheadedness; memory impairment; disorienta-\ntion; anterograde amnesia; restlessness; confusion; crying\nor sobbing; delirium; headache; slurred speech; aphonia;\ndysarthria; stupor; seizures; coma; syncope; rigidity;\ntremor; dystonia; vertigo; dizziness; euphoria; nervous-\nness; irritability; difficulty in concentration; agitation;\ninability to perform complex mental functions; akathisia;\nhemiparesis; hypotonia; unsteadiness; ataxia; incoordina-', 'patients who have either failed trials of other treatments,\nor who should not receive benzodiazepines because of a\nhistory of substance abuse problems. Buspirone, in com-\nmon with antidepressants, requires a two to three week\nperiod before there is clinical evidence of improvement,\nand must be continuously dosed to maintain its effects.\nGALE ENCYCLOPEDIA OF MEDICINE 2 231\nAntianxiety drugs\nGEM - 0001 to 0432 - A  10/22/03 1:42 PM  Page 231']","The key contraindications for the use of benzodiazepines include:

1. **Respiratory Conditions**: They should be avoided in patients with respiratory conditions as they can act as respiratory depressants.
2. **Substance Abuse Disorders**: Benzodiazepines are potentially addictive and should not be administered to patients with a history of drug or alcohol abuse.
3. **Pregnancy**: They should not be used during the second and third trimesters of pregnancy, and their use during breastfeeding is also discouraged.
4. **Certain Medical Conditions**: Patients with the following conditions should inform their physician before using benzodiazepines:
   - Depression
   - Severe mental illness
   - Epilepsy or other seizure disorders
   - Swallowing problems
   - Chronic lung diseases (e.g., emphysema, asthma, chronic bronchitis)
   - Kidney disease
   - Liver disease
   - Brain disease
   - Glaucoma
   - Hyperactivity
   - Myasthenia gravis
   - Porphyria
   - Sleep apnea

5. **Older Adults**: Older individuals may be more sensitive to the effects and at greater risk for side effects, including drowsiness and increased risk of falls.

6. **Allergies**: Anyone with a history of unusual reactions to benzodiazepines or other mood-altering drugs should inform their physician.

It's important to consult a healthcare provider for a thorough evaluation and personalized advice regarding the use of benzodiazepines. (Source: Unknown)","Benzodiazepines should not be used in patients with psychosis, acute narrow-angle glaucoma, liver disease, or respiratory conditions (as they are respiratory depressants). They are also avoided in patients with substance abuse disorders due to addiction potential.",0.5,0.698412698389418,1.0,0.9999999999999999,0.39264631936968974
What is the recommended initial dosing schedule for buspirone?,"['Benzodiazepines are controlled drugs under federal\nlaw. Buspirone is not a controlled substance and has no\nestablished abuse potential.\nRecommended dosage\nBenzodiazepines should be administered 30 to 60\nminutes before exposure to the anticipated stress.\nDosage should be individualized to minimize sedation.\nThe normal dose of alprazolam is 0.25–0.5 mg. The\nusual dose of lorazepam is 2–3 mg. Doses may be repeat-\ned if necessary.\nBuspirone is initially dosed at 5 mg t.i.d. (3 times a\nday.) Increase the dosage 5 mg/day, at intervals of two to\nthree days, as needed. Do not exceed 60 mg/day. Two to\nthree weeks may be required before a satisfactory response\nis seen.\nPrecautions\nBenzodiazepines should not be used in patients with\npsychosis , acute narrow angle glaucoma , or liver dis-', 'patients who have either failed trials of other treatments,\nor who should not receive benzodiazepines because of a\nhistory of substance abuse problems. Buspirone, in com-\nmon with antidepressants, requires a two to three week\nperiod before there is clinical evidence of improvement,\nand must be continuously dosed to maintain its effects.\nGALE ENCYCLOPEDIA OF MEDICINE 2 231\nAntianxiety drugs\nGEM - 0001 to 0432 - A  10/22/03 1:42 PM  Page 231', 'tion; weakness; vivid dreams; psychomotor retardation;\n“glassy-eyed” appearance; extrapyramidal symptoms;\nparadoxical reactions. Other reactions include changes in\nheart rate and blood pressure, changes in bowel function,\nsevere skin rash and changes in genitourinary function.\nOther adverse effects have been reported.\nBuspirone has a low incidence of side effects. Dizzi-\nness and drowsiness are the most commonly reported\nadverse effects. Other CNS effects include dream distur-\nbances; depersonalization, dysphoria, noise intolerance,\neuphoria, akathisia, fearfulness, loss of interest, disasso-\nciative reaction, hallucinations , suicidal ideation,\nseizures; feelings of claustrophobia, cold intolerance,\nstupor and slurred speech, psychosis. Rarely, heart prob-', 'Recommended dosage\nTo control nausea and vomiting in adults, the usual\ndose is:\n• tablets: one 5-mg or 10-mg tablet three to four times a\nday\n• extended-release capsules: one 15-mg capsule first\nthing in the morning or one 10-mg capsule every 12\nhours\n• suppository: 25 mg, twice a day\n• syrup: 5-10 mg three to four times a day\n• injection: 5-10 mg injected into a muscle three to four\ntimes a day\nDoses for children must be determined by a physician.\nPrecautions\nProchlorperazine may cause a movement disorder\ncalled tardive dyskinesia . Signs of this disorder are\ninvoluntary twitches and muscle spasms in the face and\nbody and jutting or rolling movements of the tongue. The\ncondition may be permanent. Older people, especially\nwomen, are particularly at risk of developing this prob-', 'long half-life, may make this a poorer choice than other\ndrugs in its class. Note that there is considerable varia-\ntion between individuals in metabolism of benzodi-\nazepines, so patient response may not be predictable. As\na class, benzodiazepines are used not only as anxiolytics,\nbut also as sedatives, muscle relaxants, and in treatment\nof epilepsy and alcoholism . The distinctions between\nthese uses are largely determined by onset and duration\nof action, and route of administration.\nBuspirone (BuSpar), which is not chemically related\nto other classes of central nervous system drugs, is also a\ntraditional anxiolytic, although it is now considered\neither a third line or adjunctive agent for use after trials\nof SSRIs and benzodiazepines. It is appropriate for use in', 'ease. The drugs can act as respiratory depressants and\nshould be avoided in patients with respiratory conditions.\nBenzodiazepines are potentially addictive and should not\nbe administered to patients with substance abuse disor-\nders. Because benzodiazepines are sedative, they should\nbe avoided in patients who must remain alert. Their use\nfor periods over four months has not been documented.\nThese drugs should not be used during the second and\nthird trimester of pregnancy , although use during the\nfirst trimester appears to be safe. They should not be\ntaken while breastfeeding. Consult specialized references\nfor use in children.\nBuspirone is metabolized by the liver and excreted\nby the kidney, and should be used with care in patients\nwith hepatic or renal disease. The drug is classified as', 'the first dose, significant therapeutic improvement is\nalways delayed. Similarly, the effects of antidepressants\nwill continue for a similar length of time after the drugs\nhave been discontinued.\nRecommended dosage\nDose varies with the specific drug and patient. Con-\nsult specialized references.\nPrecautions\nAntidepressants have many significant cautions and\nadverse effects. Although a few are listed here, specific\nreferences should be consulted for more complete infor-\nmation.\nSSRIs. The most common side effect of SSRIs is exci-\ntation and insomnia. Excitation has been reported in over\n20% of patients, and insomnia in 33%. Significant weight\nloss has been frequently reported, but most commonly in\npatients who are already underweight. SSRIs may cause']","The recommended initial dosing schedule for buspirone is 5 mg taken three times a day (t.i.d.). The dosage can be increased by 5 mg per day at intervals of two to three days, as needed, but should not exceed 60 mg per day. It may take two to three weeks before a satisfactory response is seen (Source: Unknown). 

Always consult a healthcare provider for personalized medical advice.","Buspirone is initially dosed at 5 mg three times a day (t.i.d.). The dosage may be increased by 5 mg/day at intervals of two to three days as needed, not to exceed 60 mg/day.",1.0,0.9999999999,0.8,1.0000000000000002,0.802326935539605
Why are benzodiazepines generally avoided for patients who must remain alert?,"['ease. The drugs can act as respiratory depressants and\nshould be avoided in patients with respiratory conditions.\nBenzodiazepines are potentially addictive and should not\nbe administered to patients with substance abuse disor-\nders. Because benzodiazepines are sedative, they should\nbe avoided in patients who must remain alert. Their use\nfor periods over four months has not been documented.\nThese drugs should not be used during the second and\nthird trimester of pregnancy , although use during the\nfirst trimester appears to be safe. They should not be\ntaken while breastfeeding. Consult specialized references\nfor use in children.\nBuspirone is metabolized by the liver and excreted\nby the kidney, and should be used with care in patients\nwith hepatic or renal disease. The drug is classified as', 'ditions:\n• current or past drug or alcohol abuse\n• depression\n• severe mental illness\n• epilepsy or other seizure disorders\n• swallowing problems\n• chronic lung disease such as emphysema, asthma,o r\nchronic bronchitis\n• kidney disease\n• liver disease\n• brain disease\n• glaucoma\n• hyperactivity\n• myasthenia gravis\n• porphyria\n• sleep apnea\nUSE OF CERTAIN MEDICINES. Taking benzodiaze-\npines with certain other drugs may affect the way the\ndrugs work or may increase the chance of side effects.\nSide effects\nThe most common side effects are dizziness, light-\nheadedness, drowsiness, clumsiness, unsteadiness, and\nGALE ENCYCLOPEDIA OF MEDICINE 2 467\nBenzodiazepines\nGEM -0433 to 0624 - B  10/22/03 6:08 PM  Page 467', 'long half-life, may make this a poorer choice than other\ndrugs in its class. Note that there is considerable varia-\ntion between individuals in metabolism of benzodi-\nazepines, so patient response may not be predictable. As\na class, benzodiazepines are used not only as anxiolytics,\nbut also as sedatives, muscle relaxants, and in treatment\nof epilepsy and alcoholism . The distinctions between\nthese uses are largely determined by onset and duration\nof action, and route of administration.\nBuspirone (BuSpar), which is not chemically related\nto other classes of central nervous system drugs, is also a\ntraditional anxiolytic, although it is now considered\neither a third line or adjunctive agent for use after trials\nof SSRIs and benzodiazepines. It is appropriate for use in', 'cedures. These effects may last several days after treat-\nment with benzodiazepines ends. The combined effects of\nbenzodiazepines and alcohol or other CNS depressants\n(drugs that slow the central nervous system) can be very\ndangerous, leading to unconsciousness or, rarely, even\ndeath. Anyone taking benzodiazepines should not drink\nalcohol and should check with his or her physician before\nusing any CNS depressants. Taking an overdose of benzo-\ndiazepines can also cause unconsciousness and possibly\ndeath. Anyone who shows signs of an overdose or of the\neffects of combining benzodiazepines with alcohol or\nother drugs should get immediate emergency help.Warn-\ning signs include slurred speech or confusion, severe\ndrowsiness, staggering, and profound weakness.', 'take benzodiazepines. Before taking these drugs, be sure\nto let the physician know about any of these conditions:\nALLERGIES. Anyone who has had unusual reactions to\nbenzodiazepines or other mood-altering drugs in the past\nshould let his or her physician know before taking the\ndrugs again. The physician should also be told about any\nallergies to foods, dyes, preservatives, or other substances.\nPREGNANCY. Some benzodiazepines increase the\nlikelihood of birth defects. Using these medicines during\npregnancy may also cause the baby to become dependent\non them and to have withdrawal symptoms after birth.\nWhen taken late in pregnancy or around the time of labor\nand delivery, these drugs can cause other problems in the\nnewborn baby, such as weakness, breathing problems,', 'patients who have either failed trials of other treatments,\nor who should not receive benzodiazepines because of a\nhistory of substance abuse problems. Buspirone, in com-\nmon with antidepressants, requires a two to three week\nperiod before there is clinical evidence of improvement,\nand must be continuously dosed to maintain its effects.\nGALE ENCYCLOPEDIA OF MEDICINE 2 231\nAntianxiety drugs\nGEM - 0001 to 0432 - A  10/22/03 1:42 PM  Page 231', 'Benzodiazepines may also cause behavior changes\nin some people, similar to those seen in people who act\ndifferently when they drink alcohol. More extreme\nchanges, such as confusion, agitation, and hallucina-\ntions, also are possible. Anyone who starts having\nstrange or unusual thoughts or behavior while taking this\nmedicine should get in touch with his or her physician.\nBecause benzodiazepines work on the central ner-\nvous system, they may add to the effects of alcohol and\nother drugs that slow down the central nervous system,\nsuch as antihistamines, cold medicine, allergy medicine,\nsleep aids, medicine for seizures, tranquilizers, some pain\nrelievers, and muscle relaxants. They may also add to the\neffects of anesthetics, including those used for dental pro-']","Benzodiazepines are generally avoided for patients who must remain alert because they are sedative in nature, which can lead to drowsiness, dizziness, and unsteadiness. These effects can impair a person's ability to stay alert and focused, making them unsuitable for individuals who need to maintain a high level of alertness. Additionally, the potential for behavior changes and confusion associated with benzodiazepine use further supports the recommendation to avoid these medications in such situations (Source: Unknown). 

It's important to consult a healthcare provider for personalized advice regarding medication use.","Because they are sedatives, benzodiazepines cause side effects such as drowsiness, lethargy, fatigue, and lightheadedness, which impair the ability to remain alert.",1.0,0.9428571428382857,0.9090909090909091,0.0,0.777119288455704
What is the fundamental purpose of antiarrhythmic drugs?,"['Drug therapy can manage many arrhythmias, but\nfinding the right drug and dose requires care and can take\nsome time. Common drugs for suppressing arrhythmias\ninclude beta-blockers, calcium channel blockers, quini-\ndine, digitalis preparations, and procainamide. Because\nof their potential serious side effects, stronger, desensi-\ntizing drugs are used only to treat life-threatening\narrhythmias. All of the drugs used to treat arrhythmias\nhave possible side effects, ranging from mild complica-\ntions with beta-blockers and calcium channel blockers to\nmore serious effects of desensitizing drugs that can, para-\ndoxically, cause arrhythmias or make them worse.\nResponse to drugs is usually measured by ECG, Holter\nmonitor, or electrophysiologic study.', 'prescribed to control the heart rate. Digitalis drugs slow\nthe heart’s electrical impulses, helping to restore the nor-\nmal rate and rhythm. These drugs also increase the abili-\nty of the heart’s muscular layer to contract and pump\nproperly. Beta-blockers and calcium channel blockers\ncan also be used for this purpose. Beta-blockers slow the\nspeed of electrical impulses through the heart. Some cal-\ncium channel blockers dampen the heart’s response to\nerratic electrical impulses.\nTo prevent blood clots, aspirin or warfarin\n(Coumadin) is administered. Warfarin, however, has\npotential bleeding side effects, especially in older\npatients. Amiodarone is fairly efffective for atrial flutter.\nThis drug is often able to maintain the heart’s proper', 'effects in animals, but not in well-controlled\nhuman studies.\nPregnancy category C —No adequate human or\nanimal studies; or adverse fetal effects in animal\nstudies, but no available human data.\nSeizure—A sudden attack, spasm, or convulsion.\nPurpose\nNormally, the heart beats at a steady, even pace. The\npace is controlled by electrical signals that begin in one part\nof the heart and quickly spread through the whole heart. If\nsomething goes wrong with this control system, the result\nmay be an irregular heartbeat, or an arrhythmia. Antiar-\nrhythmic drugs correct irregular heartbeats, restoring the\nnormal rhythm. If the heart is beating too fast, these drugs\nwill slow it down. By correcting these problems, antiar-\nrhythmic drugs help the heart work more efficiently.\nDescription', 'Description\nAntiarrhythmic drugs are available only with a\nphysician’s prescription and are sold in capsule (regular\nand extended release), tablet (regular and extended-\nrelease), and injectable forms. Commonly used antiar-\nrhythmic drugs are disopyramide (Norpace, Norpace\nCR), procainamide (Procan SR, Pronestyl, Pronestyl-\nSR), and quinidine (Cardioquin, Duraquin, Quinidex,\nand other brands). Do not confuse quinidine with qui-\nnine, which is a related medicine with different uses, such\nas relieving leg cramps.\nRecommended dosage\nThe recommended dosage depends on the type of\nantiarrhythmic drug and other factors. Doses may be dif-\nferent for different patients. Check with the physician\nwho prescribed the drug or the pharmacist who filled the\nprescription for the correct dosage.', 'the arrhythmia starts. During the procedure, physicians\ncan test the effects of various drugs by provoking an\narrhythmia through the electrodes and trying different\ndrugs. The procedure takes one to three hours, during\nwhich the patient is awake but mildly sedated. Local\nanesthetic is injected at the catheter insertion sites.\nTreatment\nMany arrhythmias do not require any treatment. For\nserious arrhythmias, treating the underlying heart disease\nsometimes controls the arrhythmia. In some cases, the\narrhythmia itself is treated with drugs, electrical shock (car-\ndioversion), automatic implantable defibrillators, artificial\npacemakers, catheter ablation, or surgery. Supraventricu-\nlar arrhythmias often can be treated with drug therapy. Ven-\ntricular arrhythmias are more complex to treat.', 'monitor, or electrophysiologic study.\nIn emergency situations, cardioversion or defibrilla-\ntion (the application of an electrical shock to the chest\nwall) is used. Cardioversion restores the heart to its nor-\nmal rhythm. It is followed by drug therapy to prevent\nrecurrence of the arrhythmia.\nArtificial pacemakers that send electrical signals to\nmake the heart beat properly can be implanted under the\nskin during a simple operation. Leads from the pacemak-\ner are anchored to the right side of the heart. Pacemakers\nare used to correct bradycardia and are sometimes used\nafter surgical or catheter ablation.\nAutomatic implantable defibrillators correct life-\nthreatening ventricular arrhythmias by recognizing them\nand then restoring a normal heart rhythm by pacing the', 'heart or giving it an electric shock. They are implanted\nwithin the chest wall without major surgery and store\ninformation for future evaluation by physicians. Auto-\nmatic implantable defibrillators have proven to be more\neffective in saving lives than drugs alone. They often are\nused in conjunction with drug therapy.\nAblation, a procedure to alter or remove the heart\ntissue causing the arrhythmia in order to prevent a recur-\nrence, can be performed through a catheter or surgery.\nSupraventricular tachycardia can be treated successfully\nwith ablation. Catheter ablation is performed in a\ncatheterization laboratory with the patient under seda-\ntion. A catheter equipped with a device that maps the\nheart’s electrical pathways is inserted into a vein and is\nGALE ENCYCLOPEDIA OF MEDICINE 2 353']","The fundamental purpose of antiarrhythmic drugs is to correct irregular heartbeats, restoring the normal rhythm of the heart. These drugs help the heart work more efficiently by slowing it down if it is beating too fast or by addressing other issues related to the heart's electrical signals (Source: Unknown). 

It's important to consult a healthcare provider for personalized medical advice regarding the use of these medications.","Antiarrhythmic drugs are used to correct irregular heartbeats (arrhythmias) to restore a normal rhythm and to slow down hearts that are beating too fast, helping the heart work more efficiently.",1.0,0.999999999975,0.6666666666666666,0.9787597735886696,0.8415588953544755
Why is it important to take antiarrhythmic drugs at evenly spaced intervals?,"['prescription for the correct dosage.\nAlways take antiarrhythmic drugs exactly as direct-\ned. Never take larger or more frequent doses.\nDo not stop taking this medicine without checking\nwith the physician who prescribed it. Stopping it sudden-\nly could lead to a serious change in heart function.\nAntiarrhythmic drugs work best when they are at\nconstant levels in the blood. To help keep levels constant,\ntake the medicine in doses spaced evenly through the day\nand night. Do not miss any doses. If taking medicine at\nnight interferes with sleep, or if it is difficult to remem-\nber to take the medicine during the day, check with a\nhealth care professional for suggestions.\nPrecautions\nPersons who take these drugs should see their physi-\ncian regularly. The physician will check to make sure the', 'around-the-clock frequency order indicates they should be administered \nat regular time intervals, such as every six hours, to maintain consistent \n15.2 Basic Concepts of Administering Medications  |  839', 'Description\nAntiarrhythmic drugs are available only with a\nphysician’s prescription and are sold in capsule (regular\nand extended release), tablet (regular and extended-\nrelease), and injectable forms. Commonly used antiar-\nrhythmic drugs are disopyramide (Norpace, Norpace\nCR), procainamide (Procan SR, Pronestyl, Pronestyl-\nSR), and quinidine (Cardioquin, Duraquin, Quinidex,\nand other brands). Do not confuse quinidine with qui-\nnine, which is a related medicine with different uses, such\nas relieving leg cramps.\nRecommended dosage\nThe recommended dosage depends on the type of\nantiarrhythmic drug and other factors. Doses may be dif-\nferent for different patients. Check with the physician\nwho prescribed the drug or the pharmacist who filled the\nprescription for the correct dosage.', 'Drug therapy can manage many arrhythmias, but\nfinding the right drug and dose requires care and can take\nsome time. Common drugs for suppressing arrhythmias\ninclude beta-blockers, calcium channel blockers, quini-\ndine, digitalis preparations, and procainamide. Because\nof their potential serious side effects, stronger, desensi-\ntizing drugs are used only to treat life-threatening\narrhythmias. All of the drugs used to treat arrhythmias\nhave possible side effects, ranging from mild complica-\ntions with beta-blockers and calcium channel blockers to\nmore serious effects of desensitizing drugs that can, para-\ndoxically, cause arrhythmias or make them worse.\nResponse to drugs is usually measured by ECG, Holter\nmonitor, or electrophysiologic study.', 'cines. When this happens, the effects of one or both of\nthe drugs may change or the risk of side effects may be\ngreater. Anyone who takes antiarrhythmic drugs should\nlet the physician know all other medicines he or she is\ntaking. Among the drugs that may interact with antiar-\nrhythmic drugs are:\n• other heart medicines, including other antiarrhythmic\ndrugs\n• blood pressure medicine\n• blood thinners\n• pimozide (Orap), used to treat Tourette’s syndrome\nThe list above does not include every drug that may\ninteract with antiarrhythmic drugs. Be sure to check with\na physician or pharmacist before combining antiarrhyth-\nmic drugs with any other prescription or nonprescription\n(over-the-counter) medicine.\nNancy Ross-Flanigan\nAntiasthmatic drugs\nDefinition', 'rhythmic drugs, people with any of these medical prob-\nlems should make sure their physicians are aware of their\nconditions:\n• heart disorders such as structural heart disease or inflam-\nmation of the heart muscle\n• congestive heart failure\n• kidney disease\n• liver disease\n• diseases of the blood\n• asthma or emphysema\n• enlarged prostate or difficulty urinating\n• overactive thyroid\n• low blood sugar\n• psoriasis\n• glaucoma\nGALE ENCYCLOPEDIA OF MEDICINE 2 235\nAntiarrhythmic drugs\nGEM - 0001 to 0432 - A  10/22/03 1:42 PM  Page 235', 'anyone taking this medicine should alert the health care\nprofessional in charge.\nAnyone who is taking antiarrhythmic drugs should\nbe sure to tell the health care professional in charge\nbefore having any surgical or dental procedures or\nreceiving emergency treatment.\nAntiarrhythmic drugs may cause low blood sugar in\nsome people. Anyone who experiences symptoms of low\nblood sugar should eat or drink a food that contains sugar\nand call a physician immediately. Signs of low blood\nsugar are:\n• anxiety\n• confusion\n• nervousness\n• shakiness\n• unsteady walk\n• extreme hunger\n• headache\n• nausea\n• drowsiness\n• unusual tiredness or weakness\n• fast heartbeat\n• pale, cool skin\n• chills\n• cold sweats\nAntiarrhythmic drugs may cause dry mouth . To\ntemporarily relieve the discomfort, chew sugarless gum,']","It is important to take antiarrhythmic drugs at evenly spaced intervals to maintain constant levels of the medication in the blood. This helps the drugs work effectively in managing arrhythmias. Taking the medicine in doses spaced evenly throughout the day and night ensures that the levels remain stable, which is crucial for optimal heart function. Missing doses or taking them at irregular intervals can lead to fluctuations in drug levels, potentially affecting their efficacy and safety (Source: Unknown). 

If you have concerns about timing or dosing, it's best to consult with a healthcare professional for personalized advice.",These drugs work best when maintained at constant levels in the blood. Spacing doses evenly through the day and night ensures these levels remain stable.,1.0,0.99999999995,1.0,0.9999999999999997,0.9147891910573882
What are the symptoms of low blood sugar (hypoglycemia) that patients taking antiarrhythmic drugs should watch for?,"['anyone taking this medicine should alert the health care\nprofessional in charge.\nAnyone who is taking antiarrhythmic drugs should\nbe sure to tell the health care professional in charge\nbefore having any surgical or dental procedures or\nreceiving emergency treatment.\nAntiarrhythmic drugs may cause low blood sugar in\nsome people. Anyone who experiences symptoms of low\nblood sugar should eat or drink a food that contains sugar\nand call a physician immediately. Signs of low blood\nsugar are:\n• anxiety\n• confusion\n• nervousness\n• shakiness\n• unsteady walk\n• extreme hunger\n• headache\n• nausea\n• drowsiness\n• unusual tiredness or weakness\n• fast heartbeat\n• pale, cool skin\n• chills\n• cold sweats\nAntiarrhythmic drugs may cause dry mouth . To\ntemporarily relieve the discomfort, chew sugarless gum,', 'nine. The physician should also be told about any aller-\ngies to foods, dyes, preservatives, or other substances.\nCONGESTIVE HEART DISEASE. Antiarrhythmic drugs\nmay cause low blood sugar, which can be a particular\nproblem for people with congestive heart disease. Any-\none with congestive heart disease should be familiar with\nthe signs of low blood sugar (listed above) and should\ncheck with his or her physician about what to do if such\nsymptoms occur.\nDIABETES. Antiarrhythmic drugs may cause low\nblood sugar, which can be a particular problem for peo-\nple with diabetes. Anyone with diabetes should be famil-\niar with the signs of low blood sugar (listed above) and\nshould check with his or her physician about what to do\nif such symptoms occur.\nPREGNANCY. The effects of taking antiarrhythmic', 'vision or other vision problems. Because of these possi-\nble problems, anyone who takes these drugs should not\ndrive, use machines or do anything else that might be\ndangerous until they have found out how the drugs affect\nthem. If the medicine does cause vision problems, wait\nuntil vision is clear before driving or engaging in other\nactivities that require normal vision.\nAntiarrhythmic drugs make some people feel light-\nheaded, dizzy, or faint when they get up after sitting or\nlying down. To lessen the problem, get up gradually and\nhold onto something for support if possible.\nAnyone taking this medicine should not drink alco-\nhol without his or her physician’s approval.\nSome antiarrhythmic drugs may change the results\nof certain medical tests. Before having medical tests,', 'urination, and dizziness or lightheadedness.\nThe antiarrhythmic drug procainamide can cause\nserious blood disorders. Anyone taking this medicine\nshould have regular blood counts and should check with\na physician if any of the following symptoms occur:\n• joint or muscle pain\n• muscle weakness\n• pain in the chest or abdomen\n• tremors\n• wheezing\n• cough\n• palpitations\n• rash, sores, or pain in the mouth\n• sore throat\n• fever and chills\n• loss of appetite\n• diarrhea\n• dark urine\n• yellow skin or eyes\n• unusual bleeding or bruising\n• dizziness\n• hallucinations\n• depression\nSpecial conditions\nPeople with certain medical conditions or who are tak-\ning certain other medicines may have problems if they take\nantiarrhythmic drugs. Before taking these drugs, be sure to', 'blood glucose readings, it is important to continually monitor for signs of \nhypoglycemia. Hypoglycemia is defined as blood sugar readings less than \n70 and signs and symptoms such as the following: \n• Shakiness \n• Feeling nervous or anxious \n• Sweating, chills, and clamminess \n• Irritability or impatience \n• Confusion \n• Fast heartbeat \n• Feeling light-headed or dizzy \n• Hunger \n• Nausea \n• Color draining from the skin (pallor) \n• Feeling sleepy \n• Feeling weak or having no energy \n• Blurred/impaired vision \n• Tingling or numbness in the lips, tongue, or cheeks \n• Headaches \n• Coordination problems or clumsiness \n• Nightmares or crying out during sleep \n• Seizures4 \nA low blood sugar level triggers the release of epinephrine (adrenaline),', 'suck on sugarless candy or ice chips, or use saliva substi-\ntutes, which come in liquid and tablet forms and are\navailable without a prescription. If the problem continues\nfor more than 2 weeks, check with a physician or dentist.\nMouth dryness that continues over a long time may con-\ntribute to tooth decay and other dental problems.\nPeople taking antiarrhythmic drugs may sweat less,\nwhich can cause the body temperature to rise. Anyone\nwho takes this medicine should be careful not to become\noverheated during exercise or hot weather and should\navoid hot baths, hot tubs, and saunas. Overheating could\nlead to heat stroke.\nOlder people may be especially sensitive to the\neffects of antiarrhythmic drugs. This may increase the\nrisk of certain side effects, such as dry mouth, difficult', 'occur. If any of the following side effects occur, check\nwith the physician who prescribed the medicine as soon\nas possible:\n• fever and chills\n• difficult urination\n• swollen or painful joints\n• pain when breathing\n• skin rash or itching\nPeople who are especially sensitive to quinidine may\nhave a reaction to the first dose or doses. If any of these\nside effects occur after taking quinidine, check with a\nphysician immediately:\n• dizziness\n• ringing in the ears\n• breathing problems\n• vision changes\n•f e v e r\n• headache\n• skin rash\nOther rare side effects may occur with any antiar-\nrhythmic drug. Anyone who has unusual symptoms after\ntaking antiarrhythmic drugs should get in touch with his\nor her physician.\nInteractions\nAntiarrhythmic drugs may interact with other medi-']","Patients taking antiarrhythmic drugs should be aware of the following symptoms of low blood sugar (hypoglycemia):

- Anxiety
- Confusion
- Nervousness
- Shakiness
- Unsteady walk
- Extreme hunger
- Headache
- Nausea
- Drowsiness
- Unusual tiredness or weakness
- Fast heartbeat
- Pale, cool skin
- Chills
- Cold sweats

If any of these symptoms occur, it is important to eat or drink something that contains sugar and call a physician immediately (Source: Unknown).","Symptoms include anxiety, confusion, nervousness, shakiness, unsteady walk, extreme hunger, headache, nausea, drowsiness, unusual tiredness, fast heartbeat, pale/cool skin, chills, and cold sweats.",1.0,0.8666666666377778,1.0,0.973226901065244,0.9248425108524903
Why must patients taking antiarrhythmic drugs avoid overheating?,"['suck on sugarless candy or ice chips, or use saliva substi-\ntutes, which come in liquid and tablet forms and are\navailable without a prescription. If the problem continues\nfor more than 2 weeks, check with a physician or dentist.\nMouth dryness that continues over a long time may con-\ntribute to tooth decay and other dental problems.\nPeople taking antiarrhythmic drugs may sweat less,\nwhich can cause the body temperature to rise. Anyone\nwho takes this medicine should be careful not to become\noverheated during exercise or hot weather and should\navoid hot baths, hot tubs, and saunas. Overheating could\nlead to heat stroke.\nOlder people may be especially sensitive to the\neffects of antiarrhythmic drugs. This may increase the\nrisk of certain side effects, such as dry mouth, difficult', 'rhythmic drugs, people with any of these medical prob-\nlems should make sure their physicians are aware of their\nconditions:\n• heart disorders such as structural heart disease or inflam-\nmation of the heart muscle\n• congestive heart failure\n• kidney disease\n• liver disease\n• diseases of the blood\n• asthma or emphysema\n• enlarged prostate or difficulty urinating\n• overactive thyroid\n• low blood sugar\n• psoriasis\n• glaucoma\nGALE ENCYCLOPEDIA OF MEDICINE 2 235\nAntiarrhythmic drugs\nGEM - 0001 to 0432 - A  10/22/03 1:42 PM  Page 235', 'let the physician know about any of these conditions:\nALLERGIES. Anyone who has had unusual reactions\nto an antiarrhythmic drug in the past should let his or her\nphysician know before taking this type of medicine\nagain. Patients taking procainamide should let their\nphysicians know if they have ever had an unusual or\nallergic reaction to procaine or any other “caine-type”\nmedicine, such as xylocaine or lidocaine. Patients taking\nquinidine should mention any previous reactions to qui-\nGALE ENCYCLOPEDIA OF MEDICINE 2234\nAntiarrhythmic drugs\nGEM - 0001 to 0432 - A  10/22/03 1:42 PM  Page 234', 'Drug therapy can manage many arrhythmias, but\nfinding the right drug and dose requires care and can take\nsome time. Common drugs for suppressing arrhythmias\ninclude beta-blockers, calcium channel blockers, quini-\ndine, digitalis preparations, and procainamide. Because\nof their potential serious side effects, stronger, desensi-\ntizing drugs are used only to treat life-threatening\narrhythmias. All of the drugs used to treat arrhythmias\nhave possible side effects, ranging from mild complica-\ntions with beta-blockers and calcium channel blockers to\nmore serious effects of desensitizing drugs that can, para-\ndoxically, cause arrhythmias or make them worse.\nResponse to drugs is usually measured by ECG, Holter\nmonitor, or electrophysiologic study.', 'prescription for the correct dosage.\nAlways take antiarrhythmic drugs exactly as direct-\ned. Never take larger or more frequent doses.\nDo not stop taking this medicine without checking\nwith the physician who prescribed it. Stopping it sudden-\nly could lead to a serious change in heart function.\nAntiarrhythmic drugs work best when they are at\nconstant levels in the blood. To help keep levels constant,\ntake the medicine in doses spaced evenly through the day\nand night. Do not miss any doses. If taking medicine at\nnight interferes with sleep, or if it is difficult to remem-\nber to take the medicine during the day, check with a\nhealth care professional for suggestions.\nPrecautions\nPersons who take these drugs should see their physi-\ncian regularly. The physician will check to make sure the', 'nine. The physician should also be told about any aller-\ngies to foods, dyes, preservatives, or other substances.\nCONGESTIVE HEART DISEASE. Antiarrhythmic drugs\nmay cause low blood sugar, which can be a particular\nproblem for people with congestive heart disease. Any-\none with congestive heart disease should be familiar with\nthe signs of low blood sugar (listed above) and should\ncheck with his or her physician about what to do if such\nsymptoms occur.\nDIABETES. Antiarrhythmic drugs may cause low\nblood sugar, which can be a particular problem for peo-\nple with diabetes. Anyone with diabetes should be famil-\niar with the signs of low blood sugar (listed above) and\nshould check with his or her physician about what to do\nif such symptoms occur.\nPREGNANCY. The effects of taking antiarrhythmic', 'vision or other vision problems. Because of these possi-\nble problems, anyone who takes these drugs should not\ndrive, use machines or do anything else that might be\ndangerous until they have found out how the drugs affect\nthem. If the medicine does cause vision problems, wait\nuntil vision is clear before driving or engaging in other\nactivities that require normal vision.\nAntiarrhythmic drugs make some people feel light-\nheaded, dizzy, or faint when they get up after sitting or\nlying down. To lessen the problem, get up gradually and\nhold onto something for support if possible.\nAnyone taking this medicine should not drink alco-\nhol without his or her physician’s approval.\nSome antiarrhythmic drugs may change the results\nof certain medical tests. Before having medical tests,']","Patients taking antiarrhythmic drugs must avoid overheating because these medications can cause a reduction in sweating, which may lead to an increase in body temperature. Overheating can pose serious health risks, including the potential for heat stroke. Therefore, it is important for individuals on these medications to be cautious during exercise or in hot weather and to avoid hot baths, hot tubs, and saunas (Source: Unknown). 

Always consult a healthcare provider for personalized advice regarding medication and health conditions.","These drugs may cause patients to sweat less, causing body temperature to rise. Overheating during exercise or hot weather (or in hot tubs/saunas) could lead to heat stroke.",1.0,0.9999999999,1.0,0.9601944082807878,0.9117983856905968
What specific monitoring is required for patients taking procainamide?,"['let the physician know about any of these conditions:\nALLERGIES. Anyone who has had unusual reactions\nto an antiarrhythmic drug in the past should let his or her\nphysician know before taking this type of medicine\nagain. Patients taking procainamide should let their\nphysicians know if they have ever had an unusual or\nallergic reaction to procaine or any other “caine-type”\nmedicine, such as xylocaine or lidocaine. Patients taking\nquinidine should mention any previous reactions to qui-\nGALE ENCYCLOPEDIA OF MEDICINE 2234\nAntiarrhythmic drugs\nGEM - 0001 to 0432 - A  10/22/03 1:42 PM  Page 234', 'urination, and dizziness or lightheadedness.\nThe antiarrhythmic drug procainamide can cause\nserious blood disorders. Anyone taking this medicine\nshould have regular blood counts and should check with\na physician if any of the following symptoms occur:\n• joint or muscle pain\n• muscle weakness\n• pain in the chest or abdomen\n• tremors\n• wheezing\n• cough\n• palpitations\n• rash, sores, or pain in the mouth\n• sore throat\n• fever and chills\n• loss of appetite\n• diarrhea\n• dark urine\n• yellow skin or eyes\n• unusual bleeding or bruising\n• dizziness\n• hallucinations\n• depression\nSpecial conditions\nPeople with certain medical conditions or who are tak-\ning certain other medicines may have problems if they take\nantiarrhythmic drugs. Before taking these drugs, be sure to', 'magnesium, should be monitored closely for clients at risk. Refer to Table 15.4 \nin the “Electrolytes” section for an overview of electrolyte imbalances, \ncommon symptoms, and common treatments. \nAdditional diagnostic tests used to evaluate for signs of fluid and electrolyte \n15.6 Applying the Nursing Process  |  1099', 'rhythmic drugs, people with any of these medical prob-\nlems should make sure their physicians are aware of their\nconditions:\n• heart disorders such as structural heart disease or inflam-\nmation of the heart muscle\n• congestive heart failure\n• kidney disease\n• liver disease\n• diseases of the blood\n• asthma or emphysema\n• enlarged prostate or difficulty urinating\n• overactive thyroid\n• low blood sugar\n• psoriasis\n• glaucoma\nGALE ENCYCLOPEDIA OF MEDICINE 2 235\nAntiarrhythmic drugs\nGEM - 0001 to 0432 - A  10/22/03 1:42 PM  Page 235', 'evaluates the patient after medications have been administered to \nmonitor the efficacy of the drug. For example, if a patient reported a pain \nlevel of “8” before PRN pain medication was administered, the nurse \nevaluates the patient’s pain level after administration to ensure the pain \nlevel is decreasing and the pain medication was effective. This evaluation \ndata is documented in the patient’s chart. \nAdditionally, the nurse continually monitors for adverse effects from all of \na patient’s medications. For example, the first dose of an antibiotic was \nadministered to a patient during a previous shift, but the nurse notices the \npatient has developed a rash. The nurse notifies the prescribing provider \nof the change in condition and anticipates new orders or changes in the', 'Objective Assessment \nFollow agency policy and procedures regarding IV therapy assessment \nand documentation. Current infusion standards indicate the venous \naccess device site, the entire infusion system, and the patient should be \nassessed for signs of complications at a frequency dependent on a variety \nof factors, including the patient’s age, condition, and cognition; the type \nand frequency of the intravenous fluid/medication; and the health care \nsetting. In inpatient and nursing facilities, peripherally inserted IVs should \nbe assessed at least every 4 hours with increased frequency of assessment \nevery 1 to 2 hours for patients who are critically ill, sedated, or have \nS., Sharp, E., & Alexander, M. A. (2021). Infusion therapy standards of practice. Journal of Infusion Nursing,', 'that record the heart’s rhythm during daily activities.\nTranstelephonic monitoring can identify arrhythmias that\noccur infrequently. Similar to Holter monitoring ,\ntranstelephonic monitoring can continue for days or\nweeks, and it enables patients to send the ECG via tele-\nphone to a monitoring station when an arrhythmia is felt,\nor the patient can store the information in the recorder\nand transmit it later.\nElectrophysiologic studies are invasive procedures\nperformed in a hospital to identify the origin of serious\narrhythmias and responses to various treatments. They\ninvolve cardiac catheterization , in which catheters\ntipped with electrodes are passed from a vein in the arm\nor leg through the blood vessels into the heart. The elec-\ntrodes record impulses in the heart, highlighting where']","Patients taking procainamide should have regular blood counts monitored due to the risk of serious blood disorders associated with this medication. Additionally, they should check with their physician if they experience any of the following symptoms: joint or muscle pain, muscle weakness, chest or abdominal pain, tremors, wheezing, cough, palpitations, rash, sores or pain in the mouth, sore throat, fever and chills, loss of appetite, diarrhea, dark urine, yellow skin or eyes, unusual bleeding or bruising, dizziness, hallucinations, or depression (Source: Unknown). 

It's important to consult a healthcare provider for personalized advice and monitoring plans.","Patients taking procainamide require regular blood counts because the drug can cause serious blood disorders. Symptoms like joint pain, muscle weakness, fever, bruising, or mouth sores should be reported immediately.",1.0,0.49999999995,1.0,0.889975743104949,0.6048627675567424
What symptoms indicate a sensitivity reaction to the first dose of quinidine?,"['occur. If any of the following side effects occur, check\nwith the physician who prescribed the medicine as soon\nas possible:\n• fever and chills\n• difficult urination\n• swollen or painful joints\n• pain when breathing\n• skin rash or itching\nPeople who are especially sensitive to quinidine may\nhave a reaction to the first dose or doses. If any of these\nside effects occur after taking quinidine, check with a\nphysician immediately:\n• dizziness\n• ringing in the ears\n• breathing problems\n• vision changes\n•f e v e r\n• headache\n• skin rash\nOther rare side effects may occur with any antiar-\nrhythmic drug. Anyone who has unusual symptoms after\ntaking antiarrhythmic drugs should get in touch with his\nor her physician.\nInteractions\nAntiarrhythmic drugs may interact with other medi-', 'let the physician know about any of these conditions:\nALLERGIES. Anyone who has had unusual reactions\nto an antiarrhythmic drug in the past should let his or her\nphysician know before taking this type of medicine\nagain. Patients taking procainamide should let their\nphysicians know if they have ever had an unusual or\nallergic reaction to procaine or any other “caine-type”\nmedicine, such as xylocaine or lidocaine. Patients taking\nquinidine should mention any previous reactions to qui-\nGALE ENCYCLOPEDIA OF MEDICINE 2234\nAntiarrhythmic drugs\nGEM - 0001 to 0432 - A  10/22/03 1:42 PM  Page 234', 'reaction include fast or pounding heartbeat, sweating or a\nhot feeling, chills or a clammy feeling, headache, light-\nheadedness, and red or itchy skin. This reaction is very\nGALE ENCYCLOPEDIA OF MEDICINE 2310\nAntituberculosis drugs\nGEM - 0001 to 0432 - A  10/22/03 1:42 PM  Page 310', 'urination, and dizziness or lightheadedness.\nThe antiarrhythmic drug procainamide can cause\nserious blood disorders. Anyone taking this medicine\nshould have regular blood counts and should check with\na physician if any of the following symptoms occur:\n• joint or muscle pain\n• muscle weakness\n• pain in the chest or abdomen\n• tremors\n• wheezing\n• cough\n• palpitations\n• rash, sores, or pain in the mouth\n• sore throat\n• fever and chills\n• loss of appetite\n• diarrhea\n• dark urine\n• yellow skin or eyes\n• unusual bleeding or bruising\n• dizziness\n• hallucinations\n• depression\nSpecial conditions\nPeople with certain medical conditions or who are tak-\ning certain other medicines may have problems if they take\nantiarrhythmic drugs. Before taking these drugs, be sure to', 'Side effects\nThe frequency and severity of adverse effects will\nvary between drugs. Not all adverse reactions will apply\nto every member of this class.\nCentral nervous system reactions include drowsi-\nness, sedation, dizziness, faintness, disturbed coordina-\ntion, lassitude, confusion, restlessness, excitation,\ntremor, seizures, headache, insomnia, euphoria, blurred\nvision, hallucinations , disorientation, disturbing\ndreams/nightmares, schizophrenic-like reactions, weak-\nness, vertigo, hysteria , nerve pain, and convulsions.\nOverdoses may cause involuntary movements. Other\nproblems have been reported.\nGastrointestinal problems include increased appetite,\ndecreased appetite, nausea, vomiting, diarrhea, and con-\nstipation.\nHematologic reactions are rare, but may be severe.', '• painful, bluish or purplish fingers or toes\n• puffy or swollen eyelids, face, feet, or lower legs\n• changes in the color of the face\n• skin rash,itching, or hives\n• yellow eyes or skin\n• severe or continuing headache\n• sore throat and fever, with or without chills\n• breathing problems or wheezing\n• tightness in the chest\n• dizziness\n• unusual tiredness or weakness\n• weight gain\nIn addition, patients taking anticoagulant drugs\nshould check with their physicians as soon as possible if\nany of these side effects occur:\n• nausea or vomiting\n• diarrhea\n• stomach pain or cramps\nOther side effects may occur. Anyone who has\nunusual symptoms while taking anticoagulant drugs\nshould get in touch with his or her physician.\nInteractions\nAnticoagulants may interact with many other med-', 'the following:  \n• Mucous Membrane Symptoms: red watery eyes or swollen lips, tongue, or eyes.  \n• Skin Symptoms: itchiness, flushing, rash, or hives.  \n• Gastrointestinal Symptoms: nausea, pain, cramping, vomiting, diarrhea, or acid reflux.  \n• Upper Respiratory Symptoms: nasal congestion, sneezing, hoarse voice, trouble \nswallowing, dry staccato cough, or numbness around mouth.  \n• Lower Respiratory Symptoms: deep cough, wheezing, shortness of breath or difficulty \nbreathing, or chest tightness.  \n• Cardiovascular Symptoms: pale or blue skin color, weak pulse, dizziness or fainting, \nconfusion or shock, hypotension (decrease in blood pressure), or loss of consciousness.  \n• Mental or Emotional Symptoms: a sense of “impending doom,” irritability, change in']","Symptoms that indicate a sensitivity reaction to the first dose of quinidine include:

- Dizziness
- Ringing in the ears
- Breathing problems
- Vision changes
- Fever
- Headache
- Skin rash

If any of these symptoms occur after taking quinidine, it is important to check with a physician immediately (Source: Unknown).","Symptoms of quinidine sensitivity include dizziness, ringing in the ears, breathing problems, vision changes, fever, headache, or skin rash.",1.0,0.7222222221981481,1.0,0.9973857009473578,0.9404143769997514
Why should patients taking antiarrhythmic drugs inform health care professionals before dental procedures?,"['anyone taking this medicine should alert the health care\nprofessional in charge.\nAnyone who is taking antiarrhythmic drugs should\nbe sure to tell the health care professional in charge\nbefore having any surgical or dental procedures or\nreceiving emergency treatment.\nAntiarrhythmic drugs may cause low blood sugar in\nsome people. Anyone who experiences symptoms of low\nblood sugar should eat or drink a food that contains sugar\nand call a physician immediately. Signs of low blood\nsugar are:\n• anxiety\n• confusion\n• nervousness\n• shakiness\n• unsteady walk\n• extreme hunger\n• headache\n• nausea\n• drowsiness\n• unusual tiredness or weakness\n• fast heartbeat\n• pale, cool skin\n• chills\n• cold sweats\nAntiarrhythmic drugs may cause dry mouth . To\ntemporarily relieve the discomfort, chew sugarless gum,', 'let the physician know about any of these conditions:\nALLERGIES. Anyone who has had unusual reactions\nto an antiarrhythmic drug in the past should let his or her\nphysician know before taking this type of medicine\nagain. Patients taking procainamide should let their\nphysicians know if they have ever had an unusual or\nallergic reaction to procaine or any other “caine-type”\nmedicine, such as xylocaine or lidocaine. Patients taking\nquinidine should mention any previous reactions to qui-\nGALE ENCYCLOPEDIA OF MEDICINE 2234\nAntiarrhythmic drugs\nGEM - 0001 to 0432 - A  10/22/03 1:42 PM  Page 234', 'They should also carry identification stating that they are\nusing an anticoagulant drug.\nOther prescription drugs or over-the-counter medi-\ncine—especially aspirin—should be not be taken without\nthe prescribing physician being informed.\nBecause of the risk of heavy bleeding, anyone who\ntakes an anticoagulant drug must take care to avoid\ninjuries. Sports and other potentially hazardous activities\nshould be avoided. Any falls, blows to the body or head,\nor other injuries should be reported to a physician, as\ninternal bleeding may occur without any obvious symp-\ntoms. Special care should be taken in shaving and in\nbrushing and flossing the teeth. Soft toothbrushes should\nbe used and the flossing should be very gentle. Electric\nrazors should be used instead of a blade.', 'rhythmic drugs, people with any of these medical prob-\nlems should make sure their physicians are aware of their\nconditions:\n• heart disorders such as structural heart disease or inflam-\nmation of the heart muscle\n• congestive heart failure\n• kidney disease\n• liver disease\n• diseases of the blood\n• asthma or emphysema\n• enlarged prostate or difficulty urinating\n• overactive thyroid\n• low blood sugar\n• psoriasis\n• glaucoma\nGALE ENCYCLOPEDIA OF MEDICINE 2 235\nAntiarrhythmic drugs\nGEM - 0001 to 0432 - A  10/22/03 1:42 PM  Page 235', 'nine. The physician should also be told about any aller-\ngies to foods, dyes, preservatives, or other substances.\nCONGESTIVE HEART DISEASE. Antiarrhythmic drugs\nmay cause low blood sugar, which can be a particular\nproblem for people with congestive heart disease. Any-\none with congestive heart disease should be familiar with\nthe signs of low blood sugar (listed above) and should\ncheck with his or her physician about what to do if such\nsymptoms occur.\nDIABETES. Antiarrhythmic drugs may cause low\nblood sugar, which can be a particular problem for peo-\nple with diabetes. Anyone with diabetes should be famil-\niar with the signs of low blood sugar (listed above) and\nshould check with his or her physician about what to do\nif such symptoms occur.\nPREGNANCY. The effects of taking antiarrhythmic', 'If it is, other medication may be prescribed to counteract\nthe effects of the anticoagulant drug.\nOTHER MEDICAL CONDITIONS. Before using anti-\ncoagulant drugs, people should inform their physician\nabout any medical problems they have. They should also\nlet the physician who prescribed the medicine know if\nthey are being treated by any other medical physician or\ndentist. In addition, people who will be taking anticoagu-\nlant drugs should let their physician know if they have\nrecently had any of the following:\n• fever lasting more than one to two days\n• severe or continuing diarrhea\n• childbirth\n• heavy or unusual menstrual bleeding\n• insertion of an intrauterine contraceptive device (IUD)\n• falls, injuries, or blows to the body or head\n• any type of surgery, including dental surgery', 'while taking these medicines.\nAnyone who has ever had unusual reactions to\nantiprotozoal drugs or related medicines should let his or\nher physician know before taking the drugs again. The\nphysician should also be told about any allergies to\nfoods, dyes, preservatives, or other substances.\nSome antiprotozoal drugs may cause problems with\nthe blood. This can increase the risk of infection or\nexcessive bleeding. Patients taking these drugs shouldbe\ncareful not to injure their gums when brushing or floss-\ning their teeth or using a toothpick. They shouldcheck\nwith the physician before having any dentalwork done.\nCare should also be taken to avoidcuts from razors, nail\nclippers, or kitchen knives, orhousehold tools. Anyone\nwho has any of these symptoms while taking antiproto-']","Patients taking antiarrhythmic drugs should inform health care professionals before dental procedures because these medications can have significant effects on the body, including the potential to cause low blood sugar. This is particularly important as low blood sugar can lead to symptoms such as anxiety, confusion, shakiness, and drowsiness, which could complicate dental treatment. Additionally, informing the health care professional ensures that any necessary precautions can be taken to manage these risks effectively (Source: Unknown). 

It's always best to consult with a healthcare provider for personalized advice and recommendations.","Antiarrhythmic drugs can cause dry mouth, which contributes to tooth decay and other dental problems, and the medication usage needs to be known for safety during any surgical or dental treatment.",1.0,0.642857142825,0.8333333333333334,0.9999999999999997,0.4112004184926916
What types of medications commonly interact with antiarrhythmic drugs?,"['cines. When this happens, the effects of one or both of\nthe drugs may change or the risk of side effects may be\ngreater. Anyone who takes antiarrhythmic drugs should\nlet the physician know all other medicines he or she is\ntaking. Among the drugs that may interact with antiar-\nrhythmic drugs are:\n• other heart medicines, including other antiarrhythmic\ndrugs\n• blood pressure medicine\n• blood thinners\n• pimozide (Orap), used to treat Tourette’s syndrome\nThe list above does not include every drug that may\ninteract with antiarrhythmic drugs. Be sure to check with\na physician or pharmacist before combining antiarrhyth-\nmic drugs with any other prescription or nonprescription\n(over-the-counter) medicine.\nNancy Ross-Flanigan\nAntiasthmatic drugs\nDefinition', 'isoniazid, ketoconazole, metoprolol, propoxyphene, pro-\npranolol and valproic acid. The absorption of all benzo-\ndiazepines is inhibited by concomitant use of antacids.\nBenzodiazepines may increase blood devels of digoxin,\nand reduce the efficacy of levodopa. Other drug interac-\ntions have been reported.\nBuspirone levels will be increased by concomitant\nuse of erythromycin, itraconazole, and nefazadone.\nDoses should be adjusted based on clinical response. Use\nof buspirone at the same time as mono-amine oxidase\ninhibitors (MAOIs, phenelzine, tranycypromine) may\ncause severe blood pressure elevations. Use of buspirone\nwith MAOIs should be avoided.\nSamuel Uretsky, PharmD\nAntiarrhythmic drugs\nDefinition\nAntiarrhythmic drugs are medicines that correct irreg-', 'Description\nAntiarrhythmic drugs are available only with a\nphysician’s prescription and are sold in capsule (regular\nand extended release), tablet (regular and extended-\nrelease), and injectable forms. Commonly used antiar-\nrhythmic drugs are disopyramide (Norpace, Norpace\nCR), procainamide (Procan SR, Pronestyl, Pronestyl-\nSR), and quinidine (Cardioquin, Duraquin, Quinidex,\nand other brands). Do not confuse quinidine with qui-\nnine, which is a related medicine with different uses, such\nas relieving leg cramps.\nRecommended dosage\nThe recommended dosage depends on the type of\nantiarrhythmic drug and other factors. Doses may be dif-\nferent for different patients. Check with the physician\nwho prescribed the drug or the pharmacist who filled the\nprescription for the correct dosage.', 'should get in touch with his or her physician.\nInteractions\nSome antimalarial drugs may interact with other\nmedicines. When this happens, the effects of one or both\nof the drugs may change or the risk of side effects may\nbe greater. Anyone who takes antimalarial drugs should\nlet the physician know all other medicines he or she is\ntaking. Among the drugs that interact with some anti-\nmalarial drugs are:\n• beta blockers such as atenolol (Tenormin), propranolol\n(Inderal), and metoprolol (Lopressor)\n• calcium channel blockers such as diltiazem (Cardizem),\nnicardipene (Cardene), and nifedipine (Procardia)\n• other antimalarial drugs\n• quinidine, used to treat abnormal heart rhythms\n• antiseizure medicines such as vaproic acid derivatives\n(Depakote or Depakene)\n• oral typhoid vaccine', 'rhythmic drugs, people with any of these medical prob-\nlems should make sure their physicians are aware of their\nconditions:\n• heart disorders such as structural heart disease or inflam-\nmation of the heart muscle\n• congestive heart failure\n• kidney disease\n• liver disease\n• diseases of the blood\n• asthma or emphysema\n• enlarged prostate or difficulty urinating\n• overactive thyroid\n• low blood sugar\n• psoriasis\n• glaucoma\nGALE ENCYCLOPEDIA OF MEDICINE 2 235\nAntiarrhythmic drugs\nGEM - 0001 to 0432 - A  10/22/03 1:42 PM  Page 235', 'Drug therapy can manage many arrhythmias, but\nfinding the right drug and dose requires care and can take\nsome time. Common drugs for suppressing arrhythmias\ninclude beta-blockers, calcium channel blockers, quini-\ndine, digitalis preparations, and procainamide. Because\nof their potential serious side effects, stronger, desensi-\ntizing drugs are used only to treat life-threatening\narrhythmias. All of the drugs used to treat arrhythmias\nhave possible side effects, ranging from mild complica-\ntions with beta-blockers and calcium channel blockers to\nmore serious effects of desensitizing drugs that can, para-\ndoxically, cause arrhythmias or make them worse.\nResponse to drugs is usually measured by ECG, Holter\nmonitor, or electrophysiologic study.', 'let the physician know about any of these conditions:\nALLERGIES. Anyone who has had unusual reactions\nto an antiarrhythmic drug in the past should let his or her\nphysician know before taking this type of medicine\nagain. Patients taking procainamide should let their\nphysicians know if they have ever had an unusual or\nallergic reaction to procaine or any other “caine-type”\nmedicine, such as xylocaine or lidocaine. Patients taking\nquinidine should mention any previous reactions to qui-\nGALE ENCYCLOPEDIA OF MEDICINE 2234\nAntiarrhythmic drugs\nGEM - 0001 to 0432 - A  10/22/03 1:42 PM  Page 234']","Common medications that may interact with antiarrhythmic drugs include:

- Other heart medicines, including other antiarrhythmic drugs
- Blood pressure medications
- Blood thinners
- Pimozide (Orap), which is used to treat Tourette’s syndrome

It's important to note that this list does not include every drug that may interact with antiarrhythmic drugs. Therefore, anyone taking antiarrhythmic drugs should inform their physician about all other medications they are taking to avoid potential interactions (Source: Unknown).","Interactions may occur with other heart medicines (including other antiarrhythmics), blood pressure medicines, blood thinners, and pimozide (Orap).",1.0,0.99999999995,0.875,0.0,0.8071445691112455
What is Active Supervision in the context of early childhood education?,"['What is Active Supervision? \nActive supervision requires focused attention and intentional observation of children at all \ntimes. Staff position themselves so that they can observe all of the children: watching, counting,', '✓ The licensee shall provide care and supervision as necessary to meet \nthe children’s needs. No child shall be left without the supervision \nof a teacher at any time. Supervision includes visual observation. \n \nIntroduction \nKeeping children safe must be a top priority for all early care and education programs. Active \nSupervision is the most effective strategy for creating a safe environment and preventing \ninjuries in young children. It transforms supervision from a passive approach to an active skill. \nStaff use this strategy to make sure that children of all ages explore their environments safely. \nEach program can keep children safe by teaching all staff how to look, listen, and engage. \n \nWhat is Active Supervision?', ""times. Active supervision is a specific child supervision technique that requires focused \nattention and intentional observation of children at all times. Active supervision includes six \nbasic strategies.  \n1. Plan and set up the environment to ensure clear sightlines and easy access to the \nchildren and the equipment at all times while they're out on the playground. \n2. Teachers are positioned among the children in their care, changing positions as needed \nso that they can keep an eye on the children.  \n3. They are communicating about which children they're observing and any issues that \ndivert their attention so that they know other teachers are taking up the slack and \nwatching the other children.  \n4. Teachers are watching, counting, and listening to children at all times"", 'dangerous risk. Information from the daily health check (e.g., illness, allergies, lack of sleep or \nfood, etc.) informs staff’s observations and helps them anticipate children’s behavior. Staff who \nknow what to expect are better able to protect children from harm. \n \nEngage and Redirect  \nStaff use what they know about each child’s individual needs and development to offer \nsupport. Staff wait until children are unable to problem-solve on their own to get involved. \nThey may offer different levels of assistance or redirection depending on each individual child’s \nneeds. 2 \n \n \nFigure 2.2 – This teacher is nearby and carefully watching the children.3  \n \n \nWhat Does Active Supervision Look Like? \nTo understand what active supervision might look like in your program,', ""together in a team. And the other thing that's important to remember is the kind of \ncommunication that develops between the two teachers in a classroom or a family-childcare \nprovider and an assistant -- a communication that supports a child's safe movement throughout \nthe day as well as their ability to explore and grow in a nurturing environment.  \n \n \n4 Active Supervision from the Office of Head Start is in the public domain. \n5 California Infant/Toddler Curriculum Framework by the California Department of Education is used with \npermission."", ""32 | H e a l t h ,  S a f e t y ,  a n d  N u t r i t i o n  in  E a r l y  C h i l d h o o d  E d u c a t i o n  \n \nsafety. They use systems and strategies to make sure they know where \nchildren are at all times, and that support developmentally appropriate \nchild risk-taking and learning.4 \n \n \nPause to Reflect \nGo back through the example and find the active supervision strategies that \nYasmin and Maria used \n \nActive Supervision for Infants and Toddlers \nInfant/toddler care is responsive, individualized care. And it's important to think about infants \nand toddlers that are cared for in small groups with a primary-caregiver system of care and also \nto think about the flow of the day as being responsive to the individualized needs of the"", '29 | H e a l t h ,  S a f e t y ,  a n d  N u t r i t i o n  in  E a r l y  C h i l d h o o d  E d u c a t i o n  \n \nand listening at all times. During transitions, staff account for all children with name-to-face \nrecognition by visually identifying each child. They also use their knowledge of each child’s \ndevelopment and abilities to anticipate what they will do, then get involved and redirect them \nwhen necessary. This constant vigilance helps children learn safely. \n \nStrategies to Put Active Supervision in Place  \nThe following strategies allow children to explore their environments safely. Infants, toddlers, \nand preschoolers must be directly supervised at all times. This includes daily routines such as']","Active Supervision in the context of early childhood education is a specific technique that requires focused attention and intentional observation of children at all times. It transforms supervision from a passive approach to an active skill, ensuring that staff can effectively monitor and support children's safety and development. 

Key components of Active Supervision include:

1. **Environment Setup**: Planning and arranging the environment to ensure clear sightlines and easy access to children and equipment.
2. **Positioning**: Teachers position themselves among the children, changing locations as needed to maintain visibility.
3. **Communication**: Staff communicate about which children they are observing and any issues that may require attention, ensuring that all children are monitored.
4. **Vigilance**: Teachers continuously watch, count, and listen to children to anticipate their needs and behaviors.
5. **Engagement and Redirection**: Staff use their knowledge of each child's individual needs to offer support and redirect when necessary, waiting until children are unable to problem-solve on their own before intervening.
6. **Daily Health Checks**: Information from daily health checks helps staff anticipate children's behavior and protect them from harm.

Overall, Active Supervision is essential for creating a safe environment and preventing injuries, allowing children to explore their surroundings safely while receiving the necessary support (Source: Unknown).","Active supervision is a strategy that involves focused attention and intentional observation of children at all times. It requires staff to position themselves to observe, watch, count, and listen, as well as anticipate children's behavior and engage/redirect when necessary.",1.0,0.9484126983968916,1.0,0.9914243908592495,0.9807430162596343
How is 'health' defined in the context of early childhood?,"[""165 | H e a l t h ,  S a f e t y ,  a n d  N u t r i t i o n  in  E a r l y  C h i l d h o o d  E d u c a t i o n  \n \nIntroduction \nHealthy development continues to support learning throughout childhood and later life. \n“Health in the earliest years…lays the groundwork for a lifetime of well-being…”1 To promote \nthe health of children in early care and education programs, it’s important to keep records of \nboth children's and staff’s health. Programs can support children’s oral health and healthy sleep \nhabits. And they can help identify developmental and health concerns with screening. \n \n \nFigure 7.1 – Healthy children thrive!2 \n \nChildren’s Health Records \n“The health and safety of individual children requires that information regarding each child in"", '17 | H e a l t h ,  S a f e t y ,  a n d  N u t r i t i o n  in  E a r l y  C h i l d h o o d  E d u c a t i o n  \n \n(physiological, intellectual, social, and spiritual), as well as subjective feelings of well-being. A \nchild who is doing well frequently experiences joy, delight, and wonder, is secure and safe in \nhis/her family and community, and is continually expanding and deepening his/her engagement \nwith the world around him/her.”16  \n \n \nFigure 1.4 - Well children can engage in their environment and with others.17 \n \nWellness is an active process. It requires awareness and directed, thoughtful attention to the \nchoices we make. Early care and education programs can play a critical role in helping children,', 'early and middle childhood include implementing and evaluating multidisciplinary public health \ninterventions that address social determinants of health by: \n• Fostering knowledgeable and nurturing families, parents, and caregivers \n• Creating supportive and safe environments in home, schools, and communities \n• Increasing access to high-quality health care6 \n \nEarly Childhood Development and Education  \nEarly childhood, particularly the first 5 years of life, impacts long–term social, cognitive, \nemotional, and physical development. Healthy development in early childhood helps prepare \nchildren for the educational experiences of kindergarten and beyond. Early childhood \ndevelopment and education opportunities are affected by various environmental and social \nfactors, including:', 'well as on their health. For example, children who enroll in low–quality schools with limited \nhealth resources, safety concerns, and low teacher support are more likely to have poorer \nphysical and mental health.  \n \nThe developmental and educational opportunities that children have access to in their early \nyears have a lasting impact on their health as adults. The Carolina Abecedarian Project found \nthat the children in the study who participated in a high–quality and comprehensive early \nchildhood education program, including health care and nutritional components, were in better \n \n13 N. Aikens, Y. Xue, E. Bandel, P. Caronongan, C.A. Vogel, and K. Boller (2015). Early Head Start Home Visits and', '(n.d.). The Foundations of Lifelong Health are Built in Early Childhood. Retrieved from \nhttps://46y5eh11fhgw3ve3ytpwxt9r-wpengine.netdna-ssl.com/wp-content/uploads/2010/05/Foundations-of-\nLifelong-Health.pdf \n25 Image by Senior Airman Jonathan Stefanko is in the public domain.  \n26 National Forum on Early Childhood Policy and Programs & National Scientific Council on the Developing Child. \n(n.d.). The Foundations of Lifelong Health are Built in Early Childhood. Retrieved from \nhttps://46y5eh11fhgw3ve3ytpwxt9r-wpengine.netdna-ssl.com/wp-content/uploads/2010/05/Foundations-of-\nLifelong-Health.pdf', '279 | H e a l t h ,  S a f e t y ,  a n d  N u t r i t i o n  in  E a r l y  C h i l d h o o d  E d u c a t i o n  \n \nhealth is important at every stage of life, from childhood and adolescence through adulthood.2 \nWhen early educators and families know more about early childhood mental health, they are \nbetter able to support children’s learning and development.3 \n \nFoundation for Mental Health  \nBeginning at birth, children need positive relationships with the adults who care for them. \nWhen children learn to recognize and share their feelings with trusted adults, they feel good \nabout themselves. These relationships help them develop the confidence to learn new skills. \nChildren thrive when adults support their strengths and needs. Responsive adults help children', ""holistic manner as part of a bigger system. In this manner, early childhood education becomes a \nvehicle for enhancing the physical, cognitive, mental, social and economic well-being of \nindividuals and the societies in which they live. Early care and education programs should \nenhance multiple interrelated dimensions of a child's life; including health and safety, nutrition, \nemotional well-being, and social competence.15 \n \nFocus on Wellness  \nRather than waiting for health issues to arise, families and early childhood education programs \nshould focus on supporting children’s wellness. “Wellness describes the entirety of one’s \nphysical, emotional, and social health; this includes all aspects of functioning in the world""]","In the context of early childhood, 'health' is defined as a holistic concept that encompasses various dimensions of a child's well-being, including physiological, intellectual, social, and spiritual aspects, as well as subjective feelings of well-being. A healthy child is one who experiences joy, delight, and wonder, feels secure and safe within their family and community, and is actively engaged with the world around them. This definition emphasizes that health is not just the absence of illness but involves a comprehensive approach to wellness that includes physical, emotional, and social health (Source: Unknown). 

It's important to note that early childhood development and education significantly impact long-term health outcomes, and supportive environments play a critical role in fostering children's health (Source: Unknown).","Health is defined as more than merely the absence of disease; it is an evolving human resource that helps children adapt to everyday life challenges, resist infections, cope with adversity, and feel a sense of personal well-being.",0.0,0.3928571428375,0.9166666666666666,0.9929809967332304,0.5147888556895202
What constitutes 'Child Maltreatment'?,"['rate of 2.32 per 100,000 children in the population.3 \n \nDefinitions \nChild maltreatment includes all types of abuse and neglect of a child under the age of 18 by a \nparent, caregiver, or another person in a custodial role (such as clergy, a coach, a teacher) that \nresults in harm, potential for harm, or threat of harm to a child. There are four common types \nof abuse and neglect: physical abuse, sexual abuse, emotional abuse, and neglect.4 \n \nPhysical Abuse \nPhysical abuse is a nonaccidental physical injury to a child caused by a parent, caregiver, or \nother person responsible for a child and can include punching, beating, kicking, biting, shaking, \nthrowing, stabbing, choking, hitting (with a hand, stick, strap, or other object), burning, or', 'concerned about the child’s welfare, particularly when multiple signs are present or they occur \nrepeatedly. \n \nSigns of Specific Forms of Child Maltreatment \n \nTable 6.2 – Signs of Physical Abuse20 \n \nScenario Characteristics \nA child who \nexhibits the \nfollowing signs \nmay be a victim \nof physical abuse: \n• Has unexplained injuries, such as burns, bites, bruises, broken bones, \nor black eyes \n• Has fading bruises or other noticeable marks after an absence from \nschool \n• Seems scared, anxious, depressed, withdrawn, or aggressive \n• Seems frightened of his or her parents/caregivers and protests or \ncries when it is time to go home \n• Shrinks at the approach of adults \n• Shows changes in eating and sleeping habits \n• Reports injury by a parent or another adult caregiver', '156 | H e a l t h ,  S a f e t y ,  a n d  N u t r i t i o n  in  E a r l y  C h i l d h o o d  E d u c a t i o n  \n \nTable 6.1 – Signs of General Maltreatment19 \n• Looks primarily to the child for care, attention, and satisfaction of the \nparent’s emotional needs \n• Shows little concern for the child \nParent/caregiver \nand child \n• Touch or look at each other rarely \n• Consider their relationship entirely negative \n• State consistently they do not like each other \n \nIt is important to pay attention to other behaviors that may seem unusual or concerning. \nAdditionally, the presence of these signs does not necessarily mean that a child is being \nmaltreated; there may be other causes. They are, however, indicators that others should be', 'understand what child maltreatment is, risk factors for child maltreatment, signs of different \nforms of child maltreatment, and what they should do to support children and families and \nwhat they must legally do if they suspect child maltreatment.  \n \nLooking at the Data \nIn 2017, there were 674,000 substantiated victims of child abuse and neglect across the U.S. \nThe youngest children are the most vulnerable to maltreatment. Nationally, states report that \nmore than one-quarter (28.5%) of victims are younger than 3 years old. The victimization rate is \nhighest for children younger than 1-year-old at 25.3 per 1,000 children.  \n \n \nFigure 6.1 – Victims of child maltreatment by age in 2017.2', '• Children younger than 4 years of age \n• Special needs that may increase caregiver burden (e.g., disabilities, mental health issues, \nand chronic physical illnesses) \n \nRisk Factors for Perpetration \nThere are different levels of risk factors for the perpetrators of child maltreatment \n \nIndividual Risk Factors \n• Families’ lack of understanding of children’s needs, child development and parenting \nskills \n• Parental history of child abuse and or neglect \n• Substance abuse and/or mental health issues including depression in the family \n• Parental characteristics such as young age, low education, single parenthood, a large \nnumber of dependent children, and low income \n• Nonbiological, transient caregivers in the home (e.g., mother’s male partner)', 'ing, biting, burning, beating, or pulling the victim’s hair.\nThe physical abuse inflicted on a child can result in\nbruises , burns, poisoning , broken bones, and internal\nhemorrhages. Physical assault against an adult primarily\noccurs with women, usually in the form of domestic vio-\nlence. It is estimated that approximately three million\nchildren witness domestic violence every year.\nSexual abuse of a child refers to sexual behavior\nbetween an adult and child or between two children, one\nof whom is dominant or significantly older. The sexual\nbehaviors can include touching breasts, genitals, and but-\ntocks; either dressed or undressed. The behavior can also\ninclude exhibitionism, cunnilingus, fellatio, or penetra-\ntion of the vagina or anus with sexual organs or objects.', 'Sometimes cultural values, the standards of care in the community, and poverty may contribute \nto what is perceived as maltreatment, indicating the family may need information or assistance. \nIt is important to note that living in poverty is not considered child abuse or neglect. However, a \nfamily’s failure to use available information and resources to care for their child may put the \nchild’s health or safety at risk, and child welfare intervention could be required. In addition, \nmany states provide an exception to the definition of neglect for parents/caregivers who \nchoose not to seek medical care for their children due to religious beliefs. \n \nAbandonment is considered in many states as a form of neglect. In general, a child is']","Child maltreatment includes all types of abuse and neglect of a child under the age of 18 by a parent, caregiver, or another person in a custodial role that results in harm, potential for harm, or threat of harm to a child. The four common types of abuse and neglect are:

1. **Physical Abuse**: Nonaccidental physical injury to a child, which can include actions such as punching, beating, kicking, biting, shaking, throwing, stabbing, choking, hitting, burning, and more.

2. **Sexual Abuse**: Involves sexual behavior between an adult and a child or between two children, where one is dominant or significantly older. This can include inappropriate touching and other sexual acts.

3. **Emotional Abuse**: This form of maltreatment can involve behaviors that harm a child's emotional well-being or development.

4. **Neglect**: This refers to the failure to provide for a child's basic needs, which can include physical, emotional, educational, and medical needs.

It's important to recognize that the presence of signs of maltreatment does not necessarily confirm abuse, as there may be other explanations. However, these signs should prompt concern and attention from caregivers and professionals (Source: Unknown).","Child maltreatment includes all types of abuse and neglect of a child under the age of 18 by a parent, caregiver, or person in a custodial role that results in harm, potential for harm, or threat of harm. It includes physical abuse, sexual abuse, emotional abuse, and neglect.",1.0,0.6666666666333333,1.0,0.9172298940403714,0.8142042742771505
What is the 'Use Zone' on a playground?,"['referred to as a fall zone. The use zone should be free of movable hazards like trikes and toys, \nrocks, and groups of children who might cluster and fixed hazards such benches.  \nUse zones vary depending on the size and the type of equipment. For most stationary \nequipment on the playground, the use zone should extend six feet in all directions (see Figure \n4.3).15 Equipment that is taller than 30 inches should be at least nine feet from other pieces of \nequipment. And the use zone for swings should extend from the front and rear of the swings \ntwice the height of the swing (see Figure 4.4). 16 \n \n \nFigure 4.3 - The use zone around a playground structure.17 \n \n15 Playgrounds! By the Office of Head Start is in the public domain.', '97 | H e a l t h ,  S a f e t y ,  a n d  N u t r i t i o n  in  E a r l y  C h i l d h o o d  E d u c a t i o n  \n \n \nPause to Reflect \nThink of a local playground or playgrounds you played on as a child? What \ntype of surface was underneath the equipment? Was it well maintained? Did it \nprotect children from injuries due to falls? Did the materials used caused any \nother hazards (such as overflowing sand that caused slipping or a surface that \ngot too hot to safely touch skin)? \n \nUse Zones \nThe use zone is the space that encompasses the activity/piece of equipment and the area \naround that activity/equipment that will keep children from colliding and provides enough \nseparation between different pieces of equipment and types of play. It is also sometimes', ""98 | H e a l t h ,  S a f e t y ,  a n d  N u t r i t i o n  in  E a r l y  C h i l d h o o d  E d u c a t i o n  \n \n \nFigure 4.4 – the use zone around swings.18 \n \nAge Appropriateness \nAge-appropriate equipment provides children with opportunities to safely practice gross motor \nskills without putting them at risk for unnecessary injury. This takes us back to the notion of \ncreating playgrounds that are high challenge but low risk. \n \nChildren are less likely to fall when equipment is only used with the age group for which it is \ndesigned. Equipment that is made according to the ASPM or CPSC standards will clearly be \nmarked with the age group for which it is intended. And that's usually either 6 to 23 months of"", ""99 | H e a l t h ,  S a f e t y ,  a n d  N u t r i t i o n  in  E a r l y  C h i l d h o o d  E d u c a t i o n  \n \n Age Age Appropriate Equipment \n \n5 to 12 years \n• arch climbers \n• flexible climbers \n• overhead rings and ladders \n• poles \n \nNot appropriate \nfor any age \n• trampolines \n• swinging gates \n• climbing ropes that are not secured at \nboth ends \n• animal figure swings \n• multiple occupancy swings \n• rope swings \n• trapeze bars \n \nHazards on Playgrounds \nGaps in equipment such as the space between the platform and the top of the slide or hooks \ncan entangle clothing or entrap body parts, causing trips, falls, or strangulation. Head \nentrapment into gaps that are large enough for a child's body to pass through (bigger than 3.5"", 'age, 2 to 5 years of age, and 5 to 12 years of age. So, any equipment that is marked for 5 to 12 \nyears of age is not acceptable on a preschool playground.19   \n \nTable 4.4 – Age-Appropriate Equipment20 \n \n Age Age Appropriate Equipment \n \n6 to 23 months \n• equipment under 32 inches high \n• ramps \n• single-file stepladders  \n• spring rockers \n• slides  \n• bucket swings \n \n2 to 5 years \n• climbers up to 60 inches in height \n• rung ladders \n• belt and tire swings \n• balance beams \n \n18 Public Playground Safety Handbook by the U.S. Consumer Product Safety Commission is in the public domain.    \n19 Public Playground Safety Handbook by the U.S. Consumer Product Safety Commission is in the public domain.', '101 | H e a l t h ,  S a f e t y ,  a n d  N u t r i t i o n  in  E a r l y  C h i l d h o o d  E d u c a t i o n  \n \n \nPause to Reflect \nThink of that playground again. Did it offer adequate use zones around the \ndifferent pieces of equipment? Was the equipment used by the appropriate \nage groups (or did older children play on equipment designed for young \nchildren or vice versa)? How well did it protect children from the hazards \nmentioned (trips and falls, entrapment, impalement, entanglement, or \nstrangulation)? \n \nRiding Toys \nAll children older than age 1 should wear properly fitted and approved helmets when they are \nriding toys with wheels or using any wheeled equipment. Helmets should be removed as soon', ""for public playgrounds or child care facilities should be used. So, home playground equipment \nlike Little Tykes brand or plastic sets that home use at local stores are not appropriate.  \n \nTo assess whether equipment is safe, you should look for these labels. Equipment must meet \nConsumer Product Safety Commission or CPSC recommendations and the American Society for \nTesting and Materials, or ASTM, standards. These are two organizations that set standards for \ndesign and manufacturing that ensure the equipment is safe. These logos can give you some \npeace of mind and knowing the equipment has been developed with the highest safety \nstandards. And of course, it also needs to be installed according to the manufacturer's \ninstructions and properly maintained.""]","The 'Use Zone' on a playground is the space that encompasses the activity or piece of equipment and the area around it. This zone is designed to keep children from colliding and provides enough separation between different pieces of equipment and types of play. For most stationary equipment, the use zone should extend six feet in all directions. Additionally, equipment that is taller than 30 inches should be at least nine feet away from other pieces of equipment, and the use zone for swings should extend from the front and rear of the swings to twice the height of the swing (source: Health, Safety, and Nutrition in Early Childhood Education).",The use zone is the space encompassing a piece of equipment and the area around it that protects children from colliding and provides separation between different types of play. It is often referred to as the fall zone.,1.0,0.8333333333055556,1.0,0.9999990335725616,0.6823142130519864
Define 'Sudden Infant Death Syndrome' (SIDS).,"['Sudden Unexpected Infant Deaths: \nhttps://cchealth.org/sids/pdf/Child-Care-SIDS-Booklet.pdf \n• Sudden Infant Death Syndrome (SIDS) Program: \nhttps://www.cdph.ca.gov/Programs/CFH/DMCAH/SIDS/Pages/defa\nult.aspx', '84 | H e a l t h ,  S a f e t y ,  a n d  N u t r i t i o n  in  E a r l y  C h i l d h o o d  E d u c a t i o n  \n \nSafe Sleeping  \nSudden Infant Death Syndrome (SIDS) is identified when the death of a healthy infant occurs \nsuddenly and unexpectedly, and medical and forensic investigation findings (including an \nautopsy) are inconclusive. SIDS is the leading cause of death in infants 1 to 12 months old, and \napproximately 1,500 infants died of SIDS in 2013 (CDC, 2015). Because SIDS is diagnosed when \nno other cause of death can be determined, possible causes of SIDS are regularly researched. \nOne leading hypothesis suggests that infants who die from SIDS have abnormalities in the area \nof the brainstem responsible for regulating breathing (Weekes-Shackelford & Shackelford, \n2005).71', '85 | H e a l t h ,  S a f e t y ,  a n d  N u t r i t i o n  in  E a r l y  C h i l d h o o d  E d u c a t i o n  \n \no The baby is covered by a blanket or quilt. \no The baby sleeps with more than one bed-sharer. \no The baby is younger than 11 to 14 weeks of age. \n \nImportant Facts About SIDS  \n• SIDS happens in families of all social, economic and ethnic groups.  \n• Most SIDS deaths occur between one and four months of age.  \n• SIDS occurs in boys more than girls.  \n• The death is sudden and unexpected, often occurring during sleep.  In most cases, the \nbaby seems healthy.  \n• Although it is not known exactly what causes SIDS, researchers know that it is not \ncaused by suffocation, choking, spitting up, vomiting, or immunizations.  \n• SIDS is not contagious.74 \n \nReducing the Risks', '2005).71 \n \nThis is a very important topic for early childhood educators as one study found that while data \nsuggests that only 7% of incidents of SIDS should occur while children are in child care, 20.4% \nactually did.72  \n \n \nFigure 3.21– A baby sleeping safely.73 \n \nRisk Factors for SIDS  \nBabies are at higher risk for SIDS if they: \n• Sleep on their stomachs \n• Sleep on soft surfaces, such as an adult mattress, couch, or chair or under soft coverings \n• Sleep on or under soft or loose bedding \n• Get too hot during sleep \n• Are exposed to cigarette smoke in the womb or in their environment, such as at home, \nin the car, in the bedroom, or other areas \n• Sleep in an adult bed with parents/caregivers, other children, or pets; this situation is \nespecially dangerous if:', 'Reducing the Risks  \nAlthough the sudden and unexpected death of an infant cannot be predicted or prevented, \nresearch shows that certain infant care practices can help reduce the risk of a baby dying \nsuddenly and unexpectedly.  Early childhood educators can help lower the risk of SUID for \ninfants less than one year of age by following these risk reduction guidelines. \n \nSleeping Position  \nThe chance of an infant dying suddenly and unexpectedly in childcare is higher when a baby \nfirst starts the transition from home to care. Research shows if a baby has been placed on \nhis/her back by the families, and the childcare provider places the baby to sleep on his/her \nstomach, there is a higher risk of death in the first weeks of child care.  One of the most', 'to their health care provider for further information. Programs should \nrequest that a medical care professional provide a signed statement for \ninfants who have a medical reason for not being placed to sleep on their \nbacks.  \n• Teachers can attend education programs to learn more about sudden \nunexpected infant deaths. Training and education for childcare \nproviders may be available through local public health Resource and \nReferral agency or Public Health Department at no cost.   \n• Programs should be aware of resources for additional support and \nmake them available to families as appropriate. It is vital to stay up‐to‐\ndate with the latest recommendations for safe infant sleep.   \n• For education and informational materials, contact the California SIDS', 'Smoke Free  \nNo one should smoke around children. California Child Care Licensing Regulations prohibit \nsmoking in childcare centers.  Smoke in the infants’ environment is a major risk factor for SIDS.    \n \nPacifiers  \nIf the family provides a pacifier, it should be offered to the infant. If a pacifier is used, it should \nnever be attached to a string. Infants should not be forced to take a pacifier and if it falls out \nduring sleep it doesn’t need to be given back to the infant. \n \n75 California Dept. of Public Health MCAH. (2014). What Child Care Providers and Other Caregivers Should Know. \nRetrieved from https://cchealth.org/sids/pdf/Child-Care-SIDS-Booklet.pdf.']","Sudden Infant Death Syndrome (SIDS) is defined as the sudden and unexpected death of a healthy infant, typically occurring during sleep, where medical and forensic investigations, including an autopsy, do not reveal a conclusive cause of death. SIDS is the leading cause of death in infants aged 1 to 12 months, with approximately 1,500 infants reported to have died from SIDS in 2013 (CDC, 2015). It is important to note that SIDS is diagnosed when no other cause of death can be determined, and researchers are actively investigating possible causes, including abnormalities in the brainstem that regulates breathing (Source: Health, Safety, and Nutrition in Early Childhood Education).","SIDS is the sudden and unexpected death of a healthy infant where medical and forensic investigations, including an autopsy, are inconclusive. It is the leading cause of death in infants 1 to 12 months old.",1.0,0.5833333333041666,1.0,0.9307309263824205,0.5432894048898202
What is 'Trauma-Informed Care' (TIC)?,"['Trauma-Informed Care \nAs mentioned, children who are exposed to traumatic life events are at significant risk for \ndeveloping serious and long-lasting problems across multiple areas of development. However, \nchildren are far more likely to exhibit resilience to childhood trauma when child-serving \nprograms, institutions, and service systems understand the impact of childhood trauma, share \ncommon ways to talk and think about trauma, and thoroughly integrate effective practices and \npolicies to address it—an approach often referred to as trauma-informed care (TIC). \n \nThe context in which children live, learn, and grow shapes both their immediate and long-term \nwell-being. Accordingly, children who experience trauma are more likely to exhibit resilience', 'when their environments are responsive to their specific needs. Families, schools, community-\nbased programs and services, and the individuals caring for children can increase the chances of \nresilience following childhood trauma when they become aware of the impact of childhood \ntrauma, provide a sense of safety and predictability, protect children from further adversity, \nand offer pathways for their recovery. In other words, children benefit when these entities \nprovide them with trauma-informed care (TIC). \n \nDespite its focus on trauma, TIC is inherently a strengths-based perspective that emphasizes \nresilience instead of pathology. TIC has been defined and implemented in a number of ways, \nbut the Substance Abuse and Mental Health Services Administration has identified four key', '303 | H e a l t h ,  S a f e t y ,  a n d  N u t r i t i o n  in  E a r l y  C h i l d h o o d  E d u c a t i o n  \n \n \nFigure 11.12 – The Four Rs are the key elements of Trauma-Informed Care 39 \n \nApplying TIC to real-world settings begins with a child’s first contact with a program, institution, \nor service system. It requires a comprehensive and multi-pronged effort involving the many \nadults in children’s lives. For example, in a school or afterschool program, TIC means increasing \ntrauma-related knowledge and skills among program facilitators, school administrators, bus \ndrivers, food service workers, classroom assistants, administrative staff, volunteers, teachers, \nleadership, special education professionals, school social workers and psychologists, families,', 'as well as positive relationships with peers.  \n \nEvaluations of TIC initiatives also indicate that when parents, service providers, and programs \nshare a common language and view of trauma, they are better able to work together to meet \nchildren’s needs. \n \nTraining and professional development opportunities are also important for increasing the \ncapacity of adults to attend to other aspects of TIC, including: \n• family engagement. \n• practices that are responsive to culture, gender, and sexual orientation.  \n• collaboration with community service providers (e.g., mental health providers who can \nscreen for childhood trauma and provide evidence-based treatment).  \n• developing and integrating emergency and crisis response protocols.', 'Secondary Traumatic Stress \nTIC also means attending to the psychological and physical safety and well-being of the adults \nwho care for children who have experienced trauma. Professionals, parents, and other \ncaregiving adults may suffer secondary traumatic stress (trauma-related reactions to exposure \nto another person’s traumatic experience). The National Child Traumatic Stress Network \nrecommends the following strategies to combat secondary traumatic stress and reduce related \nstaff burnout and turnover: \n• Provide high-quality, reflective supervision \n• Maintain trauma workload balance \n• Support workplace self-care groups \n• Enhance the physical safety of staff \n• Provide training to both staff and leadership to increase awareness about secondary', '305 | H e a l t h ,  S a f e t y ,  a n d  N u t r i t i o n  in  E a r l y  C h i l d h o o d  E d u c a t i o n  \n \n• and establishing trauma-informed policies that support positive youth development \ndespite exposure to trauma.  \n \nBuilding capacity and maintaining an ongoing commitment to TIC efforts are critical to \nsustainability. However, although it is a critical component of TIC, training staff and parents on \nthe impact of childhood trauma is not sufficient and does not in and of itself constitute TIC. TIC \nmust also include comprehensive, ongoing professional development and education for \nparents, families, school staff, out-of-school program staff, and community service providers on \njointly addressing childhood trauma. \n \nSecondary Traumatic Stress', 'and anyone else who comes into contact with children. However, increasing trauma knowledge \nis only one aspect of TIC, which also means that the individuals who care for children must be \nable to: \n1. Realize the widespread nature of childhood trauma and how it impacts the child’s \nemotional, social, behavioral, cognitive, brain, and physical development, as well as \ntheir mental health. In addition, adults must be aware of the influence of trauma on \nfamily members, first responders, service providers, and others who may experience \nsecondary stress (trauma-related reactions to exposure to another person’s traumatic \nexperience). In some instances, adults endure the same traumatic events or \ncircumstances as the child (e.g., a natural disaster, community violence, death of a']","Trauma-Informed Care (TIC) is an approach that recognizes the impact of childhood trauma on children's development and well-being. It emphasizes understanding trauma and integrating effective practices and policies to support children who have experienced traumatic events. TIC is characterized by a strengths-based perspective that focuses on resilience rather than pathology.

Key elements of TIC include:

1. **Awareness of Trauma**: Recognizing the widespread nature of childhood trauma and its effects on emotional, social, behavioral, cognitive, and physical development.
2. **Responsive Environments**: Creating safe and predictable environments that protect children from further adversity and support their recovery.
3. **Collaboration**: Encouraging cooperation among families, schools, and community services to meet children's needs effectively.
4. **Professional Development**: Providing ongoing training for adults who interact with children to enhance their understanding of trauma and its effects.

TIC also addresses the well-being of adults who care for traumatized children, acknowledging that they may experience secondary traumatic stress from exposure to others' traumatic experiences. Overall, TIC aims to foster resilience in children by ensuring that their environments are supportive and responsive to their specific needs (Source: Unknown). 

For further understanding or specific concerns, it's always best to consult a healthcare provider.","Trauma-Informed Care is an approach that understands the impact of trauma, shares common ways to talk about it, and integrates effective practices to address it. It emphasizes resilience rather than pathology and involves realizing, recognizing, responding to, and resisting re-traumatization.",0.6666666666666666,0.99999999995,0.9333333333333333,0.9606967182705378,0.8299412160882721
What is a 'Mandated Reporter' in California?,"['obligations to report suspected cases of abuse and neglect pursuant to California Penal Code \nSection 11166.5. \n \nAll persons who are mandated reporters are required, by law, to report all known or suspected \ncases of child abuse or neglect. It is not the job of the mandated reporter to determine whether \nthe allegations are valid. If child abuse or neglect is reasonably suspected or if the child shares \ninformation with a mandated reporter leading him/her to believe abuse or neglect has taken \nplace, the report must be made. No supervisor or administrator can impede or inhibit a report \nor subject the reporting person to any sanction. \n \nTo make a report, an employee must contact appropriate local law enforcement or county child', '159 | H e a l t h ,  S a f e t y ,  a n d  N u t r i t i o n  in  E a r l y  C h i l d h o o d  E d u c a t i o n  \n \n \n \nPause to Reflect \nThink back to your example situations. What signs might a teacher or caregiver \nnotice for each of these? \n \nMandated Reporting of Child Maltreatment in California \nA list of persons whose profession qualifies them as “mandated reporters” of child abuse or \nneglect is found in California Penal Code Section 11165.7. The list is extensive and continues to \ngrow. It includes all school/district employees, administrators, and athletic coaches. All persons \nhired into positions included on the list of mandated reporters are required, upon employment, \nto be provided with a statement, informing them that they are a mandated reporter and their', 'Consequences of Failing to Report \nA person who fails to make a required report is guilty of a misdemeanor punishable by up to six \nmonths in jail and/or up to a $1,000 fine (California Penal Code Section 11166[c]). \n \nAfter the Report is Made \nThe local law enforcement agency is required to investigate all reports. Cases may also be \ninvestigated by Child Welfare Services when allegations involve abuse or neglect within \nfamilies. \n \nChild Protective Services \nChild Protective Services (CPS) is the major organization to intervene in child abuse and neglect \ncases in California. Existing law provides services to abused and neglected children and their \nfamilies. More information can be found at Child Protective Services.26 \n \n \n25 Image by Petr Kratochvil is in the public domain.', '146 | H e a l t h ,  S a f e t y ,  a n d  N u t r i t i o n  in  E a r l y  C h i l d h o o d  E d u c a t i o n  \n \n101212 REPORTING REQUIREMENTS \n✓ The licensee shall report the following incidents to the Department: \no Any injury to any child that requires medical treatment. \no Any unusual incident or child absence that threatens \nsafety. \no Any suspected physical or psychological abuse of any \nchild. \n \nMandated Reporter Laws \nChild care providers are included in the professions that are required to \nreport suspected child maltreatment by the Child Abuse and Neglect \nReporting Act (CANRA) pursuant to Penal Codes 11164 through 11174.3.1 \n \nIntroduction \nOne more responsibility early childhood educators have to protect children’s safety is to', '160 | H e a l t h ,  S a f e t y ,  a n d  N u t r i t i o n  in  E a r l y  C h i l d h o o d  E d u c a t i o n  \n \n \nFigure 6.7 –When an early childhood educator suspects  \nabuse, it should be reported immediately.25 \n \nRights to Confidentiality and Immunity \nMandated reporters are required to give their names when making a report. However, the \nreporter’s identity is kept confidential. Reports of suspected child abuse are also confidential. \nMandated reporters have immunity from state criminal or civil liability for reporting as \nrequired. This is true even if the mandated reporter acquired the knowledge, or suspicion of \nabuse or neglect, outside his/her professional capacity or scope of employment. \n \nConsequences of Failing to Report', '26 Child Abuse Identification & Reporting Guidelines by the California Department of Education is used with \npermission.', '1 Penal Code Article 2.5 Child Abuse and Neglect Reporting Act [11164-11174.3] is in the public domain.  \n2 Child Maltreatment 2017 by the Administration for Children and Families is in the public domain.']","A 'Mandated Reporter' in California is a person who is legally required to report known or suspected cases of child abuse or neglect. This includes a wide range of professionals, such as school and district employees, administrators, and athletic coaches, among others. Mandated reporters must report any reasonable suspicion of abuse or neglect without determining the validity of the allegations themselves. They are provided with a statement upon employment that informs them of their status as mandated reporters (California Penal Code Section 11165.7). 

It's important to note that mandated reporters are protected by confidentiality laws, and their identity is kept confidential when they make a report. They also have immunity from state criminal or civil liability for reporting as required, even if they acquired the knowledge or suspicion outside their professional capacity (California Penal Code Section 11166.5). 

If you have further questions or concerns, please consult a healthcare provider or legal expert for more detailed guidance.",A mandated reporter is a professional required by law (CANRA) to report all known or suspected cases of child abuse or neglect to local law enforcement or county child welfare agencies. This includes child care providers.,1.0,0.8874999999778125,0.8888888888888888,0.9944163991293363,0.4388004215129203
What is 'Food Insecurity'?,"['Food Insecurity \nFood inse curity is def ined as not ha ving ade quate ac cess to f ood \nthat me ets nutri tional ne eds. Ac cording to the USD A, about 48.8 \nmillion people live in f ood-insecure households and ha ve reported \nmultiple indications of food access problems. About sixteen million \nof those ha ve “v ery low f ood se curity,” which me ans one or mor e \npeople in the household were hungry at some point over the course \nof a year due to the inabili ty to afford enough food. The difference \nbetween lo w and v ery lo w f ood se curity is tha t members o f lo w \ninsecurity households ha ve reported problems of food access, but \nhave reported only a f ew instances of reduced food intake, if an y.2 \nAfrican Americ an and H ispanic households e xperience f ood', 'food insecurity. 20 \n \nFood Insecurity \nFood insecurity is defined as the disruption of food intake or eating patterns because of a lack \nof money and other resources. In 2014, 17.4 million U.S. households were food insecure at \nsome time during the year. Food insecurity does not necessarily cause hunger, but hunger is a \npossible outcome of food insecurity. \n \n \n \nFigure 13.5 –Resources such as food banks, can help families experiencing food insecurity.21 \n \nThe United States Department of Agriculture (USDA) divides food insecurity into the following 2 \ncategories: \n• Low food security: “Reports of reduced quality, variety, or desirability of diet. Little or \nno indication of reduced food intake.” \n• Very low food security: “Reports of multiple indications of disrupted eating patterns', '208. \nFood Insecurity  |  1135', 'insecurity at much higher rates than the national average.3 \nHouseholds with limited resources employ a variety of methods to \nincrease their access to adequate food. Some families purchase junk \nfood and fast f ood—cheaper options tha t ar e also v ery unhe althy. \nOther families who strugg le wi th f ood se curity supplemen t the \ngroceries they purchase by participating in go vernment assistance \n2. Coleman-Jensen A. Household Food Security in the \nUnited States in 2010. US Department of Agriculture, \nEconomic Research Report, no. ERR-125. 2011. \n https://www.ers.usda.gov/publications/pub-\ndetails/?pubid=44909. Accessed April 15, 2018. \n3. Coleman-Jensen A. Household Food Security in the \nUnited States in 2010. US Department of Agriculture,', '• food insecure with severe hunger \nMillions o f childr en gr ow up in f ood-insecure households wi th \ninadequate diets due to both the amoun t of available food and the \nquality of food. In the United States, about 20 percent of households \nwith childr en ar e f ood inse cure to some degr ee. I n half o f those, \nonly adults experience food insecurity, while in the other half both \nadults and childr en ar e c onsidered to be f ood inse cure, which \nmeans tha t childr en did not ha ve ac cess to ade quate, nutri tious \nmeals at times.3 \nGrowing up in a f ood-insecure household c an lead to a number \nof problems. Def iciencies in ir on, zinc, pr otein, and vi tamin A c an \nresult in stun ted growth, illness, and limi ted development. Federal', 'the body alerts the brain that it requires food. This uneasy sensation \nis easily addressed with a snack or a full me al. However, the term \n“hunger” also relates to a weakened condition that is a consequence \nof a pr olonged lack o f f ood. P eople who suf fer fr om this f orm o f \nhunger t ypically e xperience malnourishmen t, along wi th poor \ngrowth and development. \nHunger \nAdequate f ood in take tha t me ets nutri tional r equirements is \nessential to achieve a healthy, productive lifestyle. However, millions \nof people in North America, not to mention globally, go hungry and \nare malnourished each year due to a recurring and involuntary lack \n1132  |  Food Insecurity', 'experiences. \nFood Security \nMost American households are considered to be food secure, which \nmeans the y ha ve ade quate ac cess to f ood and c onsume enoug h \nnutrients to achie ve a he althy lifestyle. However, a minori ty of US \nhouseholds experiences food insecurity at certain points during the \nyear, which me ans their ac cess to f ood is limi ted due to a lack \nof mone y or other r esources. This gr aphic sho ws the per centage \nof food-secure and f ood-insecure households in the Uni ted States \nduring the year 2010. \n1. Hunger in America: 2016 United States Hunger and \nPoverty Facts. World Hunger Education Service. \nRetrieved from http://www.worldhunger.org/articles/\nLearn/us_hunger_facts.htm. Accessed April 15, 2018. \nFood Insecurity  |  1133']","Food insecurity is defined as not having adequate access to food that meets nutritional needs. It can manifest as a disruption of food intake or eating patterns due to a lack of money and other resources. According to the USDA, food insecurity is categorized into two levels: 

1. **Low food security**: This involves reports of reduced quality, variety, or desirability of diet, with little or no indication of reduced food intake.
2. **Very low food security**: This includes reports of multiple indications of disrupted eating patterns, where individuals may experience hunger at some point during the year due to the inability to afford enough food.

Food insecurity does not necessarily cause hunger, but hunger is a possible outcome of food insecurity. Millions of children grow up in food-insecure households, which can lead to deficiencies in essential nutrients and result in stunted growth, illness, and limited development (Source: Unknown). 

If you or someone you know is experiencing food insecurity, it may be helpful to seek assistance from local resources such as food banks or government assistance programs.",Food insecurity is the disruption of food intake or eating patterns due to a lack of money and other resources. It is divided into low food security and very low food security.,1.0,0.8095238094968253,1.0,0.9247831079610597,0.9898355431811163
What are 'Macronutrients'?,"['Figure 1.1 The \nMacronutrie\nnts: \nCarbohydrat\nes, Lipids, \nProtein, and \nWater \nProteins \nProteins are macromolecules composed of chains of subunits called \namino acids. Amino acids ar e simple subunits composed of carbon, \noxygen, hydrogen, and ni trogen. Food sour ces of proteins include \nmeats, dair y pr oducts, se afood, and a v ariety o f dif ferent plan t-\nbased f oods, most notabl y so y. The w ord pr otein c omes fr om a \nGreek w ord me aning “ of primar y impor tance,” which is an apt \ndescription o f these macr onutrients; the y ar e also kno wn \ncolloquially as the “w orkhorses” o f lif e. Pr oteins pr ovide f our \nkilocalories o f ener gy per gr am; ho wever pr oviding ener gy is not \nprotein’s most impor tant func tion. Pr oteins pr ovide struc ture to', 'Macronutrients: Nutrients needed in larger amounts due to energy needs. \nMacronutrients include carbohydrates, proteins, and fats. (Chapter 14.2) \nMastication: The chewing of food in the mouth. (Chapter 14.2) \nMechanical digestion: Breaking food down into small chunks through \nchewing prior to swallowing. (Chapter 14.2) \nNitrogen balance: The net loss or gain of nitrogen excreted compared to \nnitrogen taken into the body in the form of protein consumption; an indicator \nof protein status where a negative nitrogen balance equates to a protein \ndeficit in the diet and a positive nitrogen balance equates to a protein excess \nin the diet. (Chapter 14.2) \nNutrient-dense foods: Foods with a high proportion of nutritional value \nrelative to calories contained in the food. (Chapter 14.2)', '310 | H e a l t h ,  S a f e t y ,  a n d  N u t r i t i o n  in  E a r l y  C h i l d h o o d  E d u c a t i o n  \n \nwater, vitamins, and minerals. Foods also contain non-nutrients that may be harmful (such as \nnatural toxins common in plant foods and additives like some dyes and preservatives) or \nbeneficial (such as antioxidants). \n \nMacronutrients \nNutrients that are needed in large amounts are called macronutrients. There are three classes \nof macronutrients: carbohydrates, fats, and proteins. These can be metabolically processed into \ncellular energy, allowing our bodies to conduct their basic functions. A unit of measurement of \nfood energy is the calorie. Water is also a macronutrient in the sense that you require a large', 'in nature, they must obtain their nutrients from the environment. Nutrients that are required in large amounts\nare called macronutrients, whereas those required in smaller or trace amounts are calledmicronutrients. Just\na handful of elements are considered macronutrients—carbon, hydrogen, oxygen, nitrogen, phosphorus, and\nsulfur. (A mnemonic for remembering these elements is the acronym CHONPS.)\nWhy are these macronutrients needed in large amounts? They are the components of organic compounds in\ncells, including water. Carbon is the major element in all macromolecules: carbohydrates, proteins, nucleic acids,\nlipids, and many other compounds. Carbon accounts for about 50 percent of the composition of the cell. In', 'Macronutrients \nNutrients tha t ar e ne eded in lar ge amoun ts ar e c alled \nmacronutrients. Ther e ar e thr ee classes o f macr onutrients: \ncarbohydrates, lipids, and pr oteins. These c an be me tabolically \nprocessed in to c ellular ener gy. The ener gy fr om macr onutrients \ncomes fr om their chemic al bonds. This chemic al ener gy is \nconverted into cellular energy that is then utilized to perform work, \nallowing our bodies to c onduct their basic func tions. A uni t o f \nmeasurement of food energy is the calorie. On nutrition food labels \nthe amount given for “calories” is actually equivalent to each calorie \nmultiplied b y one thousand. A kiloc alorie ( one thousand c alories, \ndenoted with a small “ c”) is synon ymous with the “ Calorie” (with a', 'capital “C”) on nutrition food labels. Water is also a macronutrient in \nthe sense that you require a large amount of it, but unlike the other \nmacronutrients, it does not yield calories. \nCarbohydrates \nCarbohydrates are molecules composed of carbon, hydrogen, and \noxygen. The major f ood sources of carbohydrates are grains, milk, \nfruits, and starchy vegetables, like potatoes. Non-starchy vegetables \nalso contain carbohydrates, but in lesser quan tities. Carbohydrates \nare br oadly classif ied in to t wo f orms base d on their chemic al \nstructure: simple c arbohydrates, o ften c alled simple sugars; and \ncomplex carbohydrates. \nSimple carbohydrates consist of one or two basic units. Examples \nof simple sugars include sucr ose, the type of sugar you would have', 'cushioned, and body temperature would fluctuate widely.  \n \n \nProtein \n \nCarbohydrates \n \nFats \n \nWater \nFigure 12.1 – The Macronutrients: Carbohydrates, Fats, Protein, and Water1 \n \nMicronutrients \nMicronutrients are nutrients required by the body in lesser amounts, but are still essential for \ncarrying out bodily functions. Micronutrients include all the essential minerals and vitamins. \nThere are sixteen essential minerals and thirteen vitamins (See Table 12.1 “Minerals and Their \nMajor Functions” and Table 12.2 “Vitamins and Their Major Functions” for a complete list and \ntheir major functions). In contrast to carbohydrates, fats, and proteins, micronutrients are not \nsources of energy (calories), but they assist in the process as components of enzymes. Enzymes']","Macronutrients are nutrients that are needed in large amounts due to energy needs. There are three classes of macronutrients: carbohydrates, proteins, and fats. These macronutrients can be metabolically processed into cellular energy, allowing our bodies to conduct their basic functions. Water is also considered a macronutrient because it is required in large amounts, although it does not yield calories. The energy from macronutrients comes from their chemical bonds, which are converted into cellular energy for bodily functions (Source: Unknown).","Macronutrients are nutrients required by the body in large amounts to provide energy and perform basic functions. They include carbohydrates, fats, proteins, and water.",1.0,0.5845238095091964,1.0,0.9437165298981327,0.9489945269372199
What is 'Anaphylaxis'?,"['Description\nAnaphylaxis is a type of allergic reaction, in which\nthe immune system responds to otherwise harmless sub-\nstances from the environment. Unlike other allergic\nreactions, however, anaphylaxis can kill. Reaction may\nbegin within minutes or even seconds of exposure, and\nrapidly progress to cause airway constriction, skin and\nintestinal irritation, and altered heart rhythms. In severe\ncases, it can result in complete airway obstruction,\nshock, and death.\nCauses and symptoms\nCauses\nLike the majority of other allergic reactions, anaphy-\nlaxis is caused by the release of histamine and other\nchemicals from mast cells. Mast cells are a type of white\nblood cell and they are found in large numbers in the tis-\nsues that regulate exchange with the environment: the', '252 | H e a l t h ,  S a f e t y ,  a n d  N u t r i t i o n  in  E a r l y  C h i l d h o o d  E d u c a t i o n  \n \n \nAnaphylaxis \nAnaphylaxis is a serious allergic reaction. It can begin very quickly, and \nsymptoms may be life-threatening. The most common causes are reactions \nto foods (especially peanuts), medications, and stinging insects. Other causes \ninclude exercise and exposure to latex. Sometimes no cause can be found. \n \nIt can affect many organs: \n• Skin - itching, hives, redness, swelling \n• Nose - sneezing, stuffy nose, runny nose \n• Mouth - itching, swelling of the lips or tongue \n• Throat - itching, tightness, trouble swallowing, swelling of the back of \nthe throat \n• Chest - shortness of breath, coughing, wheezing, chest pain or \ntightness', 'Anaphylactic shock see Anaphylaxis\nAnaphylactoid purpura see Allergic purpura\nAnaphylaxis\nDefinition\nAnaphylaxis is a rapidly progressing, life-threaten-\ning allergic reaction.\nGALE ENCYCLOPEDIA OF MEDICINE 2178\nAnaphylaxis\nGEM - 0001 to 0432 - A  10/22/03 1:42 PM  Page 178', 'tion, redness, and swelling. On the smooth muscle cells\nof the airways and digestive system, they cause constric-\ntion. On nerve endings, they increase sensitivity and\ncause itching.\nIn anaphylaxis, the dramatic response is due both to\nextreme hypersensivity to the allergen and its usually\nsystemic distribution. Allergens are more likely to cause\nanaphylaxis if they are introduced directly into the circu-\nlatory system by injection. However, exposure by inges-\ntion, inhalation, or skin contact can also cause anaphy-\nlaxis. In some cases, anaphylaxis may develop over time\nfrom less severe allergies.\nAnaphylaxis is most often due to allergens in foods,\ndrugs, and insect venom. Specific causes include:\n• fish, shellfish, and mollusks\n• nuts and seeds\n• stings of bees, wasps, or hornets', 'Prognosis\nThe rapidity of symptom development is an indica-\ntion of the likely severity of reaction: the faster symp-\ntoms develop, the more severe the ultimate reaction.\nPrompt emergency medical attention and close monitor-\ning reduces the likelihood of death. Nonetheless, death is\npossible from severe anaphylaxis. For most people who\nreceive rapid treatment, recovery is complete.\nPrevention\nAvoidance of the allergic trigger is the only reliable\nmethod of preventing anaphylaxis. For insect allergies,\nthis requires recognizing likely nest sites. Preventing food\nallergies requires knowledge of the prepared foods or\ndishes in which the allergen is likely to occur, and careful\nquestioning about ingredients when dining out. Use of a\nMedic-Alert tag detailing drug allergies is vital to prevent', 'opment of symptoms in response to a suspect allergen.\nIdentification of the culprit may be done with RAST test-\ning, a blood test that identifies IgE reactions to specific\nallergens. Skin testing may be done for less severe ana-\nphylactic reactions.\nTreatment\nEmergency treatment of anaphylaxis involves injec-\ntion of adrenaline (epinephrine) which constricts blood\nvessels and counteracts the effects of histamine. Oxygen\nmay be given, as well as intravenous replacement fluids.\nAntihistamines may be used for skin rash, and amino-\nphylline for bronchial constriction. If the upper airway is\nobstructed, placement of a breathing tube or tracheosto-\nmy tube may be needed.\nGALE ENCYCLOPEDIA OF MEDICINE 2 179\nAnaphylaxis\nGEM - 0001 to 0432 - A  10/22/03 1:42 PM  Page 179', 'resolve within twenty-four hours. A deeper and more\nextensive skin reaction, involving more extensive fluid\ncollection and pain, is called angioedema. This usually\noccurs on the extremities, fingers, toes, and parts of the\nhead,neck,and face. Anaphylaxis is marked by airway\nconstriction, blood pressure drop, widespread tissue\nswelling, heart rhythm abnormalities, and in some cases,\nloss of consciousness. Other syptoms may include, dizzi-\nness, weakness, seizures, coughing,flushing, or cramp-\ning. The symptoms may begin within five minutes after\nexposure to the allergan up to one hour or more later.\nMast cells in the tissues and basophils in the blood\nrelease mediators that give rise to the clinical symptoms\nof this IgE-mediated hypersensitivity reaction. Common-']","Anaphylaxis is a rapidly progressing, life-threatening allergic reaction in which the immune system responds to otherwise harmless substances from the environment. It can begin very quickly, often within minutes or even seconds of exposure, and may lead to severe symptoms such as airway constriction, skin and intestinal irritation, and altered heart rhythms. In severe cases, it can result in complete airway obstruction, shock, and death. The most common causes of anaphylaxis include reactions to foods (especially peanuts), medications, and stinging insects, although it can also be triggered by exercise and exposure to latex. Symptoms can affect multiple organs, including the skin, nose, mouth, throat, and chest (source: Unknown). 

It is crucial to seek emergency medical attention if anaphylaxis is suspected, as prompt treatment can significantly reduce the risk of severe outcomes (source: Unknown).","Anaphylaxis is a severe, potentially life-threatening allergic reaction that can occur within minutes of exposure to an allergen. Symptoms may include difficulty breathing, swelling of the mouth and throat, and decreased blood pressure.",1.0,0.9428571428382857,1.0,0.9250925431095539,0.9904453239276811
What is 'Integrated Pest Management' (IPM)?,"[""current, comprehensive information on the life cycles of pests and their interaction with the \nenvironment.  \n \nIntegrated Pest Management “(IPM) is a safer, more effective, longer-lasting method of pest \ncontrol that emphasizes pest prevention by eliminating pests' access to food, water, and \nshelter. When using IPM, properly identify the pest and know why it's there so an appropriate \ncombination of different pest control methods can be used for better effectiveness in \ncontrolling the pest.”47 This information, in combination with the last toxic available pest \ncontrol methods, is used to manage pest damage by the most economical means, and with the \nleast possible hazard to people, property, and the environment.48"", 'Extension. Retrieved from https://extension.psu.edu/ipm-for-child-care-and-early-learning-environments \n48 Integrated Pest Management (IPM) Principles by the U.S. Environmental Protection Agency is in the public \ndomain \n49 Image by the U.S. Environmental Protection Agency is in the public domain', '215 | H e a l t h ,  S a f e t y ,  a n d  N u t r i t i o n  in  E a r l y  C h i l d h o o d  E d u c a t i o n  \n \nYoung children also frequently place their hands and objects in their mouths, resulting in the \nnon-dietary ingestion of pesticides. Children are less developed immunologically, \nphysiologically, and neurologically, and therefore may be more susceptible to the adverse \neffects of chemicals and toxins. There is increasing evidence of adverse effects of pesticides on \nyoung children, particularly on neurodevelopment.46  \n \nIntegrated Pest Management (IPM) is an effective and environmentally sensitive approach to \npest management that relies on a combination of common-sense practices. IPM programs use', ""Figure 8.14 – Using traps can help a program determine what insects they are dealing \nwith in order to take the most effective and least hazardous steps to get rid of them.49 \n \nChemical Hazards \nA child born today will grow up exposed to more chemicals than a child from any other \ngeneration in our nation's history.  Of the 85,000 synthetic chemicals in commerce today, only a \nsmall fraction has been tested for toxicity on human health. \n \n46 Resources about Pesticides and Integrated Pest Management for Child Care Providers by the U.S. Environmental \nProtection Agency is in the public domain  \n47 PennState Extension. (2011, October 11). IPM for Child Care and Early Learning Environments. PennState"", 'grapes, oranges, lemons, peppers, most brassica (broccoli and cauliflower), and many berries, melons, and\nnuts.\nFinally, humans compete for their food with crop pests, most of which are insects. Pesticides control these\ncompetitors; however, pesticides are costly and lose their effectiveness over time as pest populations adapt and\nevolve. They also lead to collateral damage by killing non-pest species and risking the health of consumers and\nagricultural workers. Ecologists believe that the bulk of the work in removing pests is actually done by predators\nand parasites of those pests, but the impact has not been well studied. A review found that in 74 percent of\nstudies that looked for an effect of landscape complexity on natural enemies of pests, the greater the complexity,', 'the greater the effect of pest-suppressing organisms. An experimental study found that introducing multiple\nenemies of pea aphids (an important alfalfa pest) increased the yield of alfalfa significantly. This study shows the\nimportance of landscape diversity via the question of whether a diversity of pests is more effective at control than\none single pest; the results showed this to be the case. Loss of diversity in pest enemies will inevitably make it\nmore difficult and costly to grow food.\nWild Food Sources\nIn addition to growing crops and raising animals for food, humans obtain food resources from wild populations,\nprimarily fish populations. In fact, for approximately 1 billion people worldwide, aquatic resources provide the', 'technology to reduce exposure to injury or illness. \nStandard 4: Select, install, and maintain SPHM technology. \nThis standard provides guidance in selecting, installing, and \nmaintaining SPHM technology. \nStandard 5: Establish a system for education, training, and \nmaintaining competence. This standard outlines SPHM training \nfor employees, including the demonstration of competency \nbefore using SPHM technology with patients. \nStandard 6: Integrate patient-centered SPHM assessment, \nplan of care, and use of SPHM technology. This standard \nfocuses on the patient’s needs by establishing assessment \nguidelines and developing an individual plan of care. It outlines \nthe importance of using SPHM technology in a therapeutic \nmanner with the goal of promoting patients’ independence. For']","Integrated Pest Management (IPM) is a safer, more effective, and longer-lasting method of pest control that emphasizes pest prevention by eliminating pests' access to food, water, and shelter. It involves properly identifying the pest and understanding why it is present, allowing for the use of an appropriate combination of different pest control methods. This approach aims to manage pest damage in the most economical way while minimizing hazards to people, property, and the environment (Source: Unknown). 

IPM is particularly important in settings like child care and early learning environments, where young children may be more susceptible to the adverse effects of pesticides due to their developing immune and neurological systems (Source: Unknown).","IPM is an environmentally sensitive approach to pest management that relies on common-sense practices. It emphasizes pest prevention by eliminating access to food, water, and shelter, using the least toxic methods necessary.",0.6666666666666666,0.8333333332916666,1.0,0.9234897228461659,0.8383561104852678
Define 'Family-Centered Care' regarding chronic conditions.,"['Family-Centered Care \nOver the last 15 years, children\'s health care and the relationship between families and health \nprofessionals have changed significantly. The role of parents/caregivers has shifted from being \npatients to partners with the health care provider; and the ""good patient"" has changed from \nunquestioningly following advice to being a good partner who actively participates in decisions \nand advocates for services for their child. \n \n""Family-centered care"" involves providing the family health care and other services based on \nthe family\'s needs, priorities, and convenience rather than those of the service providers or the \nchild alone. Family-centered services are evidence of a program’s commitment to family \npartnerships and supporting child and family development.', ""10.1 – Family centered care relies on respect and collaboration.2 \n \nServices are family-centered when:  \n• The family is recognized as the child's most constant and important caregiver.  \n• The family and professionals collaborate as partners.  \n• Communication is open and honest, in both directions, between the family and \nprofessionals.  \n \n1 Care Plan for Children with Special Health Care Needs by Head Start Early Childhood Learning & Knowledge \nCenter is in the public domain  \n2 Image by the California Department of Education is used with permission"", 'Caregiver Support \nMost clients with chronic illness have family caregivers that are an extension \nof the health care team and work around the clock, all days of the week. They \ntypically provide 70-80% of the care at home. It is important for nurses to \nassess the caregiver when seeing them with the client in the home, clinic, \nhospital, or long-term setting and provide encouragement. It is helpful to \nacknowledge their work is very difficult and to praise them for their \nefforts.35 See Figure 17.936\n for an image of a mother acting as caregiver and \nsupporting her son’s health. \nFigure 17.9 Caregiver Support \nResearch shows caregivers often have the following needs37\n: \n35. Lowey, S. E. (2015). Nursing care at the end of life. Open Library.', 'with special medical needs feel more secure and able to learn when their caregivers \nknow what to do.  \n \n \nFigure 10.2 – Families, health care and service providers, and early care and education programs  \ncan work together to make sure children with special health needs get the care they need.3 \n \nWhat should be Included in an Individualized Health Plan?  \nCaring for children with chronic conditions is a serious responsibility. Staff are commonly \nconcerned about meeting the child\'s daily care needs: ""How can I be sure to give him his \nmedicine at the right time? Do we have enough staff to do his tracheostomy care while also \nsupervising the other children? Will I have all his asthma supplies on the field trip?"" Staff are', ""247 | H e a l t h ,  S a f e t y ,  a n d  N u t r i t i o n  in  E a r l y  C h i l d h o o d  E d u c a t i o n  \n \n• Individual strengths and differences are respected among families.  \n• Services are flexible and responsive to the family's needs.  \n• Family-to-family support is encouraged.  \n• Children with chronic conditions and their families are treated like other children and \nfamilies, and not defined by their condition. \n \nIndividualizing Care \nIndividualizing means recognizing the characteristics that make each child unique and planning \na program that responds to these differences. Individualizing allows families and staff to \nrespond to each child's built-in time clock for development, as well as culture, family, home"", ""246 | H e a l t h ,  S a f e t y ,  a n d  N u t r i t i o n  in  E a r l y  C h i l d h o o d  E d u c a t i o n  \n \nparents/guardians, included in their on-site health record and readily accessible to those caring \nfor the child.1 \n \nIndividualized Planning for Health \nWhat does it take to care for children with chronic conditions in an early care and education \nprogram? There's no single recipe for all situations. What it takes—more than any policy, list of \nservices, or staffing plan—is a commitment to communication, collaboration, and creative \nproblem-solving, and a determination to make it work. The essential principles that should \nguide the care of children with chronic conditions in early childhood education are: care should \nbe family-centered, individualized, safe, and legal."", ""language, life experiences, strengths, needs, skills, and abilities. \n \nEarly care and education programs can best meet the needs of children with chronic conditions \nby following a systematic process of Individualized Health Planning. For children who are \neligible for an Individualized Education Program (IEP) or Individualized Family Service Plan \n(IFSP), the IEP or IFSP may or may not include planning for the child's health care needs. In \naddition, many children with special health needs who are not eligible for an IEP or IFSP would, \nin fact, benefit from individualized health planning.  \n \nIndividualized health planning for children with chronic conditions involves close \ncommunication and collaboration among families, the early care and education program staff,""]","Family-Centered Care is an approach that emphasizes the importance of the family in the health care process, particularly for children with chronic conditions. It involves recognizing the family as the child's most constant and important caregiver and fostering a partnership between families and health care professionals. This care model prioritizes the family's needs, priorities, and convenience over those of the service providers or the child alone. 

Key aspects of Family-Centered Care include:
- Collaboration between families and professionals as partners.
- Open and honest communication in both directions.
- Respect for individual strengths and differences among families.
- Flexibility and responsiveness of services to meet the family's needs.
- Encouragement of family-to-family support.
- Treating children with chronic conditions and their families like other children and families, rather than defining them solely by their condition.

This approach is essential for ensuring that families feel secure and empowered in managing their child's health care needs (Source: Unknown).","Family-centered care involves providing health care and services based on the family's needs, priorities, and convenience rather than those of the provider alone, recognizing the family as the child's most constant caregiver.",1.0,0.81666666664625,1.0,0.8981948102229218,0.6503012675969576
What is 'Social and Emotional Health' in early childhood?,"['Early childhood mental health is the same as social emotional development.8 Social and \nemotional development is important to early learning. Many social-emotional qualities—such \nas curiosity; self-confidence as a learner; self-control of attention, thinking, and impulses; and \ninitiative in developing new ideas—are essential to learning at any age. Learning, problem \nsolving, and creativity rely on these social-emotional and motivational qualities as well as basic \ncognitive skills.  \n \nWhen learning occurs in groups, such as in preschool classrooms or family child care programs, \nthe social environment significantly influences how learning occurs. When young children enjoy \ninteracting with adults and other children, they are more enthusiastic about activities and', 'feel safe and valued and learn how to get along well with others. \n \nChildren who can manage their feelings can learn and play with peers. They are better able to \nplan, monitor and control their behavior. They can also adjust to changes in schedules and \nroutines. Children who get along with adults learn to work together and follow rules. They can \nalso show concern for, and share, take turns and compromise with other children.4 \n \n \nFigure 11.1 – It is important to care for children’s emotional well-being from the beginning.5 \n \nMental Health from the Beginning \nInfant mental health practice applies knowledge of relationships to support and enhance \nhealthy social and emotional development and to prevent and treat mental health disorders.', 'strengthen and support the healthy social and emotional development of \nchildren―early and before intervention is needed. \n \nIECMHC has been shown to improve children’s social skills and emotional \nfunctioning, promote healthy relationships, reduce challenging behaviors, \nreduce the number of suspensions and expulsions, improve classroom \nquality, and reduce provider stress, burnout, and turnover. 33 \n \nIncreasing Children’s Opportunities to Practice Social Skills \nand Emotional Competencies \nEveryday activities in the classroom can be planned and implemented to help children’s social \nand emotional development (which, as mentioned, is the same as their mental health).  \n \nTeaching Children About Emotions', '281 | H e a l t h ,  S a f e t y ,  a n d  N u t r i t i o n  in  E a r l y  C h i l d h o o d  E d u c a t i o n  \n \nyoung children’s development; and the childrearing practices that parents and \ncaregivers use to promote, protect, or restore infants’ and toddlers’ mental health.6 \n \n \nPause to Reflect \nHow does this toddler’s exploration relate to his self-esteem? \n \n \nFigure 11.27  \n \nMental Health in Early Childhood \nEarly childhood mental health (birth to 5 years) is a child’s growing capacity to do these things, \nall in the cultural context of family and community (adapted from ZERO TO THREE): \n• Experience, regulate, and express emotions \n• Develop close, secure, relationships \n• Explore the surroundings and learn.', 'express and manage emotions—is critical for school readiness and lifelong success. Without it, \nyoung children are more likely to: \n• Have difficulty experiencing or showing emotions, which may lead to withdrawal from \nsocial activities and maintaining distance from others \n• Have trouble making friends and getting along with others \n• Have behaviors, such as biting, hitting, using unkind words, or bullying—behaviors that \noften lead to difficulty with learning, suspension or expulsion, and later school dropout49 \n \nMore information about this topic can be found in other parts of this book. Behavior has been \naddressed in Chapter 3 in the section on Interpersonal Safety and children’s mental health is \nthe focus of Chapter 11.', 'It is important that children are in an environment that keeps them physically and emotionally \nsafe and healthy and provides sound nutrition. As an early educator, providing these requires \nattention, planning, and intention. \n \n \n16 Murphey, D., et al. (2014). Are the Children Well? A Model and Recommendations for Promoting the Mental \nWellness of the Nation’s Young People. Robert Wood Johnson Foundation. Retrieved from \nhttps://www.childtrends.org/wp-content/uploads/2014/07/2014-33AreChildrenWellRWJF.pdf \n17 California Preschool Program Guidelines by the California Department of Education is used with permission.  \n18  Strong Foundations in Mental Health for Social and Emotional Well-Being Newsletter by the National Center on', '282 | H e a l t h ,  S a f e t y ,  a n d  N u t r i t i o n  in  E a r l y  C h i l d h o o d  E d u c a t i o n  \n \nexcitement about learning, and children are also motivated by others’ acknowledgment of the \nchild’s accomplishments.9  \n \nIt is important because it affects a child’s ability to:  \n• Express their needs  \n• Pay attention  \n• Solve problems  \n• Get along with others  \n• Follow directions  \n• Persist when challenged  \n• Manage their emotions  \n• Take initiative  \n• Be curious and interested in learning10 \n \nInterviews with preschool and kindergarten teachers indicate that children who have the \ngreatest difficulties in learning are hindered by the lack of these social-emotional qualities more']","Social and emotional health in early childhood, also referred to as early childhood mental health, encompasses a child's growing capacity to experience, regulate, and express emotions, develop close and secure relationships, and explore their surroundings to learn. It is crucial for school readiness and lifelong success. Children with strong social and emotional health are better able to manage their feelings, interact positively with peers and adults, and engage in learning activities. Conversely, a lack of social and emotional health can lead to difficulties in forming friendships, managing behaviors, and succeeding in educational settings (Source: Unknown). 

It's important to foster this development from an early age to support children's overall well-being and learning capabilities.","It is the child's developing capacity to experience, regulate, and express emotions; form close, secure relationships; and explore the environment and learn.",1.0,0.9761904761742063,1.0,0.964773417947549,0.5486444798032145
What is a 'Daily Health Check'?,"['168 | H e a l t h ,  S a f e t y ,  a n d  N u t r i t i o n  in  E a r l y  C h i l d h o o d  E d u c a t i o n  \n \n \nPause to Reflect \nWhat does staying healthy mean to you? What do you do (or could you do) to \nmanage your stress, reinforce your resilience, and keep yourself physically \nhealthy (nutrition, activity, etc.)? How could your employer help you stay \nhealthy? \n \nDaily Health Checks \nEvery day an informal, observation-based quick health check should be performed on every \nchild (before the parent/caregiver leaves). Early childhood educators should use their \nknowledge about what is normal for a child to identify any concerns about the child’s well-\nbeing (but not as an attempt to formally diagnose illness). It is not a process that formally', 'excludes children from illness, but following up concerns noticed at a health check may find \nreasons to exclude children.  \n \n“In a child care setting where lots of people are coming at the same time, it is hard to take a \nmoment with each child. However, this welcoming routine can establish many things and is a \ngood child development policy. This contact will help [teachers] better understand each child, \nhelp the children feel comfortable and good about themselves, reduce the spread of illness by \nexcluding children with obvious signs of illness, and foster better communications with \n[families].”11 \n \n \nFigure 7.4 – Teachers should do a health check when each child is dropped off.12 \n \nConducting the Daily Health Check', 'Conducting the Daily Health Check \nTeachers should use all of their senses to check for signs of illness. This includes: \n• Listening to what families tell you about how their child is feeling and what the child \nsounds like (hoarse voice, coughing, wheezing, etc.) \n• Looking at the child from head to toe (with a quick scan) to see if the child looks flushed, \npale, has a rash, has a runny nose or mucus in the eyes \n \n11 California Child Care Health Program. (2011). Health and Safety in the Child Care Setting: Prevention of Infectious \nDisease. University of California San Francisco. Retrieved from \nhttps://cchp.ucsf.edu/sites/g/files/tkssra181/f/idc2book.pdf \n12 Image by the California Department of Education is used with permission', ""103 | H e a l t h ,  S a f e t y ,  a n d  N u t r i t i o n  in  E a r l y  C h i l d h o o d  E d u c a t i o n  \n \nA monthly inspection would include: \n• checking for loose or missing hardware, checking  \n• inspecting equipment for broken parts, splinters, rust, or sharp edges, \n• replenishing loose fill surfacing if needed, and  \n• examining vegetation for hazardous or poisonous plants. \n \nThere has to be a system in place to conduct inspections and then respond in a timely manner \nwhen something is identified. It's too common for someone to notice a hazard but to forget to \nreport it or for somebody to report a hazard but then people forget to follow through to correct \nit. Many checklists include space for writing down a corrective action plan. Once the hazard is"", 'Feel free to share any health concerns that come to mind during this \ndiscussion.” \n136  |  2.8 Functional Health and Activities of Daily Living', '33. This work is a derivative of The Complete Subjective Health Assessment by Lapum, St-Amant, Hughes, \nPetrie, Morrell, and Mistry licensed under CC BY-SA 4.0 \n34. This work is a derivative of The Complete Subjective Health Assessment by Lapum, St-Amant, Hughes, \nPetrie, Morrell, and Mistry licensed under CC BY-SA 4.0 \n2.8 Functional Health and Activities of Daily Living  |  135', '189 | H e a l t h ,  S a f e t y ,  a n d  N u t r i t i o n  in  E a r l y  C h i l d h o o d  E d u c a t i o n  \n \nSummary \nBy keeping accurate records, conducting daily health checks, supporting children’s \ndevelopment of good dental hygiene, and by providing for individual children’s sleep needs \nearly care and education programs can help promote good health on a daily basis. When \nprograms monitor and screen children, they can ensure that conditions or situations that might \ninterfere with a child’s health or well-being can be identified and supports put in place to \nmitigate potential negative effects. \n \n \n \n \n \nResources for Further Exploration \n• Head Start’s Health Literacy: Tips for Health Managers:  \nhttps://eclkc.ohs.acf.hhs.gov/publication/health-literacy-tips-']","A 'Daily Health Check' is an informal, observation-based quick health assessment performed on every child in a childcare setting, typically conducted before the parent or caregiver leaves. Early childhood educators utilize their knowledge of what is normal for a child to identify any concerns regarding the child's well-being. This process is not intended to formally diagnose illness but to observe signs that may indicate health issues. The Daily Health Check involves using all senses to look for signs of illness, such as listening to what families report about their child's condition and visually inspecting the child for symptoms like flushed skin, rashes, or respiratory issues (e.g., coughing or wheezing) (Source: Unknown). 

This routine helps educators understand each child better, fosters a comfortable environment, reduces the spread of illness by potentially excluding children showing obvious signs of illness, and enhances communication with families (Source: Unknown).","A daily health check is an informal, observation-based assessment performed on every child upon arrival to identify concerns about well-being and determine if exclusion from care is necessary.",1.0,0.8928571428348213,1.0,0.9357422769914606,0.6940483904731154
What does 'Exclusion' mean in the context of child care health policies?,"['238 | H e a l t h ,  S a f e t y ,  a n d  N u t r i t i o n  in  E a r l y  C h i l d h o o d  E d u c a t i o n  \n \nThey can be readmitted when the health department official or that health care provider \ndecides that the risk of transmission is no longer present.29 \n \nWhat to do When a Child Requires Exclusion \nWhen a child becomes ill enough to be excluded, they should be immediately isolated from \nother children. Early care and education programs are required to be equipped to isolate and \ncare for any child who becomes ill during the day. The isolation area shall be located to afford \neasy supervision of children by center staff and equipped with a mat, cot, couch or bed for each \nill child (or a crib if caring for infants).', ""• Typhus Fever \n \nExclusion Policies \nMost children with mild illnesses can safely attend child care. “Many health policies concerning \nthe care of ill children [including exclusion policies] have been based upon common \nmisunderstandings about contagion, risks to ill children, and risks to other children and staff. \nCurrent research clearly shows that certain ill children do not pose a health threat. Also, the \nresearch shows that keeping certain other mildly ill children at home or isolated at the child \ncare setting will not prevent other children from becoming ill.”27 \n \nBut there are times when exclusion is the right answer. Licensing states that a child may be too \nsick to attend if: \n• The child does not feel well enough to participate comfortably in the program's \nactivities."", '240 | H e a l t h ,  S a f e t y ,  a n d  N u t r i t i o n  in  E a r l y  C h i l d h o o d  E d u c a t i o n  \n \nNow, come up with your own examples of a child that should be excluded \nfrom care and that should not automatically be excluded. \n \nCaring for Mildly Ill Children \nBecause young in early care and education programs have high incidence of illness and may \nhave conditions (such as eczema and asthmas), providers should be prepared to care for mildly \nill children, at least temporarily. And since we know that excluding most mildly ill children \ndoesn’t prevent the spread of illness and can have negative effects on families, programs \nshould consider whether they can care for children with mild symptoms (not meeting the', '468 | H e a l t h ,  S a f e t y ,  a n d  N u t r i t i o n  in  E a r l y  C h i l d h o o d  E d u c a t i o n  \n \nAppendix J: Exclusion Form \n \n \nChild’s Name:____________________________________ Date:__________________________ \n \n \nToday your child was observed to have the following signs or symptoms of illness: \n______________________________________________________________________________ \n______________________________________________________________________________ \n______________________________________________________________________________ \n______________________________________________________________________________ \n \nBased on our exclusion policy, your child is being excluded from care:        \uf07f yes     \uf07f no \n \n \nIf excluded, your child can return when:', '243 | H e a l t h ,  S a f e t y ,  a n d  N u t r i t i o n  in  E a r l y  C h i l d h o o d  E d u c a t i o n  \n \nCommunication with Families \nWhen children are excluded from care, it’s important to provide documentation for families of \nhow the child meets the guidelines in your exclusion policy and what needs to happen before \nthe child can return to care. See Appendix K for a possible form that programs could use.  \n \nPrograms are also required to inform families when children are exposed to a communicable \ndisease. See Appendix L for an example of a notice of exposure form you can provide to families \nso they know what signs of illness to watch for and to seek medical advice when necessary.37  \n \n \nPause to Reflect', 'exclusion policy). The California Childcare Health Program poses the following questions to \nconsider: \n• Are there sufficient staff (including volunteers) to provide minor modifications that a \nchild might need (such as quiet activities or extra fluids)?  \n• Are staff willing and able to care for the child’s symptoms (such as wiping a runny nose \nand checking a fever) without neglecting the care of other children in the group?  \n• Is there a space where the mildly ill child can rest if needed?  \n• Are families able or willing to pay extra for sick care if other resources are not available, \nso that you can hire extra staff as needed?  \n• Have families made alternative arrangements for someone to pick up and care for their \nill children if they cannot?”', 'medication, must be familiar with the licensing regulations they must follow. \n \nOpen communication with families is important when a child becomes ill or is potentially \nexposed to an illness. Helping families understand and follow policies regarding exclusion is \nvital to keeping everyone in the program as healthy as possible.  \n \n \n \n \n \n \n \n \n37 California Childcare Health Program. (2018). Preventive Health and Safety in the Child Care Setting: A Curriculum \nfor the Training of Child Care Providers (3rd ed.). University of California, San Francisco. Retrieved from \nhttps://cchp.ucsf.edu/sites/g/files/tkssra181/f/PHT-Handbook-Student-2018-FINAL.pdf']","In the context of child care health policies, 'exclusion' refers to the practice of temporarily removing a child from care due to illness. This is done to ensure the health and safety of both the ill child and other children in the program. A child may be excluded if they are too sick to participate comfortably in activities or if they pose a risk of transmitting illness to others. The decision to exclude a child is based on specific health policies and guidelines, and children can be readmitted once a health department official or healthcare provider determines that the risk of transmission is no longer present (Source: Unknown). 

It's important to communicate with families about the reasons for exclusion and what needs to happen before the child can return to care (Source: Unknown).","Exclusion refers to the policy of requiring a child to stay home or be isolated from the group because they are too sick to participate comfortably, require more care than staff can provide, or have a contagious condition that poses a risk to others.",1.0,0.9761904761742063,1.0,0.9978463102625905,0.3520177441268104
What are the proper steps for handwashing recommended by the CDC?,"['following steps. See Figure 4.413 for an image of a handwashing poster \ncreated by the World Health Organization. \n• Wet hands with warm or cold running water and apply facility-\napproved soap. \n• Lather hands by rubbing them together with the soap. Use the same \ntechnique as the handrub process to clean the palms and fingers, \nbetween the fingers, the backs of the hands and fingers, the \nfingertips, and the thumbs. \n• Scrub thoroughly for at least 20 seconds. \n• Rinse hands well under clean, running water. \n• Dry the hands using a clean towel or disposable toweling. \n• Use a clean paper towel to shut off the faucet.14 \n13. “How_To_HandWash_Poster.pdf” by World Health Organization is licensed under CC BY-NC-SA 3.0 IGO.', '◦ Palm to palm with fingers interlaced \n◦ Rotational rubbing of left and right thumbs \n◦ Rub your fingertips against the palm of your opposite hand \n◦ Rub wrists \n◦ Repeat sequence at least 2 times \n◦ Keep fingertips pointing downward throughout \n5. Clean under your fingernails with disposable nail cleaner (if \napplicable). \n6. Wash for a minimum of 20 seconds. \n7. Keep your hands and forearms lower than your elbows during the \nentire washing. \n8. Rinse your hands with water, keeping your fingertips pointing down \n4.5 Checklist for Hand Hygiene With Soap and Water  |  235', '4.5 Checklist for Hand Hygiene With Soap and Water \nUse the checklist below to review the steps for completion of “Hand \nHygiene With Soap and Water.” \nSteps \nDisclaimer: Always review and follow agency policy regarding this \nspecific skill. \n1. Remove jewelry according to agency policy; push your sleeves above \nyour wrists. \n2. Turn on the water and adjust the flow so that the water is warm. Wet \nyour hands thoroughly, keeping your hands and forearms lower than \nyour elbows. Avoid splashing water on your uniform. \n3. Apply a palm-sized amount of hand soap. \n4. Perform hand hygiene using plenty of lather and friction for at least 15 \nseconds: \n◦ Rub hands palm to palm \n◦ Back of right and left hand (fingers interlaced) \n◦ Palm to palm with fingers interlaced', '4. “Rinse your hands well under running water.”  \n5. “Dry your hands using a clean towel or air dry them.” \n \n \nFigure 8.10 – Illustrations of the 5 steps of handwashing.23 \n \nInfants and young children will need help with handwashing. Caring for Our Children \nrecommends that caregivers:  \n• Safely cradle an infant in one arm to wash their hands at a sink.  \n• Provide assistance with handwashing for young children that cannot yet wash their \nhands independently. \n• Offer a stepping stool to young children so they may safely reach the sink.24 \n \nWearing Disposable Gloves \nTeachers and caregivers should wear gloves when they anticipate coming into contact with any \nof the following (on a child’s body or a contaminated surface) \n• Blood or bodily substances (i.e., fluids or solids)', '7. Keep your hands and forearms lower than your elbows during the \nentire washing. \n8. Rinse your hands with water, keeping your fingertips pointing \ndown so water runs off your fingertips. Do not shake water from \nyour hands. \n9. Do not lean against the sink or touch the inside of the sink during \nthe hand-washing process. \n10. Dry your hands thoroughly from your fingers to wrists with a \npaper towel or air dryer. \n11. Dispose of the paper towel(s). \n12. Use a new paper towel to turn off the water. \n13. Dispose of the paper towel. \nCHECKLIST FOR USING HAND SANITIZER \n1. Use the checklist below to review the steps for completion of “Hand \nHygiene With Alcohol-Based Hand Sanitizer.” \nSteps \nDisclaimer: Always review and follow agency policy regarding this \nspecific skill.', 'Figure 4.2 Five Moments of Hand Hygiene Expanded \nWhen performing hand hygiene, washing with soap and water, or an \napproved alcohol-based hand rub solution that contains at least 60% \nalcohol, may be used. Unless hands are visibly soiled, an alcohol-based \nhand rub is preferred over soap and water in most clinical situations due \nto evidence of improved compliance. Handrubs are also preferred because \nthey are generally less irritating to health care worker’s hands. However, it \nis important to recognize that alcohol-based rubs do not eliminate some \ntypes of germs, such as Clostridium difficile (C-diff). \nWhen using the alcohol-based handrub method, the CDC recommends \nthe following steps. See Figure 4.311\n for a handrub poster created by the \nWorld Health Organization.', 'Figure 4.3 WHO Handrub Poster \nWhen washing with soap and water, the CDC recommends using the \n4.2 Aseptic Technique Basic Concepts  |  195']","The proper steps for handwashing recommended by the CDC, as outlined in the provided context, are as follows:

1. **Remove jewelry** according to agency policy and push your sleeves above your wrists.
2. **Turn on the water** and adjust the flow so that the water is warm. Wet your hands thoroughly, keeping your hands and forearms lower than your elbows to avoid splashing.
3. **Apply a palm-sized amount of hand soap.**
4. **Lather and scrub your hands** using plenty of lather and friction for at least 20 seconds. This includes:
   - Rubbing hands palm to palm
   - Rubbing the back of each hand with fingers interlaced
   - Palm to palm with fingers interlaced
   - Rotational rubbing of left and right thumbs
   - Rubbing fingertips against the palm of the opposite hand
   - Rubbing wrists
5. **Rinse your hands well** under clean, running water, keeping your fingertips pointing downward so that water runs off your fingertips.
6. **Dry your hands** thoroughly using a clean towel or air dryer.
7. **Use a clean paper towel** to turn off the faucet and dispose of the towel properly.

These steps ensure effective hand hygiene to reduce the spread of germs (Source: Unknown). 

Always remember to consult a healthcare provider for any specific medical advice or concerns.","1. Wet hands with clean running water and apply soap. 2. Rub hands to lather and scrub well (backs, between fingers, under nails). 3. Scrub for at least 20 seconds. 4. Rinse well under running water. 5. Dry using a clean towel or air dry.",1.0,0.9999999999,0.8235294117647058,0.9999999999999997,0.8158135206164251
What is the procedure for removing soiled gloves to prevent contamination?,"['Figure 4.6 Proper Removal of Gloves to Prevent Contamination \n202  |  4.2 Aseptic Technique Basic Concepts', 'glove. \n4. Dispose of contaminated wastes appropriately. \n5. Perform hand hygiene. \n4.8 Checklist for Applying and Removing Sterile Gloves  |  241', '208 | H e a l t h ,  S a f e t y ,  a n d  N u t r i t i o n  in  E a r l y  C h i l d h o o d  E d u c a t i o n  \n \n3. Slide fingers of the ungloved hand under the remaining glove at the wrist and peel off \nthe second glove over the first glove.  \n4. Discard the gloves in a waste container.26 \n \n \nFigure 8.11 – Safe glove removal.27 \n \nAfter you remove your gloves you should wash your hands. “Do not reuse the gloves: this can \nspread germs from one child to another…Gloves provide added protection from communicable \ndisease only if used correctly. If you use gloves incorrectly, you actually risk spreading more \ngerms than if you don’t use gloves at all. Pay attention to your gloving technique so that you do', 'contaminated glove with your gloved hand, wrapping the \ncontaminated glove in the palm of your gloved hand. Take off the \nglove with your bare hand to the skin of your wrist, moving inside \nof the glove to remove the contaminated glove inside out over the \nother glove. Note: If the gown is tied in front, untie it prior to \nremoving your glove. \n◦ 2nd REMOVE GOWN: Untie all ties (or unsnap all buttons). Some \ngown ties can be broken rather than untied. Do so in a gentle \nmanner, avoiding a forceful movement. Reach up to the shoulders \nand carefully pull the gown down and away from the body. Rolling \nthe gown down is an acceptable approach. Dispose in trash \nreceptacle. \n◦ 3rd PERFORM HAND HYGIENE. \n◦ 4th REMOVE FACE SHIELD or GOGGLES: Carefully remove face', 'with isolation gowns because they will cover the gown cuff and provide a \nmore reliable continuous barrier for the arms, wrists, and hands. \nGloves should be removed properly to prevent contamination. See Figure \n4.619\n for an illustration of properly removing gloves. Hand hygiene should \nbe performed following glove removal to ensure the hands will not carry \npotentially infectious material that might have penetrated through \nunrecognized tears or contaminated the hands during glove removal. One \nmethod for properly removing gloves includes the following steps: \n• Grasp the outside of one glove near the wrist. Do not touch your skin. \n• Peel the glove away from your body, pulling it inside out. \n• Hold the removed glove in your gloved hand.', 'dominant hand to pull the second sterile glove over the fingers of the \nnondominant hand. \n12. After the second sterile glove is on, interlock the fingers of your sterile \ngloved hands, being careful to keep your hands above your waist. \n13. Do not touch the inside of the package or the sterile part of the gloves \nwith your bare hands during the process. \n14. Maintain sterility throughout the procedure of donning sterile gloves. \nRemoving Sterile Gloves \n1. Grasp the outside of one cuff with the other gloved hand. Avoid \ntouching your skin. \n2. Pull the glove off, turning it inside out and gather it in the palm of the \ngloved hand. \n3. Tuck the index finger of your bare hand inside the remaining glove \ncuff and peel the glove off inside out and over the previously removed \nglove.', '• Put your fingers inside the glove at the top of your wrist and peel off \nthe second glove. \n• Turn the second glove inside out while pulling it away from your body, \nleaving the first glove inside the second. \n• Dispose of the gloves safely. Do not reuse. \n• Perform hand hygiene immediately after removing the gloves.20 \n19. “poster-how-to-remove-gloves.pdf” by Centers for Disease Control and Prevention is in the Public \nDomain. Access for free at https://www.cdc.gov/vhf/ebola/resources/posters.html \n20. Siegel, J. D., Rhinehart, E., Jackson, M., Chiarello, L., & Healthcare Infection Control Practices Advisory \nCommittee. (2019, July 22). 2007 guideline for isolation precautions: Preventing transmission of infectious']","The procedure for removing soiled gloves to prevent contamination involves the following steps:

1. Grasp the outside of one glove near the wrist with the other gloved hand, avoiding contact with your skin.
2. Peel the glove away from your body, turning it inside out as you remove it.
3. Hold the removed glove in the palm of your gloved hand.
4. With your bare hand, tuck your index finger inside the cuff of the remaining glove and peel it off inside out, over the first glove, so that the first glove is contained within the second.
5. Dispose of the gloves safely in a waste container.
6. Perform hand hygiene immediately after removing the gloves to ensure that any potential infectious material is removed from your hands.

It is important to not reuse gloves, as this can spread germs, and to pay attention to your gloving technique to avoid contamination (Source: Unknown). 

Always consult a healthcare provider for specific guidance and practices.",Grasp the palm of one gloved hand and peel it off; hold the removed glove in the gloved hand; slide ungloved fingers under the remaining glove at the wrist and peel it off over the first glove; discard in a waste container.,0.75,0.5628571428458856,0.9285714285714286,0.9814926193461034,0.9806589080680895
How should breastmilk be warmed for an infant?,"['breastmilk in the refrigerator or freezer until ready to use. Breastmilk that is not frozen, should \nbe disposed of if not eaten within 72 hours. \n \nThaw frozen breastmilk by running the container under cool water. Do not set breastmilk out to \nthaw at room temperature. Do not thaw breastmilk by heating on the stove or in a microwave.8 \nSee below for instructions on how to bottle feed an infant. \n \n \n7 Nellis Child Development Center II by Staff Sgt. Taylor Worley (USAF) is in the public domain \n8 Breastfed Babies Welcome Here! by the USDA Food and Nutrition Service is in the public domain', ""and infant to connect and build their relationship.10 \n \nBurp by placing the infant high over your shoulder or over your knee. You can also lean the \ninfant forward in a sitting position supported by your hands. Pat or rub the infant's back. This \nputs gentle pressure on the abdomen to push extra air from the stomach.11  \n \nUneaten breastmilk or formula should be discarded after a feeding as bacteria from the infant’s \nmouth may have made it into the bottle. \n \n \n10 Image by Ben Kerckx on Pixabay \n11 Breastfed Babies Welcome Here! by the USDA Food and Nutrition Service is in the public domain"", 'mouth and throat. These hot spots may stay even if you shake the bottle. And heating also \ndestroys most of the natural substances in breastmilk. \n \nDouble-check the labels on bottles before feeding to ensure the infant is getting the correct \nbreastmilk or formula. Always hold the infant when bottle feeding. Try different positions for \ninfants who do not want to take their bottles. Some infants are happier if you feed them in the \nusual cradle position. Others prefer a different position. Do not prop up a bottle to feed an \ninfant or put an infant in a crib with a bottle. Bottle propping could cause the infant to choke, \ntooth decay, and ear infections. \n \n \nFigure 14.2 – Not only is holding an infant during bottle feeding safest, but it is also an important time for caregiver', ""366 | H e a l t h ,  S a f e t y ,  a n d  N u t r i t i o n  in  E a r l y  C h i l d h o o d  E d u c a t i o n  \n \nBottle Feeding (Both Expressed Breastmilk and Formula) \nAlways wash your hands before handling bottles or feeding the infant. Use only clean bottles, \nnipples, and cups. For infants that do not crawl, bottles and nipples should be sterilized. If you \nneed to reuse them, sterilize by boiling in water for 5 minutes or by washing in a dishwasher. \n \nWarm breastmilk and formula by placing the bottle in a pan of warm water or by holding it \nunder warm running water for a few minutes. Do not warm breastmilk or formula on the stove \nor in a microwave. Microwave heating causes hot spots in the milk that can burn the infant's"", ""Expressed breastmilk needs to be stored and handled safely to keep it from spoiling. Remind \nmothers to label, date, and chill or refrigerate their breastmilk right after they express it. Ask \nmothers to bring the milk in hard plastic bottles. \n \nAsk mothers to bring in enough breastmilk to feed the infant each day. Be sure that each bottle \nor other container of breastmilk is labeled with the infant's name and the date the milk was \nexpressed. Bottles should have just the amount both you and the mother think the infant will \ntake at each feeding. This amount will be about 2 to 4 ounces of breastmilk for the younger \ninfant. As the infant gets older, the mother can put more breastmilk in each bottle. Keep"", 'two to three days after birth, human milk contains colostrum, a thick \nyellowish-white fluid rich in proteins and immunoglobulin A (IgA). Colostrum \nis lower in carbohydrates and fat than mature breast milk. Colostrum helps \nprotect the newborn from infection and builds normal intestinal bacteria. As \nbreast milk matures after two to three days postpartum, it becomes lower in \nproteins and IgA and higher in carbohydrates and fat.11\n Human donor milk \nmay be used in some situations when the mother cannot breastfeed. If \nhuman donor milk is given, it should be sourced through an accredited \nhuman milk bank and pasteurized to minimize risk of spreading infectious \ndiseases. \nThere are many reasons infants may not be breastfed, including insufficient', ""364 | H e a l t h ,  S a f e t y ,  a n d  N u t r i t i o n  in  E a r l y  C h i l d h o o d  E d u c a t i o n  \n \n \nFigure 14.1 – This child care center provides mothers a space to breastfeed.7 \n \nFeeding with Breastmilk in Early Care and Education Programs \nMothers may choose to have their breastfed infants fed in one of several ways when the infant \nis in child care including:  \n1. mother uses her breaks to come to the child care site at feeding times to nurse her \ninfant;  \n2. child care provider gives the infant the breastmilk that the mother has expressed on a \nprevious day. \n \nFollow the feeding method that the mother chooses. Feeding advice such as the use of infant \nformula should come from the infant's doctor or clinic.""]","Breastmilk should be warmed by placing the bottle in a pan of warm water or by holding it under warm running water for a few minutes. It is important not to warm breastmilk on the stove or in a microwave, as microwave heating can create hot spots in the milk that may burn the infant's mouth and throat (Source: Unknown). 

Always remember to consult a healthcare provider for personalized advice regarding feeding practices.",Breastmilk should be warmed by placing the bottle in a pan of warm water or holding it under warm running water. It should never be warmed in a microwave or on a stove.,1.0,0.7499999999625,0.8571428571428571,0.9615120621553016,0.9328622987425422
What is the correct compression-to-breath ratio for infant CPR?,"[""7. If the infant is not breathing: \n• Cover the infant's mouth and nose tightly with your mouth. \n• Alternatively, cover just the nose. Hold the mouth shut. \n• Keep the chin lifted and head tilted. \n• Give 2 breaths. Each breath should take about a second and make the chest rise. \n8. Continue CPR (30 chest compressions followed by 2 breaths, then repeat) for about 2 \nminutes. \n \n36 Choking first aid-infant under 1 year-Part 1 by NIH is in the public domain. \n37 CPR-infant series-Chest compressions by NIH is in the public domain."", '128 | H e a l t h ,  S a f e t y ,  a n d  N u t r i t i o n  in  E a r l y  C h i l d h o o d  E d u c a t i o n  \n \n9. After about 2 minutes of CPR, if the infant still does not have normal breathing, \ncoughing, or any movement, leave the infant to call 911. \n10. Repeat rescue breathing and chest compressions until the infant recovers or help \narrives. \n \nIf the infant starts breathing again, place them in the recovery position (see Figure 5.12). \nPeriodically re-check for breathing until help arrives.38 \n \n \nFigure 5.6 – Check for breathing.39 \n \nFigure 5.7 – Position for compressions40 \n \nFigure 5.8 – Position for giving rescue breaths.41 \n \n \n38 CPR-infant series-Infant not breathing by NIH is in the public domain.', '• Keep your other hand on the infant\'s forehead, keeping the head tilted back. \n• Press down on the infant\'s chest so that it compresses about 1/3 to 1/2 the \ndepth of the chest. \n• Give 30 chest compressions. Each time, let the chest rise completely. These \ncompressions should be FAST and hard with no pausing. Count the 30 \ncompressions quickly: ""1, 2, 3, 4, 5, 6, 7, 8, 9, 10, 11, 12, 13, 14, 15, 16, 17, 18, \n19, 20, 21, 22, 23, 24, 25, 26, 27, 28, 29, 30, off.""37 \n5. Open the airway. Lift up the chin with one hand. At the same time, push down on the \nforehead with the other hand. \n6. Look, listen, and feel for breathing. Place your ear close to the infant’s mouth and nose. \nWatch for chest movement. Feel for breath on your cheek. \n7. If the infant is not breathing:', ""130 | H e a l t h ,  S a f e t y ,  a n d  N u t r i t i o n  in  E a r l y  C h i l d h o o d  E d u c a t i o n  \n \n \nFigure 5.9 – Check for breathing45 \n \n \nFigure 5.10 – Position for compressions46 \n \n \nFigure 5.11 – Position for giving rescue breaths.47 \n \n \nFigure 5.12 Recovery position: The mouth is downward so that fluid can drain from the child's airway; the  \nchin is well up to keep the airway open. Arms and legs are locked to stabilize the position of the child.48 \n \n45 CPR-Child 1 to 8 years old series-Check for responsiveness by NIH is in the public domain. \n46 CPR-Child 1 to 8 years old series-Chest compressions by NIH is in the public domain. \n47 CPR-Child 1 to 8 years old series-Child not breathing by NIH is in the public domain."", 'Figure 11.17 Bag Valve Mask \nWhen using a bag mask valve, the rescuer manually compresses the bag \nto force air into the lungs. Squeezing the bag once every 5 to 6 seconds for \nan adult or once every 3 seconds for an infant or child provides an \nadequate respiratory rate. In inpatient settings, the bag mask valve is \nattached to an oxygen supply to increase the concentration of \noxygenation provided with each breath. See Figure 11.1820\n for an illustration \nof operating a bag valve mask. \nIt is vital to obtain a tight seal of the mask to the patient’s face, but this is \ndifficult for a single rescuer to achieve. Therefore, two rescuers are \nrecommended; one rescuer performs a jaw thrust maneuver, secures the \nmask to the patient’s face with both hands, and focuses on maintaining a', ""consciousness at any point start CPR (which is covered in the next section). \n \nResponding to a Choking Infant (under 1 year of age) \n1. Lay the infant face down, along your forearm. Use your thigh or lap for support. Hold \nthe infant's chest in your hand and jaw with your fingers. Point the infant's head \ndownward, lower than the body. \n2. Give up to 5 quick, forceful blows between the infant's shoulder blades. Use the heel of \nyour free hand.29 \n3. If the object is not dislodged, turn the infant face up. Use your thigh or lap for support. \nSupport the head. \n4. Place 2 fingers on the middle of his breastbone just below the nipples. \n5. Give up to 5 quick thrusts down, compressing the chest 1/3 to 1/2 the depth of the \nchest."", 'available, use it now. \n10. Repeat rescue breathing and chest compressions until the child recovers or help arrives. \n11. If the child starts breathing again, place them in the recovery position (See Figure 5.9). \nPeriodically re-check for breathing until help arrives. 44 \n \n \n \n42 CPR-Child 1 to 8 years old series-Check for responsiveness by NIH is in the public domain.  \n43 CPR-Child 1 to 8 years old series-Chest compressions by NIH is in the public domain.  \n44 CPR-Child 1 to 8 years old series-Child not breathing by NIH is in the public domain.']","The correct compression-to-breath ratio for infant CPR is 30 chest compressions followed by 2 breaths. This cycle should be repeated continuously for about 2 minutes or until help arrives or the infant recovers (Source: Unknown). 

It's important to remember that if the infant is not breathing, you should also check for any signs of movement or coughing after 2 minutes of CPR before calling for emergency help. Always consult a healthcare provider for professional advice and guidance.",The ratio is 30 chest compressions followed by 2 rescue breaths.,1.0,0.9999999999,0.8571428571428571,1.0000000000000002,0.41398925121312086
How should a caregiver respond to a choking infant under 1 year of age?,"[""consciousness at any point start CPR (which is covered in the next section). \n \nResponding to a Choking Infant (under 1 year of age) \n1. Lay the infant face down, along your forearm. Use your thigh or lap for support. Hold \nthe infant's chest in your hand and jaw with your fingers. Point the infant's head \ndownward, lower than the body. \n2. Give up to 5 quick, forceful blows between the infant's shoulder blades. Use the heel of \nyour free hand.29 \n3. If the object is not dislodged, turn the infant face up. Use your thigh or lap for support. \nSupport the head. \n4. Place 2 fingers on the middle of his breastbone just below the nipples. \n5. Give up to 5 quick thrusts down, compressing the chest 1/3 to 1/2 the depth of the \nchest."", ""7. If the infant is not breathing: \n• Cover the infant's mouth and nose tightly with your mouth. \n• Alternatively, cover just the nose. Hold the mouth shut. \n• Keep the chin lifted and head tilted. \n• Give 2 breaths. Each breath should take about a second and make the chest rise. \n8. Continue CPR (30 chest compressions followed by 2 breaths, then repeat) for about 2 \nminutes. \n \n36 Choking first aid-infant under 1 year-Part 1 by NIH is in the public domain. \n37 CPR-infant series-Chest compressions by NIH is in the public domain."", ""Therefore, you must continue CPR until the child's heartbeat and breathing return, or trained \nmedical help arrives. \n \n \n35 Choking first aid-infant under 1 year-Part 5 by NIH is in the public domain."", 'dislodged and the child breathes or coughs on their own.34 \n \n31 Choking first aid-infant under 1 year-Part 1 by NIH is in the public domain. \n32 Choking first aid-infant under 1 year-Part 2 by NIH is in the public domain. \n33 Choking first aid-infant under 1 year-Part 4 by NIH is in the public domain. \n34 Choking first aid-infant under 1 year-Part 5 by NIH is in the public domain.', '124 | H e a l t h ,  S a f e t y ,  a n d  N u t r i t i o n  in  E a r l y  C h i l d h o o d  E d u c a t i o n  \n \n \nFigure 5.2 – Apply direct pressure on external wounds with a sterile \n cloth or your gloved hand,  maintaining pressure until bleeding stops.27 \n \nResponding to Choking \nIf a child is not able to breathe, not able to cry, talk, or make noise, turning blue, or grabbing at \ntheir throat, or coughing and gagging the early childhood educator should call 911. If they are \nable to cough or gag (which indicates they are breathing), no further response is needed. If they \nare not breathing, an immediate response is important.28 The response to choking is called the \nHeimlich maneuver and varies based on the age of the person that is choking. If the child loses', ""125 | H e a l t h ,  S a f e t y ,  a n d  N u t r i t i o n  in  E a r l y  C h i l d h o o d  E d u c a t i o n  \n \n \nFigure 5.4 Positioning for back blows31 \n \n \nFigure 5.5 Positioning for chest thrusts32 \n \nResponding to a Choking in a Child (over 1 year of age) \n1. Lean the child forward and make 5 blows to their back with the heel of your hand. \n2. If this does not work, stand behind the child and wrap your arms around the child's \nwaist. \n3. Make a fist with one hand. Place the thumb side of your fist just above the child's navel, \nwell below the breastbone.33 \n4. Grasp the fist with your hand. \n5. Make 5 quick, upward and inward thrusts with your fists. \n6. Alternate between 5 blows to the back and 5 thrusts to the abdomen until the object is"", '4. Perform chest compressions: \n• Place the heel of one hand on the breastbone -- just below the nipples. Make \nsure your heel is not at the very end of the breastbone. \n• Keep your other hand on the child\'s forehead, keeping the head tilted back. \n• Press down on the child\'s chest so that it compresses about 1/3 to 1/2 the depth \nof the chest. \n• Give 30 chest compressions. Each time, let the chest rise completely. These \ncompressions should be FAST and hard with no pausing. Count the 30 \ncompressions quickly:""1, 2, 3, 4, 5, 6, 7, 8, 9, 10, 11, 12, 13, 14, 15, 16, 17, 18, 19, \n20, 21, 22, 23, 24, 25, 26, 27, 28, 29, 30, off.""43 \n5. Open the airway. Lift up the chin with one hand. At the same time, push down on the \nforehead with the other hand.']","To respond to a choking infant under 1 year of age, a caregiver should follow these steps:

1. **Position the Infant**: Lay the infant face down along your forearm, using your thigh or lap for support. Hold the infant's chest in your hand and the jaw with your fingers, ensuring the infant's head is lower than their body.

2. **Back Blows**: Give up to 5 quick, forceful blows between the infant's shoulder blades using the heel of your free hand.

3. **Chest Thrusts**: If the object is not dislodged, turn the infant face up while still supporting them. Place 2 fingers on the middle of the breastbone just below the nipples and give up to 5 quick thrusts down, compressing the chest about 1/3 to 1/2 the depth of the chest.

4. **Check for Breathing**: If the infant is not breathing, cover their mouth and nose tightly with your mouth (or just cover the nose while holding the mouth shut), keep the chin lifted and head tilted, and give 2 breaths. Each breath should take about a second and should make the chest rise.

5. **Continue CPR**: If the infant does not start breathing, continue CPR by performing 30 chest compressions followed by 2 breaths, and repeat this cycle for about 2 minutes until the infant breathes or coughs on their own, or until trained medical help arrives.

It is crucial to act quickly and call for emergency help if the infant is unable to breathe, cry, talk, or is turning blue (Source: Unknown). 

Always remember that this information is not a substitute for professional medical advice, and it's important to consult a healthcare provider for any medical emergencies.","Place the infant face down on the forearm, supporting the head. Give 5 back blows between the shoulder blades. Turn the infant face up and give 5 chest thrusts with two fingers on the breastbone. Repeat until the object is dislodged.",1.0,0.9999999999,0.8695652173913043,0.9827863647176235,0.5045278330500276
What are the steps for disinfecting a diaper changing area?,"[""Step 6: Wash the child's hands and return the child to a supervised area. \nStep 7: Clean and disinfect the diaper-changing surface and any equipment or supplies \nthat were touched (and any other area child soiled before changed). \nStep 8: Perform hand hygiene and record the diaper change, diaper contents, and/or \nany problems. \n \nCaregivers/teachers should never leave a child unattended on a table or countertop. A safety \nstrap or harness should not be used on the diaper changing table/surface.36 \n \n \nIf Using Potty Chairs \nDue to being hard to clean and disinfect, potty chairs are not ideal in a \nchild care environment. If they are used, they should be used in the \nbathroom only. After each use: \n• Empty contents immediately into the toilet"", ""Step 2: Carry/bring the child to the changing table/surface, keeping soiled clothing away \nfrom you and any surfaces you cannot easily clean and sanitize after the change. Always \nkeep a hand on the child. \nStep 3: Remove the soiled diaper and clothing without contaminating any surface not \nalready in contact with stool or urine. Put soiled diaper in covered waste container. Put \nany soiled clothing in a plastic bag that is securely closed to give to family. \nStep 4: Clean the child's diaper area with disposable wipes and place soiled wipes into a \ncovered waste container.  \nStep 5: Removed the disposable liner and gloves and place in waste container \nStep 6: Use facial tissue to apply any creams or ointments. Slide clean diaper under the \nchild and fasten it and dress the child."", '211 | H e a l t h ,  S a f e t y ,  a n d  N u t r i t i o n  in  E a r l y  C h i l d h o o d  E d u c a t i o n  \n \nDiaper Changing \nDiaper changing areas should be smooth and nonporous (such as a plastic-covered pad), have a \nraised edge to prevent children from falling, be near a sink, be out of reach from children, and \naway from food preparation areas.35 \n \nThe following diaper changing procedure should be posted in the changing area and followed to \nprotect the health and safety of children and staff: \nStep 1: Before bringing the child to the diaper changing area, perform hand hygiene \n(including putting on gloves, if using) and bring supplies to the diaper changing area, and \nplace a disposable liner on the changing area.', '• Rinse with water and dump water into the toilet \n• Wash with soap and water (with a paper towel) and empty \nsoapy water into the toilet \n• Rinse again and empty into the toilet \n \n35 California Child Care Health Program. (2011). Health and Safety in the Child Care Setting: Prevention of Infectious \nDisease. University of California San Francisco. Retrieved from \nhttps://cchp.ucsf.edu/sites/g/files/tkssra181/f/idc2book.pdf \n36 Diaper Changing Procedure by Head Start Early Childhood Learning & Knowledge Center is in the public domain', 'Toilet seats, handles, door knobs or \nhandles in toileting area, floors X X Daily and immediately is soiled \nToilet bowls X X Daily \nChanging tables X X After each child’s use \nPotty chairs (discouraged in child \ncare because of contamination risks) X X After each child’s use \nAny surface contaminated with \nbodily fluids (saliva, mucus, vomit, \nurine, stool, or blood) \nX X Immediately \nWater containers X X Daily \n \nDisposal of Waste \nProper disposal and storage of garbage waste prevent the spread of disease, odors, and \nproblems with pests. Disposable items (diapers, gloves, paper towels, and facial tissues) should \nbe thrown away immediately in an appropriate container. Make sure the container is water and', '101438.1 INFANT CARE GENERAL SANITATION \n✓ All items used by pets and animals shall be kept out of the reach of \ninfants. \n✓ Each caregiver shall wash his/her hands with soap and water before \nfeeding and after each diaper change. \n✓ Areas that infants have access to shall be washed, cleared and \nsanitized as follows: floors shall be vacuumed or swept and mopped \ndaily and as often as necessary. Carpeted floors shall be vacuumed \ndaily and cleaned at least every 6 months. Walls shall be washed \nwith disinfecting solution at least weekly. \n✓ The diaper changing area shall be disinfected including walls and \nfloors. After each diaper change, counter tops, sinks, drawers and \ncabinets near diaper changing area shall be washed.', '441 | H e a l t h ,  S a f e t y ,  a n d  N u t r i t i o n  in  E a r l y  C h i l d h o o d  E d u c a t i o n  \n \n◼ Each caregiver shall wash his/her hands with soap and water before feeding and after \neach diaper change. \n◼ Areas that infants have access to shall be washed, cleared and sanitized as follows: floors \nshall be vacuumed or swept and mopped daily and as often as necessary. Carpeted \nfloors shall be vacuumed daily and cleaned at least every 6 months. Walls shall be \nwashed with disinfecting solution at least weekly. \n◼ The diaper changing area shall be disinfected including walls and floors. After each \ndiaper change, counter tops, sinks, drawers and cabinets near diaper changing area shall \nbe washed.']","The steps for disinfecting a diaper changing area, based on the provided context, are as follows:

1. **After each diaper change**, clean and disinfect the diaper-changing surface and any equipment or supplies that were touched, as well as any other area the child soiled before the change (Step 7).
2. **Wash the hands** of the caregiver with soap and water after each diaper change (as emphasized in multiple sections).
3. **Disinfect the diaper changing area**, including walls and floors, as part of the routine cleaning (as mentioned in the general sanitation guidelines).
4. **Ensure that surfaces are smooth and nonporous**, and that the area is kept out of reach from children and away from food preparation areas (as described in the diaper changing area requirements).

It's important to follow these steps to maintain a safe and hygienic environment for children. Always consult a healthcare provider for specific health-related concerns.","The area must be cleaned and then disinfected after each use. This typically involves using a bleach and water solution (or approved disinfectant), wetting the surface, and allowing it to air dry.",0.5,0.6178571428416965,0.8181818181818182,0.9999999999999997,0.5702758597893449
What immediate action should be taken for a tooth knocked out of a young child's mouth?,"['120 | H e a l t h ,  S a f e t y ,  a n d  N u t r i t i o n  in  E a r l y  C h i l d h o o d  E d u c a t i o n  \n \nInjuries to the Mouth \nInjuries to the head, face, and mouth are common in young children. Even when families do \ntheir best to keep children safe, oral injuries can happen. Most oral injuries happen when young \nchildren are learning to walk. The top front teeth are injured most often. \n \nIf the child’s tongue or lip is injured, the area should be cleaned. Ice wrapped in a clean cloth \ncan be placed on the area to reduce swelling. If the bleeding doesn’t stop after 30 minutes, \nmedical attention should be sought. \n \nIf a child has an injury to a tooth, families should contact a dentist for advice. Teeth that are \nknocked out should not be put back in the mouth.12', ""consciousness at any point start CPR (which is covered in the next section). \n \nResponding to a Choking Infant (under 1 year of age) \n1. Lay the infant face down, along your forearm. Use your thigh or lap for support. Hold \nthe infant's chest in your hand and jaw with your fingers. Point the infant's head \ndownward, lower than the body. \n2. Give up to 5 quick, forceful blows between the infant's shoulder blades. Use the heel of \nyour free hand.29 \n3. If the object is not dislodged, turn the infant face up. Use your thigh or lap for support. \nSupport the head. \n4. Place 2 fingers on the middle of his breastbone just below the nipples. \n5. Give up to 5 quick thrusts down, compressing the chest 1/3 to 1/2 the depth of the \nchest."", '124 | H e a l t h ,  S a f e t y ,  a n d  N u t r i t i o n  in  E a r l y  C h i l d h o o d  E d u c a t i o n  \n \n \nFigure 5.2 – Apply direct pressure on external wounds with a sterile \n cloth or your gloved hand,  maintaining pressure until bleeding stops.27 \n \nResponding to Choking \nIf a child is not able to breathe, not able to cry, talk, or make noise, turning blue, or grabbing at \ntheir throat, or coughing and gagging the early childhood educator should call 911. If they are \nable to cough or gag (which indicates they are breathing), no further response is needed. If they \nare not breathing, an immediate response is important.28 The response to choking is called the \nHeimlich maneuver and varies based on the age of the person that is choking. If the child loses', '4. Perform chest compressions: \n• Place the heel of one hand on the breastbone -- just below the nipples. Make \nsure your heel is not at the very end of the breastbone. \n• Keep your other hand on the child\'s forehead, keeping the head tilted back. \n• Press down on the child\'s chest so that it compresses about 1/3 to 1/2 the depth \nof the chest. \n• Give 30 chest compressions. Each time, let the chest rise completely. These \ncompressions should be FAST and hard with no pausing. Count the 30 \ncompressions quickly:""1, 2, 3, 4, 5, 6, 7, 8, 9, 10, 11, 12, 13, 14, 15, 16, 17, 18, 19, \n20, 21, 22, 23, 24, 25, 26, 27, 28, 29, 30, off.""43 \n5. Open the airway. Lift up the chin with one hand. At the same time, push down on the \nforehead with the other hand.', 'child need from a caring adult to feel emotionally safe? \n \nPoisoning \nIf a child ingests a potentially poisonous substance, Poison Control should be contacted at 1-\n800-222-1222. They will advise about the effects of the substance that has been ingested and \nwhat the proper response should be. \n \nBites \nHow you will respond to bites depends on what bit (or stung) the child and how severe the \ninjury is. Table 5.1 provides more information. \n \n12 Giving First Aid for Your Child’s Oral Injuries by the Office of Head Start is in the public domain.   \n13 Tellado, M.P. (2019). Nose Bleeds. Retrieved from https://kidshealth.org/en/parents/nose-\nbleed.html?WT.ac=ctg#catemergencies', ""forehead with the other hand. \n6. Look, listen, and feel for breathing. Place your ear close to the child's mouth and nose. \nWatch for chest movement. Feel for breath on your cheek. \n7. If the child is not breathing: \n• Cover the child's mouth tightly with your mouth. \n• Pinch the nose closed. \n• Keep the chin lifted and head tilted. \n• Give two breaths. Each breath should take about a second and make the chest \nrise. \n8. Continue CPR (30 chest compressions followed by 2 breaths, then repeat) for about 2 \nminutes. \n9. After about 2 minutes of CPR, if the child still does not have normal breathing, coughing, \nor any movement, leave the child if you are alone and call 911. If an AED for children is \navailable, use it now."", 'dislodged and the child breathes or coughs on their own.34 \n \n31 Choking first aid-infant under 1 year-Part 1 by NIH is in the public domain. \n32 Choking first aid-infant under 1 year-Part 2 by NIH is in the public domain. \n33 Choking first aid-infant under 1 year-Part 4 by NIH is in the public domain. \n34 Choking first aid-infant under 1 year-Part 5 by NIH is in the public domain.']","If a young child has a tooth knocked out, families should contact a dentist for advice. It is important not to put the knocked-out tooth back in the mouth (Source: Unknown).","The family should contact a dentist immediately. Unlike permanent teeth in adults, baby teeth should generally not be put back into the mouth.",1.0,0.9999999999,1.0,0.954961039551828,0.8266826628103972
"What is the 'Drop, Cover, and Hold On' procedure used for?","['Figure 5.19 – Drop, Cover, and Hold graphic.61 \n \nIf an earthquake occurs inside, everyone should drop, cover, and hold on \nuntil the shaking stops. Teachers should then check everyone for injuries \nand look for things that may have fallen or broken that may now be a \nhazard (including fire). If evacuation is necessary, everyone should use \nstairs. \n \nIf an earthquake occurs when people are outdoors, they should stay \noutside, moving away from buildings, trees, streetlights and overhead lines, \ncrouching down and covering their heads. Many injuries occur within ten \nfeet of the entrance to buildings. Bricks, roofing and other materials can fall \nfrom buildings, injuring persons nearby. Trees, streetlights and overhead \nlines may also fall, causing damage or injury.62 \n \nFire Response', '140 | H e a l t h ,  S a f e t y ,  a n d  N u t r i t i o n  in  E a r l y  C h i l d h o o d  E d u c a t i o n  \n \n \nResponding to Fires and Earthquakes \nEarthquake Response – Drop, Cover, and Hold On \nIn order to be prepared to respond when there is an earthquake, teachers \nshould identify safe places. A safe place could be under a sturdy table or \ndesk or against an interior wall away from windows, bookcases or tall \nfurniture that could fall on teachers and children. The shorter the distance \nto move to safety, the less likely that someone will be injured. \n \nEveryone should practice drop, cover, and hold on. Have children go under \na table (or desk if school-age) and hold on to one leg of the table or desk. \nHave them protect their eyes by keeping their head down.', 'Sometimes the activate step is also stated as “Alarm.” \n• Confine: Confine the fire by closing doors and windows. This includes \nclosing fire doors to help prevent the fire from breaching one fire zone \nand encroaching on another. \n• Extinguish or Evacuate: Extinguish small fires if possible. Again, maintain \nyour safety before trying to extinguish a fire. If the fire cannot be easily \nextinguished, then evacuate the fire zone or the building if necessary. \nPASS stands for Pull, Aim, Squeeze, and Sweep16\n: \nhttps://www.jointcommission.org/resources/the-physical-environment/fire-\nprotection/clinical-impact/ \n15. Whitlock, M., & Boone, W. (2014). Improving fire safety in an ambulatory \nsetting. Nursing 44(8), 67. https://doi.org/10.1097/\n01.NURSE.0000451537.40340.d0', 'practice.  \n \n \nFigure 5.17 – Practicing an evacuation drill.57 \n \nRegular emergency drills, both announced and unannounced, help everyone become familiar \nwith emergency procedures and activities. This can reduce panic and fear during an actual \nemergency, freeing participants to focus on how to evacuate, shelter in place, or lockdown. \n \nReunification Procedures  \nAn effective method of reuniting children with their parents and guardians after an emergency \nis an often-overlooked component of an emergency plan, but it is very important. Including up-\nto-date emergency contact information for each child in your emergency kit can help provide \nstructure around this process. Reunification procedures that should be communicated to \nfamilies:  \n• Evacuation or shelter-in-place locations', 'Types of Emergency Responses \nThere are many types of emergencies. The key to remember is that each is a method to put \neffective barriers between you and a threat. The difference is in the types of threats and what \nkind of barrier is called for.  \n• Evacuating is a means to leave a dangerous situation or area (e.g., because of a fire).  \n• Sheltering in place is the use of a structure and its indoor atmosphere to temporarily \nseparate you from a hazardous outdoor atmosphere (e.g., tornadoes, earthquakes, \nsevere weather, landslides, or debris flow). It entails closing all doors, windows, and \nvents and taking immediate shelter in a readily accessible location.  \n \n55 Image by Cpl. Dylan Chagnon is in the public domain.', '• Pull: Pull the pin on the fire extinguisher handle. This action is necessary \nto allow the handle to be depressed and allow fire extinguisher contents \nto be released. \n• Aim: Aim low towards the base of the fire with the fire extinguisher nozzle \nor hose. It is important to aim the fire extinguisher contents to the base of \nthe fire because this is what will extinguish the fire through smothering. \nThe top part of the fire will not be smothered by the fire extinguisher \ncontents because it is too large and spread out \n• Squeeze: Squeeze down on the handle of the fire extinguisher to depress \nit and allow contents to be released from the extinguisher. \n• Sweep: Sweep the hose or nozzle from side to side as the fire', 'partially inflate the reservoir bag before applying the mask. Place the \npatient in an upright position as clinically appropriate. \n11. Evaluate patient’s response to oxygen therapy including airway, \nrespiratory rate, pulse oximetry reading, and reported dyspnea. \n12. Institute additional interventions to improve oxygenation as needed. \n13. Adapt this procedure to reflect variations across the life span. \n14. Assist the patient to a comfortable position, ask if they have any \nquestions, and thank them for their time. \n15. Ensure safety measures when leaving the room: \n◦ CALL LIGHT: Within reach \n◦ BED: Low and locked (in lowest position and brakes on) \n◦ SIDE RAILS: Secured \n◦ TABLE: Within reach \n◦ ROOM: Risk-free for falls (scan room and clear any obstacles)']","The 'Drop, Cover, and Hold On' procedure is used in response to an earthquake. When an earthquake occurs indoors, individuals should drop to the ground, take cover under a sturdy piece of furniture (like a table or desk), and hold on until the shaking stops. This method helps protect individuals from falling objects and debris. After the shaking stops, teachers should check for injuries and look for hazards that may have resulted from the earthquake, such as broken items or fire. If evacuation is necessary, it is advised to use stairs (Source: Unknown).","It is the safety response procedure for earthquakes. Individuals should drop to the ground, take cover under a sturdy table or desk, and hold on until the shaking stops.",1.0,0.99999999995,1.0,0.9122197646866804,0.7005885804094643
How should a provider respond if a child has a seizure?,"['262 | H e a l t h ,  S a f e t y ,  a n d  N u t r i t i o n  in  E a r l y  C h i l d h o o d  E d u c a t i o n  \n \nTeacher should never do any of the following things: \n• Do not hold the child down or try to stop their movements. \n• Do not put anything in the child’s mouth. This can injure teeth or the jaw. A person \nhaving a seizure cannot swallow his or her tongue. \n• Do not try to give mouth-to-mouth breaths (like CPR). People usually start breathing \nagain on their own after a seizure. \n• Do not offer the person water or food until he or she is fully alert.35 \n \n \nFigure 10.11 – This girl has Dravet syndrome, a rare form of epilepsy.36 \n \nNationwide, about 470,000 children have epilepsy. For many children, epilepsy is easily', 'included in classrooms with children that do not have special needs.32 \n \nEpilepsy  \nEpilepsy is a broad term used for a brain disorder that causes seizures. There are many different \ntypes of epilepsy. There are also different kinds of seizures.33 A seizure is a short change in \nnormal brain activity. Seizures are the main sign of epilepsy. Some seizures can look like staring \nspells. Other seizures cause a person to fall, shake, and lose awareness of what’s going on \naround them. 34 \n \nMost seizures end in a few minutes. If a child has a seizure the teacher should:  \n• Stay with the child until the seizure ends and he or she is fully awake. Once they are \nalert and able to communicate, tell them what happened in very simple terms. \n• Comfort the person and speak calmly.', 'any of the following things happen:  \n• You believe a child needs immediate medical assessment and \ntreatment that cannot wait for parents to take the child for care. \n• A child has a stiff neck (that limits his ability to put his chin to his chest) \nor severe headache and fever.  \n• A child has a seizure for the first time.  \n• A child who has a fever as well as difficulty breathing. \n• A child looks or acts very ill, or seems to be getting worse quickly.  \n \n32 California Childcare Health Program. (2018). Preventive Health and Safety in the Child Care Setting: A Curriculum \nfor the Training of Child Care Providers (3rd ed.). University of California, San Francisco. Retrieved from \nhttps://cchp.ucsf.edu/sites/g/files/tkssra181/f/PHT-Handbook-Student-2018-FINAL.pdf', '• Comfort the person and speak calmly. \n• Keep yourself and other people calm. \n• Follow the directions in the Health Care Plan (which likely will include calling the family) \n \n \n \n \n31 Image by the California Department of Education is used with permission  \n32 Facts about Down Syndrome by the Centers for Disease Control and Prevention is in the public domain \n33 About Epilepsy by the Centers for Disease Control and Prevention is in the public domain \n34 Epilepsy in Schools by the Centers for Disease Control and Prevention is in the public domain', 'ill children if they cannot?” \n \nIt’s important that programs recognize the families have to weigh many things when trying to \ndecide whether or not to send a child to child care. They must consider how the child feels \n(physically and emotionally), whether or not the program can provide care for the specific \nneeds of the child, what alternative care arrangements are available, as well as the income they \nmay lose if they have to stay home.32 \n \n \n \nResponding to Illness that Requires Medical Care \n“Some conditions, require immediate medical help. If the parents can be \nreached, tell them to come right away and to notify their medical provider.   \nCall Emergency Medical services (9-1-1) immediately and also notify parents if \nany of the following things happen:', 'Tell the parent to come right away, and get medical help immediately, when \nany of the following things happen. If the parent or the child’s medical \nprovider is not immediately available, call 9-1-1 (EMS) for immediate help:  \n• A fever in any child who appears more than mildly ill.  \n• An infant under 2 months of age has an axillary (“armpit”) temperature \nabove 100.4º F.  \n• An infant under four months of age has two or more forceful vomiting \nepisodes (not the simple return of swallowed milk or spit-up) after \neating.  \n• A child has neck pain when the head is moved or touched.  \n• A child has a severe stomach ache that causes the child to double up \nand scream.  \n• A child has a stomach ache without vomiting or diarrhea after a recent \ninjury, blow to the abdomen or hard fall.', 'representative of the nature of the injury when the child is picked up from the center. \n◼ The licensee shall make prompt arrangements for obtaining medical treatment for any \nchild as necessary. \n \n◼ In centers where the licensee chooses to handle medication: \n◼ Medications must be kept inaccessible to children. \n◼ Prescription medications must be administered in accordance with the label \ndirections as prescribed by the child’s physician and there must be written \napproval and instructions from the child’s authorized representative before \ngiving medication to the child. \n◼ Nonprescription medications must be administered in accordance with the \nproduct label and there must be written approval and instructions from the']","If a child has a seizure, the provider should take the following steps:

1. **Stay with the child** until the seizure ends and he or she is fully awake.
2. **Comfort the person** and speak calmly to them.
3. Once the child is alert and able to communicate, **explain what happened in very simple terms**.
4. **Keep yourself and other people calm** during the event.
5. **Follow the directions in the Health Care Plan**, which may include calling the family.

It is important to remember not to hold the child down, put anything in their mouth, or attempt mouth-to-mouth breaths, as these actions can cause harm (Source: Unknown). 

If the seizure is the child's first or if there are any concerns about the child's health, it may be necessary to seek immediate medical assistance (Source: Unknown). Always consult a healthcare provider for further guidance.","Stay with the child, keep them safe, speak calmly, do not hold them down, do not put anything in their mouth, and do not offer food or water until fully alert. Call 911 if necessary based on the care plan.",1.0,0.999999999975,0.8333333333333334,0.9511825159653925,0.57580333387753
What is the procedure for thawing frozen breastmilk?,"['breastmilk in the refrigerator or freezer until ready to use. Breastmilk that is not frozen, should \nbe disposed of if not eaten within 72 hours. \n \nThaw frozen breastmilk by running the container under cool water. Do not set breastmilk out to \nthaw at room temperature. Do not thaw breastmilk by heating on the stove or in a microwave.8 \nSee below for instructions on how to bottle feed an infant. \n \n \n7 Nellis Child Development Center II by Staff Sgt. Taylor Worley (USAF) is in the public domain \n8 Breastfed Babies Welcome Here! by the USDA Food and Nutrition Service is in the public domain', ""Expressed breastmilk needs to be stored and handled safely to keep it from spoiling. Remind \nmothers to label, date, and chill or refrigerate their breastmilk right after they express it. Ask \nmothers to bring the milk in hard plastic bottles. \n \nAsk mothers to bring in enough breastmilk to feed the infant each day. Be sure that each bottle \nor other container of breastmilk is labeled with the infant's name and the date the milk was \nexpressed. Bottles should have just the amount both you and the mother think the infant will \ntake at each feeding. This amount will be about 2 to 4 ounces of breastmilk for the younger \ninfant. As the infant gets older, the mother can put more breastmilk in each bottle. Keep"", 'of br eastmilk or f ormula a t their ne xt f eeding. W hen pr eparing \nformula, parents and c aregivers should c arefully follow the mixing \ninstructions and safety guidelines, since an infant has an imma ture \nimmune system. All e quipment used in formula preparation should \nbe steriliz ed f or ne wborns, and espe cially pr emature infan ts. \nPrepared, unuse d f ormula should be r efrigerated to pr event \nbacterial growth. A partially finished bottle of infant formula should \nbe disc arded af ter 1 hour . P arents must mak e sur e not to use \ncontaminated water to mix f ormula in or der to pr event foodborne \nor other illnesses. Follo w the instruc tions f or po wdered and \nconcentrated f ormula c arefully—formula tha t is o verly dilute d will', 'breastfeeding ar e summariz ed in the T en S teps to S uccessful \nBreastfeeding, la unched join tly b y the WHO and UNICEF. 4 These \nrecommended pr actices  include: helping mothers ini tiate \nbreastfeeding within one hour of birth; keeping mothers and babies \ntogether (rooming in); encouraging breastfeeding on demand, and \ngiving br eastfed infan ts no f ood or drink other than br eastmilk, \nunless medically indicated. \nIn addi tion, spouses, par tners, and other famil y members c an \nplay critical roles in helping a pr egnant woman make the de cision \nto br eastfeed and assisting wi th f eeding af ter the bab y is born. \n3. US Department of Health and Human Services. (2011, \nJanuary 20). Executive summary: The Surgeon General’s \ncall to action to support breastfeeding.', 'frequently ( 8 to 14 times per 2 4 hours ) helps to bring in this \nincreased v olume o f milk sooner . T ransitional milk is a cr eamy, \nusually y ellow liquid tha t lasts f or appr oximately t wo w eeks and \nincludes hig h le vels o f fa t, lac tose, and w ater-soluble vi tamins. I t \n16. American Pregnancy Association. (2019, October 14). \nBreastfeeding: Overview. \nhttp://www.americanpregnancy.org/firstyearoflife/\nbreastfeedingoverview.htm. \nInfancy  |  827', ""and infant to connect and build their relationship.10 \n \nBurp by placing the infant high over your shoulder or over your knee. You can also lean the \ninfant forward in a sitting position supported by your hands. Pat or rub the infant's back. This \nputs gentle pressure on the abdomen to push extra air from the stomach.11  \n \nUneaten breastmilk or formula should be discarded after a feeding as bacteria from the infant’s \nmouth may have made it into the bottle. \n \n \n10 Image by Ben Kerckx on Pixabay \n11 Breastfed Babies Welcome Here! by the USDA Food and Nutrition Service is in the public domain"", 'two to three days after birth, human milk contains colostrum, a thick \nyellowish-white fluid rich in proteins and immunoglobulin A (IgA). Colostrum \nis lower in carbohydrates and fat than mature breast milk. Colostrum helps \nprotect the newborn from infection and builds normal intestinal bacteria. As \nbreast milk matures after two to three days postpartum, it becomes lower in \nproteins and IgA and higher in carbohydrates and fat.11\n Human donor milk \nmay be used in some situations when the mother cannot breastfeed. If \nhuman donor milk is given, it should be sourced through an accredited \nhuman milk bank and pasteurized to minimize risk of spreading infectious \ndiseases. \nThere are many reasons infants may not be breastfed, including insufficient']","The procedure for thawing frozen breastmilk is to run the container under cool water. It is important not to set breastmilk out to thaw at room temperature, and you should not thaw breastmilk by heating it on the stove or in a microwave (Source: Unknown). 

Always remember to consult a healthcare provider for any specific concerns or questions regarding breastmilk handling.",Thaw under cool running water or in the refrigerator. Do not thaw at room temperature.,1.0,0.9999999999,0.8,0.99231017924923,0.5888670073670482
What steps must be taken before administering prescription medication to a child?,"[""• Prescription medications may be administered with written permission by the child’s \nauthorized representatives in accordance with the label instructions by the physician \n• Nonprescription medications may be administered without approval or instructions \nfrom the child's physician with written approval and instructions from the child’s \nauthorized representative and when administered in accordance with the product label \ndirections. \n \n \nFigure 9.11 – Medication must be given according to the label.35 \n \nValid reasons for an early care and education program to consider administering medication. \n• Some medication dosing cannot be adjusted to be taken before and after care (and \nkeeping them out of care when otherwise well enough to attend, would be a hardship \nfor families."", 'prescribed medication to the \nspecific patient. \nAssess the patient’s history of medication \nallergies or nondrug allergies that may \ninterfere with the medication. If there is a \nhistory of allergic reactions, document the type \nof reaction if possible (e.g., hives, rash, swelling, \ndifficulty breathing). If there is an allergy to \nprescriber medication, do not prepare it and \nnotify the prescribing provider. \nSafely administer medication. \nReview a current, evidence-based drug \nreference to determine medication action, \nindication for medication, normal dosage \nrange, and potential side effects. Identify peak \nand onset times, as well as any nursing \nconsiderations. \nSafely administer medication \nand plan to monitor the \npatient’s response. For \nexample, by knowing the peak', 'Special Considerations: \n• Plan medication administration to avoid disruption. \n• Dispense medication in a quiet area. \n1040  |  18.8 Checklists for Parenteral Medication Administration', '242 | H e a l t h ,  S a f e t y ,  a n d  N u t r i t i o n  in  E a r l y  C h i l d h o o d  E d u c a t i o n  \n \nAdministering Medications \nSome children in your early care and education setting may need to take medications during \nthe hours you provide care for them. It’s important that early care and education programs \nhave a written policy for the use of prescription and nonprescription medication.34  \n \nAccording to licensing, programs that choose to handle medications must abide by the \nfollowing:  \n• All prescription and nonprescription medications shall be centrally stored in a safe place \ninaccessible to children, with an unaltered label, and labeled with the child’s name and \ndate \n• A refrigerator shall be used to store any medication that requires refrigeration.', '• Name of the patient \n• Age or date of birth \n• Date and time of the order \n• Drug name \n• Dose, frequency, and route \n• Name/Signature of the prescriber \n• Weight of the patient to facilitate dose calculation when applicable. \n(Note that dose calculations are based on metric weight: kilograms for \nchildren/adults or grams for newborns) \n• Dose calculation requirements, when applicable \n• Exact strength or concentration, when applicable \n• Quantity and/or duration of the prescription, when applicable \n• Specific instructions for use, when applicable \nWhen reviewing a medication order, the nurse must ensure these \ncomponents are included in the prescription before administering the \nmedication. If a pertinent piece of information is not included, the nurse', 'to administer the medication if the child trusts them more than the nurse. \nOral syringes (without needles attached) may be used to administer \nprecise dosages of medication to children. See Figure 15.1451\n of a nurse \nadministering oral medication to a child with an oral syringe. When \nadministering medication with an oral syringe, remember to remove the \ncap prior to administration because this could be a choking hazard. It is \nalso important to educate the caregiver of the child how to properly \nadminister the medication at the correct dosage at home. \n \n51. “USMC-080623-M-9467O-024.jpg” by Lance Cpl. Regina A. Ochoa for the United States Marine Corps is in \nthe Public Domain. \n15.2 Basic Concepts of Administering Medications  |  873', 'Guidelines Additional Information \nBe cautious \nand focused \nwhen \npreparing \nmedications. \nAvoid distractions. Some agencies have a no-interruption zone \n(NIZ) where health care providers can prepare medications \nwithout interruptions.2 \nCheck and \nverify allergies. \nAlways ask the patient about their medication allergies, types \nof reactions, and severity of reactions. Verify the patient’s \nmedical record for documented allergies. \nUse two patient \nidentifiers and \nfollow agency \npolicy for \npatient \nidentification. \nUse at least two patient identifiers before administration and \ncompare information against the medication administration \nrecord (MAR).3 \nPerform \nappropriate \npatient \nassessments \nbefore \nmedication \nadministration.']","Before administering prescription medication to a child, the following steps must be taken:

1. **Obtain Written Permission**: Ensure that there is written permission from the child's authorized representatives in accordance with the label instructions provided by the physician.

2. **Assess Medication Allergies**: Review the child's history for any medication allergies or nondrug allergies that may interfere with the medication. Document any allergic reactions if possible (e.g., hives, rash, swelling, difficulty breathing).

3. **Verify Prescription Details**: Ensure that the medication order includes all necessary components, such as:
   - Name of the patient
   - Age or date of birth
   - Date and time of the order
   - Drug name
   - Dose, frequency, and route
   - Name/Signature of the prescriber
   - Weight of the patient for dose calculation, if applicable
   - Dose calculation requirements, if applicable
   - Exact strength or concentration, if applicable
   - Quantity and/or duration of the prescription, if applicable
   - Specific instructions for use, if applicable

4. **Prepare for Administration**: Be cautious and focused when preparing medications, avoiding distractions. Some facilities may have a no-interruption zone (NIZ) for this purpose.

5. **Use Patient Identifiers**: Use at least two patient identifiers to confirm the identity of the child before administration, comparing this information against the medication administration record (MAR).

6. **Monitor Patient Response**: Plan to monitor the child's response to the medication after administration.

These steps help ensure the safe and effective administration of prescription medications to children (Source: Unknown). Always consult a healthcare provider for specific medical advice or treatment decisions.","The medication must be in its original container with an unaltered label, prescribed by a physician, and there must be written approval and instructions from the child's authorized representative.",1.0,0.9999999999,0.96875,0.9974246486771501,0.30478390382488646
How should a tick be removed?,"['likely to carry diseases.  \n \n \nFigure 4.10 – Remove a tick by gripping it with tweezers as close to the skin as possible, pulling upward with steady \npressure. After removal, clean the bite area and your hands with sanitizer or soap and water and dispose of the tick \nby putting it in alcohol, placing it in a sealed bag/container, wrapping it tightly in tape, or flushing it down the \ntoilet.34 \n \nWater Safety \nDrowning is a major cause of death among children under 5 years of age in California. Water \nsafety presents a particular challenge to child care providers. Most drownings in this age group \noccur in home swimming pools. Water-filled bathtubs, wading pools, toilets, buckets or other \ncontainers are also places where top-heavy young children can drown. Water safety presents', 'through the woods, avoiding tall grasses, wearing long\nsleeves and tucking pant legs into socks, wearing insect\nrepellent, and checking for ticks after an outing. Remove\na tick as soon as possible by grasping the tick with tweez-\ners and gently pulling. Splenectomized people should\navoid northeastern coastal regions during the tick season.\nResources\nBOOKS\nBlood: Textbook of Hematology.2nd ed. Ed. James H. Jandl.\nBoston: Little, Brown and Co., 1996.\nChiodini, Peter L. “Babesiosis.” In Manson’s Tropical Dis-\neases. 20th ed. Philadelphia: W. B. Saunders Co., 1996.\nInfections and Diseases. 2nd ed. Ed. Sherood L. Gorbach, John\nG. Bartlett, and Neil R. Blacklow. Philadelphia: W. B.\nSaunders Co., 1997.\nOTHER\nMayo Clinic Online.5 Mar. 1998 <http://www.mayohealth.org>.\nBelinda Rowland, PhD', 'remove the suture from below the surface. \n◦ Do not pull the contaminated suture (suture on top of the skin) \nthrough tissue. \n15. Grasp the knotted end of the suture with forceps, and in one \ncontinuous action pull the suture out of the tissue and place it on the \nsterile 2″ x 2″ gauze. \n16. Remove every second suture until the end of the incision line. Assess \nwound healing after removal of each suture to determine if each \nremaining suture will be removed. If the wound edges are open, stop \nremoving sutures, apply Steri-Strips (using tension to pull wound \nedges together), and notify the appropriate health care provider. \nRemove remaining sutures on the incision line if indicated. \n17. Using the principles of no-touch technique, cut and place Steri-Strips \nalong the incision line:', '12. Place the lower tip of the staple extractor beneath the staple. Do not \npull up while depressing the handle on the staple remover or change \nthe angle of your wrist or hand. Close the handle, and then gently \nmove the staple side to side to remove. The closed handle depresses \nthe middle of the staple causing the two ends to bend outward and \nout of the top layer of skin. \n13. When both ends of the staple are visible, move the staple extractor \naway from the skin and place the staple on a sterile piece of gauze by \nreleasing the handles on the staple extractor. This avoids pulling the \nstaple out prematurely and avoids putting pressure on the wound. It \nalso prevents scratching the skin with the sharp staple. \n14. Using the principles of no-touch technique, place Steri-Strips on the', 'tissue to the side or downward. \ne. Maintaining tissue traction, hold the syringe like a dart and insert the \nneedle into the skin at 90 degrees. \nf. Maintaining tissue traction, use the available thumb and index finger \nto help stabilize the syringe. \ng. Follow agency policy and manufacturer recommendations regarding \naspiration. If aspiration is required, pull back the plunger and observe \nfor blood return. If there is no blood return, inject the medication. If \nblood return is observed, remove the needle, and prepare a new \nmedication. \nh. Maintaining tissue traction, wait 10 seconds with the needle still in the \nskin to allow the muscle to absorb the medication. Withdraw the \nneedle from the site and then release traction. Do not rub/massage \nthe site.', 'used. This step reduces risk of infection from microorganisms on the \nwound site or surrounding skin. Cleaning also loosens and removes \nany dried blood or crusted exudate from the sutures and wound bed. \n11. To remove intermittent sutures, hold the scissors in your dominant \nhand and the forceps in your nondominant hand for dexterity with \nsuture removal. \n12. Place a sterile 2″ x 2″ gauze close to the incision site to collect the \nremoved suture pieces. \n13. Grasp the knot of the suture with the forceps and gently pull up the \nknot while slipping the tip of the scissors under the suture near the \nskin. Examine the knot. \n14. Cut under the knot as close as possible to the skin at the distal end of \nthe knot: \n◦ Never snip both ends of the knot as there will be no way to', 'allow the site to dry, and then puncture the skin using the lancet. See \nFigure 19.211\n for an image of performing a skin puncture using a lancet. \n \nFigure 19.2 Using a Lancet to Perform a Skin Puncture \nIf needed, gently squeeze above the site to obtain a large drop of blood. \nDo not milk or massage the finger because it may introduce excess tissue \nfluid and hemolyze the specimen. Wipe away the first drop of blood and \nuse the second drop for the blood sample. Follow agency policy and \nmanufacturer instructions regarding placement of the drop of blood for \nabsorption on the reagent strip. See Figure 19.312\n for an image of a nurse \nabsorbing the patient’s drop of blood on the reagent strip. Timeliness is \nessential in gathering an appropriate specimen before clotting occurs or']","To remove a tick, you should grip it with tweezers as close to the skin as possible and pull upward with steady pressure. After removal, it's important to clean the bite area and your hands with sanitizer or soap and water. Dispose of the tick by putting it in alcohol, placing it in a sealed bag or container, wrapping it tightly in tape, or flushing it down the toilet (Source: Unknown). 

If you have any concerns or experience symptoms after a tick bite, please consult a healthcare provider for further advice.",Grip the tick with tweezers as close to the skin as possible and pull upward with steady pressure. Clean the bite area and hands with soap and water afterward.,1.0,0.99999999995,0.875,0.966012368863137,0.6424389587698365
What is the exclusion protocol for a child with head lice?,"['discontinued. “No-nit” policies that require a child to be free of nits before \nthey can return to schools should be discontinued for the following reasons: \n• Many nits are more than ¼ inch from the scalp. Such nits are usually \nnot viable and very unlikely to hatch to become crawling lice, or may \nin fact be empty shells, also known as ‘casings’. \n• Nits are cemented to hair shafts and are very unlikely to be \ntransferred successfully to other people. \n• The burden of unnecessary absenteeism to the students, families and \ncommunities far outweighs the risks associated with head lice. \n• Misdiagnosis of nits is very common during nit checks conducted by \nnonmedical personnel.24 \n \n \nPause to Reflect \nWhat experience with or knowledge do you have about policies that specific', '239 | H e a l t h ,  S a f e t y ,  a n d  N u t r i t i o n  in  E a r l y  C h i l d h o o d  E d u c a t i o n  \n \nCondition Exclusion Criteria \nHepatitis A As directed by health department. \nImpetigo Until 24 hours after treatment begins and lesions are not draining. \nActive Tuberculosis Until local health department approves the return to care. \nStrep Throat (and \nother streptococcal \ninfections) \nUntil 24 hours after treatment and fever is gone. \nHead lice Until after first treatment \nScabies Until treatment is completed \nHaemophilus \nInfluenza Type b \n(Hib) \nUntil antibiotic treatment has begun. \nRespiratory Illness \nIf the child is not well enough to participate and/or caring for the \nchild limits the provider from caring for the other children or if it', ""The child's authorized representative shall be notified immediately when the child becomes ill \nenough to require isolation, and shall be asked to have the child picked up from the center as \nsoon as possible.30 \n \nSee Table 9.2 for a list of illnesses that require exclusion and when children who are diagnosed \nwith those illnesses can return to care.  \n \nTable 9.2 – Conditions that Require Exclusion31 \n \nCondition Exclusion Criteria \nChickenpox Until 6 days after the beginning of the rash or once the sores have \ndried or crusted over. \nShingles Only sores is cannot be covered with bandages or clothing. If not, \nuntil sores are dry and have crusted over. \nRash with fever or \njoint pain Until 6 days after the beginning of the rash. \nMeasles and"", '232 | H e a l t h ,  S a f e t y ,  a n d  N u t r i t i o n  in  E a r l y  C h i l d h o o d  E d u c a t i o n  \n \n \nNo More “No Nits” Policies \nChildren diagnosed with live head lice do not need to be sent home early \nfrom early care and education programs or school; they can go home at the \nend of the day, be treated, and return to class after appropriate treatment \nhas begun. Nits may persist after treatment, but successful treatment should \nkill crawling lice. \n \nHead lice can be a nuisance but they have not been shown to spread \ndisease. Personal hygiene or cleanliness in the home or school has nothing \nto do with getting head lice. \n \nBoth the American Academy of Pediatrics (AAP) and the National Association \nof School Nurses (NASN) advocate that “no-nit” policies should be', 'household members and other close contacts should be checked; those persons with evidence \nof an active infestation should be treated with an over-the-counter or prescription medication \n(following the provided instructions).  \n \nHats, scarves, pillow cases, bedding, clothing, and towels worn or used by the person with the \ninfestation in the 2-day period just before treatment is started can be machine washed and \ndried using the hot water and hot air cycles because lice and eggs are killed by exposure for 5 \nminutes to temperatures greater than 128.3°F. Items that cannot be laundered may be dry-\ncleaned or sealed in a plastic bag for two weeks. Items such as hats, grooming aids, and towels \nthat come in contact with the hair of a person with an infestation should not be shared.', 'early education and care program and schools have on head lice? Are (or \nwere) those policies “no nits” or in line with the recommendations above? \n \nOther Illnesses \nTo learn more about the following illnesses, go to Appendix J. \n• Bronchitis  \n• Chickenpox \n• Conjuctivitis (Pink Eye) \n• Fifth Disease (Slapped Cheek) \n• Hand, Foot, and Mouth Disease \n• Hepatitis A \n• Impetigo \n \n24 Head Lice Information for Schools by the Centers for Disease Control and Prevention is in the public domain', '238 | H e a l t h ,  S a f e t y ,  a n d  N u t r i t i o n  in  E a r l y  C h i l d h o o d  E d u c a t i o n  \n \nThey can be readmitted when the health department official or that health care provider \ndecides that the risk of transmission is no longer present.29 \n \nWhat to do When a Child Requires Exclusion \nWhen a child becomes ill enough to be excluded, they should be immediately isolated from \nother children. Early care and education programs are required to be equipped to isolate and \ncare for any child who becomes ill during the day. The isolation area shall be located to afford \neasy supervision of children by center staff and equipped with a mat, cot, couch or bed for each \nill child (or a crib if caring for infants).']","The exclusion protocol for a child with head lice is that they do not need to be sent home early from school or early care and education programs. Instead, they can go home at the end of the day, receive treatment, and return to class after appropriate treatment has begun. It is important to note that while nits may persist after treatment, successful treatment should eliminate crawling lice. 

This approach aligns with the recommendations from both the American Academy of Pediatrics (AAP) and the National Association of School Nurses (NASN), which advocate against ""no-nit"" policies (Source: Unknown). 

If you have further questions or concerns, it's always best to consult a healthcare provider for personalized advice.",A child with head lice can generally return to care after the first treatment has been completed; 'no-nit' policies are discouraged.,1.0,0.9166666666361111,0.9090909090909091,0.9871812302762429,0.4436565275639608
How should leftovers be handled to ensure food safety?,"['bottle.74 \n \nHandling Leftovers \nAll food that has been served to children must be discarded after the meal or snack. If a \nprogram chooses to save food that has not been served to children, follow these guidelines: \n• Divide large amounts of leftovers (for example, large cuts of meat or poultry) into \nsmaller portions and place them in shallow containers before refrigerating for faster \ncooling. \n• Use refrigerated leftovers within three to four days or discard them. \n• Bring sauces, soups, and gravy to a boil when reheating. Heat other leftovers to 165° F.75 \n \n \nPause to Reflect \nWhat are some new things you learned about food safety? Do you have \nany questions about food safety that weren’t addressed in this section? If \nso, where could you find answers to them?', 'Leftovers, to reheat 165\uf0b0 \nLeftovers 165\uf0b0 \n \n \n73 Safe Minimum Internal Temperature Chart by the USDA Food Safety and Inspection Service is in the public \ndomain', 'kept a t 0°F ( or − 18°C). S tore pota toes and onions in a c ool, dar k \nplace, but not under a sink be cause le akage fr om pipes c ould \ncontaminate them. Empt y c ans o f perishable f oods or be verages \nthat have been opened into containers, and promptly place them in \na refrigerator. Also, be sure to consume leftovers within three to five \ndays, so mold does not have a chance to grow. \nPreparing Food \nWash hands thoroughly with warm, soapy water for at least twenty \nseconds bef ore preparing f ood and e very time af ter handling r aw \nfoods. W ashing hands is impor tant f or man y r easons. One is to \nprevent cross-contamination between foods. Also, some pathogens \ncan be passe d fr om person to person, so hand w ashing c an help', 'and storage. Use separate cutting boards for produce and for \nmeat, poultry, seafood, and eggs. Store food products \nseparately in the refrigerator. \n• Cook. Heat food to proper temperatures. Use a food \nthermometer to check the temperature of food while it is \ncooking. Keep food hot after it has been cooked. \n• Chill. Refrigerate any leftovers within two hours. Never thaw \nor marinate food on the counter. \nKnow when to keep food and when to throw it out. It can be helpful \n1. US Department of Health and Human Services. “Keep \nFood Safe.” Food Safety.gov. Accessed December 21, 2011. \nhttp://www.foodsafety.gov/keep/index.html. \n1034  |  Efforts on the Consumer\nLevel: What You Can Do', 'containers, or otherwise protected from contamination. \n• Wrap raw meat, poultry, and seafood securely to prevent raw juices from contaminating \nother foods. Store them in the meat drawer or coldest section of the refrigerator or \nfreezer. \n• Do not store perishable foods, such as eggs, in the refrigerator door. The temperature of \nstorage bins in the door fluctuates more than the temperature in the cabinet. \n• Cook or freeze fresh poultry, fish, ground meat, and mixed meats within 2 days after you \nbuy them. Cook or freeze other beef, veal, lamb, or pork within 3 to 5 days. \n• Use the cold storage chart in Table 15.9 for guidelines of how long different food \nproducts can be safely stored in the refrigerator and freezer.', 'refrigerator and disc ard lef tover marinade af ter use be cause i t \ncontains raw juices. Always use clean cutting boards, which should \nbe washed with soap and w arm water by hand or in a dish washer \nafter e ach use. Another w ay to sani tize cut ting boar ds is to rinse \nthem wi th a solution o f 5 millili ters (1 te aspoon) chlorine ble ach \nto about 1 li ter (1 quar t) of water. If possible, use separ ate cutting \nboards f or fr esh pr oduce and f or r aw me at. Also, w ash the top \nbefore opening c anned f oods to pr event dir t fr om c oming in to \ncontact with food. \nCooking Food \nCooked food is safe to eat only after it has been heated to an internal \ntemperature that is hig h enough to kill bac teria. You cannot judge', 'to check the website http://www.stilltasty.com, which explains how \nlong refrigerated food remains fresh. \nBuying Food \nIt is best to bu y y our f ood fr om r eputable gr ocers wi th cle an, \nsanitary facilities, that keep products at appropriate temperatures. \nConsumers should e xamine food carefully before they purchase it. \nIt is impor tant to look a t f ood in g lass j ars, che ck the stems on \nfresh pr oduce, and a void bruise d frui t. Do not bu y c anned goods \nwith den ts or bulges, which ar e a t risk f or c ontamination wi th \nClostridium botulinum. Fresh meat and poultry are usually free from \nmold, but cur ed and c ooked me ats should be e xamined c arefully. \nAlso, avoid torn, crushe d, or open f ood packages, and do not bu y']","To ensure food safety when handling leftovers, follow these guidelines:

1. **Discard Served Food**: All food that has been served to children must be discarded after the meal or snack.

2. **Refrigerate Promptly**: If you choose to save food that has not been served, refrigerate it within two hours of cooking.

3. **Portioning**: Divide large amounts of leftovers into smaller portions and place them in shallow containers for faster cooling.

4. **Storage Duration**: Use refrigerated leftovers within three to four days or discard them to prevent spoilage.

5. **Reheating**: When reheating, bring sauces, soups, and gravy to a boil. Heat other leftovers to an internal temperature of 165°F to ensure they are safe to eat.

6. **Avoid Cross-Contamination**: Use separate cutting boards for raw meats and other foods, and wash hands thoroughly before and after handling food.

These practices help minimize the risk of foodborne illnesses and ensure that leftovers are safe to consume (Source: Unknown). 

Always consult a healthcare provider for specific advice regarding food safety and health concerns.","Leftovers should be divided into smaller portions in shallow containers for fast cooling, refrigerated immediately, and used within 3 to 4 days or discarded.",1.0,0.8099999999838,0.9333333333333333,0.9657413495776871,0.5247315145191662
What is the proper position for an infant to sleep to reduce SIDS risk?,"['2005).71 \n \nThis is a very important topic for early childhood educators as one study found that while data \nsuggests that only 7% of incidents of SIDS should occur while children are in child care, 20.4% \nactually did.72  \n \n \nFigure 3.21– A baby sleeping safely.73 \n \nRisk Factors for SIDS  \nBabies are at higher risk for SIDS if they: \n• Sleep on their stomachs \n• Sleep on soft surfaces, such as an adult mattress, couch, or chair or under soft coverings \n• Sleep on or under soft or loose bedding \n• Get too hot during sleep \n• Are exposed to cigarette smoke in the womb or in their environment, such as at home, \nin the car, in the bedroom, or other areas \n• Sleep in an adult bed with parents/caregivers, other children, or pets; this situation is \nespecially dangerous if:', '85 | H e a l t h ,  S a f e t y ,  a n d  N u t r i t i o n  in  E a r l y  C h i l d h o o d  E d u c a t i o n  \n \no The baby is covered by a blanket or quilt. \no The baby sleeps with more than one bed-sharer. \no The baby is younger than 11 to 14 weeks of age. \n \nImportant Facts About SIDS  \n• SIDS happens in families of all social, economic and ethnic groups.  \n• Most SIDS deaths occur between one and four months of age.  \n• SIDS occurs in boys more than girls.  \n• The death is sudden and unexpected, often occurring during sleep.  In most cases, the \nbaby seems healthy.  \n• Although it is not known exactly what causes SIDS, researchers know that it is not \ncaused by suffocation, choking, spitting up, vomiting, or immunizations.  \n• SIDS is not contagious.74 \n \nReducing the Risks', '86 | H e a l t h ,  S a f e t y ,  a n d  N u t r i t i o n  in  E a r l y  C h i l d h o o d  E d u c a t i o n  \n \n \nFigure 3.22 – Airway positioning when infants sleep on their backs (left) and on their stomachs (right)75  \n \nBabies who are able to roll back and forth between their back and tummy should be placed on \ntheir backs for sleep and allowed to assume their sleep position of choice. When infants fall \nasleep while playing on their tummies, move the baby to a crib onto his/her back to continue \nsleeping.  \n \nCribs, Sleep Surface and Bedding \nInfants should sleep in a crib, bassinet, portable crib or play yard that conforms to the safety \nstandards of the Consumer Product Safety Commission (CPSC). The mattress should be firm,', 'Reducing the Risks  \nAlthough the sudden and unexpected death of an infant cannot be predicted or prevented, \nresearch shows that certain infant care practices can help reduce the risk of a baby dying \nsuddenly and unexpectedly.  Early childhood educators can help lower the risk of SUID for \ninfants less than one year of age by following these risk reduction guidelines. \n \nSleeping Position  \nThe chance of an infant dying suddenly and unexpectedly in childcare is higher when a baby \nfirst starts the transition from home to care. Research shows if a baby has been placed on \nhis/her back by the families, and the childcare provider places the baby to sleep on his/her \nstomach, there is a higher risk of death in the first weeks of child care.  One of the most', 'important things you can do to reduce the risk of sudden unexpected death is to place babies to \nsleep on their backs.   \n \nHealthy babies do not choke when placed to sleep on their backs. By reflex, babies swallow or \ncough up fluids to keep the airway clear.  Since the windpipe (trachea) is positioned on top of \nthe esophagus, fluids are not likely to enter the airway. (See Figure 3.21)   \n \n \n74 California Dept. of Public Health MCAH. (2014). What Child Care Providers and Other Caregivers Should Know. \nRetrieved from https://cchealth.org/sids/pdf/Child-Care-SIDS-Booklet.pdf.', '87 | H e a l t h ,  S a f e t y ,  a n d  N u t r i t i o n  in  E a r l y  C h i l d h o o d  E d u c a t i o n  \n \n \nBreastfeeding  \nBreastfeeding has many health benefits for mother and baby, including a reduced risk of SIDS. \nChildcare programs should be breastfeeding friendly. 76 \n \n \n \n \n \nOther Things Caregivers and Teachers Can Do To Reduce the \nRisks  \n• Families should be asked about their infant’s usual sleep position. \nTeachers should discuss the recommended back sleeping position with \nfamilies and share the program’s policy is to place infants on their back \nto sleep.    \n• Policies should be developed to address sleep position.  If a family \ninsists their baby sleep on the side or stomach, they should be referred', 'fit tightly, and be covered with a tight fitted sheet. Babies should not sleep on adult beds, \nwaterbeds, couches, beanbag chairs or other soft surfaces. Do not use fluffy blankets or \ncomforters under the baby, or put the baby to sleep on a sheepskin, pillow or other \nsoft materials. Keep stuffed toys, bumper pads, loose bedding and other toys and soft objects \nout of the crib.    \n \nTemperature  \nBabies should be kept warm, not hot. Babies should be dressed with only one additional layer \nthan you are wearing for warmth. In areas where babies sleep, keep the temperature so that it \nfeels comfortable to you. If needed, infants can be dressed in blanket sleepers for warmth. This \nensures that the baby’s head will be uncovered during sleep. \n \nSmoke Free']","The proper position for an infant to sleep to reduce the risk of Sudden Infant Death Syndrome (SIDS) is on their back. It is important to place babies on their backs for sleep, and they should be allowed to assume their sleep position of choice once they are able to roll back and forth. This practice helps lower the risk of sudden unexpected death in infants, especially during the transition from home to childcare (Source: Unknown). 

If you have further questions or concerns, please consult a healthcare provider for professional advice.",Infants should always be placed on their backs to sleep.,1.0,0.8099999999838,0.8333333333333334,0.9891605094695821,0.6032654572522504
At what age should solid foods typically be introduced to infants?,"['Introducing Solid Foods \nInfants should be br eastfed or bot tle-fed e xclusively f or the f irst \nsix mon ths o f lif e ac cording to the WHO . Foods tha t ar e adde d \nin addi tion to br eastmilk ar e c alled c omplementary f oods. \nComplementary foods should be nutrien t dense to pr ovide optimal \nnutrition. Complemen tary f oods include bab y me ats, v egetables, \nInfancy  |  837', 'Solid baby foods can be boug ht commercially or pr epared from \nregular food using a food processor, blender, food mill, or grinder at \nhome. By nine months to a year, infants are able to chew soft foods \nand can eat solids that are well chopped or mashed. Infants who are \nfed solid foods before 4 months of age are susceptible to developing \nfood allergies. Therefore, as parents and caregivers introduce solids, \nthey should f eed their child onl y one ne w f ood at a time, to help \nidentify allergic responses or food intolerances. An iron supplement \nis also r ecommended at this time. Ric e is no longer r ecommended \nfor a f irst infan t f ood be cause o f i ts hig h arsenic c ontent. W hen \ncereals are introduced, parents can try baby oats or baby wheat.', 'solid foods, timing is important. To keep mealtimes positive, choose a time when the infant is \nhappy and when you have the patience and time to focus. Offer 1 to 2 teaspoons after a \nbreastmilk or formula feeding. This can increase over time to 2 to 3 tablespoons.  \n \nIt is normal for infants to refuse new foods. Sometimes it can take 10 to 12 times of offering a \nfood before an infant will accept it. Infants know when they have had enough and may turn \ntheir head away. Don’t force them to keep eating.16 \n \nAs families and caregivers introduce solids, they should feed the child only one new food at a \ntime, to help identify allergic responses or food intolerances. An iron supplement is also \nrecommended at this time.17  \n \n \nFoods to Avoid for Infants', 'fruits, infan t c ereal, and dair y pr oducts such as y ogurt, but not \ninfant formula. Infant formula is a substi tute, not a c omplement to \nbreastmilk. \nInfants should not c onsume solid f oods prior to six mon ths \nbecause most solids ar e less nutri tious than br eastmilk. Ea ting \nsolids bef ore 6 mon ths o f age usuall y me ans drinking less br east \nmilk and is associa ted wi th mor e e ar inf ections and r espiratory \ninfections. If parents try to feed an infant who is too young or is not \nready, their tongue will push the food out; this is called an extrusion \nreflex. After six months, the suck-swallow reflexes are not as strong, \nand infants can hold up their heads and move them around, both of \nwhich make eating solid foods more feasible.', 'occurs, an infant may not consume the right quantities of various nutrients. If parents try to \nfeed an infant who is too young or is not ready, their tongue will push the food out, which is \ncalled an extrusion reflex. After six months, the suck-swallow reflexes are not as strong, and \ninfants can hold up their heads and move them around, both of which make eating solid foods \nmore feasible.13 \n \n \nKnowing When an Infant is Ready for Solid Foods \nHere are several ways you can tell that an infant is ready to eat solid foods: \n• The infant’s birth weight has doubled. \n• The infant can control their head and neck movements. \n• The infant can sit up with some support. \n \n12 Healthy Feeding from the Start: A Resource for Expectant Families by the National Center on Early Childhood', ""Foods to Avoid for Infants \n• Never give honey to infants. It may contain bacteria that can cause \nbotulism, a rare, but serious illness. \n• Do not give infants cow's milk until they are 1 year old. Before age 1, \nthey have a difficult time digesting cow's milk. \n• Avoid foods with added salt or sugar. \n• Do not give infants egg white until after they are 1 (egg yolks 3-4 per \nweek are okay)18 \n \nLearning to Self-Feed \nWith the introduction of solid foods, young children begin to learn how to handle food and how \nto feed themselves. At six to seven months, infants can use their whole hand to pick up items \n \n14 Human Nutrition by University of Hawai‘i at Mānoa Food Science and Human Nutrition Program is licensed \nunder CC BY 4.0"", 'Pause to Reflect \nSome families put infants on a schedule that dictates when they eat (and even \nsleep)? Is this compatible with feeding on demand as described above? How \nmight you discuss this with a family?  \n \nIntroducing Solid Foods \nInfants should be breastfed or formula-fed exclusively for the first six months of life according \nto the WHO. (The American Academy of Pediatrics recommends breast milk or bottle formula \nexclusively for at least the first four months, but ideally for six months.) Infants should not \nconsume solid foods before six months because solids do not contain the right nutrient mix that \ninfants need. Also, eating solids may mean drinking less breast milk or bottle formula. If that']","Solid foods should typically be introduced to infants at six months of age. According to the WHO, infants should be exclusively breastfed or bottle-fed for the first six months of life. Introducing solid foods before this age is not recommended, as most solids do not provide the right nutrient mix that infants need and may lead to reduced intake of breast milk or formula (Source: Unknown).","Solid foods should be introduced around 6 months of age, when the infant can hold their head up, sit with support, and the extrusion reflex has diminished.",1.0,0.6961904761765524,1.0,0.9749374728202322,0.41601956497544695
Why should honey be avoided for infants under 1 year old?,"['sucrose because \nhoney is denser. \n*Considered safe \nfor baking and \ncooking.Infants \nunder twelve \nmonths old should \nnot be given \nhoney because \ntheir digestive \ntracts cannot \nhandle the \nbacteria found in \nhoney. Older \nchildren and \nadults are \nimmune to these \neffects. Honey \ncontains some \nharmful bacteria \nthat can cause \nfatal food \npoisoning in \ninfants. \nCarbohydrates and Personal Diet Choices  |  285', 'Foods to Avoid \nMany foods can cause harm to infants, including: \n• Honey should never be given to a child under 12 months, \nincluding honey graham crackers and other foods with honey. \n• Cow’s Milk should never be given to a child under 12 months. \n• Syrups, Sugars, Artificial Sweeteners, and Sugar-Sweetened \nBeverages \n• Vegetables High in Nitrates – spinach, beets, carrots, collard \ngreens, or turnips should not be fed to infants less than 6 \nmonths of age. \n• Raw or Partially Cooked Meat, Fish, or Poultry \nCertain foods should also be a voided as the y are choking hazar ds. \nThese foods are listed in the table fr om the USD A Infant Nutrition \nand Feeding Guidelines. \nTable 13.6 Common Foods That Cause Choking in Children Under \nAge 4 \nInfancy  |  843', ""Foods to Avoid for Infants \n• Never give honey to infants. It may contain bacteria that can cause \nbotulism, a rare, but serious illness. \n• Do not give infants cow's milk until they are 1 year old. Before age 1, \nthey have a difficult time digesting cow's milk. \n• Avoid foods with added salt or sugar. \n• Do not give infants egg white until after they are 1 (egg yolks 3-4 per \nweek are okay)18 \n \nLearning to Self-Feed \nWith the introduction of solid foods, young children begin to learn how to handle food and how \nto feed themselves. At six to seven months, infants can use their whole hand to pick up items \n \n14 Human Nutrition by University of Hawai‘i at Mānoa Food Science and Human Nutrition Program is licensed \nunder CC BY 4.0"", 'fruits, infan t c ereal, and dair y pr oducts such as y ogurt, but not \ninfant formula. Infant formula is a substi tute, not a c omplement to \nbreastmilk. \nInfants should not c onsume solid f oods prior to six mon ths \nbecause most solids ar e less nutri tious than br eastmilk. Ea ting \nsolids bef ore 6 mon ths o f age usuall y me ans drinking less br east \nmilk and is associa ted wi th mor e e ar inf ections and r espiratory \ninfections. If parents try to feed an infant who is too young or is not \nready, their tongue will push the food out; this is called an extrusion \nreflex. After six months, the suck-swallow reflexes are not as strong, \nand infants can hold up their heads and move them around, both of \nwhich make eating solid foods more feasible.', 'caries from breast milk, formula, juice, or other drinks f ed through \na bot tle. Liquids c an build up in a bab y’s mouth, and the na tural \nor adde d sugars le ad to de cay. Ear ly childhood c aries ar e c aused \n25. Alvisi P, Brusa S, Alboresi S. (2015). Recommendations on \ncomplementary feeding for healthy, full-term infants. \nItalian Journal of Pediatrics, \n41(36) https://www.ncbi.nlm.nih.gov/pmc/articles/\nPMC4464122/ \n26. Gever J. (2012, March 7). Nursing mom’s diet no guard \nagainst baby allergies. Medpage Today. \nhttp://www.medpagetoday.com/MeetingCoverage/\nAAAAIMeeting/31527 \n27. Du Toit G, et al. (2015). Randomized trial of peanut \nconsumption in infants at risk for peanut allergy. New \nEngland Journal of Medicine. 372(9), 803-813. \n846  |  Infancy', 'their breast milk of an immunog lobulin specific to cow’s milk. This \nantibody is thought to protect against the development of allergies \nin children. Even when an infan t is at higher risk for food allergies, \nthere is no e vidence tha t alter ations in a mother’ s die t mak e a \ndifference. And, i t is possible tha t c ontinuing br eastfeeding when \nintroducing solid foods in the infant diet may help prevent allergies. \nThere is curr ently no scien tific e vidence indic ating tha t dela yed \n(after six mon ths o f age ) or e arly (bef ore f our mon ths o f age ) \nintroduction o f solid f oods is pr eventative. H owever, ther e is \nevidence tha t in troduction o f solid f oods af ter 17 w eeks o f age is \nInfancy  |  845', 'can be use d as a r eplacement f or br east milk. H owever, in \ndeveloping na tions wher e HIV inf ection r ates ar e hig h and \nacceptable infant formula can be dif ficult to f ind, many newborns \nwould be deprived of the nutrients they need to develop and grow. \nAlso, inappr opriate or c ontaminated infan t f ormulas c ause 1.5 \nmillion infant deaths each year. As a r esult, the WHO r ecommends \nthat women infected with HIV in the developing world should nurse \nInfancy  |  833']","Honey should be avoided for infants under 12 months old because it may contain harmful bacteria that can cause botulism, a rare but serious illness. Infants' digestive tracts are not developed enough to handle these bacteria, which can lead to fatal food poisoning. This caution applies to all forms of honey, including honey graham crackers and other foods that contain honey (Source: Unknown). 

It's important to consult a healthcare provider for any dietary concerns regarding infants.","Honey can contain bacteria that cause botulism, a rare but serious illness in infants.",1.0,0.9999999999666667,0.875,0.9806048820821155,0.5022903976543329
What are the five food groups represented in MyPlate?,"['Image by \nAllison \nCalabrese / \nCC BY 4.0 \nBuilding a Healthy Plate: Choose \nNutrient-Dense Foods \nClick on the different food groups listed to view their food gallery: \n• Fruits \n• Grains \n• Dairy \n• Vegetables \n• Protein \nPlanning a healthy diet using the M yPlate approach is not dif ficult. \nAccording to the ic on, half o f y our pla te should ha ve frui ts and \nvegetables, one-quarter should have whole grains, and one-quarter \nshould have protein. Dairy products should be lo w-fat or non-fa t. \nThe ide al die t g ives y ou the most nutrien ts wi thin the f ewest \ncalories. This means choosing nutrient-rich foods. \nFill half of your plate with red, orange, and dark green vegetables \nand frui ts, such as kale, bok cho y, kalo ( taro), toma toes, sw eet \n746  |  MyPlate Planner', 'meals contributing to about half of the food you consume each day. \nThe f oods in this gr oup ar e hig h in vi tamins and miner als. These \nfoods ar e r ecommended to be include d in all me als and snacks \ncontributing about one thir d of the f ood consumed each day. The \nfoods in this gr oup are high in pr otein and is r ecommended to be \neaten twice a day in small amoun ts. Examples o f each of the f oods \nfrom the Pacific that fit into these categories are shown in the image \nbelow. \nFigure 12.8 Healthy Eating in the Pacific \n51&Itemid=51. Published 2002. Accessed December 2, \n2017. \nPacific Based Dietary Guidelines  |  761', 'Vegetable Group \nAny vegetable or 100% vegetable juice counts as a member of the Vegetable Group. Vegetables \nmay be raw or cooked; fresh, frozen, canned, or dried/dehydrated; and may be whole, cut-up, \nor mashed. Based on their nutrient content, vegetables are organized into 5 subgroups: dark-\ngreen vegetables, starchy vegetables, red and orange vegetables, beans and peas, and other \nvegetables. While it is not necessary to eat vegetables from each subgroup daily, over the \ncourse of a week, vegetables from each subgroup should be eaten to reach ensure the daily \nintake recommendation of the different vitamins is met.35 \n \n \nFigure 15.13 – Broccoli, peppers, carrots, tomatoes, lettuce, cucumbers, radishes, and spinach are in the vegetable \ngroup.36   \n2', '• A variety of vegetables from all of the subgroups—dark green, \nred and orange, legumes (beans and peas), starchy, and other \n• Fruits, especially whole fruits \n• Grains, at least half of which are whole grains \n• Fat-free or low-fat dairy, including milk, yogurt, cheese, and/\nor fortified soy beverages \n• A variety of protein foods, including seafood, lean meats and \npoultry, eggs, legumes (beans and peas), and nuts, seeds, and \nsoy products \n• Oils \nA healthy eating pattern limits: \n• Saturated fats and trans fats \n• Added sugars \n• Sodium \nKey quan titative r ecommendations ar e pr ovided f or se veral \ncomponents of the die t that should be limi ted. These c omponents \nare of particular public health concern in the United States, and the', 'included in the DRIs are obtained through a typical diet, although some foods \nmay be fortified with certain nutrients that are commonly deficient in diets.38 \nChoose MyPlate Food Guide \nThe U.S. Department of Agriculture (USDA) issues dietary guidelines for \nappropriate serving sizes of each food group and number of servings \nrecommended each day. The “Choose MyPlate” food guide is an easy-to-\nunderstand visual representation of how a healthy plate of food should be \ndivided based on food groups. See Figure 14.439\n for a Choose MyPlate image. A \nlittle more than half of the plate should be grains and vegetables, with a focus \non whole grains and a variety of vegetables. About one quarter of the plate \nshould be fruits, with an emphasis on whole fruits. About one quarter of the', 'Dietary Guidelines recommend eating a balanced diet from the five \nfood groups: fruits, vegetables, protein, grains and dairy.3 In Hawai‘i, \nonly about 19% o f adults eat the recommended amount of servings \nof fruits and vegetables per day. Inadequacy of any food group can \nlead to se veral he alth issues. 4 Consuming die ts hig h in frui ts and \nvegetables may have health benefits such as a reduced risk for heart \ndisease, and protection against certain cancers.5 \nLearning Activities \nTechnology Note: The second edition of the Human \nNutrition Open Educational Resource (OER) textbook \nfeatures interactive learning activities.  These activities are \navailable in the web-based textbook and not available in the \n3. All About the Fruit Group. USDA ChooseMyPlate.gov.', 'juice, and squash. The beans, peas, and lentils group includes dried beans, \nblack beans, chickpeas, kidney beans, split peas, and black-eyed peas. (Note \nthat this group does not include green beans or green peas.) This vegetable \ngroup also supplies some protein and can be included in the protein group as \nwell. Starchy vegetables include root vegetables, such as potatoes, as well as \n43. “MyPlate_Vietnamese.png” by USDA is licensed under CC0 \n980  |  14.2 Nutrition Basic Concepts']","The five food groups represented in MyPlate are:

1. Fruits
2. Vegetables
3. Grains
4. Protein
5. Dairy

These groups are essential for planning a healthy diet, as they provide a variety of nutrients necessary for overall health (Source: Unknown).","Vegetables, fruits, grains, protein foods, and dairy.",1.0,0.691666666649375,0.2857142857142857,1.0,0.8467521541569081
What is the 5-2-1-0 recommendation for healthy active living?,"['Image by \nAllison \nCalabrese / \nCC BY 4.0 \nPhysical Activity Recommendations \nThe CDC along wi th the Americ an College o f S ports M edicine \n(ACSM) have evidence based  recommendations and guidelines f or \nindividuals to f ollow in or der to obtain or main tain a he althy \nlifestyle. Adults should ge t a t le ast 150 minutes o f moder ate-\nintensity aer obic ph ysical ac tivity or 75 minutes o f vigor ous-\nintensity aerobic physical activity each week. In addition to aerobic \nphysical ac tivity, i t is r ecommended tha t adults do muscle \nstrengthening activities on e ach major muscle gr oup two or thr ee \ntimes each week. Adults also ar e recommended by the ACSM to do \nflexibility exercises at least t wo to thr ee times a w eek to impr ove', ""338 | H e a l t h ,  S a f e t y ,  a n d  N u t r i t i o n  in  E a r l y  C h i l d h o o d  E d u c a t i o n  \n \n \nFigure 13.1 – The 5-2-1-0 recommendations6 \n \n \nEngaging Families in 5-2-1-0 Recommendations \nShare the recommendations with families with these tips. \n \n5 Fruits and Vegetables a Day \n• Go for the rainbow. Each month, pick a color from the rainbow and try to \neat a new fruit or veggie of that color (green, purple, orange, yellow, \nred). It's a great way for little ones to learn colors while you're all eating \nhealthy. \n• Whenever possible, let your child help get fruits and veggies ready to \nserve. Maybe he can wash an apple or mix the salad. Your little chef may \nbe more likely to try foods that he helps to prepare."", ""patients at every well-child check on diet and lifestyle goals as a part of obesity prevention \ninitiatives (Hassink, 2010). These recommendations, initially put forth by the Maine Youth \nOverweight Collaborative obesity prevention program “Let's Go! 5-2-1-0”, have been promoted \nlocally and nationally for broad consumption (Rogers and Motyka, 2009).5  \n \n \n2 Healthy Active Living: Tips for Health Managers by the National Center on Early Childhood Health and Wellness is \nin the public domain \n3 Guidelines for School Health Programs to Promote Lifelong Healthy Eating by CDC Morbidity and Mortality \nWeekly Report (MMWR) is in the public domain  \n4 Healthy Active Living: Tips for Health Managers by the National Center on Early Childhood Health and Wellness is \nin the public domain"", 'encourage active play that includes a variety of activity types. \nChildren and Adolescents \nIt is important to provide young people opportunities and encouragement to participate in \nphysical activities that are appropriate for their age, that are enjoyable, and that offer variety. \nChildren and adolescents ages 6 through 17 years should do 60 minutes (1 hour) or more of \nmoderate-to-vigorous physical activity daily that includes activity that is aerobic, muscle-\nstrengthening, and bone-strengthening.28 \n \nPhysical activity will be addressed further in Chapter 13. \n \nMyPlate \nMyPlate is the United States Department of Agriculture’s food guidance program to help \nAmericans eat healthy and is based on the Dietary Guidelines for America. It replaces', 'physical activity is more important for achieving health benefits than is any one component \n(frequency, intensity, or duration) or specific mix of activities (aerobic, muscle strengthening, \nbone strengthening). \n \nChildren and adolescents should meet the key guidelines by doing activities that are \nappropriate for their age. Their natural patterns of movement differ from those of adults. For \nexample, children are naturally active in an intermittent way, particularly when they do \nunstructured active play. During recess and in their free play and games, children use basic \naerobic and bone-strengthening activities, such as running, hopping, skipping, and jumping, to \ndevelop movement patterns and skills. They alternate brief periods of moderate- and vigorous', '341 | H e a l t h ,  S a f e t y ,  a n d  N u t r i t i o n  in  E a r l y  C h i l d h o o d  E d u c a t i o n  \n \nper day of activity of all intensities: light, moderate, or vigorous intensity. This is the average \namount of activity observed among children of this age and is consistent with guidelines from \nCanada, the United Kingdom, and the Commonwealth of Australia. \n \nSchool-aged youth (ages 6 through 17 years) can achieve substantial health benefits by doing \nmoderate and vigorous-intensity physical activity for periods of time that add up to 60 minutes \nor more each day. This activity should include aerobic activity as well as age-appropriate \nmuscle- and bone-strengthening activities. It appears that, as in adults, the total amount of', '• Less than 10% of daily calories should come from saturated fats. \n• Less than 10% of daily calories should come from added sugars \n• Shift to healthier food and beverage choices. \n• Support healthy eating patterns for all.27 \n \nPhysical Guidelines for Americans \nThe second edition of the Physical Activity Guidelines for Americans issued by the Department \nof Health and Human Services provides science-based guidance to help people ages 3 years and \nolder improve their health through participation in regular physical activity. Key guidelines \ninclude: \n \nPreschool-Aged Children \nPreschool-aged children (ages 3 through 5 years) should be physically active throughout the day \nto enhance growth and development. Adult caregivers of preschool-aged children should']","The 5-2-1-0 recommendation for healthy active living encourages families to promote healthy habits in children. It includes:

- **5**: Eat at least 5 servings of fruits and vegetables each day.
- **2**: Limit screen time to no more than 2 hours per day.
- **1**: Engage in at least 1 hour of physical activity each day.
- **0**: Avoid sugary drinks, opting for water or low-fat milk instead.

These guidelines aim to support healthy eating and active living among children and adolescents (source: Unknown).","5 fruits and vegetables a day, 2 hours or less of screen time, 1 hour of physical activity, and 0 sugary drinks.",1.0,0.5833333333041666,0.6666666666666666,0.9933017701174031,0.6843034059437094
What types of foods are high-risk choking hazards for children under 4?,"['Foods to Avoid \nMany foods can cause harm to infants, including: \n• Honey should never be given to a child under 12 months, \nincluding honey graham crackers and other foods with honey. \n• Cow’s Milk should never be given to a child under 12 months. \n• Syrups, Sugars, Artificial Sweeteners, and Sugar-Sweetened \nBeverages \n• Vegetables High in Nitrates – spinach, beets, carrots, collard \ngreens, or turnips should not be fed to infants less than 6 \nmonths of age. \n• Raw or Partially Cooked Meat, Fish, or Poultry \nCertain foods should also be a voided as the y are choking hazar ds. \nThese foods are listed in the table fr om the USD A Infant Nutrition \nand Feeding Guidelines. \nTable 13.6 Common Foods That Cause Choking in Children Under \nAge 4 \nInfancy  |  843', '• Never offer foods that are round, hard, small, thick and sticky, smooth, or slippery to \nchildren under four years of age because they can cause choking. Hot dogs (sliced into \nrounds), whole grapes, hard candy, nuts, seeds, raw peas, dried fruit, pretzels, chips, \npeanuts, popcorn, marshmallows, spoonfuls of peanut butter, and chunks of meat, \nwhich are larger than can be swallowed whole are examples of foods that can cause \nchoking. \n• Cut food into small pieces for infants (¼ inch) and toddlers (½ inch). \n• Do not use microwave ovens for warming infant bottles and infant food because the \nmicrowave can heat liquids or food unevenly and to scalding temperatures. The milk or \nformula in a microwaved bottle may reach a higher temperature than the outside of the \nbottle.74', '• Graham crackers \n• Melba toast \n• Noodles \n• Soft cooked vegetables \n• Washed and peeled fruits \n• Graham crackers \n• Melba toast \n• Noodles \n \nHere are foods to avoid as they are a choking hazard: \n• Apple chunks or slices  \n• Grapes \n• Berries \n• Raisins \n• Dry flake cereals  \n• Hot dogs \n• Sausages \n• Peanut butter \n• Popcorn \n• Nuts \n• Seeds  \n• Round candies  \n• Raw vegetables21 \n \n \n19 Human Nutrition by University of Hawai‘i at Mānoa Food Science and Human Nutrition Program is licensed \nunder CC BY 4.0 \n20 Tips for Keeping Infants and Toddlers Safe: A Developmental Guide for Home Visitors – Mobile Infants by Early \nHead Start National Resource Center is in the public domain \n21 Feeding Patterns and Diet - Children 6 Months to 2 Years by MedlinePlus is in the public domain', '78 | H e a l t h ,  S a f e t y ,  a n d  N u t r i t i o n  in  E a r l y  C h i l d h o o d  E d u c a t i o n  \n \nairway increases in size, with 90% of fatal choking happening in children less than 4 years of \nage.55  \n \nReducing the Risks of Choking \nThe main way to prevent choking is to recognize that objects that are 1½ inches or less in \ndiameter are higher risk. 56 Foods are the most common cause of choking. Having children sit \nduring snacks and meals at an unhurried pace, allowing time for children to properly chew their \nfood helps prevent choking on food. Food is safest when cut into small pieces or served in small \namounts. See Table 3.7 for foods that commonly cause choking.  \n \nTable 3.7 – Common Choking Hazards57  \n \nFoods Other Items \n• Cubed cheese', 'Foods Other Items \n• Cubed cheese \n• Fruits (especially when the skin is left \non) \n• Peanut butter \n• Popcorn \n• Pretzels \n• Raisins \n• Vegetables (especially when raw) \n• Ice cubes \n• Candy \n• Balloons \n• Batteries \n• Coins \n• Bottle caps \n• Small balls \n• Office supplies \n \n \nToys, and other items that children may play with, are another common source of choking \nhazards. Ensuring children only have access to age-appropriate toys is an important step. See \nTable 3.7 for items that should be kept out of reach of young children. \n \nTeachers can use a small parts tester, a commercial product commonly known as choke tube, to \ntest whether or not an object is a choking hazard. Recognizing and responding to choking will \nbe addressed in Chapter 5.58', 'that helps them avoid choking and other hazards. Examples include fresh fruits that have been \nsliced into pieces, orange or grapefruit sections, peas or potatoes that have been mashed for \nsafety, a cup of yogurt, and whole-grain bread or bagels cut into pieces. Even with careful \npreparation and training, the learning process can be messy. As a result, parents and other \ncaregivers can help children learn how to feed themselves by providing the following: \n• small utensils that fit a young child’s hand \n• small cups that will not tip over easily \n• plates with edges to prevent food from falling off \n• small servings on a plate \n• highchairs, booster seats, or small enclosed chairs to reach a low table31', 'with fluoride-poor water. Iron deficiency is also a major concern for \nchildren between the ages o f t wo and thr ee. You will le arn about \niron-deficiency anemia later in this section. \nLearning How to Handle Food \nAs children grow older, they enjoy taking care of themselves, which \nincludes self -feeding. During this phase, i t is impor tant to o ffer \nchildren foods that they can handle on their own and that help them \navoid choking and other hazards. Examples include fresh fruits that \nhave be en slic ed in to pie ces, or ange or gr apefruit se ctions, pe as \nor pota toes tha t ha ve be en mashe d f or saf ety, a cup o f y ogurt, \nand whole-grain bread or bagels cut in to pieces. Even with careful \npreparation and tr aining, the le arning process can be messy . As a']","High-risk choking hazards for children under 4 years of age include foods that are round, hard, small, thick and sticky, smooth, or slippery. Specific examples of these foods are:

- Hot dogs (especially when sliced into rounds)
- Whole grapes
- Hard candy
- Nuts
- Seeds
- Raw peas
- Dried fruit
- Pretzels
- Chips
- Peanuts
- Popcorn
- Marshmallows
- Spoonfuls of peanut butter
- Chunks of meat larger than can be swallowed whole

It's important to cut food into small pieces for infants (¼ inch) and toddlers (½ inch) to reduce the risk of choking (Source: Unknown). Always ensure that children sit during meals and snacks to help them chew their food properly (Source: Unknown).","Hot dogs (rounds), whole grapes, hard candy, nuts, seeds, raw peas, dried fruit, pretzels, chips, popcorn, marshmallows, and spoonfuls of peanut butter.",1.0,0.5833333333041666,1.0,0.9693319795442122,0.3108239564238275
What is iron-deficiency anemia and how can it be prevented in toddlers?,"['There are steps tha t parents and c aregivers can take to pr event \niron-deficiency anemia, such as adding mor e ir on-rich f oods to \na child’ s die t, including le an me ats, f ish, poultr y, eggs, legumes, \nand iron-enriched whole-grain breads and c ereals. A toddler’s diet \nshould pr ovide 7 to 10 milligr ams o f ir on dail y. Althoug h milk is \ncritical for the bone-building calcium that it provides, intake should \nnot e xceed the RD A to a void displacing f oods rich wi th ir on. \nChildren may also be given a daily supplement, using infant vitamin \ndrops with iron or f errous sulfate drops. If iron-deficiency anemia \ndoes oc cur, tr eatment includes a dosage o f 3 milligr ams per \nkilogram once daily before breakfast, usually in the form of a ferrous', 'occurs when an ir on-deprived bod y c annot pr oduce enoug h \nhemoglobin, a pr otein in r ed blood c ells tha t tr ansports o xygen \nthroughout the body. The inadequate supply of hemoglobin for new \nblood c ells r esults in anemia. I ron-deficiency anemia c auses a \nnumber o f pr oblems including w eakness, pale skin, shor tness o f \nbreath, and irri tability. It can also r esult in in tellectual, behavioral, \nor motor problems. In infants and toddlers, iron-deficiency anemia \ncan occur as young children are weaned from iron-rich foods, such \nas br east milk and ir on-fortified f ormula. The y beg in to e at solid \nfoods tha t ma y not pr ovide enoug h o f this nutrien t. As a r esult, \ntheir iron stores become diminished at a time when this nutrien t is', '357 | H e a l t h ,  S a f e t y ,  a n d  N u t r i t i o n  in  E a r l y  C h i l d h o o d  E d u c a t i o n  \n \nIron-Deficiency Anemia \nIron deficiency anemia is the most common cause of anemia in the United States.39 This \ncondition occurs when an iron-deprived body cannot produce enough hemoglobin, a protein in \nred blood cells that transports oxygen throughout the body. The inadequate supply of \nhemoglobin for new blood cells results in anemia. Iron-deficiency anemia causes a number of \nproblems including weakness, pale skin, shortness of breath, and irritability. It can also result in \nintellectual, behavioral, or motor problems.  \n \nIn infants and toddlers, iron-deficiency anemia can occur as young children are weaned from', 'iron-rich foods, such as breast milk and iron-fortified formula. They begin to eat solid foods that \nmay not provide enough of this nutrient. As a result, their iron stores become diminished at a \ntime when this nutrient is critical for brain growth and development. \n \nThere are steps that parents and caregivers can take to prevent iron-deficiency anemia, such as \nadding more iron-rich foods to a child’s diet, including lean meats, fish, poultry, eggs, legumes, \nand iron-enriched whole-grain breads and cereals40 and foods high in vitamin C, which helps the \nbody absorb iron efficiently.41 Although milk is critical for the bone-building calcium that it \nprovides, intake should not exceed the recommended daily allowance (RDA) to avoid displacing \nfoods rich with iron.42  \n \nSummary', 'anemia and the most c ommon c auses ar e die tary ir on def iciency \nand chr onic dise ase such as ulc er, inf lammatory dise ases, and \ncancer. Addi tionally, those who ha ve r ecently suf fered fr om \ntraumatic blood loss, fr equently dona te blood, or tak e e xcessive \nantacids for heartburn need more iron in the diet. \nPreventing Iron-Deficiency Anemia \nIn y oung childr en ir on-deficiency anemia c an c ause signif icant \nmotor, mental, and behavioral abnormalities that are long-lasting. In \nthe United States, the hig h incidence of iron-deficiency anemia in \ninfants and children was a major public-health problem prior to the \nearly 1970s, but no w the incidenc e has be en greatly reduced. This \nachievement was accomplished by implementing the scr eening of', 'minerals can be met with a balanced diet, with a few exceptions. According to the American \nAcademy of Pediatrics, toddlers and children of all ages need 600 international units of vitamin \nD per day. Vitamin D-fortified milk and cereals can help to meet this need. However, toddlers \nwho do not get enough of this micronutrient should receive a supplement. Pediatricians may \nalso prescribe a fluoride supplement for toddlers who live in areas with fluoride-poor water. \nIron deficiency is also a major concern for children between the ages of two and three.30  \n \nSelf-Feeding  \nAs children grow older, they enjoy taking care of themselves, which includes self-feeding. \nDuring this phase, it is important to offer children foods that they can handle on their own and', 'sulfate syrup. Consuming vi tamin C, such as or ange juice, can also \nhelp to improve iron absorption.10 \n \nLearning Activities \nTechnology Note: The second edition of the Human \nNutrition Open Educational Resource (OER) textbook \nfeatures interactive learning activities.  These activities are \navailable in the web-based textbook and not available in the \n10. Louis A., Kazal J.R. (2002). Prevention of Iron deficiency \nin infants and toddlers. American Academy of Family \nPhysicians, 66(7), 1217—25. http://www.aafp.org/afp/\n2002/1001/p1217.html. \n862  |  Toddler Years']","Iron-deficiency anemia is a condition that occurs when the body lacks sufficient iron to produce enough hemoglobin, a protein in red blood cells that transports oxygen throughout the body. This deficiency can lead to symptoms such as weakness, pale skin, shortness of breath, irritability, and can also result in intellectual, behavioral, or motor problems, particularly in infants and toddlers (Source: Unknown).

To prevent iron-deficiency anemia in toddlers, parents and caregivers can take several steps:

1. **Incorporate Iron-Rich Foods**: Add more iron-rich foods to a child's diet, including lean meats, fish, poultry, eggs, legumes, and iron-enriched whole-grain breads and cereals.

2. **Monitor Milk Intake**: While milk is important for calcium, its intake should not exceed the recommended daily allowance (RDA) to avoid displacing iron-rich foods.

3. **Consider Supplements**: Children may be given a daily iron supplement, such as infant vitamin drops with iron or ferrous sulfate drops, especially if their dietary intake may not meet their iron needs.

4. **Enhance Iron Absorption**: Consuming foods high in vitamin C, such as orange juice, can help improve iron absorption (Source: Unknown).

By following these guidelines, caregivers can help ensure that toddlers receive adequate iron for their growth and development. If there are concerns about a child's iron levels or symptoms of anemia, it is important to consult a healthcare provider for further evaluation and guidance.","It is a condition where the body cannot produce enough hemoglobin due to lack of iron. It can be prevented by serving iron-rich foods like lean meats, legumes, and iron-fortified cereals, and pairing them with Vitamin C.",1.0,0.99999999998,1.0,0.9462391100828154,0.7227635861181436
What is the difference between a food allergy and food intolerance?,"['Food Allergies \nPaying a ttention to the w ay individuals r eact to v arious f oods is \nessential in determining what foods may specifically affect a person \nadversely. Food aller gies ar e one o f the man y w ays in which \ndifferent bod y mak e-ups af fect nutri tional c oncerns. Althoug h an \nestimated t welve million Americ ans ha ve f ood aller gies, ther e ar e \nlikely man y mor e pe ople who sa y the y ha ve f ood aller gies than \nactually do. This is be cause f ood sensi tization is dif ferent fr om a \nmedically-determined f ood aller gy. W hen some one has a f ood \nallergy, the immune system mistakenly attacks a certain kind of food \n(usually the pr otein component of a f ood), such as pe anuts, as if i t \nwere a threat and IgE antibodies are produced. Doctors sometimes', 'test for food allergies by using skin-prick tests or blood tests to look \nfor the pr esence o f I gE an tibodies. H owever, these t ypes o f tests \nare not always reliable as the y can sometimes yield a false posi tive \nresult. By far, the most valuable tests for determining a food allergy \nis the Double B lind Placebo Controlled Food Challenge (D BPCFC), \nwhich involves administering the food orally and then denoting the \nsigns and symptoms of the allergic response. \nFood allergy symptoms usuall y develop within a f ew minutes to \ntwo hours after a person has eaten a food to which they are allergic. \nThese symptoms c an r ange fr om the anno ying to the poten tially \nfatal, and include: \n• A tingling mouth \n• Swelling tongue and/or throat \n• Difficulty breathing \n• Hives', '• Death \nThere ar e no cle ar tr eatments f or f ood aller gies. Epinephrine is \nsometimes use d to c ontrol se vere r eactions, and individuals wi th \nknown and danger ous aller gies ma y ge t pr escriptions f or self -\ninjectable devices. The onl y certain way to a void allergic reactions \nto f ood is to a void the f oods tha t c ause them. Be yond a voidance, \nthis c an me an r eading f ood labels c arefully, or e ven c alling \nmanufacturers for product information. \nNinety percent of food allergies are caused by these eight foods: \n1. Milk \n2. Eggs \n3. Peanuts \n4. Tree nuts \n5. Fish \n6. Shellfish \n7. Wheat \n8. Soy \nThe prevalence of food allergies is a complex and growing problem. \nIn response to this si tuation, the N ational Institute of Allergy and', 'This does not mean the substance actually causes the\npatient’s symptoms, however, since he or she may have\nno regular exposure to the allergen. In fact, the actual\nallergen may not have been included in the test array.\nFollowing allergen inhalation, reduction in exhala-\ntion capacity of more than 20%, and for at least 10-20\nminutes, indicates a positive reaction to the allergen.\nGastrointestinal symptoms within 24 hours follow-\ning the ingestion of a suspected food allergen indicates a\npositive response.\nResources\nBOOKS\nDavies, R., and S. Ollier. Allergy: The Facts.Oxford, England:\nOxford University Press, 1989.\nLawlor Jr., G. J., T. J. Fischer, and D. C. Adelman. Manual of\nAllergy and Immunology.Boston: Little, Brown and Co.,\n1995.\nRichard Robinson\nAllogenic transplant see Bone marrow', 'Lactose intolerance, though rare in very young children, is one example. Children who suffer \nfrom this condition experience an adverse reaction to the lactose in milk products. It is a result \nof the small intestine’s inability to produce enough of the enzyme lactase, which is produced by \nthe small intestine. Symptoms of lactose intolerance usually affect the GI tract and can include \nbloating, abdominal pain, gas, nausea, and diarrhea. An intolerance is best managed by making \ndietary changes and avoiding any foods that trigger the reaction.32 \n \nCaring for Children with Food Allergies \nStaff who work in schools and early care and education (ECE) programs should develop plans \nfor how they will respond effectively to children with food allergies. Although the number of', 'The Major Types of \nFoodborne Illness \nUNIVERSITY OF HAWAI‘I AT MĀNOA FOOD SCIENCE AND HUMAN \nNUTRITION PROGRAM AND HUMAN NUTRITION PROGRAM \nFoodborne illnesses ar e ei ther inf ectious or to xic in na ture. The \ndifference depends on the agen t tha t c auses the c ondition. \nMicrobes, such as bacteria, cause food infections, while toxins, such \nas the kind pr oduced b y molds, c ause in toxications. Dif ferent \ndiseases manif est in dif ferent w ays, so signs and symptoms c an \nvary with the source of contamination. However the illness oc curs, \nthe microbe or to xin enters the bod y through the gastr ointestinal \ntract, and as a r esult common symptoms include diarr hea, nausea, \nand abdominal pain. Addi tional symptoms ma y include v omiting,', 'aged childr en. R ecent studies sho w tha t thr ee million childr en \nunder age eighteen are allergic to at least one type of food.6 \nSome of the most common allergenic foods include peanuts, milk, \neggs, so y, whe at, and shellf ish. An aller gy oc curs when a pr otein \nin food triggers an immune r esponse, which r esults in the r elease \nof an tibodies, histamine, and other def enders tha t a ttack f oreign \nbodies. Possible symptoms include itchy skin, hives, abdominal pain, \nvomiting, diarr hea, and na usea. S ymptoms usuall y de velop wi thin \nminutes to hours af ter c onsuming a f ood aller gen. Childr en c an \noutgrow a f ood allergy, especially allergies to whe at, milk, eggs, or \nsoy. \nAnaphylaxis is a life-threatening reaction that results in difficulty']","The context provided does not explicitly define the difference between a food allergy and food intolerance. However, it does mention that food allergies involve the immune system mistakenly attacking a certain food, typically a protein, leading to the production of IgE antibodies. Symptoms can range from mild to potentially fatal and usually develop within minutes to two hours after consuming the allergenic food.

On the other hand, lactose intolerance is mentioned as an example of an intolerance, which occurs due to the small intestine's inability to produce enough of the enzyme lactase, leading to gastrointestinal symptoms such as bloating, abdominal pain, gas, nausea, and diarrhea. Intolerances are generally managed by dietary changes and avoiding trigger foods.

In summary, food allergies involve an immune response and can be life-threatening, while food intolerances typically involve digestive issues and are not mediated by the immune system. For a more comprehensive understanding, consulting a healthcare provider is recommended.","A food allergy involves an immune system response (like anaphylaxis), whereas food intolerance (like lactose intolerance) usually involves the digestive system and does not involve the immune system.",1.0,0.9999999999,0.9166666666666666,0.0,0.9215254259770433
What is Celiac Disease?,"['Celiac dise ase is most c ommon in pe ople o f Eur opean desc ent \nand is r are in pe ople o f Afric an Americ an, J apanese, and Chinese \ndescent. It is much mor e pr evalent in w omen and in pe ople wi th \nType 1 diabetes, autoimmune thyroid disease, and Down and Turner \nsyndromes. S ymptoms c an r ange fr om mild to se vere and c an \ninclude pale, fa tty, loose stools, gastr ointestinal upse t, abdominal \npain, w eight loss and, in childr en, a failur e to gr ow and thriv e. \nThe symptoms c an appe ar in infanc y or much la ter in lif e, e ven \nNutrition, Health and Disease  |  1079', 'a disease in which bones become brittle. \nIf you think you or someone close to you may have celiac disease, \ndo not despair; i t is a v ery tr eatable dise ase. Onc e diagnose d, a \nperson follows a g luten-free diet for life. This r equires dedication \nand careful detective work to seek out foods with hidden gluten, but \nsome stores carry gluten-free foods. After eliminating gluten from \nthe diet, the tissues of the small intestine rapidly repair themselves \nand heal in less than six months. \n1080  |  Nutrition, Health and Disease', 'by age seventy. Celiac disease is not al ways diagnosed because the \nsymptoms ma y be mild. A lar ge number o f pe ople ha ve wha t is \nreferred to as “silent” or “latent” celiac disease. \nCeliac disease diagnosis requires a blood test and a biopsy o f the \nsmall in testine. Be cause c eliac dise ase is an a utoimmune dise ase, \nantibodies produced by white blood cells circulate in the bod y and \ncan be de tected in the blood. W hen g luten-containing f oods ar e \nconsumed the an tibodies a ttack c ells lining the small in testine \nleading to a destruc tion o f the small villi pr ojections. This tissue \ndamage can be detected with a biopsy, a procedure that removes a \nportion of tissue from the damaged organ. Villi destruction is what', ""356 | H e a l t h ,  S a f e t y ,  a n d  N u t r i t i o n  in  E a r l y  C h i l d h o o d  E d u c a t i o n  \n \nResearchers are still learning more about gluten sensitivity.35 A more \nserious concern surrounding gluten that has more acknowledgment in the \nmedical field is celiac disease. \n \nCeliac Disease \nCeliac disease is an immune disease in which people can't eat gluten \nbecause it will damage their small intestine. If they have celiac disease and \neat foods with gluten, the immune system responds by damaging the small \nintestine. Gluten is a protein found in wheat, rye, and barley. It may also be \nin other products like vitamins and supplements, hair and skin products, \ntoothpaste, and lip balm.  \n \nCeliac disease affects each person differently. Symptoms may occur in the"", ""digestive system, or other parts of the body. One person might have \ndiarrhea and abdominal pain, while another person may be irritable or \ndepressed. Irritability is one of the most common symptoms in children. \nSome people have no symptoms. \n \nCeliac disease is genetic. Blood tests and tissue biopsies may be used to \ndiagnose celiac disease. 36 “Many kids are diagnosed with it when they're \nbetween 6 months and 2 years old, which is when most kids get their first \ntaste of gluten in foods.”37 Treatment is a diet free of gluten, which is \nessential to prevent damage to the small intestine.38 So it is critical that \ntheir food does not contain and is not contaminated with gluten. Because \ngluten is found in many foods, reading nutrition labels will be vital."", ""thrive, learn, and succeed.34 \n \n \n \nGluten Intolerance and Celiac Disease \nOne particular intolerance to be aware of that may affect children in early \ncare and education programs is gluten intolerance. Gluten is a protein \nfound in wheat, rye, and barley. It is found mainly in foods but may also be \nin other products like medicines, vitamins, and supplements. People with \ngluten sensitivity have problems with gluten. It is different from celiac \ndisease (see below), an immune disease in which people can't eat gluten \nbecause it will damage their small intestine. \n \nSome of the symptoms of gluten sensitivity are similar to celiac disease. \nThey include tiredness and stomachaches. It can cause other symptoms \ntoo, including muscle cramps and leg numbness. But it does not damage"", 'causes man y o f the symptoms o f c eliac dise ase. The destruc tion \nof the absorptiv e surface of the small in testine also r esults in the \nmalabsorption of nutrients, so tha t while pe ople with this dise ase \nmay e at enoug h, nutrien ts do not mak e i t to the bloodstr eam \nbecause absorption is r educed. The ef fects o f nutrien t \nmalabsorption are most apparent in children and the elderly as they \nare especially susceptible to nutrient deficiencies. Over time these \nnutrient def iciencies c an c ause he alth pr oblems. P oor absorption \nof ir on and f olic acid c an c ause anemia, which is a de crease in \nred blood c ells. Anemia impairs o xygen transport to all c ells in the \nbody. Calcium and vi tamin D def iciencies can lead to osteoporosis,']","Celiac disease is an autoimmune disease in which individuals cannot eat gluten because it damages their small intestine. Gluten is a protein found in wheat, rye, and barley, and consuming it triggers an immune response that harms the lining of the small intestine. This damage leads to the destruction of the small villi projections, which are essential for nutrient absorption. Symptoms of celiac disease can vary widely and may include gastrointestinal issues such as diarrhea, abdominal pain, and weight loss, as well as non-digestive symptoms like irritability or depression, particularly in children. Diagnosis typically involves blood tests to detect specific antibodies and a biopsy of the small intestine to assess tissue damage. The primary treatment for celiac disease is a strict, lifelong gluten-free diet, which allows the small intestine to heal and prevents further damage (Sources: Unknown). 

If you suspect you or someone you know may have celiac disease, it's important to consult a healthcare provider for proper diagnosis and management.","Celiac disease is an immune disease where eating gluten (found in wheat, rye, barley) damages the small intestine.",1.0,0.5249999999868751,0.9333333333333333,0.9347948114289139,0.4859076396873492
What are the nutritional benefits of Family Style Meal Service?,"['412 | H e a l t h ,  S a f e t y ,  a n d  N u t r i t i o n  in  E a r l y  C h i l d h o o d  E d u c a t i o n  \n \n \nFigure 15.16 – Family style meals have many benefits for children.57 \n \nThis approach to mealtime creates a number of healthy habits that are important to the growth \nand development of children at any age. Children tend to eat more healthy foods if they see \ntheir friends try it. They learn skills such as taking turns, sharing, and teamwork. \n \nFamily style dining opens up opportunities for conversation, which increases vocabulary, \npromotes proper use of language and interaction with friends. \n \nThere are even more benefits that support healthy growth. Children learn: \n• portion sizes for each food group \n• to recognize when they are hungry or satisfied', '• how to identify healthy foods and where they come from \n• to improve fine motor skills \n \nChildren are not the only ones who benefit. Providers get a better grasp of food costs, get help \nwith mealtime service and, with less food being wasted, they save money.58 \n \n \nTips for Family Style Dining \n• Start with the right equipment. When purchasing serving dishes, \nutensils and other place settings, keep in mind that they need to be \nkid-friendly and sized for little hands to maneuver \n• Remember each child’s skill level when choosing your menu. Finger \nfoods and foods that are easy to navigate with a child-size fork or \nspoon are easiest to self-serve for younger children. \n• Have multiple sets of utensils and serving spoons in case someone \ndrops one on the floor.', '(including those that may not have been presented in the book)?   \n \nFamily Style Meal Service \nCurrently, traditional family style meal service is the recommended approach to serving meals \nin preschool settings. Using this approach, all foods on the menu are served at the same time in \nserving bowls that are passed around the table, and children self-serve the amounts they \ndesire. There are a number of potential advantages to traditional family-style meal service \nincluding allowing children the opportunity to self-regulate consumption (match food selection \nwith hunger level).56  \n \n \n54 Dietary Guidelines for Americans 2015–2020 Appendix 5. USDA Food Patterns: Healthy Vegetarian Eating \nPattern by the Office of Disease Prevention and Health Promotion is in the public domain', 'foods brought from home. They also site several studies that demonstrated that knowledge and \nattitudes about nutrition were positively linked to serving fruits and vegetables to children. As \nthey stated, parents report barriers to supporting their young children’s healthy eating. \n“Common barriers for consumption of fruits and vegetables are the child’s preferences, \npreparation time involved, and higher cost of those items.”60 \n \n \n59 Why You Should Serve Family Style by the National CACFP Sponsors Organization as appears on hhs.gov is in the \npublic domain. \n60 Sweitzer, S. J., Briley, M. E., Roberts-Gray, C., Hoelscher, D. M., Staskel, D. M., & Almansour, F. D. (2011). How to', 'meals and snacks that offered variety and were visually appealing? What \nabout the versions you created? \n \nCost \nWhile well-balanced nutrition should never be sacrificed to save money, early care and \neducation programs must also consider the costs of the menus they plan. One way to save costs \nis to use cycle menus. A cycle menu follows a particular pattern and repeats on a regular \nbasis. The length of the cycle can vary, but may be 4-6 weeks long and can be different lengths \nfor different meals/snacks (for instance, with breakfast repeating more often than lunches). \nAnd they can be updated as needed to include new foods or make other accommodations.20  \n \n \n17 Introduction to Food Production and Service by Beth Egan is licensed under CC BY 4.0', 'consume more nutritious foods.2 \nChildren and Malnutrition \nMalnutrition is a pr oblem man y childr en fac e, in both de veloping \nnations and the de veloped w orld. Ev en wi th the w ealth o f f ood \nin N orth Americ a, man y childr en gr ow up malnourishe d, or e ven \nhungry. The US Census B ureau characterizes households in to the \nfollowing groups: \n• food secure \n• food insecure without hunger \n• food insecure with moderate hunger \n2. Research on the Benefits of Family Meals. Dakota \nCounty, Minnesota. https://www.co.dakota.mn.us/\nHealthFamily/HealthyLiving/DietNutrition/\nDocuments/ReturnFamilyMeals.doc. Updated April 30, \n2012. Accessed December 4, 2017. \nChildhood  |  877', '• Provide choices for children. \n• Offer a variety of nutritious, appetizing foods in small portions. \n• Encourage children to chew their food well and eat slowly. \n• Teach children to recognize signs of hunger. \n• Discuss how the body uses food. \n \nChildren learn about food and develop food preferences through their direct experiences with \nfood (i.e., handling, preparing, eating) and by observing the eating behaviors of adults and \npeers. The goal in preschool is that children will learn to eat a variety of nutritious foods and \nbegin to recognize the body’s physical need for food (i.e., hunger and fullness). \n \n \nFigure 13.4 – Serving meals family-style supports children’s self-regulation.14 \n \nThrough modeling, repeated and various exposures to food, and social experiences, children']","Family Style Meal Service offers several nutritional benefits for children, including:

1. **Self-Regulation of Consumption**: Children have the opportunity to self-serve, which allows them to match their food selection with their hunger levels. This can help them learn to recognize when they are hungry or satisfied (Source: Unknown).

2. **Exposure to Healthy Foods**: Children are more likely to try healthy foods when they see their peers doing so. This social aspect encourages them to eat a variety of nutritious foods (Source: Unknown).

3. **Learning Portion Sizes**: Through family-style dining, children learn about appropriate portion sizes for each food group, which can contribute to healthier eating habits (Source: Unknown).

4. **Improved Food Preferences**: Children develop food preferences through direct experiences with food, such as handling, preparing, and eating, as well as by observing the eating behaviors of adults and peers (Source: Unknown).

5. **Enhanced Vocabulary and Language Skills**: The mealtime conversation that occurs during family-style dining can promote proper use of language and interaction, which indirectly supports overall development, including understanding food and nutrition (Source: Unknown).

Overall, Family Style Meal Service not only promotes healthy eating habits but also supports children's growth and development in various ways. Always consult a healthcare provider for personalized dietary advice.","It allows children to self-regulate consumption (eating according to hunger), learn portion sizes, and identify healthy foods, while also improving motor skills.",1.0,0.8928571428348213,0.9411764705882353,0.9831089022411318,0.8637397290564537
What is the minimum internal temperature for cooking ground meats?,"['420 | H e a l t h ,  S a f e t y ,  a n d  N u t r i t i o n  in  E a r l y  C h i l d h o o d  E d u c a t i o n  \n \n \nFigure 15.20 – Use a meat thermometer to ensure food is cooked properly. \n \nTable 15.8 – Safe Minimum Internal Temperature Chart73 \n \nFood Product Minimum Internal Temperature (F) & Rest \nTime \nGround meats 160\uf0b0 \nBeef, Pork, Veal & Lamb Steaks, chops, \nroasts \n145\uf0b0 and allow to rest for at least 3 \nminutes \nHam, fresh or smoked (uncooked) 145\uf0b0 and allow to rest for at least 3 \nminutes \nFully Cooked Ham (to reheat) \nReheat cooked hams packaged in USDA-\ninspected plants to 140 °F; all others to \n165 °F \nAll Poultry (breasts, whole bird, legs, thighs, \nand wings, ground poultry, and stuffing) \n \n165\uf0b0 \n \nEggs 160\uf0b0 \nFish & Shellfish 145\uf0b0 \nLeftovers, to reheat 165\uf0b0', 'the sta te o f “ cooked” b y c olor and te xture alone. I nstead, use a \nfood thermome ter to be sur e. The appr opriate minimum c ooking \ntemperature varies depending on the t ype of food. Seafood should \nbe cooked to an internal temperature of 145°F, beef, lamb, and pork \nto 160°F, gr ound chick en and tur key to 165°F, poultr y br easts to \n165°F, and whole poultr y and thig hs to 180°F. W hen microwaving, \nrotate the dish and stir c ontents se veral times to ensur e e ven \ncooking. \nServing Food \nAfter f ood has be en c ooked, the possibili ty o f bac terial gr owth \nincreases as the temper ature drops. So, food should be k ept above \nthe safe temperature of 140°F, using a heat source such as a chafing \ndish, w arming tr ay, or slo w c ooker. Cold f oods should be k ept a t', 'dough, cake batter, or eating other foods made with raw eggs such as ice cream, \nmayonnaise, and eggnog. \n• Use a meat thermometer to determine the temperature in the thickest part of the \nmeat.71 Cook all food to these minimum internal temperatures provided in Table 15.8 as \nmeasured with a food thermometer before removing food from the heat source. For \nreasons of personal preference, consumers may choose to cook food to higher \ntemperatures.72 \n \n \n69 Child Care Center Self Assessment Guide: Safe Food Handling and Preparation \nLicensing Requirements and Best Practices by the California Department of Social Services Community Care \nLicensing Division is in the public domain \n70 Child Care Center Self Assessment Guide: Safe Food Handling and Preparation', 'Leftovers, to reheat 165\uf0b0 \nLeftovers 165\uf0b0 \n \n \n73 Safe Minimum Internal Temperature Chart by the USDA Food Safety and Inspection Service is in the public \ndomain', 'refrigerator and disc ard lef tover marinade af ter use be cause i t \ncontains raw juices. Always use clean cutting boards, which should \nbe washed with soap and w arm water by hand or in a dish washer \nafter e ach use. Another w ay to sani tize cut ting boar ds is to rinse \nthem wi th a solution o f 5 millili ters (1 te aspoon) chlorine ble ach \nto about 1 li ter (1 quar t) of water. If possible, use separ ate cutting \nboards f or fr esh pr oduce and f or r aw me at. Also, w ash the top \nbefore opening c anned f oods to pr event dir t fr om c oming in to \ncontact with food. \nCooking Food \nCooked food is safe to eat only after it has been heated to an internal \ntemperature that is hig h enough to kill bac teria. You cannot judge', 'kitchen hazards.69 \n \nThawing \nTo protect against foodborne illness, follow the following practices when thawing frozen foods \n• Do not thaw meat, poultry, and fish products on the counter or sink because harmful \nbacteria can grow at room temperature. \n• Thaw food in the refrigerator or microwave oven. \n• Immediately cook food thawed in the microwave. \n• Use defrosted food (cooked or frozen) within 1 to 2 days.70 \n \nCooking \nFoods must be cooked at high enough temperatures and for long enough to kill any possible \nmicroorganisms they may be contaminated with. Here are some general guidelines \n• Never serve raw or slightly cooked eggs. Cook eggs until the white is firm and the yolk \nbegins to harden. Substitute pasteurized eggs for raw eggs if sampling homemade', 'containers, or otherwise protected from contamination. \n• Wrap raw meat, poultry, and seafood securely to prevent raw juices from contaminating \nother foods. Store them in the meat drawer or coldest section of the refrigerator or \nfreezer. \n• Do not store perishable foods, such as eggs, in the refrigerator door. The temperature of \nstorage bins in the door fluctuates more than the temperature in the cabinet. \n• Cook or freeze fresh poultry, fish, ground meat, and mixed meats within 2 days after you \nbuy them. Cook or freeze other beef, veal, lamb, or pork within 3 to 5 days. \n• Use the cold storage chart in Table 15.9 for guidelines of how long different food \nproducts can be safely stored in the refrigerator and freezer.']",The minimum internal temperature for cooking ground meats is 160°F (71°C) (Source: Unknown). It's important to use a meat thermometer to ensure that the food has reached this temperature to kill any harmful bacteria. Always consult a healthcare provider for any specific dietary concerns or questions.,Ground meats should be cooked to an internal temperature of 160°F.,1.0,0.99999999995,0.75,0.9999999999999997,0.5290867408729942
How do vaccines work biologically?,"['Stiffness in neck \nand muscles, \ndifficulty \nswallowing, \nmuscle spasms, \nfever \nBroken bones, \nbreathing difficulty, \ndeath \n \n \nHow Vaccines Work \nThe immune system helps the human body fight germs by producing substances to combat \nthem. Once it does, the immune system “remembers” the germ and can fight it again. Vaccines \ncontain germs that have been killed or weakened. When given to a healthy person, the vaccine \ntriggers the immune system to respond and thus build immunity. \n \nBefore vaccines, people became immune only by actually getting a disease and surviving it. \nImmunizations are an easier and less risky way to become immune. \n \nVaccines are the best defense we have against serious, preventable, and sometimes deadly', ""Vaccinologist\nVaccination (or immunization) involves the delivery, usually by injection as shown inFigure 42.18, of\nnoninfectious antigen(s) derived from known pathogens. Other components, called adjuvants, are delivered\nin parallel to help stimulate the immune response. Immunological memory is the reason vaccines work.\nIdeally, the effect of vaccination is to elicit immunological memory, and thus resistance to specific pathogens\nwithout the individual having to experience an infection.\nFigure 42.18 Vaccines are often delivered by injection into the arm. (credit: U.S. Navy Photographer's Mate\nAirman Apprentice Christopher D. Blachly)\nVaccinologists are involved in the process of vaccine development from the initial idea to the availability"", 'of the completed vaccine. This process can take decades, can cost millions of dollars, and can involve\nmany obstacles along the way. For instance, injected vaccines stimulate the systemic immune system,\neliciting humoral and cell-mediated immunity, but have little effect on the mucosal response, which presents\na challenge because many pathogens are deposited and replicate in mucosal compartments, and the\ninjection does not provide the most efficient immune memory for these disease agents. For this reason,\nvaccinologists are actively involved in developing new vaccines that are applied via intranasal, aerosol,\noral, or transcutaneous (absorbed through the skin) delivery methods. Importantly, mucosal-administered', 'such as those that cause the childhood diseases measles, mumps, and rubella, mutate so infrequently that the\nsame vaccine is used year after year.\nFigure 21.14 Vaccinations are designed to boost immunity to a virus to prevent infection. (credit: USACE Europe\nDistrict)\nWatch this NOVAvideo (http://openstaxcollege.org/l/1918_flu)to learn how microbiologists are attempting\nto replicate the deadly 1918 Spanish influenza virus so they can understand more about virology.\nVaccines and Antiviral Drugs for Treatment\nIn some cases, vaccines can be used to treat an active viral infection. The concept behind this is that by giving\nthe vaccine, immunity is boosted without adding more disease-causing virus. In the case ofrabies, a fatal', 'are usually made by attenuating (weakening) the “wild-type” (disease-causing) virus by growing it in the\nlaboratory in tissues or at temperatures different from what the virus is accustomed to in the host. Adaptations\nto these new cells or temperatures induce mutations in the genomes of the virus, allowing it to grow better in the\nlaboratory while inhibiting its ability to cause disease when reintroduced into conditions found in the host. These\nattenuated viruses thus still cause infection, but they do not grow very well, allowing the immune response to\ndevelop in time to prevent major disease. Back mutations occur when the vaccine undergoes mutations in the\nhost such that it readapts to the host and can again cause disease, which can then be spread to other humans in', 'produce immunity about 90–100% of the time. \nWhat about the argument made by some people that vaccines don’t work that well and that \ndiseases would be going away on their own because of better hygiene or sanitation, even if \nthere were no vaccines? \n \nThat simply isn’t true. Certainly better hygiene and sanitation can help prevent the spread of \ndisease, but the germs that cause disease will still be around, and as long as they are they will \ncontinue to make people sick. \n \nAll vaccines must be licensed (approved) by the Food and Drug Administration (FDA) before \nbeing used in the United States, and a vaccine must go through extensive testing to show that it \nworks and that it is safe before the FDA will approve it. Among these tests are clinical trials,', 'Figure 21.13 A sampling of human viruses. Viruses can cause dozens of ailments in humans, ranging from mild\nillnesses to serious diseases. (credit: modification of work by Mikael Häggström)\nVaccines for Prevention\nThe primary method of controlling viral disease is byvaccination, which is intended to prevent outbreaks by\nbuilding immunity to a virus or virus family (Figure 21.14). Vaccines may be prepared using live viruses, killed\nviruses, or molecular subunits of the virus. Note that the killed viral vaccines and subunit viruses are both\nincapable of causing disease, nor is there any valid evidence that vaccinations contribute to autism.\nLive viral vaccines are designed in the laboratory to cause few symptoms in recipients while giving them']","Vaccines work biologically by stimulating the immune system to produce a response against specific pathogens without causing the disease itself. They contain noninfectious antigens derived from known pathogens, which trigger the immune system to respond and build immunity. This process involves the creation of immunological memory, allowing the immune system to ""remember"" the germ and fight it effectively if encountered again in the future.

When a vaccine is administered, it elicits both humoral (antibody-mediated) and cell-mediated immunity, helping the body to develop resistance to the targeted pathogens. Vaccines can be made from killed or weakened viruses, and they are designed to provide immunity without the individual having to experience the actual infection (Source: Unknown). 

Overall, vaccines are a crucial method for preventing outbreaks of viral diseases by building immunity in the population (Source: Unknown).","Vaccines contain killed or weakened germs. When administered, they trigger the immune system to produce antibodies to fight the germ, helping the body 'remember' how to fight the disease in the future without causing the illness itself.",1.0,0.8528571428400857,1.0,0.9276174549464944,0.9807658868576197
What is the biological mechanism of Abusive Head Trauma (Shaken Baby Syndrome)?,"['otherwise causing physical harm. Physical discipline, such as spanking or paddling, is not \nconsidered abuse as long as it is reasonable and causes no bodily injury to the child. Injuries \nfrom physical abuse could range from minor bruises to severe fractures or death. \n \n \n \nAbusive Head Trauma \nAbusive head trauma (AHT), which includes shaken baby syndrome, is a \npreventable and severe form of physical child abuse that results in an injury \nto the brain of a child. AHT is most common in children under age five, with \nchildren under one year of age at most risk. It is caused by violent shaking \nand/or with blunt impact. The resulting injury can cause bleeding around \nthe brain or on the inside back layer of the eyes.', 'violently shaking or hitting a baby’s head into something, knowing the risk \nfactors and the triggers for abuse, and finding ways to support families and \ncaregivers in their community.6 \n \nThe Bottom Line \nShaking a baby can cause death or permanent brain damage. It can result in \nlife-long disability. \nHealthy strategies for dealing with a crying baby include:  \n• finding the reason for the crying \n• checking for signs of illness or discomfort, such as diaper rash, \nteething, tight clothing; \n• feeding or burping; \n• soothing the baby by rubbing its back; gently rocking; offering a \npacifier; singing or talking; \n• taking a walk using a stroller or a drive in a properly-secured car \nseat;  \n• or calling the doctor if sickness is suspected', '148 | H e a l t h ,  S a f e t y ,  a n d  N u t r i t i o n  in  E a r l y  C h i l d h o o d  E d u c a t i o n  \n \n \n \nFigure 6.2 – Long-term damage or death are the \nconsequence of almost all victims of AHT.5 \n \nAHT often happens when a parent or caregiver becomes angry or frustrated \nbecause of a child’s crying. The caregiver then shakes the child and/or hits \nor slams the child’s head into something in an effort to stop the crying. \n \nCrying, including long bouts of inconsolable crying, is normal behavior in \ninfants. Shaking, throwing, hitting, or hurting a baby is never the right \nresponse to crying. \n \nHow Can Abusive Head Trauma Be Prevented? \nAnyone can play a role in preventing AHT by understanding the dangers of', 'having occurred at different times)is nearly always\nindicative of BCS. Establishing the diagnosis is often\nhindered by the excessive cautiousness of caregivers or\nby actual concealment of the true origin of the child˛s\ninjuries, as a result of fear, shame and avoidance or\ndenial mechanisms.\nTreatment\nMedical treatment for battered child syndrome will\nvary according to the type of injury incurred. Counseling\nand the implementation of an intervention plan for the\nchild’s parents or guardians is necessary. The child abuser\nmay be incarcerated, and/or the abused child removed\nfrom the home to prevent further harm. Reporting child\nabuse to authorities is mandatory for doctors, teachers,\nand childcare workers in most states as a way to prevent', 'accidental trauma (NAT).\nDescription\nInternal injuries, cuts, burns, bruises and broken or\nfractured bones are all possible signs of battered child\nsyndrome. Emotional damage to a child is also often the\nby-product of child abuse, which can result in serious\nbehavioral problems such as substance abuse or the\nphysical abuse of others. Approximately 14% of children\nin the United States are physically abused each year, and\nan estimated 2,000 of those children die as a result of the\nabuse. Between 1994–1995, 1.1 million cases of child\nabuse were recorded in the United States; of that number,\n55% of the victims were less than a year old.\nCauses and symptoms\nBattered child syndrome (BCS) is found at every\nlevel of society, although the incidence may be higher in', 'infant or child may trigger abuse. Symptoms may include\na delayed visit to the emergency room with an injured\nchild; an implausible explanation of the cause of a child’s\ninjury; bruises that match the shape of a hand, fist or belt;\ncigarette burns; scald marks; bite marks; black eyes;\nunconsciousness; bruises around the neck; and a bulging\nfontanel in infants.\nDiagnosis\nBattered child syndrome is most often diagnosed by\nan emergency room physician or pediatrician, or by\nteachers or social workers. Physical examination will\ndetect bruises, burns, swelling, retinal hemorrhages. X\nrays, and other imaging techniques, such as MRI or scans\nmay confirm fractures or other internal injuries. The\npresence of injuries at different stages of healing (i.e.', 'been the victims of child maltreatment.  \n \n \n \n \n \nResources for Further Exploration \n• What is Child Abuse and Neglect?: \nhttps://www.childwelfare.gov/pubpdfs/whatiscan.pdf \n• Children’s Bureau: https://www.acf.hhs.gov/cb/focus-areas/child-\nabuse-neglect  \n• Children’s Bureau’s Office on Child Abuse and Neglect Prevention \nGuide:  https://www.childwelfare.gov/pubPDFs/guide_2018.pdf \n• CDC: \nhttps://www.cdc.gov/violenceprevention/childabuseandneglect/in\ndex.html \n• California Department of Education’s Child Abuse Identification & \nReporting Guidelines: \nhttps://www.cde.ca.gov/ls/ss/ap/childabusereportingguide.asp \n• Los Angeles County Department of Children and Family Services’ \nElectronic Mandated Reporter: https://mandreptla.org/cars.web/ \n• National Center on Shaken Baby Syndrome:']","The context provided does not include specific details about the biological mechanism of Abusive Head Trauma (AHT), also known as Shaken Baby Syndrome. It mentions that AHT results in an injury to the brain of a child, which can cause bleeding around the brain or on the inside back layer of the eyes due to violent shaking and/or blunt impact. However, it does not elaborate on the underlying biological processes involved in these injuries.

For a comprehensive understanding of the biological mechanisms, it would be best to consult a healthcare provider or relevant medical literature.","Violent shaking causes the brain to hit the skull, which can result in bleeding around the brain or behind the eyes, leading to permanent brain damage or death.",1.0,0.9999999999666667,0.875,0.0,0.5707159360381282
Explain the fecal-oral route of disease transmission.,"[""Fecal-Oral Transmission \nWhen organisms that live in our intestines get into our mouths they can cause illness. Usually, \nthis happens via someone's hands, usually our own. Fecal-oral routes diseases include: \n• Hepatitis A \n• diarrhea \n• hand, foot, and mouth disease  \n• pinworms \n• rotavirus \n• norovirus \n• giardia \n• shigella \n• cryptosporidiosis  \n \nThat is why it is so important that everyone wash hands after using the bathroom, changing \ndiapers, when preparing food, and before eating. \n \n \n3 Image from Managing Infectious Disease in Head Start Webinar by Head Start Early Childhood Learning & \nKnowledge Center is in the public domain"", 'digestive tract.8 For this reason, feces can contain microorganisms that can \ncause the spread of infection, making it essential to perform good hand \nhygiene to prevent transmission of disease through the fecal-oral route. \n8. Parker, N., Schneegurt, M., Tu, A.-Hue T., Forster, B. M., & Lister, P. (2016). \nMicrobiology. OpenStax. Access for free at https://openstax.org/books/\nmicrobiology/pages/1-introduction \n9.3 Natural Defenses Against Infection  |  587', 'How Illnesses are Transmitted \nBacteria, viruses, fungi, and parasites that cause illness can be transmitted in five ways, \nincluding through: \n1. the respiratory route \n2. the fecal-oral route \n3. the direct contact route \n4. the bodily fluid route (including blood, urine, vomit, and saliva)  \n5. the vector-borne route \n \nRespiratory Transmission \nMost respiratory germs stay in the nose, sinuses, mouth and throat, or possibly the middle ear. \nUpper respiratory illnesses (colds) are the most common and the most likely to be transmitted \nin early care and education settings.  \n \nThe more common respiratory illnesses include: \n• Sinusitis \n• Sore throat \n• Common cold \n• Recurrent middle ear infection \n• Strep throat \n• RSV \n• Pneumonia \n• Bronchitis', '478 | H e a l t h ,  S a f e t y ,  a n d  N u t r i t i o n  in  E a r l y  C h i l d h o o d  E d u c a t i o n  \n \n \nFigure M.6 – Ulcers in the mouth18 \n \nThe virus can spread from person-to-person through tiny, air droplets that are released when \nthe sick person sneezes, coughs, or blows their nose. You can catch hand-foot-mouth disease if: \n• A person with the infection sneezes, coughs, or blows their nose near you. \n• You touch your nose, eyes, or mouth after you have touched something contaminated \nby the virus, such as a toy or doorknob. \n• You touch stools or fluid from the blisters of an infected person. \n \nThe virus is most easily spread the first week a person has the disease. The time between \ncontact with the virus and the start of symptoms is about 3 to 7 days.19', 'Figure 9.16 Chain of Infection \nFor a pathogen to continue to exist, it must put itself in a position to be \ntransmitted to a new host, leaving the infected host through a portal of exit. \nSimilar to portals of entry, the most common portals of exit include the skin \nand the respiratory, urogenital, and gastrointestinal tracts. Coughing and \nsneezing can expel thousands of pathogens from the respiratory tract into \nthe environment. Other pathogens are expelled through feces, urine, semen, \n9.6 Preventing Infection  |  623', ""195 | H e a l t h ,  S a f e t y ,  a n d  N u t r i t i o n  in  E a r l y  C h i l d h o o d  E d u c a t i o n  \n \n• Diphtheria \n• Pertussis \n• Pneumonia \n• Seasonal flu \n \nIf we could actually see what comes out of a child's mouth along with a cough or a sneeze, we \nmight appreciate the respiratory route of infectious disease transmission more.  \n \nFigure 8.4 – What it might look like if we could see what a child coughs or sneezes.3 \n \nThe germs that are in this contaminated cloud of exhalation can wind up on surfaces and hands \nand be transmitted to others. Staff and children who are able to are encouraged to cough into \ntheir sleeves. Covering your mouth with your hand only transfers these germs to your hand. \nThis will be addressed more in depth later in the chapter."", '494 | H e a l t h ,  S a f e t y ,  a n d  N u t r i t i o n  in  E a r l y  C h i l d h o o d  E d u c a t i o n  \n \nShigella spreads when people put something in their mouths or swallow something that has \ncome into contact with stool of a person infected with Shigella. \n \nExclusion is required for all diapered children whose stool is not contained in the diaper and \ntoilet-trained children if the diarrhea is causing soiled clothing. Re-admission after diarrhea can \noccur when diapered children have their stool contained by the diaper (even if the stools \nremain loose) and when toilet-trained children are continent.66 \n \nTuberculosis \nTuberculosis (TB) is a contagious disease, caused by the bacteria Mycobacterium tuberculosis.']","The fecal-oral route of disease transmission occurs when organisms that live in the intestines are ingested through the mouth, typically via contaminated hands. This can happen when individuals do not practice good hand hygiene after using the bathroom, changing diapers, or before preparing and eating food. 

Diseases that can be transmitted through the fecal-oral route include Hepatitis A, diarrhea, hand, foot, and mouth disease, pinworms, rotavirus, norovirus, giardia, shigella, and cryptosporidiosis. It is crucial to wash hands thoroughly to prevent the spread of these illnesses (Source: Unknown). 

In summary, maintaining proper hand hygiene is essential to prevent infections that can be transmitted through this route.","Illness spreads when organisms from the intestines (feces) enter the mouth, usually via contaminated hands, food, or water. Diseases like Hepatitis A and Norovirus spread this way.",1.0,0.9028571428390857,1.0,0.9390147846010806,0.4832401913052051
What is Amblyopia?,"['or more (on an eye-chart test of visual acuity) between\nthe two eyes or a best corrected vision of 20/30 or worse\nwould be defined as amblyopia. For example, if someone\nhas 20/20 vision with the right eye and only 20/40 with\nthe left, and the left eye cannot achieve better vision with\ncorrective lenses, the left eye is said to be amblyopic.\nDescription\nLazy eye is a common non-medical term used to\ndescribe amblyopia because the eye with poorer vision\ndoesn’t seem to be doing its job of seeing. Amblyopia is\nthe most common cause of impaired vision in children,\naffecting nearly three out of every 100 people or 2-4%\nof the population. Vision is a combination of the clarity\nof the images of the eyes (visual acuity) and the process-\ning of those images by the brain. If the images produced', 'eye is essentially not being used. This can lead to\namblyopia.\n• Nutrition. A type of organic amblyopia in which nutri-\ntional deficiencies or chemical toxicity may result in\namblyopia. Alcohol, tobacco, or a deficiency in the B\nvitamins may result in toxic amblyopia.\n• Heredity. Amblyopia can run in families.\nBarring the presence of strabismus or ptosis, chil-\ndren may or may not show signs of amblyopia. Children\nmay hold their heads at an angle while trying to favor the\neye with normal vision. They may have trouble seeing or\nreaching for things when approached from the side of the\namblyopic eye. Parents should see if one side of\nGALE ENCYCLOPEDIA OF MEDICINE 2 141\nAmblyopia\nMan with a lazy eye. (Custom Medical Stock Photo. Repro-\nduced by permission.)', 'children. Amblyopia is the medical term used when the vision in one of the eyes is reduced \nbecause the eye and the brain are not working together properly. The eye itself looks normal, \nbut it is not being used normally because the brain is favoring the other eye. Conditions leading \nto amblyopia include strabismus, an imbalance in the positioning of the two eyes, being more \n \n44 Types of Hearing Loss by the Centers for Disease Control and Prevention is in the public domain \n45 What is Hearing Loss in Children? by the Centers for Disease Control and Prevention is in the public domain \n46 Age and Vision Loss by the Centers for Disease Control and Prevention is in the public domain', 'by the two eyes are substantially different, the brain may\nnot be able to fuse the images. Instead of seeing two dif-\nferent images or double vision (diplopia), the brain sup-\npresses the blurrier image. This suppression can lead to\namblyopia. During the first few years of life, preferring\none eye over the other may lead to poor visual develop-\nment in the blurrier eye.\nCauses and symptoms\nSome of the major causes of amblyopia are as follows:\n• Strabismus. A misalignment of the eyes (strabismus) is\nthe most common cause of functional amblyopia. The\ntwo eyes are looking in two different directions at the\nsame time. The brain is sent two different images and\nthis causes confusion. Images from the misaligned or\n“crossed” eye are turned off to avoid double vision.', '268 | H e a l t h ,  S a f e t y ,  a n d  N u t r i t i o n  in  E a r l y  C h i l d h o o d  E d u c a t i o n  \n \nnearsighted, farsighted, or astigmatic in one eye than the other eye, and rarely, other eye \nconditions, such as cataracts. \n \nUnless it is successfully treated in early childhood amblyopia usually persists into adulthood, \nand is the most common cause of permanent one-eye vision impairment among children and \nyoung and middle-aged adults. An estimated 2%–3% of the population suffer from amblyopia. \n \n \nFigure 10.15 – Patching the dominant eye is one way of treating amblyopia.47 \n \nStrabismus \nStrabismus involves an imbalance in the positioning of the two eyes. Strabismus can cause the \neyes to cross in (esotropia) or turn out (exotropia). Strabismus is caused by a lack of', 'eye with eye drops or lenses to force the child to use the\namblyopic eye.\nPrognosis\nThe younger the person, the better the chance for\nimprovement with occlusion and vision therapy. Howev-\ner, treatment may be successful in older children—even\nadults. Success in the treatment of amblyopia also\ndepends upon how severe the amblyopia is, the specific\ntype of amblyopia, and patient compliance. It is impor-\ntant to diagnose and treat amblyopia early because sig-\nnificant vision loss can occur if left untreated. The best\noutcomes result from early diagnosis and treatment.\nPrevention\nTo protect their child’s vision, parents must be aware\nof amblyopia as a potential problem. This awareness may\nencourage parents to take young children for vision exams', '• Anisometropia. This is another type of functional\namblyopia. In this case, there is a difference of refrac-\ntive states between the two eyes (in other words, a dif-\nference of prescriptions between the two eyes). For\nexample, one eye may be more nearsighted than the\nother eye, or one eye may be farsighted and the other\neye nearsighted. Because the brain cannot fuse the two\ndissimilar images, the brain will suppress the blurrier\nimage, causing the eye to become amblyopic.\n• Cataract. Clouding of the lens of the eye will cause the\nimage to be blurrier than the other eye. The brain\n“prefers” the clearer image. The eye with the cataract\nmay become amblyopic.\n• Ptosis. This is the drooping of the upper eyelid. If light\ncannot enter the eye because of the drooping lid, the']","Amblyopia, commonly referred to as ""lazy eye,"" is a condition where the vision in one of the eyes is reduced because the eye and the brain are not working together properly. The affected eye appears normal, but it is not being used effectively because the brain favors the other eye. This condition is the most common cause of impaired vision in children, affecting nearly 2-4% of the population.

Amblyopia can result from several factors, including:

1. **Strabismus**: Misalignment of the eyes, where the two eyes look in different directions, causing the brain to suppress the image from the misaligned eye to avoid double vision.
2. **Anisometropia**: A difference in refractive power between the two eyes, leading the brain to suppress the blurrier image.
3. **Cataracts**: Clouding of the lens in one eye can cause it to produce a blurrier image, which the brain may ignore.
4. **Ptosis**: Drooping of the upper eyelid can block light from entering the eye, affecting vision.

If not treated early, amblyopia can persist into adulthood and is a leading cause of permanent vision impairment in one eye among children and young adults. Early diagnosis and treatment are crucial for the best outcomes (Source: Unknown). 

If you suspect amblyopia or have concerns about vision, it's important to consult a healthcare provider for proper evaluation and treatment options.","Amblyopia, or 'lazy eye,' occurs when vision in one eye is reduced because the eye and brain are not working together properly, causing the brain to favor the other eye.",1.0,0.99999999998,1.0,0.9565100419243625,0.4699543388411309
What is the biological impact of lead poisoning on a child?,"['increase exposure and r esult in hazar dous lead levels in the blood. \nChildren under age six are especially vulnerable. They may consume \nitems tainted with lead, such as chipped, lead-based paint. Another \ncommon exposure is le ad dust in c arpets, with the dust f laking off \nof pain t on w alls. W hen childr en pla y or r oll ar ound on c arpets \ncoated with lead, they are in je opardy. Lead is indestruc tible, and \nonce it has been ingested it is difficult for the human bod y to alter \nor remove it. It can quietly build up in the body for months, or even \nyears, before the onset of symptoms. Lead toxicity can damage the \nbrain and c entral ner vous system, r esulting in impair ed thinking, \nreasoning, and perception. \n8. Lactose Intolerance. National Institute of Diabetes and', 'Follow-Up to Lead Screening \nNew recommendations from the Centers for Disease Control and Prevention (CDC) state that if \nscreening indicates a lead level of five micrograms per deciliter or more, the child should be \nreferred to a health professional. 44 \n \nLead has negative outcomes on a variety of things, including: \n• Attention (easily distracted, challenges with sustained attention, hyperactivity) \n• executive functions (problems with planning, impulse control, flexible thinking, etc.) \n• visual-spatial skills (problems related to visual perception, memory, organization, and \nreasoning with visually presented information) \n• social behavior (aggression, disruptive behavior, poor self-regulation) \n• speech and language (problems with phonological and sentence processing and spoken', 'word recognition) \n• fine and gross motor skills (unsteadiness, clumsiness, and problems with coordination, \nvisual-motor control, and dexterity)45 \n \nDepending on the effects of lead poisoning, early care and education programs can implement \nintervention services to support the child. Other treatments include: \n• Nutrition counseling \n• Iron supplements \n \n44 Lead Screening: Well-Child Health Care Fact Sheet by the National Center on Early Childhood Health and \nWellness is in the public domain \n45 Educational Interventions for Children Affected by Lead by the National Center for Environmental Health is in the \npublic domain', ""affect a child's health and cause cognitive developmental delays. Research shows that lead \nexposure disproportionately affects children from minority and low–income households and \ncan adversely affect their readiness for school. \n \nThe socioeconomic status of young children's families and communities also significantly affects \ntheir educational outcomes. Specifically, poverty has been shown to negatively influence the \n \n5 Early and Middle Childhood by the Office of Disease Prevention and Health Promotion is in the public domain.   \n6 Early and Middle Childhood by the Office of Disease Prevention and Health Promotion is in the public domain."", 'for young children because of their small size and rapid growth and development. It can cause \nanemia, learning difficulties, and other medical problems. \n \nChildren can inhale or swallow lead through exposure to: \n• Home or child care environments, including those: \n• Built before 1960 with peeling paint or renovation \n• Located near a highway or lead industry \n• Family members who work with lead or have been treated for lead poisoning \n• Imported ceramic pottery for cooking, storing, or serving food \n• Home remedies with lead \n• Certain candies, which may contain high levels of lead in the wrapper or stick. Be \ncautious when providing imported candies to children. \n• Eating paint chips or dirt \n• Water pumped through lead-based pipes', '187 | H e a l t h ,  S a f e t y ,  a n d  N u t r i t i o n  in  E a r l y  C h i l d h o o d  E d u c a t i o n  \n \nLead screening involves a blood lead test, from a finger stick or a venous blood draw. It is \nrecommended at 12 months and 24 months of age. Children from 3 to 6 years of age should \nhave their blood tested if they have not been tested \n \nSymptoms of Lead Poisoning \nMost children with lead poisoning show no symptoms. However, you might notice: \n• Developmental delay \n• Learning Difficulties \n• Irritability \n• Headaches \n• Poor appetite or stomachache \n• Weight loss \n• Fatigue and sluggishness \n• Slow growth and development \n• Vomiting \n• Constipation \n• Hearing loss \n \nFollow-Up to Lead Screening', 'immature body systems are less efficient at detoxification. Exposure to lead in drinking water is \na serious health concern, especially for young children and infants since elevated lead levels in \nchildren may result in delays in physical or mental development, lower IQ, and even brain \ndamage.53 \n \n \n50 Resources about Chemical Hazards for Child Care Providers by the U.S. Environmental Protection Agency is in the \npublic domain \n51 Resources about Plastics in Child Care Settings for Parents and Providers by the U.S. Environmental Protection \nAgency is in the public domain \n52 Water-related Diseases and Contaminants in Public Water Systems by the Centers for Disease Control and \nPrevention is in the public domain']","Lead poisoning can have significant biological impacts on a child's health, particularly affecting their brain and central nervous system. The consequences of lead exposure include:

1. **Cognitive Development**: Lead toxicity can lead to impaired thinking, reasoning, and perception, which may result in cognitive developmental delays.

2. **Attention and Behavior**: Children may experience difficulties with attention, including being easily distracted, challenges with sustained attention, and hyperactivity. There can also be issues with social behavior, such as aggression and disruptive behavior.

3. **Executive Functions**: Problems may arise in planning, impulse control, and flexible thinking.

4. **Visual-Spatial Skills**: Children may face challenges related to visual perception, memory, organization, and reasoning with visually presented information.

5. **Speech and Language**: There can be difficulties with phonological processing, sentence processing, and spoken word recognition.

6. **Motor Skills**: Lead exposure can lead to unsteadiness, clumsiness, and problems with coordination, visual-motor control, and dexterity.

7. **Physical Health**: Lead poisoning can cause anemia, learning difficulties, and other medical problems, including symptoms like irritability, headaches, poor appetite, weight loss, fatigue, slow growth, vomiting, constipation, and even hearing loss.

It is important to note that many children with lead poisoning may not show symptoms initially, and the effects can build up over time (Source: Unknown). If there are concerns about lead exposure, it is crucial to consult a healthcare provider for appropriate screening and intervention.","Lead is toxic to the brain and nervous system. It can cause anemia, learning difficulties, developmental delays, and physical growth issues because the body absorbs lead which interferes with normal cell function.",0.6666666666666666,0.9999999999857143,1.0,0.9906921335044081,0.41342468532300863
What causes Early Childhood Caries (tooth decay)?,"['“Gingivitis” \n/ CC0 1.0 \nAccording to H ealthy People 2010, 23 percent of US childr en have \ncavities b y the age o f f our, and b y se cond gr ade, one-half o f all \nchildren in this country have at least one cavity.3 \nCavities are an epidemic health problem in the United States and \nare associated with poor die t, but other c ontributors include poor \ndental hygiene and the inac cessibility to regular oral health care. A \nreview in Ac ademic Pediatrics reports that “frequent consumption \nof fast-r eleasing c arbohydrates, primaril y in the f orm o f die tary \nsugars, is significantly associated with increased dental caries risk.”4 \nIn regards to sugar y so ft drinks, the Americ an Dental Associa tion \nsays tha t drinking sugar y so ft drinks incr eases the risk o f de cay \nformation.5', 'not onl y b y the kinds o f liquids g iven to an infan t, but also b y \nthe fr equency and length o f time tha t f luids ar e g iven. Giving a \nchild a bot tle o f juic e or other sw eet liquids se veral times e ach \nday, or le tting a bab y suck on a bot tle longer than a me altime, \neither when awake or asleep, can also cause early childhood caries. \nIn addi tion, this pr actice af fects the de velopment and posi tion o f \nthe teeth and the j aw. The risk o f early childhood c aries continues \ninto the toddler y ears as childr en beg in to c onsume mor e f oods \nwith a hig h sugar content. Therefore, parents should avoid putting \ntheir children to bed with a bottle, and giving their children sugary \nsnacks and beverages. If a parent insists on giving their child a bottle', 'describe tooth decay, including filled or extracted teeth due to decay, in the primary teeth \n(baby teeth). It is important to rethink the way we “treat” dental caries. Traditionally, we would \nwait until a child had a cavity and “treat” the cavity with a filling. In order to prevent ECC, we \nmust intervene before the first cavity develops.15 Early care and education programs can teach \nchildren and families about dental hygiene and oral care as well as implement good dental \nhygiene practices. Here are some ideas: \n• Use teaching practices that engage children and promoting thinking critically. Consider \nasking questions such as: \no How do you brush your teeth?  \no Why do you brush your teeth?  \no What else can you do to keep your mouth and teeth healthy?', 'caries from breast milk, formula, juice, or other drinks f ed through \na bot tle. Liquids c an build up in a bab y’s mouth, and the na tural \nor adde d sugars le ad to de cay. Ear ly childhood c aries ar e c aused \n25. Alvisi P, Brusa S, Alboresi S. (2015). Recommendations on \ncomplementary feeding for healthy, full-term infants. \nItalian Journal of Pediatrics, \n41(36) https://www.ncbi.nlm.nih.gov/pmc/articles/\nPMC4464122/ \n26. Gever J. (2012, March 7). Nursing mom’s diet no guard \nagainst baby allergies. Medpage Today. \nhttp://www.medpagetoday.com/MeetingCoverage/\nAAAAIMeeting/31527 \n27. Du Toit G, et al. (2015). Randomized trial of peanut \nconsumption in infants at risk for peanut allergy. New \nEngland Journal of Medicine. 372(9), 803-813. \n846  |  Infancy', 'children beg in to c onsume more foods with a hig h sugar c ontent. \nAccording to the National Health and Nutrition Examination Survey, \nchildren between ages of two and five consume about 200 c alories \nof adde d sugar per da y.9 Therefore, par ents wi th toddlers should \navoid processed foods, such as snacks fr om vending machines, and \nsugary beverages, such as soda. Parents also need to instruct a child \non brushing their teeth at this time to help a toddler develop healthy \nhabits and avoid tooth decay. Generally, children need help brushing \ntheir teeth until they are 5 years old. \nIron-Deficiency Anemia \nAn infan t who swi tches to solid f oods, but does not e at enoug h \niron-rich foods, can develop iron-deficiency anemia. This condition', 'formation.5 \n3. Continuing MCH Education in Oral Health. Oral Health \nand Health Care. http://ccnmtl.columbia.edu/projects/\notm/index.html. Accessed April 12, 2018. \n4. Mobley C, Marshall T. (2009). The Contribution of \nDietary Factors to Dental Caries and Disparities in \nCaries. Academy of Pediatrics, 9(6), 410–14. \nhttps://www.ncbi.nlm.nih.gov/pmc/articles/\nPMC2862385/. Accessed April 15, 2018. \n5. Foods that Affects your Teeth. American Dental \n1084  |  Nutrition, Health and Disease', 'cognitive growth and development. \n \nMore than any other developmental periods, childhood sets the stage for: \n• School success  \n• Health literacy \n• Self-discipline \n• The ability to make good decisions about risky situations \n• Eating habits \n• Conflict negotiation and healthy relationships with family and friends3 \n \nUnderstanding Childhood Health Concerns  \nAlthough young children are typically healthy, it is during this time that they are at risk for \nconditions such as: \n• Developmental and behavioral disorders \n• Child maltreatment \n• Asthma and other chronic conditions \n• Obesity \n• Dental caries (cavities) \n• Unintentional injuries \n \n \nFigure 1.2 – Young children may develop dental caries (cavities).4']","Early Childhood Caries (ECC), or tooth decay, is primarily caused by the frequent consumption of sugary liquids and foods, particularly when these are given to infants and young children in a way that allows sugars to build up in the mouth. This includes practices such as giving a child a bottle of juice or other sweet liquids several times a day or allowing a baby to suck on a bottle for extended periods, both during wakefulness and sleep. These habits can lead to the development of cavities in primary teeth (baby teeth) due to the natural or added sugars present in these liquids.

Additionally, the risk of ECC increases as children begin to consume more foods with high sugar content. Poor dental hygiene and limited access to regular oral health care also contribute to the prevalence of cavities in children. Parents are advised to avoid putting their children to bed with a bottle and to limit sugary snacks and beverages to help prevent tooth decay (Source: Unknown). 

It's important to note that early intervention and education about dental hygiene can help prevent the development of cavities before they occur (Source: Unknown).","Bacteria in the mouth feed on sugars from food and drinks, producing acid that attacks the tooth enamel. If not cleaned, this leads to decay.",0.5,0.8874999999778125,1.0,0.9587649304338921,0.21540580473154552
What is Toxic Stress?,"['instability can cause toxic stress (i.e., prolonged activation of the stress-response system). Some \nchildren may face further exposure to toxic stress from historical and ongoing traumas due to \nsystemic racism or the impacts of multigenerational poverty resulting from limited educational \nand economic opportunities. \n \n \n22 What Are Childhood Mental Disorders? by the Centers for Disease Control and Prevention is in the public \ndomain \n23 Preventing Adverse Childhood Experiences (ACEs) by the CDC National Center for Injury Prevention & Control, \nDivision of Violence Prevention, is in the public domain  \n24 Preventing Adverse Childhood Experiences (ACEs) by the CDC National Center for Injury Prevention & Control, \nDivision of Violence Prevention, is in the public domain', '290 | H e a l t h ,  S a f e t y ,  a n d  N u t r i t i o n  in  E a r l y  C h i l d h o o d  E d u c a t i o n  \n \n \nFigure 11.6 – Risks of Adverse Childhood Experiences 25 \n \nA large and growing body of research indicates that toxic stress during childhood can harm the \nmost basic levels of the nervous, endocrine, and immune systems, and that such exposures can \neven alter the physical structure of DNA (epigenetic effects). Changes to the brain from toxic \nstress can affect such things as attention, impulsive behavior, decision-making, learning, \nemotion, and response to stress. Absent factors that can prevent or reduce toxic stress, \nchildren growing up under these conditions often struggle to learn and complete schooling.', 'They are at increased risk of becoming involved in crime and violence, using alcohol or drugs, \nand engaging in other health-risk behaviors (e.g., early initiation of sexual activity; unprotected \nsex; and suicide attempts). They are susceptible to disease, illness, and mental health \nchallenges over their lifetime. Children growing up with toxic stress may have difficulty forming \nhealthy and stable relationships. They may also have unstable work histories as adults and \nstruggle with finances, family, jobs, and depression throughout life—the effects of which can be \npassed on to their own children. 26 \n \n \n25 Image by the CDC National Center for Injury Prevention & Control, Division of Violence Prevention, is in the \npublic domain', 'Secondary Traumatic Stress \nTIC also means attending to the psychological and physical safety and well-being of the adults \nwho care for children who have experienced trauma. Professionals, parents, and other \ncaregiving adults may suffer secondary traumatic stress (trauma-related reactions to exposure \nto another person’s traumatic experience). The National Child Traumatic Stress Network \nrecommends the following strategies to combat secondary traumatic stress and reduce related \nstaff burnout and turnover: \n• Provide high-quality, reflective supervision \n• Maintain trauma workload balance \n• Support workplace self-care groups \n• Enhance the physical safety of staff \n• Provide training to both staff and leadership to increase awareness about secondary', 'that was introduced in 1994 to differentiate time-limited\nreactions to trauma from post-traumatic stress disorder\n(PTSD).\nCauses and symptoms\nAcute stress disorder is caused by exposure to trau-\nma, which is defined as a stressor that causes intense fear\nand, usually, involves threats to life or serious injury to\noneself or others. Examples are rape, mugging, combat,\nnatural disasters, etc.\nThe symptoms of stress disorder include a combining\nof one or more dissociative and anxiety symptoms with\nthe avoidance of reminders of the traumatic event. Disso-\nciative symptoms include emotional detachment, tempo-\nrary loss of memory, depersonalization, and derealization.\nAnxiety symptoms connected with acute stress disor-\nder include irritability, physical restlessness, sleep prob-', 'term symptoms (longer than one month) from such stress, which are upsetting or interfere with \ntheir relationships and activities, they may be diagnosed with post-traumatic stress disorder \n(PTSD). \n \nExamples of PTSD symptoms include: \n• Reliving the event over and over in thought or in play \n• Nightmares and sleep problems \n• Becoming very upset when something causes memories of the event \n• Lack of positive emotions \n• Intense ongoing fear or sadness \n• Irritability and angry outbursts \n• Constantly looking for possible threats, being easily startled \n• Acting helpless, hopeless or withdrawn \n• Denying that the event happened or feeling numb \n• Avoiding places or people associated with the event \n \n \nFigure 11.4 – Severe stress can cause long-term effects.19', 'physical threat and an anxiety-producing thought or idea.\nThe hypothalamus may trigger the release of stress hor-\nmones by the pituitary gland, even when there is no\nexternal and objective danger. A second problem is\ncaused by the biochemical side effects of too many “false\nalarms” in the ANS. When a person responds to a real\ndanger, his or her body gets rid of the stress hormones by\nrunning away or by fighting. In modern life, however,\npeople often have fight-or-flight reactions in situations in\nwhich they can neither run away nor lash out physically.\nAs a result, their bodies have to absorb all the biochemi-\ncal changes of hyperarousal, rather than release them.\nThese biochemical changes can produce anxious feel-\nings, as well as muscle tension and other physical symp-']","Toxic stress refers to the prolonged activation of the stress-response system, which can occur in children who face instability and exposure to adverse experiences. This type of stress can arise from various factors, including historical and ongoing traumas related to systemic racism or multigenerational poverty, which often stem from limited educational and economic opportunities. 

Research indicates that toxic stress during childhood can have detrimental effects on the nervous, endocrine, and immune systems, and may even alter the physical structure of DNA (epigenetic effects). It can lead to changes in brain function that affect attention, impulsive behavior, decision-making, learning, emotion, and stress response. Children experiencing toxic stress are at increased risk for various negative outcomes, including difficulties in learning, involvement in crime and violence, substance use, and mental health challenges throughout their lives. These effects can also impact their ability to form healthy relationships and maintain stable employment, potentially passing on these challenges to their own children (Source: Unknown). 

If you have concerns about toxic stress or its effects, I recommend consulting a healthcare provider for further guidance and support.",Toxic stress is the prolonged activation of the body's stress-response system (like cortisol release) in the absence of protective relationships. It can alter brain architecture and other organ systems.,1.0,0.99999999995,0.9615384615384616,0.931410018825574,0.8917935387994519
What is the biological cause of Cystic Fibrosis?,"['is e xemplified in the signs and symptoms o f the gene tic dise ase, \ncystic fibrosis. \nCystic Fibrosis \nCystic fibrosis (CF) is one o f the most pr evalent inherited diseases \nin pe ople o f Eur opean desc ent. I t is c aused b y a muta tion in a \nprotein that transports chloride ions out o f the cell. CF’s signs and \nsymptoms include salty skin, poor digestion and absorption (leading \nto poor gr owth), sticky mucus ac cumulation in the lungs ( causing \nincreased susceptibility to respiratory infections), liver damage, and \ninfertility. \n190  |  Chloride', 'develop a plan to help the child reach his or her full potential. Common treatments include \nmedicines; surgery; braces; and physical, occupational, and speech therapy. No single \ntreatment is the best one for all children with CP.23  \n \nCystic Fibrosis \nCystic fibrosis (CF) is an inherited disease of the mucus and sweat glands. It affects mostly the \nlungs, pancreas, liver, intestines, sinuses, and sex organs. CF causes mucus to be thick and \nsticky. The mucus clogs the lungs, causing breathing problems and making it easy for bacteria to \ngrow. This can lead to repeated lung infections and lung damage.24 It is one of the most \ncommon chronic lung diseases in children and young adults. It is a life-threatening disorder.', 'in large enough quantity, bacterial and viral invaders are\nnot effectively killed off, and infection occurs.\nOther causes of bronchiectasis include an abnormal-\nly blocked (obstructed) airway. This can be due to tumor\ngrowth within the bronchial tube, or due to a child acci-\ndentally inhaling a small object which then blocks off the\nbronchial tube. People with the disease called cystic\nfibrosis (CF) often have their bronchial tubes obstructed\nby the thick, sticky mucus which is a hallmark of CF.\nToxic exposures (breathing ammonia, for example) can\nharm the bronchi, and lead to bronchiectasis. An extreme\nallergic response of the immune system to the presence\nof certain fungi (especially one called Aspergillus ) can\nalso damage the bronchial tubes enough to result in\nbronchiectasis.', ""258 | H e a l t h ,  S a f e t y ,  a n d  N u t r i t i o n  in  E a r l y  C h i l d h o o d  E d u c a t i o n  \n \n \nFigure 10.8 – Cystic fibrosis treatment.25 \n \nThe symptoms and severity of CF can vary. Some people have serious problems from birth. \nOthers have a milder version of the disease that doesn't show up until they are teens or young \nadults.  \n \nCF is diagnosed through various tests, such as gene, blood, and sweat tests. There is no cure for \nCF, but treatments have improved greatly in recent years. In the past, most deaths from CF \nwere in children and teenagers. Today, with improved treatments, some people who have CF \nare living into their forties, fifties, or older. Treatments may include chest physical therapy,"", 'causes mental retardation in people of eastern European\nJewish heritage. Two recessive disorders that affect mostly\nwhites are: cystic fibrosis, a lung and digestive disorder,\nand phenylketonuria(PKU), a metabolic disorder. If only\none parent passes along the genes for the disorder, the nor-\nmal gene received from the other parent will prevent the\ndisease, but the child will be a carrier. Having the gene is\nnot harmful to the carrier, but there is the 25% chance of\nthe genetic disease showing up in the child of two carriers.\nSome disorders are linked to the sex-determining\nchromosomes passed along by parents. Hemophilia ,a\ncondition that prevents blood from clotting, and\nDuchenne muscular dystrophy , which causes muscle\nweakness, are carried on the X chromosome. Genetic', 'tion, with increased risk of bronchiectasis developing.\nThese conditions include disorders of cilia, and immune\ndisorders.\nCilia are the tiny hairs which usually line the\nbronchial tubes. Cilia wave constantly, sweeping the\nbronchial tubes clean of bacterial or viral invaders, and\ncleaning away excess secretions (mucus, sputum) which\nmay be produced by the bronchi. When these cilia are\nabnormal or absent at birth, various bacterial or viral\ninvaders may remain in the respiratory tract, multiply,\nand cause serious infections.\nImmune disorders include decreased production of\ncertain immune chemicals (immunoglobulins) which\nusually serve to fight off infection by bacterial or viral\ninvasion. When these immunoglobulins are not produced', ""incorporated into the cell wall and some of which other cell parts use.\nGeneticist\nMany diseases arise from genetic mutations that prevent synthesizing critical proteins. One such disease\nis Lowe disease (or oculocerebrorenal syndrome, because it affects the eyes, brain, and kidneys). In Lowe\ndisease, there is a deficiency in an enzyme localized to the Golgi apparatus. Children with Lowe disease\nare born with cataracts, typically develop kidney disease after the first year of life, and may have impaired\nmental abilities.\nA mutation on the X chromosome causes Lowe disease. The X chromosome is one of the two human sex\nchromosomes, as these chromosomes determine a person's sex. Females possess two X chromosomes""]","Cystic fibrosis (CF) is caused by a mutation in a protein that transports chloride ions out of the cell. This genetic mutation leads to the production of thick and sticky mucus, which primarily affects the lungs, pancreas, liver, intestines, sinuses, and sex organs. The thick mucus clogs the lungs, causing breathing problems and increasing susceptibility to respiratory infections (Source: Unknown).","Cystic Fibrosis is an inherited disease of the mucus and sweat glands where mucus becomes thick and sticky, clogging the lungs and obstructing the pancreas.",1.0,0.9999999999666667,1.0,0.9706094884350552,0.631779022495416
What occurs during an asthma attack?,"['to many different types of stimuli that don’t affect\nhealthy lungs. In an asthma attack, the muscle tissue in\nthe walls of bronchi go into spasm, and the cells lining\nthe airways swell and secrete mucus into the air spaces.\nBoth these actions cause the bronchi to become nar-\nrowed (bronchoconstriction). As a result, an asthmatic\nperson has to make a much greater effort to breathe in\nair and to expel it.\nCells in the bronchial walls, called mast cells,\nrelease certain substances that cause the bronchial mus-\ncle to contract and stimulate mucus formation. These\nsubstances, which include histamine and a group of\nchemicals called leukotrienes, also bring white blood\ncells into the area, which is a key part of the inflammato-\nry response. Many patients with asthma are prone to', 'which makes asthma especially serious for them.11 It causes wheezing, breathlessness, chest \ntightness, and coughing at night or early in the morning. If a person has asthma, they have it all \nthe time, but they will have asthma attacks only when something bothers their lungs.  \n \nAn asthma attack may include coughing, chest tightness, wheezing, and trouble breathing. The \nattack happens in the body’s airways, which are the paths that carry air to the lungs. As the air \nmoves through the lungs, the airways become smaller, like the branches of a tree are smaller \nthan the tree trunk. During an asthma attack, the sides of the airways in the lungs swell and the \nairways shrink. Less air gets in and out of the lungs, and mucous that the body makes clogs up \nthe airways.', '(and nights) coughing and wheezing, until properly treat-\ned. Crying or even laughing may bring on an attack.\nSevere episodes are often seen when the patient gets a\nviral respiratory tract infection or is exposed to a heavy\nload of an allergen or irritant. Asthmatic attacks may last\nonly a few minutes or can go on for hours or even days (a\ncondition called status asthmaticus).\nBeing short of breath may cause a patient to become\nvery anxious, sit upright, lean forward, and use the mus-\ncles of the neck and chest wall to help breathe. The\npatient may be able to say only a few words at a time\nbefore stopping to take a breath. Confusion and a bluish\ntint to the skin are clues that the oxygen supply is much\ntoo low, and that emergency treatment is needed. In a', 'gasps for air. Obstruction to air flow either stops sponta-\nneously or responds to a wide range of treatments, but\ncontinuing inflammation makes the airways hyper-\nresponsive to stimuli such as cold air, exercise , dust\nmites, pollutants in the air, and even stress and anxiety.\nDescription\nAbout 10 million Americans have asthma, and the\nnumber seems to be increasing. Between 1982-92, the\nrate actually rose by 42%. Not only is asthma becoming\nmore frequent, but it also is a more severe disease than\nbefore, despite modern drug treatments. In the same 10-\nyear period, the death rate from asthma in the United\nStates increased by 35%.\nThe changes that take place in the lungs of asth-\nmatic persons makes the airways (the “breathing tubes,”\nor bronchi and the smaller bronchioles ) hyper-reactive', 'medication remains in this area with only a small\namount actually reaching the lungs. Some bronchodila-\ntors used to treat acute asthma attacks include adrena-\nline, albuterol, or other “adrenoceptor stimulants,” most\noften administered as aerosols. Futicasone (Flovent) is\nanother commonly prescribed inhaler. Some bron-\nchodilators used to treat acute asthma attacks include\nKEY TERMS\nAllergen —A substance that provokes an allergic\nresponse.\nAllergic rhinitis —Inflammation of the mucous\nmembranes of the nose and eyes in response to an\nallergen.\nAnaphylaxis—Increased sensitivity caused by previ-\nous exposure to an allergen that can result in blood\nvessel dilation and smooth muscle contraction.\nAnaphylaxis can result in sharp blood pressure\ndrops and difficulty breathing.', 'severe attack that lasts for some time, some of the air\nsacs in the lung may rupture so that air collects within\nthe chest. This makes it even harder to breathe in enough\nair. Almost always, even patients with the most severe\nattacks will recover completely.\nDiagnosis\nApart from listening to the patient’s chest, the exam-\niner should look for maximum chest expansion while\ntaking in air. Hunched shoulders and contracting neck\nmuscles are other signs of narrowed airways. Nasal\npolyps or increased amounts of nasal secretions are often\nnoted in asthmatic patients. Skin changes, like atopic\ndermatitis or eczema, are a tipoff that the patient has\nallergic problems.\nInquiring about a family history of asthma or aller-\ngies can be a valuable indicator of asthma. The diagnosis', '• inhaling cold air (cold-induced asthma)\n• exercise-induced asthma (in certain children, asthma is\ncaused simply by exercising)\n• stress or a high level of anxiety\nWheezing is often very obvious, but mild asthmatic\nattacks may be confirmed when the physician listens to\nthe patient’s chest with a stethoscope. Besides wheezing\nand being short of breath, the patient may cough and\nmay report a feeling of “tightness” in the chest. Children\nmay have itching on their back or neck at the start of an\nattack. Wheezing is often loudest when the patient\nbreathes out, in an attempt to expel used air through the\nnarrowed airways. Some asthmatics are free of symp-\ntoms most of the time but may occasionally be short of\nbreath for a brief time. Others spend much of their days']","During an asthma attack, the muscle tissue in the walls of the bronchi goes into spasm, causing bronchoconstriction. The cells lining the airways swell and secrete mucus, which narrows the airways and makes it much harder for an asthmatic person to breathe in and expel air. Symptoms of an asthma attack may include coughing, chest tightness, wheezing, and difficulty breathing. The airways become smaller, similar to the branches of a tree being smaller than the trunk, leading to less air getting in and out of the lungs. Additionally, the inflammation in the airways can make them hyper-responsive to various stimuli, such as cold air, exercise, allergens, and stress (Source: Unknown). 

If you experience severe symptoms or prolonged difficulty breathing, it is important to seek emergency treatment. Always consult a healthcare provider for proper diagnosis and treatment options.","During an asthma attack, the airways in the lungs swell and shrink, and excess mucus is produced, making it difficult for air to move in and out of the lungs.",1.0,0.8541666666453125,0.9411764705882353,0.975999895007646,0.8660911855554139
What is the difference between Type 1 and Type 2 Diabetes?,"['Image by \nAllison \nCalabrese / \nCC BY 4.0 \nType 2 Diabetes \nThe other 90 to 95 per cent of diabetes cases are Type 2 diabe tes. \nType 2 diabe tes is def ined as a me tabolic dise ase o f insulin \ninsufficiency, but i t is also c aused by muscle, liv er, and fa t cells no \nlonger responding to the insulin in the bod y (Figure 18.4 “H ealthy \nIndividuals and Type 2 Diabe tes” . I n brief, c ells in the bod y have \nbecome r esistant to insulin and no longer r eceive the full \nphysiological message of insulin to take up glucose from the blood. \nThus, similar to pa tients wi th Type 1 diabe tes, those wi th Type 2 \ndiabetes also have high blood-glucose levels. \nFigure 18.4 Healthy Individuals and Type 2 Diabetes \nThreats to Health  |  1111', 'For Type 2 diabe tics, the onse t of symptoms is mor e gradual and \nless notic eable than f or Type 1 diabe tics. The f irst stage o f Type \n2 diabetes is char acterized by high glucose and insulin le vels. This \nis be cause the insulin-se creting c ells in the pancr eas a ttempt to \ncompensate f or insulin r esistance b y making mor e insulin. I n the \nsecond stage o f Type 2 diabe tes, the insulin-se creting cells in the \npancreas become exhausted and die. At this point, Type 2 diabetics \nalso have to be treated with insulin injections. Healthcare providers \nis to pr event the se cond stage fr om happening. As wi th Type 1 \ndiabetes, chr onically hig h-glucose le vels c ause big de triments to \nhealth over time, so another goal f or patients with Type 2 diabe tes', 'maturity onset or non insulin-dependent. Type I is caused\nby a deficiency of insulin production, while type II is\ncharacterized by insulin resistance.\nTreatment of type I diabetes is limited to insulin\nreplacement, while type II diabetes is treatable by a num-\nber of therapeutic approaches. Many cases of insulin\nresistance are asymptomatic due to normal increases in\ninsulin secretion, and others may be controlled by diet\nand exercise . Drug therapy may be directed towards\nincreasing insulin secretion, increasing insulin sensitivi-\nty, or increasing insulin penetration of the cells.\nDescription\nAntidiabetic drugs may be subdivided into six groups:\ninsulin, sufonylureas, alpha-glucosidase inhibitors,\nbiguanides, meglitinides, and thiazolidinediones.', 'Type 1 Diabetes \nType 1 diabe tes is a me tabolic dise ase in which insulin-se creting \ncells in the pancr eas ar e kille d b y an abnormal r esponse o f the \nimmune system, c ausing a lack o f insulin in the bod y. I ts onse t \ntypically occurs before the age of thirty. The only way to prevent the \ndeadly symptoms of this disease is to inject insulin under the skin. \nA person wi th Type 1 diabe tes usuall y has a r apid onse t o f \nsymptoms that include hunger , excessive thirst and urina tion, and \nrapid weight loss. Because the main function of glucose is to provide \nenergy for the bod y, when insulin is no longer pr esent there is no \nmessage sent to c ells to tak e up g lucose from the blood. I nstead, \ncells use fa t and pr oteins to mak e energy, resulting in w eight loss.', 'During type 2 diabetes, the cells of the body become resistant to the \neffects of insulin, and the pancreas increases its production of insulin. \nHowever, over time, the pancreas may no longer be able to produce \ninsulin. In many cases, type 2 diabetes can be managed by moderate \nweight loss, regular physical activity, and a healthy diet. However, if blood \nglucose levels cannot be controlled with healthy lifestyle choices, oral \ndiabetic medication is prescribed and eventually, the administration of \ninsulin may be required.1 Prediabetes is a medical condition where blood \nsugar levels are higher than normal, but not high enough yet to be \ndiagnosed as type 2 diabetes. Approximately one in three American adults \nhave prediabetes. Gestational diabetes is a type of diabetes that occurs', '2 diabe tes? The pr evailing the ory is tha t the o verconsumption o f \nhigh-fat and hig h-sugar f oods c auses changes in muscle, fa t, and \nliver cells that leads to a diminishe d response from the pancr eatic \nhormone insulin. These cells are called “insulin-resistant.” Insulin is \nreleased after a meal and instructs the liver and other tissues to take \nup glucose and fa tty acids tha t are circulating in the blood. W hen \ncells are resistant to insulin they do not take up enough glucose and \nfatty acids, so glucose and fatty acids remain at high concentrations \nin the blood. The chronic elevation of glucose and fatty acids in the \nblood also causes damage to other tissues over time, so that people \nwho have Type 2 diabe tes are at increased risk f or cardiovascular', 'If Type 1 diabe tes goes un treated individuals wi th the dise ase will \ndevelop a lif e-threatening c ondition c alled k etoacidosis. This \ncondition occurs when the body uses fats and not g lucose to make \nenergy, resulting in a build-up o f ketone bodies in the blood. I t is \na severe form of ketosis with symptoms o f vomiting, dehydration, \nrapid br eathing, and c onfusion and e ventually c oma and de ath. \nUpon insulin injection these severe symptoms are treated and death \nis avoided. Unfortunately, while insulin in jection prevents death, it \nis not considered a cure. People who have this disease must adhere \nto a strict diet to prevent the development of serious complications. \nType 1 diabe tics ar e ad vised to c onsume a die t lo w in the t ypes']","Type 1 and Type 2 diabetes are both metabolic diseases, but they have distinct differences:

1. **Cause**:
   - **Type 1 Diabetes**: This condition is caused by the immune system attacking and destroying insulin-secreting cells in the pancreas, leading to a lack of insulin. It typically has a rapid onset and usually occurs before the age of thirty (Source: Unknown).
   - **Type 2 Diabetes**: This type is characterized by insulin resistance, where the body's cells do not respond effectively to insulin. Initially, the pancreas compensates by producing more insulin, but over time it may become unable to produce sufficient insulin (Source: Unknown).

2. **Symptoms**:
   - **Type 1 Diabetes**: Symptoms include hunger, excessive thirst and urination, and rapid weight loss due to the body using fat and proteins for energy instead of glucose (Source: Unknown).
   - **Type 2 Diabetes**: The onset of symptoms is more gradual and less noticeable compared to Type 1. Initially, individuals may have high glucose and insulin levels, but symptoms may not be as pronounced until the disease progresses (Source: Unknown).

3. **Treatment**:
   - **Type 1 Diabetes**: The only treatment is insulin replacement through injections (Source: Unknown).
   - **Type 2 Diabetes**: This type can be managed through lifestyle changes such as diet and exercise, and may also require oral medications or insulin injections if blood glucose levels cannot be controlled (Source: Unknown).

4. **Progression**:
   - **Type 1 Diabetes**: If untreated, it can lead to a life-threatening condition called ketoacidosis (Source: Unknown).
   - **Type 2 Diabetes**: If not managed, it can lead to chronic high blood glucose levels, which can cause significant health issues over time (Source: Unknown).

In summary, Type 1 diabetes is primarily an autoimmune condition leading to insulin deficiency, while Type 2 diabetes is characterized by insulin resistance and can often be managed with lifestyle changes and medications. Always consult a healthcare provider for personalized medical advice.","In Type 1 diabetes, the pancreas does not make insulin. In Type 2 diabetes, the body does not make or use insulin well (insulin resistance).",1.0,0.5833333333041666,1.0,0.9943147428057898,0.3388852849191971
